date,content
"""음식이 맛있어요""",이 키워드를 선택한 인원
"""재료가 신선해요""",이 키워드를 선택한 인원
"""가성비가 좋아요""",이 키워드를 선택한 인원
"""혼밥하기 좋아요""",이 키워드를 선택한 인원
"""친절해요""",이 키워드를 선택한 인원
10.12.일,버거앤타코 비프치즈핫 버거 넘 맛있어요!! 버거 번이 퐁신퐁신 맛있고 패티도 짱맛~ 매콤한소스 들어있어서 느끼하지않게 먹을수 있어서 넘 좋습니다!!
8.24.일,"남편이 맛있는 햄버거 가게 찾았다고해서 따라와 봤는데요! 2인 세트 (햄버거 2개, 감튀, 음료2잔, 타코 2개 까지) 가성비도 좋고 특히 햄버거 빵이랑 타코가 진챠 맛있습니다!! 재료도 다 신선한 느낌스~ 매장 내 테이블은 4인석 2개, 2인석 2개 밖에 없어서 조금 좁긴한데, 깔끔하고 인테리어도 예뻐요!! 자주 올 듯합니다."
10.2.목,패티가 두툼한게 맛있네요 감자튀김도 굳! 회사근처라 자주올거같아요!
9.7.일,가격이 착한데 맛은 엄청나요!! 햄버거도 맛있고 타코도 맛있어요!! 감자튀김도 바로 튀겨서 바삭하고 따뜻해요!! 집앞이라 자주 올게요🤤
9.23.화,"성수에서 러닝하고 집에가는길에 포장했어요. 주문 즉시 만들어져서 따뜻하고 신선한 품질에서의 맛을 느낄 수 있어요. 작짐나 안쪽에 앉아서 먹을 수 있는 공간도 있고, 사장님이 친절해요. 1인 세트로 비프 오리지널과 치킨 타코, 비프 타코 먹었는데 가격대비 맛있어요. 성수 버거 앤 타코 맛집이에요 👍"
6.10.화,무한리필행사때 목젖 바로 밑까지 먹고 나가다가 옆테이블에서 '비프치즈매니아가 맛있다' 소리가 맘에 걸려 옹인 기흥에서 자전거 2시간 타고 또 왔어요.  생일 주간이라 500원 FLex해서 버터 토스팅 멜트번으로 변경했구요. 다이어트를 생각해서 감튀말고 타코를 추가햇어요(+2900원)  유명 수제버거집보다 저렴하지믄 맛은 그렇게 크게 차이가 안나는 게 가장 큰 장점이구요. 타코도 같이 맛볼수 있는 건 세컨드 장점입니다. 탄산도 1회리필 가능하니 저처럼 분량조절말고 쭉쭉 드세요  네거티브요소는 매장공간 협소 인테리어 평범한 것인데 성수동에 놀러오신분들보다는 직장인. 거주인에겐 오히려 조아 세컨드는 타코의 살사소쓰가 양파 토마토 고추다진것이 아닌 시판 액상살사라는 점.(그래서 2900원이라 이해감
10.19.일,다양하고 맛았는 타코를 가성비 있게 즐길 수 있어요
8.12.화,야근때 종종 옵니다 언제나 신선하고 맛나요
9.1.월,"가격대는 평균적이었지만, 퀄리티에 비해 합리적인 느낌이었어요. 직원분들이 친절했고, 주문 즉시 음식이 제공되어 만족스러웠어요. 성수동의 트렌디한 분위기와 어울리는 인테리어로, 편안하면서도 깔끔한 느낌이에요."
8.28.목,맛있어요 저렴하고 패티육즙도 가늑하고
8.27.수,지나가는길에들렸는데 부드럽고 맛있어요~~~! 햄버거도맛잇을거같아요 ㅠㅠ
10.4.토,사장님 너무 친절하세요… 꼭 오시길 추천드립니다! :)
9.14.일,친절하시고 가성비 좋아요!! 성수 브레이크타임 있는 식당 많은데 여기는 없어서 오기 편합니다👍
5.15.목,"버거와 타코를 무한리필한다굽쇼? 이건 못 참치!! 5월 16일로 조기종료한다고 해서 용인 기흥에서 2시간 자전거타고 헐레벌떡 왔습니다. 일반 뷔페와 달리 키오스크(1대)에 계속 주문을 넣는 시스템이라 리필 3번을 넘어가면 조금 뻘쭘한 느낌이 스멀스멀 올라옵니다. 오늘은 햄최몇 3~5급 거인? 아니 손님들이 오셨는지 사장님과 알바분 넋이라도 있고없고. 행사이아기는 끝. 맛 평가를 하면 대한민국 수제버거, 타코 격전지 성수에서 가성비?로 공략했습니다. (외지인 관광객 보다는 성수 직장인 타겟) 버거와 감튀는 맥날,버거킹 보다 수제 느낌나서 좋았습니다만 타코는 -가격때문에- 시판 나초 살사소스를 쓰는 것 같은데 살포? 양이 조금 과하지 않은가합니다.. 전 근처 살아서 리필행사 끝나도 재방문의사"
9.7.일,버거랑 타코 생각나면 꼭 오는 곳이에요!! 다음에 또 먹으러 오겠습니다~~
8.14.목,타코도 맛있구 버거도 맛있어여
6.19.목,"진짜 맛있어요👍👍👍 맛집 입니다!! 양도푸짐하고 맛은 물론이고 인테리어분위기도 외국느낌! 너무 이뻐요!! 또, 타코 맛집!! 재방문 의사 100% 추천입니다☺️"
9.19.금,맛있어요!! 버거가 진짜 짱맛 버터번 바꾸면 더 자극적이고 맛잇어용......
8.28.목,가성비 굳!!!! 맛있어요
6.21.토,타코 맛있어서 추가주문했어요! 고수 꼭 추가하세요..(고수러버) 햄버거도 육즙풍부하고 맛있습니다 사장님 감사합니다^^*
7.26.토,"언제먹어도 맛있는 버거 타코! 이 가격에 이 퀄리티와 양, 맛까지! 강추"
5.19.월,"무한리필 행사 참여하고 싶었는데 출장 이슈로 못함.. 궁금해서 결국 방문. 이 가격에 버거와 타코라니 일단 세트 구성 만족입니다. 패티는 육즙 풍성하고, 버터번 부드럽고, 야채 상큼해서 조합이 좋습니다. 사이즈보면서 순삭하겠다 생각했는데 더블패티라 그런지 묵직해서 배가 상당히 부르네요. 맛있게 먹었습니다.."
7.2.수,버거랑 타코까지 시켰는데 만천원...🥲🫢가성비 대박이고 꼭 두 개 같이 시켜서 드시는 거 추천해요!! 매장 안은 넓은 편은 아니지만 그만큼 혼밥하기에도 좋은 매장이에요🤗 성수 오면 또 생각날 것 같네요!
6.29.일,맛있고 재료도 신선해서 잘먹고 가요.😃
8.15.금,"오늘 처음 방문해서 쉬림프 타코, 비프 타코 먹었는데 맛있었어요!! 재방문 예정이요👍👍👍👍"
5.12.월,우연히 알게된 BT 버거앤타코! 회사선배와 퇴근길에 들려 버거와 타코에 퀘사디아까지! 배터질 정도로 배부르고 맛있게 잘 먹었습니다~!!^^ 자주 올게요~
8.30.토,반응 남기기 방문일 8.30.토 2025년 8월 30일 토요일 1번째 방문 인증 수단 영수증
6.8.일,버거앤타코는 햄버거 번부터 맛있어요! 비프치즈핫세트 버거 살짝 매콤하고 속재료 알차고 최고예요~ 감튀도 뜨끈뜨끈 넘 맛있어요ㅎㅎ
7.20.일,신선하고 맛있었어요! 생각보다 많이 괜찮아서 놀람
8.2.토,성수 놀러왔다가 방문한 매장인데 매장이 깔끔하고 혼밥하기도 좋아요 버거랑 타코도 맛있어요!!!
6.8.일,버거하고 타코하고 같이 먹을 수 있어 좋고 맛도 좋네요~
6.17.화,너무 맛있습니다.. 맨날 버거킹만 먹다가 버거앤타코 먹으니까 신세계를 맛본 기분입니다..
7.15.화,타코도 넘 맛있고 치폴레 감자튀김 추천합니다!! 넘 맛있어요~~
7.10.목,진짜로 맛있어요👍👍 햄버거 빵이 겉바속촉이고 패트도 부드러워요 건강식 느낌이에요 타코랑 햄버거 조합 굿입니다!
7.11.금,간이 좋고 적당히 매콤합니다! 양도 많아서 배부르게 먹고 가네요!! 잘 먹었습니다!! ☺️
4.7.월,맛있고 실해요! 1975세트 먹었는데 딱 그 추억의 맛! 학창시절 생각나서 좋았고 브레이크 타임 없어서 식사때 놓쳐도 부담없이 오기 좋아요.
6.23.월,양도 좋고 넘 맛있어요!! 소스도 넘 맛있고 추천합니다 ~~~
10.1.수,반응 남기기 방문일 10.1.수 2025년 10월 1일 수요일 1번째 방문 인증 수단 영수증
6.27.금,햄버거와 타코 조합이 맛있어요! 사장님도 친절하세요 추천합니다!!!!
10.1.수,맛있게 잘 먹었습니다!
7.3.목,음식이 맛있고 종류가 많아서 좋아요
5.28.수,음식도 맛있고 은근 양 많아요! 의자도 편하고 좋아요
5.7.수,군침돕니당 ㅎㅎㅎ ㅎㅎ타코랑버거라니
5.31.토,퀘사디아 좋아해서 찾아왔어요! 맛은 당연히 맛있고 다음에 또 올게요!
3.21.금,주문과 동시에 패티 구워주심. 양배추와의 조화가 기가맥힘. 타코 야채도 풍성하고 간도 딱 좋아요!
3.11.화,햄버거는 먹어봤고 타고는 처음 먹었는데 맛있어요 혼자 식사하기도 좋고 가성비 좋아요 :)
6.14.토,치즈스틱 😋😋😋😋😋 버거 1975말고 다른 것도 먹고 싶네용 타코 포크는 매콤한 핫소스가 있어용
6.4.수,정말 맛있는 타코와 버거를 먹었어요!! 다음에 또 오겠습니다 ~ 감사합니다
4.30.수,서울숲에서 돗자리 깔고 먹으려고 주문했어요!  햄버거 너무 맛나는데.. 여기는 타코 맛집입니다..💗 다음에 또 가서 먹으려구용
5.7.수,세트메뉴가 알차서 좋아요
4.16.수,맛있게 잘먹었습니다. 항상 맛있습니다
4.19.토,"퓨전인 것 같은데, 갓 나오자마자 먹으니까 너무 맛있어요ㅜ 감튀는 특히 바삭촉촉.. 추천입니다! 맛있게 잘 먹고 갑니다 ㅎㅎ"
5.23.금,매번 올 때마다 느끼지만 버거가 넘 담백하고 맛있습니다ㅠㅠ
4.11.금,완전 존맛 일하는 근처라서 와봤는데 너무 맛있게 먹고가요 ㅎㅎ 다음에 또올게요
3.14.금,뚝썸에서 흔치 않은 가성비 버거 타코집.. 비프타코 주문했는데 다음엔 버거도 먹어보고 싶어요! DIY버거도 싱기
4.8.화,너무 맛있어서 이사 가서도 생각나서 다시 들리게 되는 뚝섬 맛집이에요🥺
4.2.수,"구석에서 혼밥하기 좋았어요, 신메뉴 치즈멜트버거 업사이드다운 버터토스트 보드랍고 맛있어요!"
3.15.토,처음 와봤는데 너무 맛읶어요!! 다음에 또 오겠습니당
4.17.목,비주얼 합격!! 냄새도 합격!! 맛도 합격!! ㅎㅎ
5.11.일,맛도 가성비도 넘쳐서 자주 이용할거 같아요
4.6.일,너무 맛있어요! 다음에 또 먹으려구요 :) 양도 적당하고 좋습니다!!
4.6.일,맛있어용 ㅠㅠㅠ 버거가 맛있어요
2.14.금,항상 맛있게 잘먹고 갑니다.
2.20.목,뚝섬에서 가성비 좋아서 계속 오고있어요. 맛도 좋아요!! 수
3.25.화,버거랑 타코를 같은 곳에서 먹을 수 있는게 좋었어요. 풀드포크는 약간 매콤합니다. 고수 추가했는데 넉넉하게 주셔서 좋았어요. 예상 외로 버거 번이 맛있습니다.
3.29.토,노원에서 먹고 성수에 왔는데  진짜 너무 맛있어요  미친듯이 맨날 먹고 싶음 ㅠㅠ
4.6.일,버거가 맛있고! 번이 특이한데 맛있어요!!! 가격도 적당하고 사이드 변경도 자유로워서 좋아요!
6.27.금,반응 남기기 방문일 6.27.금 2025년 6월 27일 금요일 1번째 방문 인증 수단 영수증
3.9.일,반응 남기기 방문일 3.9.일 2025년 3월 9일 일요일 1번째 방문 인증 수단 결제내역
2.14.금,오늘도 맛난 버거와 타코 먹으러 왔습니다. 굿굿
3.12.수,"타코가 먹고싶은데, 항상 타코는 양이 조금 부족해서 아쉬워서 망설였던 적이 많았습니다. 그런데, 햄버거하고 타코를 같이 먹을 수 있는 집을 찾아서 부족하지 않고 맛나게 점심식사 즐길 수 있었습니다!!"
3.14.금,타코를 저렴한 가격에 푸짐하게 먹을 수 있어요 ! 향신료도 세지 않아서 먹기 좋아여
2.7.금,저렴해서 좋아요 그리고 회사랑 엄청 가까워서 자주 올것같아요! 매장 까끔해요! 양도 많아요! 맛있어요
7.27.일,반응 남기기 방문일 7.27.일 2025년 7월 27일 일요일 1번째 방문 인증 수단 영수증
3.30.일,리뷰보고 왔는데 기대됩니다.
7.2.수,반응 남기기 방문일 7.2.수 2025년 7월 2일 수요일 1번째 방문 인증 수단 영수증
2.22.토,항상 버거 즐겨 먹는 데 가족들하고 먹어도 맛있네요~
3.22.토,보통 타코만 먹으면 양이 모자란 경우가 많은데 버거랑 타코가 같이 있어서 배불리 먹기 좋아요 타코 가격도 저렴해서 추가주문해서 먹기에도 부담없고 맛있어요
24.12.5.목,성수동에 새로 생긴거 같아요! 구성이 버거&타코&음료수에 지금 이벤트로 치즈스틱까지 먹을 수 있는데 9천원이 안되네요..! 가성비 미쳤습니다! 오늘 타코랑 버거 둘 다 땡겼는데 넘 만족스러운 한끼였습니다ㅎㅎ 자주 올게요~!!
3.18.화,항상 올때마다 맛있어용!! 특히 감튀랑 타코 짱!!
6.17.화,반응 남기기 방문일 6.17.화 2025년 6월 17일 화요일 1번째 방문 인증 수단 영수증
2.13.목,너무맛있잖오♡♡ 가성비 짱이다여!!: 강추추
2.14.금,여기 타코는 진짜 명불허전입니다. 나오자마자 순삭할 정도로 그냥 입에서 녹아요❣️ 인플루언서가 괜히 추천한 게 아닌가봐융
2.22.토,양도 많고 맛있어요 ㅎㅎ 특히 타코가 맛좋네요 감자튀기무는 양많아요 좋아요
1.13.월,버거 타코 세트 좋습니다 요즘은 감자대신 타코로 선택해서 먹네요
4.13.일,맛있게 잘 먹었어요
5.6.화,반응 남기기 방문일 5.6.화 2025년 5월 6일 화요일 1번째 방문 인증 수단 영수증
2.1.토,너무 맛잇엇습니다 타코랑 버거랑 페어링 굿
2.13.목,빨리나오고 푸짐하고 맛있네여!!
1.31.금,음식 빨리 나오고 엄청 맛있어요!!
1.27.월,너무 맛있게 잘 먹었습니다! 다음에 올게요🤤
1.10.금,너무 맛있게 잘 먹었슺니다 너무 배부르게 먹었네요 타코가 정말 맛있네요
24.11.21.목,"역이랑 가까워서 방문하기 편했고 , 수제버거 치고 가격도 만족스럽고 구성도 좋았습니다~"
1.13.월,반응 남기기 방문일 1.13.월 2025년 1월 13일 월요일 11번째 방문 인증 수단 영수증
1.10.금,맛있어요 가성비 좋아요
24.12.20.금,버거도 맛나고 타코도 맛나고 가성비도 좋은곳
24.10.21.월,런치세트로 버거랑 타코세트를 9900원에 먹었는데 완전 갓성비에요! 다른데가면 버거만 만원 훌쩍넘기는데 여긴 가격도 착하고 맛도 착해요!!  + 타코가 깔끔하게 맛있었어요❤
24.11.21.목,버거랑 타코 둘 다 먹을 수 있어서 좋아요. 맛있게 먹겠습니다!!
1.18.토,너무 친절하고 너무 맛있어요
2.4.화,반응 남기기 방문일 2.4.화 2025년 2월 4일 화요일 1번째 방문 인증 수단 영수증
24.9.15.일,엥 저는 노원점 갔는데 성수점으로 리뷰가 남겨졌네요  치킨타코에 빠져서 퇴근길마다 버거앤타코 노원점에 들려 포장해와요😋 오픈때는 사람이 많았는데 점점 줄어드는 것 같아 마음이 아파요🥲 맛있어요 드셔보세요!  오늘도 맛있게 잘 먹었습니다~
2.15.토,타코먹고 싶었는데 뚝섬역 바로 옆에 위치하고 있어서 방문했어요! 맛있어요!
2.15.토,버거 타코 모두 맛있어요 😊
24.12.1.일,뚝섬역 7번출구 코앞이에요 타코 좋아하는데 친구랑 미술관 가기 전에 우연히 발견해서 들어왔어요! 깔끔하고 가격도 합리적이고 사장님도 친절하세요!
24.12.20.금,반응 남기기 방문일 24.12.20.금 2024년 12월 20일 금요일 10번째 방문 인증 수단 영수증
1.10.금,타코와 수제버거를 함께 먹을수 있고 회사옆 가성비 좋아서 종종 방문 및 포장해요 일찍열어서 더 좋아용:)
24.11.26.화,오늘도 점심은 버거앤타코에서 해결합니다. 맛있어서 종종 옵니다.
24.11.6.수,버거 내용물 많고 맛있어요!!
2.4.화,배달로 먹고 맛잇어서 매장으로 또 왓어요
2.15.토,맛있게 잘먹었습니당~ 다음에 또 먹으러 올게요 츄릅
24.11.14.목,항상 맛있게 잘 먹고 있습니다
5.6.화,반응 남기기 방문일 5.6.화 2025년 5월 6일 화요일 1번째 방문 인증 수단 영수증
24.11.5.화,처음와서 먹었는데 맛있어요 ㅎㅎ
24.12.12.목,반응 남기기 방문일 24.12.12.목 2024년 12월 12일 목요일 10번째 방문 인증 수단 결제내역
24.10.28.월,가까운 수제버거집!! 가성비도 좋고 맛도 너무 좋은!! 혼밥 하기에도 너무 좋아용 ㅎㅎ 편안한 분위기에서 맛있는 수제버거를 즐길 수 있었습니다!!
1.6.월,맛있게 잘먹었습니다>< 치킨버거 새우타코 맛있어요!
24.10.1.화,양념 감자도 정말 맛있어요 타코랑 햄버거파는 맛집💖 돈까스 타코 매우 바삭해요 찐맛집‼️
24.12.5.목,맛있고 가성비 좋아요
4.6.일,반응 남기기 방문일 4.6.일 2025년 4월 6일 일요일 1번째 방문 인증 수단 영수증
2.1.토,반응 남기기 방문일 2.1.토 2025년 2월 1일 토요일 1번째 방문 인증 수단 영수증
24.12.8.일,버거랑 타코 조합은 처음 접해보는데 좋네용 사장님도 친절하고 음식 맛도 좋아요!
2.15.토,반응 남기기 방문일 2.15.토 2025년 2월 15일 토요일 2번째 방문 인증 수단 영수증
24.12.25.수,너무너무 맛있게 먹었어요!!
24.9.24.화,"너무 맛있어요! 타코의 핫 새우가 느끼함을 잡아주고, 통통 식감이 있습니다. 버거의 패티도 바삭하고 일반 수제버거랑 좀 다른 식감이였어요^^"
1.25.토,너무 잘먹었어요 맛있습니다
1.24.금,버거 맛있게 잘 먹었습니다!
24.11.26.화,반응 남기기 방문일 24.11.26.화 2024년 11월 26일 화요일 5번째 방문 인증 수단 영수증
24.10.13.일,양도 많고 맛도 있어요~!!ㅎㅎ 타고 투피스만 먹으면 양이 적을까 걱정했는데 크기도 크고 세트로 먹으니 한 끼로 충분하네요! 타코집이 주변에 많이 없었는데 자주 먹으러 올 것 같아요! 다음엔 버거도 먹으러 올게요~
3.21.금,반응 남기기 방문일 3.21.금 2025년 3월 21일 금요일 1번째 방문 인증 수단 영수증
24.10.30.수,버거랑 타코 둘다 맛있어요 👍🏻👍🏻🍔🌮
24.11.14.목,항상 맛있게 잘먹고있습니다
24.10.28.월,크기도 크고 맛도 좋아요 타코도 다음에 꼭 먹어보고싶어요!!
24.8.12.월,"햄버거와 타코, 두마리 토끼를 한번에 잡을 수 있는 음식점!!😊🙂 저는 버거가 진짜 맛있었던게 양파가 정말 맛있게 구워서 들어가 있더라고요❤️😊 추천해요!🙂"
24.10.4.금,"진짜 타코 너무 좋아하는데 낮은 가격에 이렇게 맛있는 타코집은 처음이에요 진짜 버거도 맛있고,, 사장님 꼭 오래 오래 장사해주세요 감사합니다"
24.11.16.토,가까이 있어서 한 번 와봤는데 생각보다 맛있었어요. 세트인데 가격도 너무 괜찮네요
24.12.23.월,노브랜드버거 문닫아서 우연히 포장 주문했는데 너무 맛있네요.. 또 시킬게요 번창하세요
24.10.1.화,언제나 만족합니다 음식도 맛있고 직원분들도 친절하세요
24.10.4.금,날씨도 좋고 음식도 맛있고 즐거운 하루
24.10.31.목,언제나 맛나고 가성비 좋아요!
24.6.16.일,뚝섬에 버거와 타코를 진짜 가성비 좋게 먹을 수 있는 곳 같아요! 보통은 그냥 수제버거집이거나 타코집이거나 따로 먹을 수 있는데 이곳에서는 버거도 타코도 먹을 수 있어서 버거를 먹으면서 타코를 사이드로 먹으니 진짜 딱이더라고요🌮🌮세트 가격대도 음료랑 감자튀김이나 치즈스틱 치즈볼 등등 골라서 만원 이하로 먹을 수 있다니 요즘같은 고물가시대에 진짜 갓성비네요 번이 파삭하고 단맛도 고소한맛도 있어서 다른 곳과 다른 점이 매력있었어요 매장이 협소하지만 배달 주문이 계속 끊임없이 울리는 걸 보니 이미 소문난 맛집같아요 직장인들이라면 이런 곳 있어주면 넘 감사한 가격착하고 맛있고 양도 많은 곳🍔🍔
2.19.수,반응 남기기 방문일 2.19.수 2025년 2월 19일 수요일 1번째 방문 인증 수단 영수증
1.16.목,반응 남기기 방문일 1.16.목 2025년 1월 16일 목요일 1번째 방문 인증 수단 영수증
24.9.10.화,구성물이 알차고 맛있습니다. 강추합니다!
24.9.23.월,종종 점심시간에 오는곳입니다 가성비 좋고 맛있습니다
24.9.27.금,맛있게 자주 이용하고 있어요
24.9.22.일,포장했어요! 타코랑 버거 두가지 다 맛볼수있어서 좋아유 ㅋㅋㅋ
24.12.19.목,햄버거도 맛있고 타코도 맛있어요. 낮술 혼맥하기 좋아요.
24.11.14.목,올때마다 맛있게 먹고 갑니다!!
24.9.10.화,튀김류가 따끈따끈바삭하고 맛있어요! 약간 쌀로별..? 고소한 맛?🌾 여름 기념으로 비프더블베이컨 버거가 무료로 세트업그레이드 되니까 참고하셔요! 더 자세한 리뷰를 보고 싶으시다면 제 블로그 구경하러 오세욤 ㅁㅅㅁ🤍
24.11.29.금,직장동료들이랑 왔어요~ 수제로 하는데 맛있어요^^타코랑 버거 같이 먹을 수 있어서 좋아용 자주올듯해요~
24.12.2.월,"근처 올때마다 들러서 버거를 먹어요! 맛도 좋고, 양도 좋아요!"
24.10.14.월,항상 잘 이용하고 있습니다 번창하세요~
24.10.18.금,언제나 맛있고 가성비도 좋아요!
24.8.19.월,"버거와 타코를 같이 먹을 수 있어서 좋고 버거번(진짜존맛)소스, 패티 간도 적당하고 맛있습니다."
24.9.11.수,이번이 세번째 방문입니다. DIY 버거. 취향에 맞게 주문 가능해서 좋았습니다. 사장님 직원분도 친절하세요. 버거 타코 맛있어요.
24.10.19.토,반응 남기기 방문일 24.10.19.토 2024년 10월 19일 토요일 4번째 방문 인증 수단 영수증
24.9.28.토,점심으로 맛있게 먹었어요
24.9.24.화,햄버거로도 종종 찾는 곳인데 오늘은 타코 먹었습니다 간단하게 먹기 좋고 매장도 깔끔해요!!
24.8.12.월,진짜 인생 버거...🍔 찾아 먹고 싶은 맛 입니다 !! 양이 진짜 많고 사이드 메뉴도 자유롭게 변경 가능한게 너무 좋았어요 !! 주문하면 바로 조리하시는데 주문하고 오래 걸리지 않아서 놀랐숩니당 🤭 이사하기 전 가보고 싶던 식당 중 하나였는데 조만간 종종 들릴게요 😆
24.8.27.화,오랜만에 왔는데 여전히 기성비 좋네요 맛나게 먹고 갑니다
24.10.4.금,항상 맛있게 잘먹고 있습니다.
24.12.1.일,모임으로 왔는대 넘 맛있습니다
24.6.15.토,뚝섬역 근처엔 사실 다양하게 먹을게 없었는데 타코!! 집이 있는걸 유투브보고 무작정 왔어요 ㅎㄹ 결과는 너무 맛있게 잘먹었습니다!! 저희 신랑은 슈림프가 제일 맛있다는데 일단 다 맛있습니다 모르고 고수 추가안햇는데.. 다음번에는 추가하고 먹을거에요~
24.10.16.수,반응 남기기 방문일 24.10.16.수 2024년 10월 16일 수요일 3번째 방문 인증 수단 영수증
24.10.23.수,성수 근처에는 햄버거가 비싼데 버거앤타코는 저렴하고 맛도있어서 자주 이용해요~
24.9.23.월,감사합니다. 맛있게 잘먹었습니다
24.10.28.월,맛있게 먹고 포장도 해갑니다!! 먹기전 사진은 없어요!! 이미 뱃 속에..ㅋ
24.10.13.일,홀에 테이블은 2개 정도 있구-!! 사장님들도 엄청 친적하셔요-!! 히밥이 온 곳이라고해서 와보시는거 좋을거같애요 ㅎㅎ
24.11.6.수,수제버거 느낌 맛있어여!
24.8.29.목,빠르게 나와서 좋아요 ㅎ 맛있고 좋아요 또올게요 감사합니다.
24.9.4.수,버거도 재료 및 소스를 취향에 맞게 선택할수 있어서 좋았고 타코도 타코벨보다 맛있었어요.
24.8.19.월,비프치즈마니아 버거 아주 맛있었습니다~~ 소고기 패티랑 치즈랑 잘 어울려서 든든하게 먹었네요 ㅎㅎ감자튀김도 바삭해요 또 와야겠어요~~~
24.8.28.수,점심에 방문 가성비 맛집이에요 ㅋㅋ 맛있게 잘먹었습니다!!^^
24.10.8.화,종종와서 점심으로 먹는데 항상 맛있어서 주기적으로 오게되네요 ^^
24.9.29.일,배달로 종종 시켜먹었을 만큼 맛있는 수제버거 집이에요~ 이번에는 남자친구랑 매장에 들려서 먹어봤어요~! 확실히 직접와서 먹으니 더 맛있는거 같아요~최고쵝오 👍👍
24.6.15.토,"타코를 먹어볼 수 있는 흔치않은 곳! 가격도 가성비 넘치고 양도 괜찮네요 ,, 고수 추가했더니 아삭아삭 상큼하니 좋습니다! 공간 아담하니 들러서 혼밥하고 가기 좋아요."
24.9.12.목,언제나 가성비 좋고 맛난 곳입니다!
24.12.24.화,반응 남기기 방문일 24.12.24.화 2024년 12월 24일 화요일 1번째 방문 인증 수단 영수증
24.6.21.금,점심시간에 종종 모는곳 깔끔하고 맛나게 먹을수 있어 좋습니다
24.9.5.목,고기가 많이 들어 있어서 놀랐숴용~👍✨ 빵도 폭신폭신하고 햄버거는 넘 맛있었어요:)
24.8.15.목,너무 맛있어요~~ 빵이 바삭하고 좋아요ㅎㅎ
24.9.14.토,패티도 도톰하고 양도 많아요 너무 맛있어요!!!
24.8.27.화,따뜻한 음식 맛있게 잘먹었습니다
24.9.4.수,처음 방문인데 정말 맛있게 잘 먹었습니다! 줄설뻔했네요! 다음엔 포장도 해봐야겠습니다! 매우 만족입니다! ㅎㅎ
24.9.12.목,사장님이 친절하시고 처음 먹어봤는데 양도 많고 맛있어요!!
24.7.23.화,"8천원에 타코,맥주,감튀까지 뚝섬 최고 가성비 인정👍👍👍"
