date,content
24.8.17.토,날씨가 더운 날 시원한 맥주 한잔 하고 싶어서 들렀습니다. 가성비가 정말 좋아서 다른 지점도 여러 번 갔었는데 뚝섬역 주변에 생겼다고 해서 와봤습니다. 맥주 완전 시원하고 맛있어요!!
24.8.20.화,날 더워서 보이는 가게 들어왔는데 안주도 맛있고 좋아용
24.10.24.목,혼술도 편하게 가능한 곳!
24.6.18.화,"시원한 생맥주에 짭조롬한 닭날개 튀김, 밥 겸 시킨 라면까지 맛있게 먹었어요~ 여름에 강추!"
24.7.20.토,저녁시간 비오는날 한잔하기 좋은곳 입니다 에어컨 빵빵!!👏👏 자리도 여유있어 대화하기 좋습니다❣️❣️
24.12.21.토,공간이 넓고 안주가 다양해여
24.6.14.금,여기 맥주 마시기 짱 좋아요 ♥️ㅋㅋㅋㅋㅋ 닭날개가 가장 취향이구 볶음면은 안주로 먹기 좋은거같아요  여기오시면 닭날개 꼭 시켜드세요!🫡
24.6.14.금,술 마시기 좋은 안주 메뉴들과 가격 좋아요ㅋㅋ 퇴근하고 친구랑 시원하게 맥부 마시기 딱 좋은! 매장도 넓고 좋음!
24.7.20.토,시원하니~~~ 맥주한잔하기 좋아요~~~ 즐겁게 잘 먹고 갑니다!!!
24.11.8.금,간빠이 서울숲점 24.11.12.화 너무 맛있게 드셨다면 간빠이 서울숲점에 재방문 해주실거죠????ㅎㅎㅎ 항상 친절과 갓성비를 유지 하겠습니다~
24.9.13.금,가볍게 한잔하러 가기 좋은 곳이에요
24.6.29.토,사람 바글바글한 성수에서 찾기 힘든 넓고 쾌적한 식당이에용! 가격 너무 괜찮고 생맥도 시원해서 친구들이랑 한잔하기 좋아요 ❤️😍 틀어주시는 노래도 신나서 분위기랑 찰떡입니다 재방문 의사 있어요!!!
24.6.2.일,맥주 좋아하시는 분은 무적건 여기로!!! 몇 잔을 들이켰는지.. 안주는 말모말모ㅜㅜ 가심비 장난아니져ㅎㅎ 낮술 제대로 즐기고 가요🥰
24.6.1.토,성수 근방에서 찾아보기 힘들게 공간이 넓직해서 편했어요. 소음은 어느정도 있는 편이지만 공간이 넓어 좋았습니다. 맥주랑 안주도 가성비 좋고 추천해요! 🤍👍
24.8.19.월,맥주를 시켰는데 너무 시원해서 안주 나오기도 전에 거의 다 마셔버렷어요 넓고 쾌적하고 음식도 맛있습니다
24.6.7.금,정말 맛있게 먹었어요! 맥주가 너무 시원합니다 ㅎㅎ 자주올게요 오늘도 저녁먹고 산책겸 왔었어요 ☺️
24.7.31.수,처음 와봤는데 가성비 정말 좋아요! 맥주 뷰담없이 시킬 수 있어서 맥귀들 환영!
24.6.6.목,매장이 쾌적하고 직원분들도 친절하세요! 음식과 술이다양하고 맛있습니다 ☺️☺️
24.8.19.월,1900원에 맥주를 마실수 있는곳!! 안주도 저렴해서 간단하게 먹으러 오기 너무 좋은것! 서울숲 올때마다 올꺼에요
24.7.25.목,생맥주 1900원이라니…1900원로 치고 진짜 너무 맛이있어요! 네기마요 오꼬노미야기도 첨 봤어 시켜는데 진짜 맛있있다 … 가성비 최고 생맥주집이다.앞으로도 재 방문하겠다!
24.6.21.금,지인 추천으로 두번째 방문입니다! 운동끝나고 간단히 맥주시켜 먹기 너무 괜찮은 장소라서 앞으로 종종 이용할게요~🍻 단체로 와도 좋고 친구랑 가볍게 대화 나누기 좋은 것이에요🤟
24.11.25.월,간빠이 서울숲점 24.11.27.수 기본안주도 좋지만 가성비가 최고인 간빠이 서울숲점 혼술 하기에도 최적인 간빠이 언제든 편안하게 즐기시다가 가시고 또 또 재방문 부탁드려요^^
24.9.24.화,성수 놀러와서 늦게까지 편하게 술먹기 좋아요! 매장도 넓어서 재미있게 놀다가 갔습니다!
24.6.2.일,서울숲에 갔다가 우연히 들른 간빠이 서울숲점~~ 연인과 가볍게 서울숲 데이트를 마무리하며 이야기하기 좋네요. 냠냠남 맛있는 안주도 담백 꼬소 깔끔하고 생맥주도 1900원부터. 있어요~~^^
24.8.24.토,간빠이 서울숲점 24.8.25.일 혼술의 성지 간빠이 서울숲~ !! 시원한 맥주 한잔 마시고 있으면 안주도 바로바로~ 혼술 하러 또 오셔요 ㅎㅎ
24.8.6.화,야근 하고 배고파서 맥주와 핫도그 먹으러 왔어요 너므 맛있고 맥주가 1900원 이라니...후덜덜 자주 올게요~ 사장님 너무 재밌어요ㅋㅋㅋ
