date,content
8.15.금,"음식이 너무 맛있고, 특히 훈연 치즈 소스 뇨끼 너무 맛있어요 !! 👍🏻"
6.10.화,장점 : 맛있고 예쁜 음식 뇨끼에서 감자맛이 많이 느껴져서 좋다 오픈키친이라 좋다 아늑하다 친절하다 굿!
8.13.수,두번째 와도 맛있어요
6.12.목,"분위기가 너무 고급지고 좋아요 ! 메뉴들도 맛있고 트러플 뇨끼와, 문어 오일파스타 미쳤습니다 … 다덜 드셔보셔용 !🌟"
6.19.목,성수 파스타 맛집으로 유명한 뇨끼룸✨예약하고 가는걸 추천드리고 구운문어 미나리가 올라간 알리오올리오랑 훈연 치즈 소스 뇨끼 먹어봤는데 올리올리오는 엄청 개운하고 무겁지않은 파스타로 계속 흡입되는 맛😍 뇨끼룸 이름 답게 뇨끼는 부드럽고 소스가 정말 맛있었어요❤️
6.24.화,스테이크도 너무 맛있게 먹었는데 정신없이 먹느라 사진을 못찍었네요. 아이들 키우느라 이런곳 잘 못왔었는데 음식으로 이렇게 행복감을 느낄줄은 몰랐네요 너무 맛있게 잘 먹었습니다.
8.16.토,너무너무 맛있고 편안한 시간이었어요 감사합니다 <3
10.3.금,종종 오는 곳이에요~
9.7.일,생면이 맛있고 트러플 뇨끼가 맛있어요! 분위기도 좋고 친절하세요~
9.10.수,라구 맛이 진하구 정성이 담긴게 느껴집니다.
7.4.금,"여자친구가 이전부터 엄청 먹어보고 싶다고 했었던 곳이었는데, 먹어보니 역시 기대를 저버리지않네요!! 트러플 뇨끼 & 볼로네즈 파스타 강추합니다!!"
7.22.화,"특별한 메뉴가 많고, 뇨끼랑 파스타 둘다 너무 맛있었어요! 다음에 또 방문할 것 같습니다🍀"
5.26.월,사장님 두분 너무 친절하시구 바질 파스타도 바질 향이랑 홍합까지 너무 잘어울려서 맛있었어요 뇨끼는 이름답게 감자가 부드럽구 트러플도 조화로웠어요 메뉴 세개 시켰는데 아무것도 실패하지 않았답니다 ❤️👏
8.8.금,너무 맛있었어요 급하게 찾았는데 인생 맛집!!
6.16.월,문어 미나리 파스타와 훈연 치즈 뇨끼를 먹었는데 둘다 맛있고 풍미가 좋은 스타일이에요! 서울숲 근처 맛집입니다😃
6.16.월,바테이블에 혼자 분위기내기 좋은곳이에요 룸도있어서 아늑하게 데이트즐기기에도 좋은곳이에오!
8.18.월,음식도 맛있고 와인 맛있어요 처음 데이트한 식당이라 애정가는데 100일 기념으로 다시 왔어요 :) 룸에서 차분히 이야기하기도 좋고 분위기 좋아요
8.16.토,너무 맛있고 분위기도 좋아요 ㅠㅠ 데이트하기 넘 좋아요
8.11.월,뇨끼랑 라구 파스타 가성비 너무 좋고 너무 맛있게 잘 먹었습니다  그리고 너무 친절하시고 최고였습니다 감사히 잘 먹었습니다
9.14.일,너무 친절하시고 음식도 너무 맛있습니당🤭 또 오고 싶어요 !
5.26.월,엄마랑 브런치 먹을곳 찾다가 들어왔는데 진짜 너무 맛있어요.. 꼭 다시 올 곳! 서울숲 성수 근처 양식 먹어 본 곳 중에서 전 최고였어요 너무 잘먹었습니다:)
10.19.일,너무 맛있어요.. 분위기도 좋아서 데이트코스로 최고💓
6.28.토,시킨 음식은 정말 빨리 나왔던 것 같아요! 그리고 음식이 나올 때 직원분께서 어떻게 먹어야 가장 좋은지 알려주셔서 더 맛있게 먹을 수 있었던 것 같아요! 다음에도 또 방문할 것 같습니다 !!
5.14.수,트러플향이 진하게 나는 뇨끼와 하몽이 잔뜩 들어있는 샐러드 최고였습니다! 그리고 사진엔 없지만 라구볼로네제 진짜 강추요.... 💚 최고예요...😍 그리고 무조건 생면 변경해서 드세욥 면이 입안에서 춤을 추더라구요..😭 너무 맛있어요💙
5.25.일,"성수 뇨끼 맛집 글 보고 왔는데, 명성에 맞게 너무 맛있었어요~ 라구 파스타도 맛있구 분위기도 너무 좋네요🙂 맛있는 점심 먹고 행복한 하루가 되었어요~👍🏻👍🏻👍🏻"
9.15.월,모든 음식들이 맛있었습니다.
9.15.월,천천히 먹으면서 시간보내기 좋아요👍
8.17.일,너무 맛있고 분위기도 좋아서 데이트하기 딱 조아오~~!!!
3.27.목,"리코타치즈브레드는 필수입니닷..🤍 너무너무 맛있게먹었어요! 바질오일파스타는 생면이라 면이 진짜 맛있었구 트러플크림뇨끼는 인생뇨끼였어요! 양이 많은편은 아니라서 두명이서 에피타이저한개,메인2개시키면 딱 맞더라구요!ㅎㅎ 데이트할때 가기 좋습니당! 직원분들도 친절하셔서 좋은식사 하고왔습니다!"
8.29.금,매장 분위기도 좋고 음식도 맛있어요! 생면 파스타 추천합니다!☺️
5.15.목,이름답게 뇨끼 맛집이예요 생면 파스타도 맛있구요 ㅎㅎ 기념일때 왔다가 넘 맛있어서 또 왔는데 이번에도 맛있게 먹고 왔네요
6.19.목,부드러운 빵에 구름같은 리코타 그리고 잘 어울리는 토마토가 너무 맛있었고 바질도 약간 퓨전 느낌이 좋았고 면 식감도 너뮤 좋았어요! 트러플 크림 뇨끼 꾸덕하고 넘 맛있어요!
5.18.일,뇨끼 맛집을 찾다 알게 되어 예약하고 방문했습니다! 둘이서 에피타이저 하나랑 메뉴 두 개 시켰는데 딱 적당했어용ㅎㅎ 맛집답게 뇨끼 식감도 너무 적당하고 소스도 맛있었어요 바질 파스타도 너무 맛있었어요!! 잘 먹구 갑니당☺️
6.25.수,토스카티니에 토마토 조합이 너무 맛있어요~~! 알리오 올리오도 생면이라 식감이 너무 좋고 맛있게 먹었습니다🫶🏻🤍🤍
4.11.금,"뇨끼룸 옛날부터 와보고 싶어서 예약해서 왔는데 너무 만족하고 갑니다. 바질 파스타는 생면이라 식감이 재밌었고, 뇨끼도 생각지도 못한 다채로운 맛이었습니다!! 물론 볼로네제도 맛있었습니다!!! 좋은 시간 보내다 갑니다!"
7.12.토,뇨끼집 중 손꼽히게 맛있어요!! 벌써 3회차 방문이랍니다~~ 분위기도 좋고 데이트장소로 추천합니다!
4.9.수,뇨끼룸 처음와봤는데 들어오자마자 아늑한 분위기도 너무좋고 일단 무엇보다 음식이… 너무 맛있었어요🥹🥹 다 맛있었지만 트러플 뇨끼 꼭 드세요!! 지금까지 먹어본 뇨끼중 단연 최고ㅠㅠㅠㅠ 💗💗  다음에 또올거에요☺️
8.27.수,뇨끼랑 파스타가 너무 맛있고 분위기가 좋아서 다음에 또 방문하고 싶어요❤️
6.29.일,첫 방문이었는데 뇨끼가 정말 맛있어요🥺 데이트장소로 강추
8.9.토,"디너 오픈 시간에 방문해서 예약안하고 바로 입장, 스타터 포카치아 브레드 너무 촉촉 부드럽고 뇨끼, 파스타 모두 맛있게 먹었네요."
6.28.토,오픈 키친 형태라서 요리 과정을 볼 수 있어 재밌어요! 저는 운좋게 바로 들어왔지만 매장이 크진않아서 예약은 하고 오시는게 좋을것같아요 전체적으로 깔끔하게 맛있는 맛이에요
7.28.월,너무맛있어요… 뇨끼가 진짜 예술
5.8.목,다 진짜 맛있었어요 특히 파스타가 너무 맛있어서 싹싹 긁어먹었어요 뇨끼도 부드럽고 양 적어보이지만 다 먹으면 배불러요 아이스크림도 추천합니다
6.15.일,친절하시고 메뉴 하나하나 다 너무맛있네요 다음에도 또 방문할게요🤙👍
5.10.토,뇨끼가 맛있다고 해서 처음 방문 했는데 뇨끼는 당연 맛있고 다른 음식들도 너무 맛있어요~~ 직원분들도 너무 친절해요~~ 완전 강추합니다👍
6.24.화,분위기도 좋고 시킨 거 다 너무 맛있었어요!!
7.27.일,라구파스타 면이 쫀득하구 풍미가 진짜 조아요..🥹 뇨끼는 위에 크렌베리같은 게 상큼해서 느끼하지 않구 조화롭게 맛있어요💞
7.13.일,여기는 리코타 크로스티니로 시작해서 생면피스타까지 하나도 맛없는게 없어요. 저의 최애 파스타 뇨끼집입니다
8.5.화,처음 가본 뇨끼 전문점이었는데 기대 이상이었어요. 뇨끼 식감이 정말 쫀득하고 소스랑도 잘 어울려서 마지막 한 입까지 맛있게 먹었어요. 특히 트러플 소스는 진짜 별미! 가게 분위기도 아늑하고 조용해서 데이트나 친구랑 가기에 딱 좋은 분위기예요. 직원분들도 친절해서 기분 좋게 식사하고 나왔습니다. 다음에 또 방문하고 싶은 맛집이에요 :)
7.31.목,뇨끼도 맛있고 스테이크도 최고에요ㅎㅎ 분위기도 좋아요~ 추천이요 !
6.2.월,엄청 친절하시고 자리도 아늑해서 좋아요😄 메뉴도 너무 맛있고 기분 좋은 식사였습니다 ㅎㅎ
9.2.화,맛난 뇨끼와 파스타 ❤️
8.17.일,뇨끼가 포만감이 있는 크기여서 좋았고 트러플 향과 크림이 잘 어우러지는 맛이에요
8.10.일,반응 남기기 방문일 8.10.일 2025년 8월 10일 일요일 1번째 방문 인증 수단 영수증
