date,content
23.6.22.목,커피랑 디저트가 맛있어요!
23.6.18.일,분위기도 좋고 좋아요!!!
23.6.19.월,음료도 맛있고 디저트도 맛있어요! 다음에 또 올게용 ㅎㅎ
23.7.23.일,금호동에 새로 생긴 예쁜 카페 입니다.
23.3.26.일,어떤 점이 좋았는지 5개가 최대가 아니었다면 더 추가 했을텐데 아쉽네요. 매장도 청결하고 무엇보다 친절하시며 좌석 배치도 깔끔해서 편안함을 줍니다. 커피와 음료도 신속하게 만들어주셨고 디저트는 더할나위없이 맛있네요. 인테리어도 너무 좋고 차분한 음악에 오시는 손님들도 매너가 좋아서 집중도 잘되고 대화도 잘되는 곳입니다. 자주 찾고 싶은 곳이에요.
23.10.1.일,반응 남기기 방문일 23.10.1.일 2023년 10월 1일 일요일 5번째 방문 인증 수단 영수증
23.7.5.수,사장님 친절 하시고 빙수 맛있어요
23.11.14.화,반응 남기기 방문일 23.11.14.화 2023년 11월 14일 화요일 1번째 방문 인증 수단 영수증
23.5.14.일,사장님이 진짜 친절하시구 ㅎㅎㅎ 분위기 너무 좋아요 커피랑 음료도 맛있었어요 배 스무디 강추합니다🖤🖤🖤
23.7.9.일,커피 마시다 빙수 포장해와서 먹었는데 생망고라 너무 맛있네요 또갈께요
23.4.6.목,지나갈때마다 테이크아웃으로 이용하는 매장입니다~! 저희 강아지도 너무 반겨주시고 친절하세요! 무엇보다 커피가 너무 맛있습니다~ 디저트도 직접 만드시던데 다음엔 디저트 왕창 먹어보려구요! 대박나세용!!!!
23.8.12.토,분위기 좋고 맛있고 우리 동네 멋집발견입니다!!ㅎㅎ
23.3.19.일,에그타르트랑 휘낭시에 세트 선물하려구 포장하러 왔다 와인 한병 마시구가요!!! 선물세트도 너무 고급진데ㅜㅡㅜ 와인도 가성비 있어 너무 좋아요!!!.. 다음엔 낮에 와인 마시러 와볼게요!!!!굿!!!!!
23.7.23.일,진짜 마카롱이 너무 고급진 맛이예요! 그렇게 마카롱을 좋아하지 않았는데 이젠 정기적으로 가서 먹고있네요! 👍👍
23.6.11.일,"매장 정말 예쁘고, 규모에 비해 디저트 종류와 음료도 다양한 편. 혼자만의 사색을 원하는 분들께는 적합하지 않은 것 같습니다. 공간이 소리가 울리는 편이라서요... 이때문에 일기 쓰러 갔다가 얼마 못 있고 나와서 아쉬웠지만, 매장 자체는 클래식하고 좋았습니다. 여럿이서 가시는 분들께 추천합니다."
23.9.16.토,반응 남기기 방문일 23.9.16.토 2023년 9월 16일 토요일 1번째 방문 인증 수단 영수증
23.8.1.화,동네에 예쁜 가게가 있어서 좋아요🥺 디저트도 존맛!!
23.3.26.일,일부러 찾아왔는데 마카롱 넘 맛있어요.. ㅜㅜ 분위기도 유럽에 온것 같고 너무 좋아요! 추천합니다 🤍🤍
23.3.6.월,지나가다가 너어어어무 예쁜 카페가 새로 생겨서 안 들어올 수가 없었네요 커피도 맛있도 디저트도 직접 만드시는 건지 퀄리티 너무 좋아요:) 강추강추
23.7.31.월,맛있고 한적해서 분위기도 좋았어오~~
23.2.5.일,"아침8시부터 문을 여는 곳이라 기억해뒀다가 갔습니다. 샌드위치와 아메리카노 세트는 약간의 할인이 있고, 텀블러 할인도 있대요. (중복은 안 여쭤봤네요) 크로와상샌드위치 맛있었고, 커피도 양이 넉넉한 편이었어요."
23.7.27.목,시장안에 유일하게 예쁜카페입니다 편히 쉬다가기 좋아요
23.7.26.수,팔빙수가 너무 맛있어요 ~~♡
23.7.25.화,올때마다 친절하게 응대해 주셔서 오면 기분이 좋아요 :) 자주 올께욥
23.3.24.금,커피도맛있고 타르트도맛있어요  와인이나 샴페인도 판매하는거같은데 다음엔 알콜 한 잔 하러 와야겠어요ㅎㅎ
23.4.2.일,사장님이 매우 친절하시고 화장실도 깨끗하고 인테리어도 예뻐요 조용해서 대화하기 좋아요
23.4.8.토,매장은 브라운 톤으로 되어 있어 편안하고 안정적인 분위기를 주는 곳이에요. 카페라떼는 무난한 맛입니다.  동물 동반 입장이 가능하지만 매장이 깨끗해요.
23.6.30.금,매장이 깔끔하고 청결해서 좋아요! 무엇보다 커피 맛이 좋아요! 강추입니다 ㅎㅎ
23.7.16.일,일단 분위기 맛집입니다!! 커피는 말모말모 너무 좋아요ㅎㅎ
23.5.14.일,"와 배스무디 미친맛,,, 그리고 매장 음악도 재즈로 나와서 더 편안한 분위기에요,,🫶🏻 우연히 지나가다 쉬려고 왔는데 너무 만족해서 갑니다!"
23.8.15.화,반응 남기기 방문일 23.8.15.화 2023년 8월 15일 화요일 4번째 방문 인증 수단 영수증
23.6.8.목,분위기 굿! 음료도 맛있어요♡♡
23.5.4.목,매장의 분위기가 정말 좋습니다.
23.3.25.토,돼지바 먹어보셨죠? 마셔보진 못했쬬? 끝장 나부러요~ 바나나프레소라떼는 달달하다 하셔서 쪼곰 걱정했는데오히려 적당히만 달고 부드러워 너무좋더라구용 사장님추천으로 디저트도 종류별로 먹어봤는데 단것 싫어하는 사람들도 맛나게 즐길 수 있는 저에겐 최고의 디저트였습니다 사진을 찍을 줄 모르는 저는 멀뚱히 있었지만 친구는 돌아다니면서 마구찍더라구요 ㅎㅎ 와서 힐링하구 가셔요~
23.8.9.수,친절하고 맛있고 이뻐요
23.6.8.목,분위기도 좋고 커피 맛있었어요 :)
23.8.7.월,시원한 빙수 맛있어요!!
23.2.9.목,아니 이게뭔가요?? 금호동에 이런 디저트 가게가 생기다니 너무좋다요♡♡자주오기도 하겠지만 지나가면서도 테이크아웃 꼭하려구요. 사장님 넘친절한거 어쩔티비 내돈내산 리뷰예용 자주 올게요♡
23.4.29.토,집 근처에 생겨서 와봤어요. 너무 괜찮은 곳이 생겨서 기분이 좋네요^^
23.1.9.월,"우연히 성동구 디저트 카페를 알아보다가 발견한 곳이에요. 근처 살면서 이 곳에 카페가 있는 줄도 몰랐네요ㅠㅎㅎ 디저트가 생각했던 것 이상으로 맛있었어요~초코 쿠키를 별로 좋아하지 않는 편인데 요기 “오레오쿠키” 정말 맛있었어요! 저희가 마지막 손님이였는데 다 먹고 나가는 도중에 사장님께서 디저트가 당일 판매라 남은 타르트를 서비스로 포장까지 해주셨어요!! 사장님이 왕 친절하셔서 앞으로 자주 갈 것 같아요~ 너무 감사해요 아, 화장실이 진짜 너무 예뻐서 ㅠㅋㅋ화장실 사진도 같이 올려요!"
23.4.28.금,커피도 디저트도 깔끔하고 맛있어요!! 매장도 너무 분위기 있고 이쁘고 알바생분도 친절하셔서 기분좋게 있다 갑니다!! 자주 오고싶어요!
23.7.8.토,분위기 너무 좋고 커피 디저트도 진짜 맛있어요! 단골각!
23.3.9.목,이쪽에 개인카페로 갈만한 곳이 없었는데 생겨서 너무 좋아요! 애기 델꼬 가도 친절히 맞이해주시고 유모차도 들어올 수 있어서 최고입니당! 커피 맛도 좋아용
23.6.18.일,인테리어도 예쁘고 편안한 분위기의 카페에요. 금호동에 이런 카페가 있어서 좋아요!
23.11.7.화,"금남시장 사거리쪽에 위치한 까페인데, 분위기가 진짜 좋아요. 인테리어가 편안하고 특별한 메뉴가 있어요. 크로플도이랑 에그타르트 정말 맛있어요!!"
23.6.20.화,일하는 곳 근처인데 라떼 마시고 싶으면 오는 곳이예요 :) 사장님도 친절 하시고 분위기도 좋아요 😌
23.5.19.금,커피랑 디저트가 너무 맛있다
23.7.2.일,마카롱 사가서 맛있게 먹으려구요 분위기도 좋아요!
23.6.30.금,분위기 좋고 맛있어요^^
23.1.1.일,지나갈때마다 외관이 예쁜 까페가 생겨서 궁금했었는데 정말 괜찮은 카페였었습니다.  디저트 보자마자 와이프랑 앞뒤 안보고 정신없이 골랐는데 전부 다 마음에 들었어요. 시키고 나니 조금 민망했지만 만족합니다.  다른 리뷰보니 샌드위치도 맛있다고 하던데 다음에는 샌드위치도 시켜봐야겠어요
23.8.25.금,반응 남기기 방문일 23.8.25.금 2023년 8월 25일 금요일 1번째 방문 인증 수단 영수증
23.4.5.수,비오는날 ~~ 딸기라떼 한잔 🥤 디저트도 맛있어영 😍😍
23.4.21.금,금호동에 이런 카페가.
