date,content
23.6.21.수,"어떻게 메뉴가 하나같이 맛있을 수 있죠!!? 미쳤어요ㅠㅠ 분위기도 너무 좋고, 사장님도 친절하시고, 음식도 너무너무 맛있었어요!! 다음에 또 올게요 번창하세요!!!!!♡"
23.7.1.토,문어 넘 맛있었고 부드럽고 소스가 진짜 맛있었어요!!! 이베리코도 부드럽고 소스 맛있구 다음에 다른 메뉴 더 먹어보려구요🫶🏻
23.9.1.금,음식 맛있고 와인 페어링 좋고 다들 친절하게 잘 설명해주시고 추천합니다
23.6.21.수,음식이 전부 너무 맛있어요! 와인도 사장님이 추천해주신 걸로 먹었는데 다 맛있고 음식이랑 잘 어울렸어요! 간단한 음식들 같은데 먹다보면 엄청 배가 불러요 ㅎㅎ 분위기도 좋고 위치도 좋아서 다음에 또 오고싶어요!
23.8.27.일,반응 남기기 방문일 23.8.27.일 2023년 8월 27일 일요일 1번째 방문 인증 수단 영수증
23.7.29.토,진짜 사장님들 두분 모두 멋지고 음식이 대박입니다. 정말로 유명 쉐프 레스토랑이나 호텔에서나 먹어볼만한 퀄리티에요. 저와 여자친구는 양이 많지 않아서 고깃집에서도 고기2인분 공깃밥 1개 나눠먹는 정도 소식가인데 여기서 22만원 어치 먹고 갔어요 심지어 많이 시켜서 서비스도 엄청 챙겨주셧는데 그 마저도 싹 비우고 왔습니다. 완전 제대로 된 찐 맛집이에요!!
23.8.2.수,사장님이 너무 친절하게 메뉴랑 추천해주셔가지구 어색하지 않게 잘 먹구 왔숩니당🍽🍽🍽 성수에 이런곳이 있다니!!! 다들 두번세번가세용 !!!!!
23.8.2.수,참돔스테이크 존맛!!!!!!!!! 꼭 가세요 여러분!! 사장님이 친절하구 음식 존맛탱❤️‍🔥❤️‍🔥❤️‍🔥
23.6.13.화,처음 먹어보는 새로윤 맛인데 신기하면서 맛있네요 잘먹고갑니디
23.7.22.토,여러분 많이가세요 아니 많이가지마세요 나만갈래..모든 메뉴가 맛잇고 초코바나나푸딩 꼭드새오
23.6.10.토,와인으로 글라스로 다양하게 먹어볼수있고 너무 친절하시고 서비스도 좋아요 !! 음식은 말해뭐해 당연히 너무맛있어요 👍🏼
23.6.9.금,특별한 메뉴와 맛난 안주들이 많습니다. 친구들 모임으로 왔는데 개좋아요!!
23.6.17.토,키워드를 5개만 선택할 수 있는게 너무 아쉬워요  진짜진짜 맛있구 분위기도 좋고 강추용
23.7.8.토,와인과 음식이 맛있어요
23.7.8.토,반응 남기기 방문일 23.7.8.토 2023년 7월 8일 토요일 1번째 방문 인증 수단 영수증
