date,content
"""음식이 맛있어요""",이 키워드를 선택한 인원
"""재료가 신선해요""",이 키워드를 선택한 인원
"""매장이 청결해요""",이 키워드를 선택한 인원
"""혼밥하기 좋아요""",이 키워드를 선택한 인원
"""친절해요""",이 키워드를 선택한 인원
"""양이 많아요""",이 키워드를 선택한 인원
"""인테리어가 멋져요""",이 키워드를 선택한 인원
"""특별한 메뉴가 있어요""",이 키워드를 선택한 인원
"""가성비가 좋아요""",이 키워드를 선택한 인원
"""매장이 넓어요""",이 키워드를 선택한 인원
"""고기 질이 좋아요""",이 키워드를 선택한 인원
"""메뉴 구성이 알차요""",이 키워드를 선택한 인원
"""아늑해요""",이 키워드를 선택한 인원
"""차분한 분위기예요""",이 키워드를 선택한 인원
"""반찬이 잘 나와요""",이 키워드를 선택한 인원
"""대화하기 좋아요""",이 키워드를 선택한 인원
"""아이와 가기 좋아요""",이 키워드를 선택한 인원
"""비싼 만큼 가치있어요""",이 키워드를 선택한 인원
"""뷰가 좋아요""",이 키워드를 선택한 인원
"""단체모임 하기 좋아요""",이 키워드를 선택한 인원
"""잡내가 적어요""",이 키워드를 선택한 인원
"""음악이 좋아요""",이 키워드를 선택한 인원
"""건강한 맛이에요""",이 키워드를 선택한 인원
"""화장실이 깨끗해요""",이 키워드를 선택한 인원
"""음식이 빨리 나와요""",이 키워드를 선택한 인원
"""현지 맛에 가까워요""",이 키워드를 선택한 인원
"""사진이 잘 나와요""",이 키워드를 선택한 인원
"""좌석이 편해요""",이 키워드를 선택한 인원
"""특별한 날 가기 좋아요""","""특별한 날 가기 좋아요"""
"""룸이 잘 되어있어요""",이 키워드를 선택한 인원
"""샐러드바가 잘 되어있어요""","""샐러드바가 잘 되어있어요"""
"""향신료가 강하지 않아요""","""향신료가 강하지 않아요"""
"""환기가 잘 돼요""",이 키워드를 선택한 인원
10.20.월,근처에 볼일이 있어서! 돈까스 맛집 찾다가 이곳을 알게 되었어요~~ 김치나베랑 모듬돈까스 시켰는데!! 구성도 너무 좋구요 둘이서 알차게 맛있게 먹고 왔네요. 김치나베 치즈 올라간거 시켰는데 고소하면서 맛있고 돈까스도 바삭해서 좋네요 또 올께용
8.8.금,"퇴근하고 밥 해먹기 귀찮아서 평소에 가보고 싶었던 시올돈을 찾았습니다 돈까스가 기대 이상으로 훌륭했습니다. 최근에 이정도로 퀄리티가 좋은 돈까스를 먹어 본 적이 없네요. 겉이 튀김은 바삭한데 고소하고, 속의 등심살은 씹자마자 육즙이 흘러넘칠 정도로 풍성한 식감을 보여 줍니다. 너무 맛있어서 소스까지 싹싹 긁어 먹었습니다. 샐러드 소스까지 진짜 일품 입니다. 동네에 이런 맛집이 있다니 충격 입니다. 너무 잘 먹었구요. 조만간 또 방문 하겠습니다."
10.3.금,아기가 치즈돈까스 좋아해서 왔어요 안심 등심도 부드러워서 잘 먹구요 매장도 깔끔하고 음식도 깔끔해요
8.5.화,전에 매장 오픈하고 오늘처음으로 와봤는데음식이 맛있고 튀김옷이 빠삭하고 촉촉하고 괜찮았어요 치즈나베는 김치의 감칠맛이 깊어서 맛있고 매장도 아늑하고 오픈주방이라 깨끗한거같아요 다음에 또올께요!
9.24.수,고기가 진짜 두꺼운데 부드러워요!!!!!너무 맛있고 친절하세요 만족스럽게 먹고왔습니다
8.27.수,"돈까스가 맛있고, 혼밥하기 좋아요. 개인적으로는 김치카츠나베가 칼칼깔끔해서 자주 오게 돼요! 바로 튀겨주셔서 음식 나오는 시간이 조금 걸려서 여유롭게 오시는 걸 추천합니당"
8.23.토,은평구 돈가스 가게 중에서 제일 좋다고 생각하는 곳이고 혼밥하는 분들도 많을 만큼 맛있습니다👍 평소 포인트도 적립해서 오늘 처음 사용해보고 좋네요 ㅎㅎ
9.7.일,너무 맛있어요~ ㅎㅎ 돈까스가 완전 부드러워서 입에서 녹아여 !! 김치카츠나베도 국물이 완전 진해요
10.12.일,고기 질이 진짜 좋은거 같아요! 먹어본 카츠중에 제일 맛있구 가격도 다른 데에 비하면 가성비인거같아요 맛있게 먹었습니다!!!
9.11.목,맛있는 돈카츠집이 동네에 있어서 참 좋아요. 주기적으로 먹을 수 있고 갈때마다 항상 맛있게 먹고 나옵니다!ㅎㅎ 늘 맛있게 만들어주셔서 감사합니다~
9.6.토,음식이 정갈하고 이쁘게 나와서 시각부터 만족이에요! 돈까스도 두툼하고 찍어먹을 수 있는 소스도 많아서 좋습니다 ㅎㅎ 엄마도 만족하세요
8.10.일,"숙성고기라 그런지 고기의 육즙까지 진짜 맛있어요ㅎㅎ 반찬 구성도 괜찮고, 집 근처라 자주 방문할 것 같아요 ! 증산역 근처 돈까스 맛집입니다 ㅎㅎ"
7.25.금,역시 시올돈입니다...👍 너무.부드럽고 맛있어요. 아이도 잘먹고 어른은 더 좋아해요. 양도 많고 점심에 와서 먹기도 좋아서 자주와요
10.16.목,항상 맛있게 먹고있어요 친절하고 양도많고 만족합니다
9.10.수,동네맛집입니다 너무너무너무너무 마싯어요 😍
10.19.일,진짜 맛있어요 직원들도 엄청 친절해요 돈까스는 시올돈!!
9.17.수,반응 남기기 방문일 9.17.수 2025년 9월 17일 수요일 6번째 방문 인증 수단 영수증
7.8.화,우리아들 최애 식당 시을돈. 매주 월요일은 휴무이기 때문에 화요일에 퇴근하고 저녁먹으러 왔어요~~ 아들은 모듬카츠. 엄마는 김치나베~ 맛있는고~~
10.12.일,김치나베만 먹어 봤었는데 특등심도 엄청 부드럽고 맛있어요 혼밥 하기 좋아요
8.7.목,"동네 맛집입니다. 안심카츠는 언제나 맛있고, 이번에 김치치즈나베 먹었는데 이것도 맛있네요!! 북가좌 돈카츠 맛집 추천!!"
7.31.목,돈까스 먹고싶을 때마다 믿고 찾는 곳이에요! 시올돈은 언제 먹어도 진짜 맛있어요..!!😋
8.27.수,메뉴 전부 맛있구 매장 깔끔해서 좋아요~!
10.8.수,자주 오는 곳이에요~~맛있게 잘먹었습니다:)
10.5.일,맛있고 깔끔하고 담백해요🤗 동네 맛집🫰🏻
10.19.일,"돈까스 좋아해서 일부러 찾아왔어요! 등심돈까스 맛있어요😃 대기 시간이 좀 걸립니다, 시간 여유롭게 오세요"
10.11.토,반응 남기기 방문일 10.11.토 2025년 10월 11일 토요일 1번째 방문 인증 수단 영수증
10.4.토,너무 맛있어요 동네맛집 뿌시기😆
9.27.토,언제나 믿고 먹는맛집이에요. 맛있게 먹었습니다.
9.26.금,양도 많고 진짜 맛있어요! 카레 추가해서 꼭 드세요 진짜 맛있습니다!! 혼밥도 좋고 친구랑 와도 좋을 것 같아요!
10.19.일,아이가 여기가 제일 맛있데요!
7.12.토,"김치나베랑 청양우동, 가츠동 시켰는데 맛있어보여요... 매창 쾌적하고 아기자기 귀여워요! 자리도 2인, 4인, 창가자리 다양하게 있습니다"
9.13.토,너무 맛있어요!!! 강추합니다
7.26.토,가성비 너무좋아요. 서울에서 이 금액에서 이정도면 너무 좋은거같아요. 가게도 쾌적하고 잘먹고 갑니다!
7.26.토,맛도 매장도 깔끔합니다 아기가 치즈돈가스를 좋아해요 ㅎ 그리고 아기용으로 따로 그릇 챙겨줘서 너뮤 좋네요 일식 돈가쓰는 여기가 최고네요~ 고기가 너무너무 부드러워요
10.12.일,맛있어요! 돈까스 생각하면 항상 오는곳!
8.6.수,진짜 너무 맛있고 💖 자주 오는 동네 돈카츠 맛집이에요💖 나베도 맛있지만 치즈카츠 진짜 내사라유ㅠㅠ 자꾸 생각나는…❤️ 또 오겠어용
5.25.일,너무 맛있어서 자주 방문하는 곳이에요!😃😃 안심카츠 너무 맛있고 새로 시켜본 김치 나베도 강추 입니다! 😘 주말 가족과의 점심식사로 너무 좋은 곳입니다:)
9.20.토,바삭바삭 돈까스 너무 맛있습니다 ㅎㅎ
6.24.화,가츠동 너무 맛있어요!! 친구는 김치나베 시켰는데 김치나베도 맛있어요!! 가츠동 강추합니다!!! 너무 맛있어요!! 플레이팅도 좋아서 더 맛있는 거 같아요!
8.7.목,혼밥하기 좋아요 매번 맛있게 먹습니다
10.18.토,동네에서 돈까스는 시올돈이 제일 맛있어요~~ 다음에 또 올게요
10.14.화,안심 돈가스 부드럽고 맛있습니다!
9.19.금,모듬카츠 너무 바삭하고 맛있어요.
8.10.일,치즈카츠 너무 부드럽고 맛있어요ㅎㅎ 재방문하려고해여!!
8.3.일,치즈카츠 존맛... 음식이 깔끔하고 맛있어요👍👍
7.16.수,"육즙도 꽉 차 있고, 코팅된 튀김은 바삭해서 너무 맛있게 잘 먹었습니다~ 다음에 또 올게요~❤️"
9.9.화,돈까스 좋아해서 방문했어요 맛있을거 같아 기대됩니다 ♡
10.16.목,고기가 부드럽고 음식이 깔끔합니다
8.24.일,매번 고민 없이 외식 하는 곳입니다. 아이도 좋아하고요. 돈까스 뿐 아니라 깍두기도 아이도 먹기 좋은 맵기. 메뉴가 많지 않아도 딱 전문점 느낌
9.24.수,첫 방문인데 좋네요 동네 살면서 지나간 적은 많았는데 애용할게요 번창하시길
9.25.목,아기랑 와서 잘 먹고갑니다^^
6.19.목,점심먹으려고 들렷어요 ㅎㅎ 칼칼한 나베땡겨서 주문해좍는데 양도 푸짐하고 딱 입맛에 맞아요:-) 매장도 깔끔하고 넓어서 다음에 카츠 점심먹으러 다시 와야겟어요 ㅎㅎ 최곱니닷 👍🏻🤤🩷
10.11.토,지나가면서 보기만 했는데 처음와봤어요! 맛있습니당!
10.11.토,돈카츠와 카레 모두 맛있습니다
9.20.토,한달에 두번 정도는 아이들과 옵니다 늘 맛있게 먹고 있어요
9.6.토,비가 너무 많이 와서 오픈보다 10분 전에 도착했었는데 너무 친절하게 응대해주셔서 기억에 남아요! 안심카츠가 6알인데 너무 부드럽고 양이 많아서 성인 남성도 포만감이 찰 정도였어요 :) 맛있는 집
8.31.일,헐 너무 맛있고 부드러워요 매장이 깨끗합니다 또와야겠다
10.14.화,항상 맛있게 먹고갑니다
10.3.금,"등심 , 안심, 치즈 다 맛있어요 >_<"
8.26.화,올 때 마다 기분좋게 먹고 가는 곳~ 오늘도 잘 먹었습니다!!^0^
8.28.목,양도 많고 다른데에 비해 저렴한 편이네요! 잘먹었습니당:)
8.31.일,바삭하고 맛있어요 추천합니다!
8.9.토,안심카츠 진짜 입에서 녹아요ㅜㅜㅜ완전 맛있어요 멀지만 담에 또 먹으러 올게요😭👍
10.5.일,반응 남기기 방문일 10.5.일 2025년 10월 5일 일요일 1번째 방문 인증 수단 영수증
8.19.화,안심이 특등심 둘다 맛있게 먹고 갑니다 !!!👍😭
9.14.일,반응 남기기 방문일 9.14.일 2025년 9월 14일 일요일 3번째 방문 인증 수단 영수증
8.23.토,깔끔하고 음식도 빨리나와서 좋아요 매번 잘 먹습니다
8.29.금,"시올돈 북가좌점은 고기 질이 좋아서 먹을 때마다 만족스러워요. 담백하고 육즙이 살아있어 정말 맛있습니다. 매장이 깔끔하고 분위기도 좋아 친구, 가족, 연인과 함께 가기 딱 좋은 곳이라 추천합니다."
8.27.수,친구들끼리 식사하러 오기 좋고 돈까스가 맛있어요
10.14.화,두번째 방문인데 잘 먹고 갑니당 너무 맛있어요 특히 특등심 맛있어요 ✨👍 감사합니다 ~~
8.19.화,친구한테 추천 받고 방문했는데 가게가 깔끔하고 편안한 분위기라 좋아요 🩷 맛있게 잘 먹고갑니다!!
4.27.일,"근처 볼일 보러 왔다가 검색하고 왔는데, 평소 돈가스 좋아하는 아이들이 먹자마자 엄지 척!!! 정말 맛있다며 앞으로 돈가스는 이 식당으로 오자고 하네요^^ 특등심가츠 궁금해서 주문했는데, 입맛 까다로운 7세 아이가 알아보네요~ 제일 맛있는 부위라며.. 맛이 다르냐고 했더니, 맛이 다른게 아니고 식감이 다르대요. 이제껏 먹은 돈가스 중 젤 맛있었대요~ 우동도 가쓰오우동 스타일 안좋아하는 아인데, 맛있게 잘 먹었어요. 일반적인 가쓰오우동 맛이 아니예요. 아이 둘 데리고 갔는데, 아이 밥까지 따로 챙겨주셔서 감사했습니다. 이 동네 오면 또 올거예요^^"
8.12.화,카츠돈 처음 먹어봤는데 너무 맛있어요 진짜 담에 또먹을게요
7.25.금,동네에 있어서 자주 가는 곳입니다~! 양도 많고 맛있고 친절하셔서 항상 맛있게 잘 먹고있습니다!😊
9.6.토,반응 남기기 방문일 9.6.토 2025년 9월 6일 토요일 1번째 방문 인증 수단 영수증
6.26.목,언제 먹어도 신선하고 맛있어요
7.13.일,남자친구와 주말마다 들리는 곳! 여기 김치나베 너무 좋아요.. 🤤 다른 돈까스도 다 맛있어요
9.23.화,매장 방문 후 자주 시켜먹는 단골 돈카츠집이에요. 고기 신선 육질 최고구요~~ 특히 아이가 매주 1회 이상은 찾는 집이어서 오늘 아이와 외식겸 매장 방문했어요~~
7.25.금,치즈 완젼 짝짝 늘어나구 돈카츠 부드럽고 맛있었어요!! 미니카레도 완젼 맛있어요!!!
8.27.수,맛있게 잘먹었습니다 다음에도 또 올게요
10.16.목,음식도 신선하고 분위기도 깔끔하고 좋아요! 샐러드도 듬뿍주고 짱 다음에 또 올게요~~
6.21.토,"시간이 맞지 않아 오랜만에 찾은 시올돈. 매장 깨끗하고 친절해서 좋아요. 김치나베는 느끼함 없이 끝까지 먹을 수 있어서 좋고, 안심카츠는 부드러운 질 좋은 고기가 느껴져서 좋았어요.~"
7.22.화,맛있습니다 !! 음식도 금방나왔어요 ~~👍
10.3.금,언니가 맛있다고해서 조카들이랑 온식구 출동했네요 안심 너무 부드러워서 녹고 등심은 진짜 겉바속촉의 끝판왕입니다 김치나베도기대이상이였어요 자주올집입니다 ㅎㅎ
9.10.수,너무 맛있게 잘 먹었습니다 다음에 방문 또 할 예정이에여😀
7.8.화,가게가 깨끗하구 돈까스가 맛있어요 😄
9.13.토,서대문구에서 제일 맛있는거 같아요 진짜로
7.20.일,치즈랑 돈까스랑 잘어울리는 느낌입니다. 리얼 치즈 느낌. 맛있게 먹었어요!
7.20.일,근처에 팝업 보러왔다가 왔는데 탁월한 선택이었어요! 맛도좋고 가격도 착해요! 완전 추천
7.19.토,카츠가 너무 부드럽고 잡내하나 없이 맛있어요!! 직원분도 친절하시고 나베가 진짜 싹싹 긁어먹었습니다 ㅎㅎ 추천!!!👍🏻
9.9.화,양도 많고 맛도 좋고 가격도 넘 착해요
7.16.수,"안심카츠 넘 부드럽고 맛나구요! 가츠동, 나베 까지 모든 메뉴가 좋네요~ 깔끔하게 잘 먹고갑니당!"
8.2.토,맛있어요 김치나베도 굿 ☺️
9.27.토,너무 맛있어요~ 동네 돈까스집에서 아이가 가장 좋아하는 식당이예요 ㅎ
5.15.목,여기 시올돈 중에 진짜 맛집! 엄청 부드럽고 맛있어요!! 직원분들도 너무 친절하셔서 기분좋게 먹다가요 모든메뉴 다 맛있어요 ㅎㅎ 매장도 깔끔하고 또 올 예정!
10.8.수,반응 남기기 방문일 10.8.수 2025년 10월 8일 수요일 1번째 방문 인증 수단 영수증
7.20.일,너무맛있어서 사진찍는걸 잊어버렸네요
7.25.금,최애 돈가스집💕 맨날 안심만 먹다가 오늘은 치즈 도전🫶💌
7.8.화,너무 맛있어요. 북가좌동에 이런곳이 있단걸 너무 늦게 알아버린 ㅠ 자주 올것 같아요! 제인생 돈가스입니다!
7.26.토,자전거 타고 지나가다가 궁금해서 들려봤는데 일본 정통스타일로 맛있고 푸짐하게 나오네요 가게도 깔끔하고 신경 많이쓴 티가 납니다. 맛집이네요 강추합니다.
7.13.일,치즈돈가스 추가도 있고 소소하게 추가해서 먹을수있는 메뉴들이 많아서 좋아요!
7.19.토,돈까스 상태도 좋고 너무 맛있어요~👍
5.2.금,근처에 돈가스집 생기고 한번 와보고는 맛있어서 단골됐어요! 돈가스 먹으러 여기만 오는데 돈가스만 먹다 나베도 한번 시켜봤는데 너무 맛있네요! 또올게요
8.30.토,너무 맜있고 고기가 신선합니다 !!
5.25.일,돈까스 먹고 싶을 때마다 시올돈 와요~ 항상 맛있게 믿고 먹을 수 있어서 좋아요 :-) 오늘도 맛있게 먹었습니당~
7.15.화,맛있었어요!!! 믿고먹는 동네맛집
7.20.일,주말 가족 외식했습니다 맛있게 잘 먹고 갑니다
7.16.수,항상 맛있게 먹고있는 곳이에요!
7.24.목,맛있어요. 아이들과 또 오고 싶어요.
7.13.일,돈까스 입에서 살살녹고 엄청맛있어요
6.28.토,내가 좋아하는 안심카츠 부드럽고 맛있어요 매장도 깔끔하고 첫 방문이지만 또 올듯해요
5.17.토,가끔 친구나 남자친구와 밥먹으러 오는 곳!! 나베 너무 맛있고 돈까스도 맛있어서 자주 와용😋
9.14.일,깔끔하고 맛있어요. 위생도 깔끔하고 좋아요.
8.21.목,돈까스 먹고 싶을때 항상 오는곳!! 카츠산도 없어진게 너무 슬프지만...다시 해주시면 안되나요??ㅠㅠ 특등심도 진짜 개맛도리
8.2.토,"음식이 맛있어요. 안심 카츠가 맛있고, 사이드 우동류도 다 맛있네요 :)"
7.9.수,자주 오는 단골집이에요~^^ 부모님하고 오기 좋아요. 카츠류 다 맛있어요!
7.31.목,안심카츠 반찬 다 맛있어요!!
8.2.토,아이들과 자주 와요. 고기가 부드럽고 메뉴가 많지 않아도 돈까스 전문점이라 확실히 맛이 좋아요.
8.12.화,자주 가는 맛집입니다 ~음식이 다 맛있어요^^
7.13.일,김치나베랑 모둠카츠 둘다 엄청 맛있어요!!!
5.11.일,고기가 너무 부드럽고 맛있네요 ^-^ 아이 식기까지 챙겨주셔서 대접받는 느낌으로 맛있게 식사했습니다 :)
5.13.화,오랜만에 와서 먹는데도 너무 맛있어요! 카츠가 정말 촉촉하고 부드러워서 맛있습니다👍👍자주 애용할거같아요💗
10.8.수,반응 남기기 방문일 10.8.수 2025년 10월 8일 수요일 1번째 방문 인증 수단 영수증
5.15.목,모듬카츠 짱 부드럽고 맛있어요͌ 치즈도 바삭고소해서 맛있구요͌ 처음 와봤는데 잘 먹고 가용
5.28.수,고기가 부드럽고 아주 맛있어요! 카레우동이 별미에요
5.29.목,맛있게 먹었어요!!!!! 동료들과 먹기 좋아요!!!
6.26.목,너무 맛있어요!! 특히 김치나베 완전 추천이요!!
8.13.수,"가봐야지 생각만 하던 곳이었는데, 매장도 깔끔하고 음식도 맛있어요 👍"
7.13.일,처음와봤는데 맛있어요 자주올게요
8.8.금,반응 남기기 방문일 8.8.금 2025년 8월 8일 금요일 1번째 방문 인증 수단 영수증
5.22.목,나베 비주얼 최고에요.. 돈까스도 입에서 녹아요 진짜 최고 맛집
7.13.일,와이프 몰래 혼자 오던 집 이제는 둘이 왔어요...ㅎㅎㅎㅎ
8.9.토,김치나베 가츠돈 다 맛있어요 카레우동은 덤
7.5.토,바삭하고 깔끔하고 부드럽고 매장도 시원하고 너무 만족합니당! 맛있어용
6.10.화,돈까스가 땡겨서 혼자왔는데 등심안심 둘다 너무 부드러워서 좋아요! 회사가근처라 또와야겠어요 :)
2.25.화,자녁 밥 하긴 귀찮고 왠지 따뜻한 우동과 맛있는 외식을 하고 싶은 마음이 들어 평소 자주 오던 시올돈 왔습니다. 역시나 기대를 져버리지 않는 음식 맛도 맛이지만 항상 느끼듯이 정성도 듬뿍 들어간 부분이 다시 이곳을 찾게 하는 것 같습니다. 물론 우리 아이도 너무 좋아하고 입맛에 맞아 우리 식구 최애 단골집 중 하나임을 인증합니다~
6.20.금,첨와보는데 고기도 부드럽고 맛나요 깔끔하게나옵니당
6.29.일,맛있게 먹겠습니다!!! 오랜만에 시올돈이에요 ㅎㅎ
8.28.목,우리동네 돈까스 1짱
6.14.토,처음 방문하는데 맛있고 가게도 깔끔하고 깨끗해요!! 😄😄
7.4.금,주에 한 번은 오는 거 같습니다 매번 맛있고 매장 깔끔하고 좋습니다
6.27.금,이런 돈카츠집 오랜만인데 너무맛있게먹었어요~
7.5.토,처음와봤는데 너무 맛있어요!
5.18.일,돈카츠 자체에 간이 되어있고 맛있어요!!
6.15.일,냄새도랏 북가좌동 돈가스 시올돈 미만잡
6.24.화,맛있는 돈가츠가 먹고 싶어서 찾아왔는데 너무 만족스러워요!
9.27.토,반응 남기기 방문일 9.27.토 2025년 9월 27일 토요일 1번째 방문 인증 수단 영수증
5.23.금,전에도 왔었는데 깔끔하고 맛이 좋아요! 혼밥도 좋을것같아요~ 추천합니다!
7.20.일,반응 남기기 방문일 7.20.일 2025년 7월 20일 일요일 1번째 방문 인증 수단 영수증
6.15.일,일식 등심카츠를 좋아해서 여러 군데 다녀봤지만 여기가 진짜 1등입니다😎 숙성시킨 고기라 그런지 맛이 되게 독특하면서 맛있습니다:)
6.14.토,깔끔하고 맛있오요 우리동네에 이런 가게가
5.6.화,첨 와봤는데 맛있고 좋았슴당 :) 잘 먹었어요!
6.21.토,음식이 정갈하고 직원분들도 친절하세요 히히
10.19.일,반응 남기기 방문일 10.19.일 2025년 10월 19일 일요일 2번째 방문 인증 수단 영수증
10.18.토,반응 남기기 방문일 10.18.토 2025년 10월 18일 토요일 1번째 방문 인증 수단 영수증
5.17.토,돈가스가 플레이팅도 예쁘고 너무 맛있어요!
5.23.금,매번 옵니다 넘 맛있어여 등심 안심 다 맛있는데 안심이 진짜 맛도리🩷
7.12.토,이번주만 2번째. 너무 맛있어서 가족들 다 데리고 또왔어요♡
8.19.화,반응 남기기 방문일 8.19.화 2025년 8월 19일 화요일 1번째 방문 인증 수단 영수증
6.13.금,음식이 맛있고 내부가 깨끗해요
6.3.화,모둠카츠 맛있어요~!! 내부도 깔끔하고 직원분들도 친절하고 좋았습니다!!
4.27.일,돈카츠가 부드럽고 카레랑 나베도 맛있어요
6.10.화,돈까스 먹고싶으면 자주 오는데 혼자 밥먹기 좋아요 맛있습니다
10.8.수,반응 남기기 방문일 10.8.수 2025년 10월 8일 수요일 1번째 방문 인증 수단 결제내역
5.10.토,엄청 부드럽고 맛있어요!! 나베도 진짜 에쁘고 짱짱 맛입니다! 나중에 또 오고싶은 곳입니다 추천드려요😊❤️
5.10.토,추천받고왔어요!! 안심가츠 아이들이 먹게 부드럽고 맛있어요 어른들은 김치가츠나베 칼칼하고 추천합니닷
7.8.화,반응 남기기 방문일 7.8.화 2025년 7월 8일 화요일 1번째 방문 인증 수단 영수증
6.22.일,주말에 혼밥하기 좋아요 언제나 변함없는 맛은 최고에요!
5.2.금,항상 넘 맛있어요🤍🤍 북가좌동 최애 돈까스가게에요!!💗💗🫶🫶
3.22.토,아이랑 함께 갔는데 아이용 그릇과 숟가락 포크도 챙겨주셔서 너무 좋았습니다 음식도 빨리 나오고 너무 맛있게 잘 먹았습니당
3.30.일,최근 가격이 오른것같아요 ㅠㅠ 근데 가격올려서그런지 양이 훨씬많아진느낌…..? 그래도 맛은 이동네에서 맛으로는 진짜 압도적1등입니다!
5.24.토,바삭하고 담백하고 맛있어요 아이들이 좋아해서 더 자주 오게 되는 것 같아요 치즈까스는 치즈의 풍미가 아주 좋아요
7.4.금,메인메뉴는 당연히 맛있고 셀러드도 소스가 맛있네요~
6.6.금,항상 올때마다 너무 맛있게 먹고 가는 곳이에요!! 오늘도 기대하며 왔습니다!!
7.19.토,간간히 이용하는 돈까스 맛집입니다!! 주차가 좀 불편하지만 그래도 생각나면 찾게 되는곳이네요 ^^
5.30.금,재료가 신선하고 맛있어요!!!
8.31.일,반응 남기기 방문일 8.31.일 2025년 8월 31일 일요일 1번째 방문 인증 수단 영수증
6.26.목,맛있어요 집근처라 종종 옵니다
6.22.일,늘 지나갈 때 사람이 많아서 와보고 싶던 곳이에요!! 너무 맛있네요😋
5.24.토,자주 오는 단골집이지만 올 때마다 똑같은 메뉴를 먹는데 정말 맛있어요!
6.1.일,너무 맛있어요 직원 분들도 너무 친절합니다
7.25.금,맛있어서 또 왔어요!
6.10.화,좋은 고기에 깨끗하고 바삭한 튀김을 입힌 훌륭한 돈가스!
6.7.토,너므 맛있네요. 근래 먹어본 김치카츠 중 최고입니다 남편도 가츠동 엄청 맛있다네요
5.6.화,"등심카츠도 부드럽고 맛있고, 치즈카츠는 치즈가 너무많아서 좋아요~ ^^"
8.16.토,반응 남기기 방문일 8.16.토 2025년 8월 16일 토요일 1번째 방문 인증 수단 영수증
8.12.화,반응 남기기 방문일 8.12.화 2025년 8월 12일 화요일 3번째 방문 인증 수단 영수증
3.26.수,돈가스 먹으러 항상 오는데 너무 맛있고 고기가 숙성돼서 그런지 특별히 더 맛있는 것 같아요😀
4.6.일,"진짜 맛있어요!! 친절하시고, 음식도 다 맛있어서 자주 온답니다ㅎㅎ"
5.13.화,3번째 방문입니다. 가깝고 가성비좋고 맛도있어서 동네 돈카츠집중에서 가장 맛있었어요!! 특히 샐러드소스가 맛있어요. 돈카츠먹으러 재방문할거같습니다ㅎㅎ
4.8.화,등김카츠 시켰는데 너무 맛있었어요 ㅎㅎ
