date,content
"""디저트가 맛있어요""",이 키워드를 선택한 인원
"""커피가 맛있어요""",이 키워드를 선택한 인원
"""친절해요""",이 키워드를 선택한 인원
"""음료가 맛있어요""",이 키워드를 선택한 인원
"""특별한 메뉴가 있어요""",이 키워드를 선택한 인원
"""대화하기 좋아요""",이 키워드를 선택한 인원
"""인테리어가 멋져요""",이 키워드를 선택한 인원
"""매장이 청결해요""",이 키워드를 선택한 인원
"""사진이 잘 나와요""",이 키워드를 선택한 인원
"""화장실이 깨끗해요""",이 키워드를 선택한 인원
"""음식이 맛있어요""",이 키워드를 선택한 인원
"""뷰가 좋아요""",이 키워드를 선택한 인원
"""가성비가 좋아요""",이 키워드를 선택한 인원
"""좌석이 편해요""",이 키워드를 선택한 인원
"""빵이 맛있어요""",이 키워드를 선택한 인원
"""아늑해요""",이 키워드를 선택한 인원
"""메뉴 구성이 알차요""",이 키워드를 선택한 인원
"""집중하기 좋아요""",이 키워드를 선택한 인원
"""차분한 분위기예요""",이 키워드를 선택한 인원
"""건강한 맛이에요""",이 키워드를 선택한 인원
"""컨셉이 독특해요""",이 키워드를 선택한 인원
"""재료가 신선해요""",이 키워드를 선택한 인원
"""음악이 좋아요""",이 키워드를 선택한 인원
"""주차하기 편해요""",이 키워드를 선택한 인원
"""비싼 만큼 가치있어요""",이 키워드를 선택한 인원
"""매장이 넓어요""",이 키워드를 선택한 인원
10.8.수,김치 오므라이흐... 든백질 폭탄... 친절하시고 분위기짱이고 혼밥인데도 힐링합니다 자주올게요 커피만마시기도짱입니다 브런치도많은것같아서다음에도 친구들이랑오려고요
9.6.토,우프 식당 편하고 좋아요. 인테리어도 좋고 가격도 좋아요! 음식도 맛있구요 ☺️
9.15.월,들기름 낙지젓 파스타 주문했어요 약간 비빔국수같은 느낌도 나고 상큼하고 맛있어요 ㅎㅎ
10.3.금,너무 맛있어요 노래도 힙하고 좋네용
9.4.목,계란듬뿍 김치볶음밥! 맛있어요>_<
4.30.수,친구가 밥사주고 2차로 커피랑 디저트까지 여기서 해결했어용^~^ 11시쯤 갔는데도 이미 몇테이블 있었고 좀 있으니 곧 다 차더라고요! 다른 테이블보니 맛있는 메뉴가 많아보여서 고르는데 힘들었어요😂 김볶은 외식메뉴로 시켜본 게 오랜만이었는데 다른 테이블보고 고르게 됐어요ㅎㅎ 맛있어보여서 못참겠더라는. 루꼴라 오일파스타도 맛있었고 김볶 밥알도 넘 기름지지않고 고슬고슬했고 계란도 제가 딱 좋아하는 익힘정도로 보들하니 좋았습니다. 케잌은 망고가 더 맛있었네요😚 담엔 크림류 파스타랑 당근라페 샌드위치 먹으러 재방문할거에요!
7.17.목,맛있다는 얘기 많이 들어 궁금했는데 드뎌 방문 산딸기 바게트는 크림 많이 달지 않고 명란바게트도 비리지 않고 맛있어요. 다만 명란은 끝맛이 살짝 매워요.
10.19.일,학동역 브런치집 우프 넘 맛있어요!!
5.18.일,푸짐하게 잘 나와요! 맛있고 알차요
5.7.수,숙대 후디구디 때부터 다녔는데 우프 넘 맛있어용 특히 스프 너무 조아용
4.11.금,"평소에도 좋아해서 종종 배달로도 즐겼던 곳이라 날씨도 좋아서 맛있는거 먹고 싶어서 갔던 곳인데, 기분만 상해서 왔습니다. 점심 시간이라서 바쁜거 알지만, 응대가 정말 별로 였습니다. 메뉴는, 오믈렛과 오늘의 스프 주문했는데 19분만에 오늘의 스프 나오고선 계속 음식이 안나오는데 저희보다 늦게온 테이블의 음식이 다 나오고 주문 후 40분 가까이 되도 오믈렛이 안나와서 직원분께 문의 드리니 그제야 음식을 다시 하고 있어서 5분 더 걸린다뇨? 가야한다면 환불해주겠다 라뇨? 음식을 다시 만들어야 한다고 괜찮냐고 설명하셨나요? 그럼 저희 음식 나오고 다음팀 음식 나와야 하는거 아닌가요? 그냥 주문 까먹었다고 솔직하게 말하지 그러셨어요. 그게 덜 기분 나빴겠어요. 좋아했던 곳인데, 실망 스럽네요."
24.11.30.토,아이들과 여행중 지나가다 보여서 방문했습니다.직원분들 바쁜중에도 친절하게 응대 해주시고 음료도 맛있었네요.디저트도 좋았습니다.
4.6.일,반응 남기기 방문일 4.6.일 2025년 4월 6일 일요일 1번째 방문 인증 수단 영수증
1.4.토,카레 파스타 에이드 맛있어요
24.8.29.목,외부 미팅이 있어서 방문했다가 점심식사하게된 우프 음식이 정갈하고 맛있습니다. 너무 맛있어~~ 막 그론정도는 아니고 분위기가 참 좋고 편안합니다.
24.11.13.수,"브런치하기 좋았어요. 가격도,메뉴구성도,맛도 다 좋았는데 다른손님이 없는데도 음악소리가 커서 불편했어요. 다른리뷰에도 언급돼던데 볼륨을 좀 낮춰주셔도 좋지않을까요"
24.10.5.토,출출해서 브런치 메뉴 함께 주문했어요.. 옆에서 먹던 샌드위치가 더 맛있어보이더라고요 ㅎㅎ 메뉴는 빨리 나오는 편이고 음악소리는 좀 큰 편이었습니다.
24.10.8.화,맛있고 든든해요. 매장이 붐비지 않아 여유롭게 식사했어요.
3.28.금,반응 남기기 방문일 3.28.금 2025년 3월 28일 금요일 1번째 방문 인증 수단 영수증
24.7.22.월,처음 들른 밀카페 우프 복숭아 생크림 케이크에 복숭아 맛이 잘 녹아있네요
24.10.25.금,음악이 좀 큰 것 빼고 좋았어요
24.8.14.수,팬케이크가 너무 먹고 싶었는데 근처 팬케이크 집이 다 판매를 안해서 급하게 찾아 방문한 곳이었는데 우연히 들른 곳에서 넘 맛있게 잘 먹고 나왔네용
24.2.3.토,"팬케이크는 너무 부드럽고, 입에서 녹아 내렸습니다. 에크스크램블도너무 부드러웠구요. 곁드려진 커피도 진짜 맛있었습니다. 2인 테이블이 조금 작아서 불편한 느낌은 있었지만 음식 맛은 정말 좋았습니다. 배달 주문도 꽤 자주 들어오더라구요. 가볍게 브런치 즐기기 좋습니다. 가격대비 양이 많은 편은 아니지만, 소소하게 즐기기에는 좋았습니다"
24.6.27.목,비싸고 예쁘다 배달이 엄청많아서 매장주문이 너무 오래걸렸다
24.5.15.수,친구들이랑 같이 왔어요. 운 좋게 자리 잘 잡았고 휴일에는 웨이팅 있을 수 있어요 화장실은 1층 문 잠겨있으니 키 받아 가야 합니둥
24.4.6.토,사람이 카페에 너무 많아서 커피랑 잠봉 샌드위치 포장해서 왔어요^.^ 커피 쓴맛도 없고 딱 제 스타일이고 샌드위치 빵이 진짜 보드러우면서도 버터향 나서 맛있네요!  대기가 많아서 포장해 갈때는 할인해주셨으면 좋겠네요🙏
24.3.31.일,샌드위치 양 진짜많아요 하나 시켜서 둘이 먹어도 될 정도의 크기였습니다 맛은 나쁘지 않았어요 커피가 맛있습니다
24.5.4.토,비교적 골목 2층에 위치해서 사람이 덜 붐빔 디져트 메뉴가 다양하고 맛있음 ㅎ ㅎ 직원분이 노무 훈훈함
24.6.20.목,반응 남기기 방문일 24.6.20.목 2024년 6월 20일 목요일 1번째 방문 인증 수단 영수증
24.2.24.토,커피 잔이 다양해서 참 이쁘고 좋았습니다. 딸기 스트로베리케익의 생크림이 너무 부드럽고 딸기도 너무 맛있었습니다. 가격이 너무 비싸서 후덜덜했지만 그래도 커피와 케익 맛은 너무 좋았습니다.
24.2.24.토,생크림 딸기 케이크가 신선한 크림과 향긋하게 맛있어요. 레몬파운드케이크도 진짜 상큼해요. 커피랑 먹기 좋은 궁합입니다.
24.3.23.토,"크기에 비해 비싸긴한데, 많이 달지 않아서 좋았어요"
24.4.6.토,테이블 간격 좁고 분위기 어수선해요 디저트도 가격대비 훌륭한 편은 아니에요 왜 사람 많은지 모르겠어요!
23.12.20.수,대화 하기 좋은 카페였어요 ^^ 브런치 메뉴 괜찮았어요 ~ 함께 나온 빵이 너무 맛있었어요
24.3.29.금,조용히 얘기하기 좋은 카페입니다. 케잌이랑 커피 무난합니다.
24.3.21.목,바스크 치즈 케이크 보다 치자 타르트가 더 맛있고 진했어요~!!
24.2.10.토,서울숲에서 이용하기 좋아요
23.10.22.일,"🌟🌟🌟🌟🌟 너무 맛있는 브런치맛집. 성수동에 수많은 브런치집이 있는데, 요기는 정말 찐🫶🏻 스크램블 토스트랑 케이크류 최고👍🏻"
24.5.4.토,반응 남기기 방문일 24.5.4.토 2024년 5월 4일 토요일 1번째 방문 인증 수단 영수증
24.3.19.화,반응 남기기 방문일 24.3.19.화 2024년 3월 19일 화요일 1번째 방문 인증 수단 영수증
23.10.28.토,햇볕이 잘드는 창가자리가 분위기 있네요 깔끔한 화이트톤의 인테리어가 예쁘네요 아메리카노 바디감과 산미의 밸런스가 좋네요 트로이시반 좋아하는데 카페 음악도 취향이네요
24.2.3.토,방문했을때 홀 손님은 내가 첫번째였는데 스프와 풀블랙퍼스트 나오는데 30분이상 걸림.. 배달이 많은것처럼 보였으나 어쨋든 저 메뉴나오는데 30분 이상 걸리는건 좀 심한듯. 매장 너무 추움. 추워서 외투도 못벗고 식사. 가격대비 블랙퍼스트 구성 별로. 특별함은 전혀 없는 브런치였음.
24.3.30.토,반응 남기기 방문일 24.3.30.토 2024년 3월 30일 토요일 1번째 방문 인증 수단 영수증
24.3.24.일,초콜렛 케이크게 라즈베리 크림 조합이 좋아요! 커피 무난해요~ 친절하고 직원분 훈훈해요! 다른곳은 거의 팝송 틀어주는데 여기 케이팝 틀어줘요 ^_^
23.10.26.목,케이크.맛집~~ 2층이라 잘안보임 찾아가야되는 카페!!! 아메리카노 마시고 목말라서 카페라떼 추가주문해서 먹었는데 라떼가 더 맛났음😋
24.1.16.화,반응 남기기 방문일 24.1.16.화 2024년 1월 16일 화요일 1번째 방문 인증 수단 영수증
23.11.4.토,생각보다 그냥 평범해서 좀 실망햇음.. 배달도 돼서 배달 기사님들 계속 대기 중
23.12.20.수,매장안에가 추워요~~ 커피는 맛있고요.
23.10.27.금,"브런치 메뉴 양도 많고 맛있어요. 커피맛도 괜찮았지만, 단 커피양이 적어요.. 스벅 톨사이즈보다 훨씬 적은양이에요. 2층공간이고 대화하긴 괜찮았지만 의자가 너무 불편해서 오래있긴 힘들었네요. 엉덩이 허리 아픕니다."
23.6.4.일,여긴 과일팬케이크때문에 갑니다. 팬케이크가 너무 맛있어요. 따뜻하게 갓구운 팬케이크에 진하고 고소하고 부드러운 생크림과 제철과일을 곁들여 시럽을 조금 얹어 먹으면 너무나 행복합니당! 플레이트나 분위기도 산뜻하고 좋아요. 커피나 수프는 쏘쏘... 였습니다. 비어있는 테이블도 여럿있었고 대기가 전혀 없던 시간이었지만 주문결제할 때 이용시간 2시간이라고 약간 단호박스럽게 말씀하시는 건 조금 아쉬웠어요ㅠ 팬케이크맛집인 건 인정합니다! 감사히 잘 먹었습니다. 🙏
23.5.29.월,오늘 서울숲 사람이 너무 많아서 더위에 찌들다 우연히 찾아 들어갔는데 비쥬얼도 맛도 너무 좋았어서 영수증 챙겨서 리뷰 남깁니다☺️✨✨더위도 식혀주고 상큼 당도 챙겨준 팬케잌이랑 우프만의 메뉴 바나나푸딩도 넘 신박하고 맛있었어요^^* 요즘 가격이 사악한데 가격도 괜찮고 좋은 시간 보내다 갑니다
24.2.24.토,반응 남기기 방문일 24.2.24.토 2024년 2월 24일 토요일 1번째 방문 인증 수단 영수증
24.3.23.토,반응 남기기 방문일 24.3.23.토 2024년 3월 23일 토요일 1번째 방문 인증 수단 영수증
23.5.15.월,"샌드위치랑 음료 포장하고 서울숲에서 먹었어요! 피크닉 하느라 포장했는데 매장 내부도 쾌적하고 좋아서 먹고 갈까 싶기도 했답니다. 샌드위치가 알차고 맛있고, 친절하게 응대해주셔서 기분이 좋았어요. 서울숲이랑 가까워서 피크닉 하실 분들 포장해가시면 좋을 것 같아요~~"
23.9.2.토,음... 맛은 특별한 거 없고 ㅠ 일반적인 맛이예요! 가격도 ... 맛에 비해 조금 비싸다 느껴지고 사람 많으면 소리가 웅웅웅 울려서 조용한 곳 좋아하시는 분들은 오래 못있을 것 같습니다!
23.8.25.금,맛있긴 한데 가격이 살짝 비싼 감이 있긴 해요 그래도 빵도 직접 만드시는 거 같아 보였습니다
23.12.2.토,반응 남기기 방문일 23.12.2.토 2023년 12월 2일 토요일 1번째 방문 인증 수단 영수증
23.6.26.월,깔끔하고 조용하게 커피타임하기 좋아요
23.4.15.토,다소 비싸지만 레몬 파이가 너무 맛있어요.. 파이지가 딱딱하지 않아서 먹기 편하고 좋아요!
23.5.6.토,조용하고 아늑해요 ㅎㅅㅎ 조용히 이야기 하기 좋은듯
23.9.2.토,오트라떼가 깔끔해서 맛있었어요
23.4.29.토,케이크는 맛있어요! 그 외엔 평타. 다시 가진 않을 것 같아욤
23.4.2.일,커피도 괜찮고 말차딸기케잌 너무 맛있었어요><
23.3.10.금,매장이 환하고 대화하기 좋아요!
23.1.20.금,브런치랑 디저트가 맛있는 곳이에요
22.12.26.월,브런치 메뉴들이 진짜 너무 맛있어요! 매장 분위기도 가구들이며 취저예요!
23.5.14.일,반응 남기기 방문일 23.5.14.일 2023년 5월 14일 일요일 1번째 방문 인증 수단 영수증
23.2.4.토,디저트가 너무 맛있어요~~ 초콜릿딸기 조각 케이크 추천합니다👍🏻
22.12.26.월,딸기타르트 진짜 맛있어요...
22.12.25.일,"광야 갔다가 들린 카페 ☕️ 좌석끼리 좀 가까운 편이고, 반려견 출입이 가능한 곳이었어요 ! 사장님이 친절 하셨고, 근방에 있다면 들러보기 좋은 것 같아요 🫶🏻 담엔 브런치도 먹어보고싶어요 😊"
23.3.15.수,콘센트 꼽지는 못하지만 대화하기는 좋아요
22.12.10.토,케이크가 좀 비싼 느낌이었는데 한 조각 크기가 큰 편이예요ㅎㅎ 커피가 진한 편이라 디저트랑 잘 어울려서 맛있게 잘 먹었어요.
22.12.17.토,주말이라 대기도 사람도 엄청났지만 커피와 케크 맛있게 먹었어요 ♡
22.10.15.토,성수동 브런치 카페는 여기로!! 양 대박 많도 맛 또한 얌얌!! 오픈시간에 맞춰서 가니 우리 밖에 없어서 너무 좋았어요!
23.1.9.월,케이크 사러 들른곳! 너무 맛있구 다음엔 브런치 먹어야지
23.1.14.토,그냥 그래요. 실패하지는 않아요.
22.9.24.토,커피도 맛있고 오믈렛도 너무 맛있었습니다 서빙해주시는분도 넘 친절하셨어요
23.3.11.토,반응 남기기 방문일 23.3.11.토 2023년 3월 11일 토요일 1번째 방문 인증 수단 영수증
22.11.5.토,반응 남기기 방문일 22.11.5.토 2022년 11월 5일 토요일 1번째 방문 인증 수단 영수증
23.4.2.일,반응 남기기 방문일 23.4.2.일 2023년 4월 2일 일요일 1번째 방문 인증 수단 결제내역
22.12.3.토,반응 남기기 방문일 22.12.3.토 2022년 12월 3일 토요일 1번째 방문 인증 수단 영수증
22.10.8.토,과일케이크 존맛이에요🥹과일 좋아 과일 사랑해!!!!!!!!!!!!💗
22.9.24.토,라임파이 되게 셔요 ㅋㅋㅋ 첫입 먹었을 땐 와 상큼하다 했데 계속 먹으니까 엄청 셨어요.
23.1.7.토,반응 남기기 방문일 23.1.7.토 2023년 1월 7일 토요일 1번째 방문 인증 수단 영수증
22.11.9.수,서울숲은 그동네만의 특별한 분위기가 있네요
22.8.1.월,매장이 쾌적하고 자리도 넓직하고 너무 좋아요👍 월요일거의다 휴무인 서울숲에서 한줄기 빛인곳...
22.7.18.월,오믈렛은 계란 안에 베이컨이랑 치즈가 잔뜩 들어서 풍부한 맛이었고 여기 팬케이크가 진짜 맛있어서 기억에 남네요! 샌드위치는 빵이 정말 맛있는 빵이더라고요 맛은 있었는데 먹기가 좀 불편했어요
22.11.5.토,친절하시고 매장도 깔끔하고 음식 모양도 예쁘고 맛도 좋습니다
22.11.4.금,조용하고 음식 먹기 좋은 분위기입니다.
22.7.18.월,서울숲 맛집이예요...오늘의 스프 꼭 꼭 드세요ㅠㅠ 스프가 미쳤어요.. 세이보리 에그 베이컨 팬케이크랑 오믈렛 추천 해주셨는데 맛있었어요ㅠ 먹는 내내 입이 진짜 즐거움..입이 그냥 춤출정도 ㅋㅋㅋㅋㅋ밀카페 우프는 스프 다들 기억하세요 .. 물론 다른것도 진짜 맛있어요ㅠㅠ !
22.10.23.일,샌드위치 오믈렛 맛있어요ㅠㅠ!
22.11.12.토,라임파이 맛있어용 ><
22.8.29.월,팬케이크 맛있어요 커피도 괜찮아요
22.10.3.월,"파이, 케이크 들이 다른데서 못먹어본 맛이고 맛있어요 :)"
22.6.5.일,아인슈페너가 너어어어어어무맛있어요!! 커피 고소하고 크림달고❤️👍 케이크도 맛있어요! 딸기생크림케익먹으려고왓는데 시즌지나서 안팔았어용
22.11.26.토,반응 남기기 방문일 22.11.26.토 2022년 11월 26일 토요일 1번째 방문 인증 수단 영수증
22.7.4.월,샌드위치는 더 토스팅 되었으면 하는 바람이 있었으나샐러드는 계절의 싱그러움을 느낄 수 있었음. 플레이팅이 전반적으로 예뻐서 사진 잘나옴.
22.10.16.일,반응 남기기 방문일 22.10.16.일 2022년 10월 16일 일요일 1번째 방문 인증 수단 영수증
22.6.24.금,맛있고 친절! 식기도 너무 예뻐요
22.6.26.일,롱블랙 아이스로 마시니까 잠도 확깨고 넘 좋아요 직원분도 친절하시고 매장도 쾌적하고 좋아요 메론 케이크는 익어 있었으면 진짜 맛있었을텐데 ㅠ
22.7.17.일,"깨끗하고 산뜻한 분위기. 팬케잌 맛있고, 아인슈패너도 달달하니 맛있어요."
22.6.24.금,분위기도 냥냥하고 식기가 너무 예뻐용
22.6.23.목,인테리어도 이쁘구 음료도 맛있고 팬케이크도 맛있고 케이크도 맛있어요!! 직원분들도 친절💖 담에 와서 다른것도 왕왕 먹어보고 싶어요 ◡̈ ♪
22.9.2.금,사진찍기좋고 심플한듯 느낌있는 ㅎㅎㅎ 좋아욤
23.2.25.토,반응 남기기 방문일 23.2.25.토 2023년 2월 25일 토요일 1번째 방문 인증 수단 영수증
22.7.2.토,맛있게 잘먹었습니다~ 특히 과일 팬케이크 추천해요!!! 팬케이크가 진짜 촉촉하고 과일들도 싱싱해서 넘 맛있었어요 🫠🫠👍💖 커피는 그럭저럭 먹을만하고 에이드가 맛있습니다! 디저트 맛집... ㅎㅎ
22.11.20.일,반응 남기기 방문일 22.11.20.일 2022년 11월 20일 일요일 1번째 방문 인증 수단 영수증
22.9.10.토,팬케익 넘 맛있어요
22.12.4.일,반응 남기기 방문일 22.12.4.일 2022년 12월 4일 일요일 1번째 방문 인증 수단 영수증
22.10.8.토,제철과일 케이크존맛 ㅠ
23.3.3.금,반응 남기기 방문일 23.3.3.금 2023년 3월 3일 금요일 1번째 방문 인증 수단 영수증
22.11.10.목,반응 남기기 방문일 22.11.10.목 2022년 11월 10일 목요일 1번째 방문 인증 수단 영수증
22.11.24.목,반응 남기기 방문일 22.11.24.목 2022년 11월 24일 목요일 1번째 방문 인증 수단 영수증
22.6.17.금,평일 애매한 시간에 방문해서 그런지 한적해서 대화하기 너무 좋았고 직원분도 매우 친절했습니다! 주문한 메뉴들도 넘 맛있었어요:)
22.6.26.일,쾌적하고 좋아요 메론이 더 달앆으면 맛있었겠지만 크림이랑 빵은 맛있었어요!
22.4.30.토,커피 맛있고 케이크도 맛있어요! 여기 아인슈페너는 크림을 섞어먹는게 맛있었답니다! 그리고 그릇 예뻐요.
22.8.25.목,반응 남기기 방문일 22.8.25.목 2022년 8월 25일 목요일 1번째 방문 인증 수단 영수증
22.4.2.토,라임파이와 펌킨파이 예술이었고 올그린스무디도 많이 달지 않은데 상큼함은 엄청났습니다
22.2.5.토,치폴레 소스만 빼면 샌드위치 맛있어요 🥪 오믈렛 🍳 꼭 드세요 🥚🥚🥚 웊 = egg 🐯💖
22.8.24.수,반응 남기기 방문일 22.8.24.수 2022년 8월 24일 수요일 1번째 방문 인증 수단 영수증
23.1.28.토,반응 남기기 방문일 23.1.28.토 2023년 1월 28일 토요일 1번째 방문 인증 수단 영수증
22.6.3.금,반응 남기기 방문일 22.6.3.금 2022년 6월 3일 금요일 1번째 방문 인증 수단 영수증
22.8.31.수,반응 남기기 방문일 22.8.31.수 2022년 8월 31일 수요일 1번째 방문 인증 수단 영수증
22.8.31.수,반응 남기기 방문일 22.8.31.수 2022년 8월 31일 수요일 1번째 방문 인증 수단 영수증
22.6.24.금,반응 남기기 방문일 22.6.24.금 2022년 6월 24일 금요일 1번째 방문 인증 수단 영수증
22.8.24.수,반응 남기기 방문일 22.8.24.수 2022년 8월 24일 수요일 1번째 방문 인증 수단 영수증
22.7.16.토,반응 남기기 방문일 22.7.16.토 2022년 7월 16일 토요일 1번째 방문 인증 수단 영수증
22.7.9.토,반응 남기기 방문일 22.7.9.토 2022년 7월 9일 토요일 1번째 방문 인증 수단 영수증
22.10.8.토,반응 남기기 방문일 22.10.8.토 2022년 10월 8일 토요일 1번째 방문 인증 수단 영수증
22.7.15.금,반응 남기기 방문일 22.7.15.금 2022년 7월 15일 금요일 1번째 방문 인증 수단 영수증
22.5.14.토,반응 남기기 방문일 22.5.14.토 2022년 5월 14일 토요일 1번째 방문 인증 수단 영수증
22.1.8.토,커피도 브런치도 너무 맛있어요 ^^ 성수동지날때 또 방문할게요~
22.4.9.토,반응 남기기 방문일 22.4.9.토 2022년 4월 9일 토요일 1번째 방문 인증 수단 영수증
22.4.14.목,스트로베리밀크 딸기청 가득 넣어주시구 너무 맛있어용
22.1.5.수,음식 맛있어요 다만 주문이 밀리면 좀 늦게 나오네요
22.8.13.토,우와 펌킨케익 넘 맛있어요. 레몬에이드는 별루에요ㅎ
22.1.15.토,혼자 가서 브런치부터 디저트까지 싹 다 먹고 오고 싶은 곳🤍💭 펌킨파이 못잃어...🎃🥧
22.6.24.금,반응 남기기 방문일 22.6.24.금 2022년 6월 24일 금요일 1번째 방문 인증 수단 영수증
22.2.18.금,커피가 고소하고 맛있었어요☕️
22.1.3.월,깔끔한 분위기에서 맛있게 먹고 가요❤️
22.4.17.일,반응 남기기 방문일 22.4.17.일 2022년 4월 17일 일요일 1번째 방문 인증 수단 영수증
22.4.2.토,반응 남기기 방문일 22.4.2.토 2022년 4월 2일 토요일 2번째 방문 인증 수단 영수증
22.8.20.토,반응 남기기 방문일 22.8.20.토 2022년 8월 20일 토요일 1번째 방문 인증 수단 영수증
22.4.2.토,반응 남기기 방문일 22.4.2.토 2022년 4월 2일 토요일 1번째 방문 인증 수단 영수증
22.4.3.일,반응 남기기 방문일 22.4.3.일 2022년 4월 3일 일요일 1번째 방문 인증 수단 영수증
22.4.17.일,반응 남기기 방문일 22.4.17.일 2022년 4월 17일 일요일 1번째 방문 인증 수단 영수증
22.4.8.금,반응 남기기 방문일 22.4.8.금 2022년 4월 8일 금요일 1번째 방문 인증 수단 영수증
22.4.3.일,반응 남기기 방문일 22.4.3.일 2022년 4월 3일 일요일 1번째 방문 인증 수단 영수증
22.4.3.일,반응 남기기 방문일 22.4.3.일 2022년 4월 3일 일요일 1번째 방문 인증 수단 영수증
22.3.9.수,반응 남기기 방문일 22.3.9.수 2022년 3월 9일 수요일 1번째 방문 인증 수단 영수증
22.2.19.토,반응 남기기 방문일 22.2.19.토 2022년 2월 19일 토요일 1번째 방문 인증 수단 영수증
22.4.21.목,반응 남기기 방문일 22.4.21.목 2022년 4월 21일 목요일 1번째 방문 인증 수단 영수증
22.1.23.일,반응 남기기 방문일 22.1.23.일 2022년 1월 23일 일요일 1번째 방문 인증 수단 영수증
22.3.8.화,놓치면 안되는 3월의 케이크 :)
22.1.3.월,"샌드위치, 케이크 전부 JMT!!!"
술병난꼬부깅,"Brunch🥞🥚🧇🧈 술병난꼬부깅장소 10 조회수 13114 업체명 밀카페 우프 업체명 앤드밀 청담점 테마리스트 업체 +8 곳 업체명 윰드 🌟🌟🌟🌟🌟 너무 맛있는 브런치맛집. 성수동에 수많은 브런치집이 있는데, 요기는 정말 찐🫶🏻 스크램블 토스트랑 케이크류 최고👍🏻"
