date,content
24.1.22.월,딱을 좋아해서 찾아보다 가봤는데 사장님도 엄청 친절하시고 매장도 깨끗하고 좋았어요~무엇보다 맛있어서 더 좋습니다!다음에도 또 사로 가야겠어요~다시 방문 의사 있음~~~~!!!너무 맛있게 잘 먹엇어요~^^😋
24.1.21.일,파리바게트 케익만 먹다가 떡케익은 처음 먹어봤는데 맛있어요 부모님도 엄청 좋아하셨네요 사장님도 친절하시고 재방문의사 200%% 잘먹었습니다
24.1.18.목,진짜 너무 예뻐요~~ 인스타에서 보고 예뻐서 할매 생신때 케이크로 준비했는데 생각지도 못하게 너무 맛있는거에요;;;; 깜짝 놀랐어요 떡케이크가 이렇게 맛있을 수 있는지 첨 알았어여;;; 쫀닥한데 폭신하고 암튼 존맛탱... 가족들 다들 대만족 했고 다음에 또 주문하려고용
24.1.16.화,엄마 생신 케이크 주문했습니다:) 색깔도 알록달록 예쁘고 고급스러운 디자인이 정말 마음에 들어요! 5일 전에 미리 주문해두었더니 예약한 날짜에 맞게 준비해주셨답니다:) 떡케이크 맛도 최고였어요ㅎㅎ덕분에 행복한 하루를 보냈답니다:) 다음에 또 주문할게요🤍🤍
24.1.16.화,부모님 생신이여서 '봉주공방' 에서 주문 했습니다. 사장님이 너무 친절 하셔서 깜짝 놀랐습니다. 디테일 부분까지 설명 해주셔서 아주 만족했습니다. 어머니가 맛 보시더니 평소에는 많이 드시지 않는 분 이신데 그 자리에서 가족들이랑 다 먹었습니다~~ 맛이랑 퀄리티 거기에 사장님의 천절함 까지 나이에 상관없이 다음 케이크는 무조건 여기서 할 예정 입니다. 아! 케이크 픽업하러 매장에 갔는데 사장님이 너무 이쁘셔가지고 깜짝 놀랐습니다ㅎㅎ
24.1.15.월,"사장님 미모만큼 떡케잌 무진장 예뻐버려요..😜 예뻐서 어찌 먹지하다가 다 먹어버렸어요ㅎㅎ 특히 커피설기는 떡 안좋아하는 저도 엄청 집어먹기바빴고..앙금이며 수수팥떡 또한 많이 달지않아서 온가족이 금새 먹어치운..ㅋㅋ 생신 주인공인 아빠도 무척 좋아하시고, 조카들도 맛있어서 계속 주워먹더라구요. 나이불문하고 다같이 먹기 좋은 떡케잌, 또 기념일이 되면 여기서만 주문하고 싶어요!! 재주문 의사 100%❤️ 번창하셔서 제발 오랫동안 이 맛보게 해주세욤ㅎ  리뷰 잘 안쓰는데..찐으로 맛있어서 남깁니다✨"
24.1.14.일,"아빠생신이라 떡 케익 주문했어요! :) 주문부터 픽업까지 부족한거 없이 행복한 순간이었어요!  어떤걸로할지 고민이 많았는데, 찰떡같이 척척 마음이 든든했어요! 부모님도 너무 마음에 들어하셨고 떡과 앙금 조화가 미쳤어요... ㅎㅎㅎㅎㅎㅎ행사있을 때마다 주문해야할 것 갘아요!"
24.1.14.일,빵집 케이크들은 언제나 버리기 바빴는데 떡케이크는 다 드시더라구요!! 집 근처에 떡케이크공방이 마음에 드는데가 없어서 압구정까지 다녔는데ㅠ ㅠ 진짜 너무 맛있고 압구정보다 예쁘고 차비도 안들고 너무 좋았습니다!! 아빠는 이 꽃잎들 하나하나 만드는데 정성이 엄청났을꺼라며 고맙다했고 엄마는 뭐 하나 버릴거없이 꽃잎들마저 팥앙금이라 맛있다며 골라먹고ㅎㅎㅎ 떡케이크 하나로 대화가 활기찼어요ㅎㅎㅎ 2-3인용이라 했지만 식사 후 먹는거라 5명이 먹으니 저희는 남기지않고 딱 좋았네요!! 2달 뒤 엄마 생신 때 또 봬요!!♥
24.1.13.토,아버님 생신이셔서 주문했는데 너무예쁘고 떡케이크라서 케이크안좋아하시는 어르신들도 맛있게드셨어요! 고소하고 너무맛있었네요 다음에또 기념일생기면 주문할거같아요 정성가득 만들어주셔서 감사해용💗
24.1.13.토,베라에서만 주문하다가 겨울이라 처음으로 떡케잌을 시켯는데 너무 부드럽고 맛잇네요 자주자주 주문할게요 번창!
24.1.10.수,"😍 할머니 생신에 예쁜 꽃케이크 가져가니 비주얼로 칭찬받고, 먹기 아깝다고 하시면서 드셔보시더니 넘 맛있다고 칭찬 받았어요~! 단호박과 흑임자 선택했는데 제 입맛엔 둘 다 맛있어서 우열을 가리기 어려웠지만 가족들은 단호박이 더 맛있다고 했어요 ㅎㅎㅎ 봉주공방 케이크 예뻐서 선물용으로 몇 번 구입해봤는데 받으시고 다들 넘 좋아해서 맛이 진짜 궁금했거든요 오늘 식사하고 후식으로 앉은자리에서 다 먹었어요.. ㅎㅎ 사장님 넘 친절하시고 예쁘고 맛있게 만들어주셔서 리뷰 남겨요!! 선물용, 기념일 케이크로 강추합니다!"
23.12.30.토,팔순잔치 기념으로 숫자케이크 맞췄는데 원하는 색감의 꽃으로 디자인도 해주셔서 시댁 식구들에게 아주 폭발적인 반응 얻었습니다 :-D 아이부터 어르신들까지 모두 맛있게 드셔서 너무 뿌듯했습니다! 주문부터 수령까지 세심하게 챙겨주셔서 다시 한번 감사드립니다!
23.12.30.토,이번에 아버지 생신이라 떡 케이크 주문했는데 받았는데 우와 진짜 너무이쁘고 보는것만으로도 잘 주문했다는게 느껴졌어요! 아버지어머니가 보시는순간 이런 케이크는 어디서 파냐며 이쁘다고 아주극찬이셨습니다. 꿀설기로하였는데 먹는순간 떡을 딱히좋아하지않는 저도 너무 맛있었어요! 조카와 온가족이 게눈 감추듯 먹어치워버렸... 정말 추천드려요! 사진은.. 잘 못찍었지만 실물파입니다 제가 똥손이라서ㅠㅠ 무튼 정말이쁘고 맛이좋아서 우리 애기 돌 떡도 봉주공방에서 하기로 했어요! 다들 꼭 드셔보세요😃😃
23.12.26.화,친구가 추천 해줘서 저번에 한번 이용하고 너무너무 만족해서 재주문했어요! 두번째도 역시네요😭😭😭 맛은 두말할꺼없고 사장님께서도 완전 친절하시고 하나부터 열까지 원하는대로 꼼꼼하게 해주셨어요!! 덕분에 즐거운 시간을 보냈습니당! 감사합니당!!! 앞으로도 쭈욱 재주문하려구요🩷🩷🩷 사장님 번창하세용!!
23.12.24.일,저번에 먹었다가 맛있어서 직접 찾았는데 위치도 찾기 쉬워서 금방 찾았는요. 사장님도 매우 친철 하셔서 따뜻한 크리스마스를 보낼수있을거같아요 ㅎㅎ
23.12.20.수,"너무 급하게 주문했는데도 너무 친절하게 세트구성 설명과 또 어떤 쓰임에 선물할 건지 먼저 물어봐주시고, 제가 필요한 구성에 맞춰 추천해 주셔서 일정에 맞춰 좋은 답례품이 되었습니다.:) 그리고 하필 날씨까지 안좋아 눈이 펑펑 내리는 날에 퀵으로 받는 것보다는 본인이 직접 전달해 주는게 제가 요청한 시간네 받을 수 있을 것 같다고 가깝지 않은 거리를 직접 와서 전달해 주셔서 필요한 시간에 맞출 수 있었습니다 ! 답례품으로 너무 적은 양이였지만 너무 맛있고 정성스럽게 준비해주셨고, 받아보신 분들도 연령대가 다양했는데너무 이쁘고 맛있다고 해서 괜히 뿌듯했어요 ! 특히 제 입맛에는 수수팥떡이 굉장히 맛있었습니다 ㅎㅎ"
23.12.5.화,본가에 선물로 가져갈 패킹된 떡집 찾다가 집근처 봉주공방 방문!! 사장님께서 팥을 직접 끓이고 불린다고하시네요 그래선지 고소하고 떡도 찰져요 온 가족이 맛있게 먹었습니다!! 다음엔 케이크 주문할게요🎂🫶🏻
23.12.3.일,"어머니 생신 케익으로 주문했는데, 디자인도 이쁘고 맛도 좋았습니다. (흑임자) 특별한 날 봉주공방 떡케익 만족합니다!"
23.12.2.토,"엄마 생일 기념으로 케이크 제작하구 효녀되었습니다 🫡🫡 일단 너무 예쁜 비주얼에 한 번, 맛있는 맛에 한번.... 원래 케익 한판 사도 물려서 다 못먹는 편이라 가장 작은 1호 주문했는데, 아쉬워서 2호 시킬걸 했어요 😂😂 케익 덕분에 행복한 주말 파티였습니다! 다음에 또 주문할게요 사장님~~"
23.12.1.금,"결혼식 끝나고 아버님 회사 답례떡으로 3구 주문했는데, 정말 너무 이쁘게 포장이랑 라벨까지 신경써주셔서 아버님들도 좋아하시고!! 나눠준 회사분들도 너무 좋아하셨다고 전해들어 기분이 좋았어요!!! 😝  그리고 이쁜거뿐만 아니라 맛이!!! 진짜 너무 맛있다고 하셔가지고 너무 보람있었습니당!! 🫶🏻🩵🩵 무조건 기념 떡은 봉주공방에서 할거 같아요 >< 사장님 대박나시고 오래오래 떡 만들어주세요 😍"
23.11.30.목,케이크 비주얼이 놀라울정도로 예뻤어요!! 그런데 정말 맛있더라구요~ 보통 예쁜 빵케이크는 위에가 슈가크래프트나 버터크림이라 느끼했는데 봉주공방 케이크는 위에 디자인이 팥 앙금 같아서 맛있었어요! 안에는 흑임자 맛 선택했는데 적당히 달콤하고 담백 고소에서 마지막까지 맛있게 먹었어요ㅎㅎ 부모님도 너무 좋아하셔서 센스 있는 선물이 된 거 같아 행복했어요🫶🏻
23.11.26.일,부모님 환갑으로 숫자 케익 많이 알아봣는데 이쪽 동네는 여기 밖에 없었어요 리뷰가 많이 없어 걱정했는데 완전 이쁘고 가격도 다른곳에 비해 합리적이에요 색 조합도 너무 이쁘고 진짜 이뻐요 사장님 친절하시고 완전 강추에요 😊👍
23.11.23.목,"퇴근후 늦은 시간 픽업인데 사장님이 흔쾌히 기다려주셔서 기념일 이벤트 할수있었습니다! 떡은 흑임자,커피 반반설기로 주문했고 두가지 맛 다 맛있어서 남자친구가 좋아하네요ㅎㅎ 앙금까지 싹 긁어먹었습니다! 남자친구 요청으로 흑임자설기 한판 주문완료^^.. 오늘 또 가지러 갑니다♥️♥️ 제작케익 불모지 왕십리에 오래오래 있어주세요ㅜㅜ!"
23.11.21.화,요즘 또 핫하게 다시 떡케이크가 뜨고있어서 친구생일겸 주문해봤는데 의외로 그냥 케이크보다 떡케이크가 더 좋았어요!!! 술안주로 먹기도 딱좋고 디자인도 너무 예뻐서 모두 만족했습니다 :) 사장님두 너무 친절하시구 대박나고번창하세요🫶🏻
23.11.20.월,"동생들이 설기를 좋아해서, 수능 선물로 인스타그램에서 찾던 중 예쁘게 만들어 주시는 걸 보고 주문했어요 :) 당일에 먹었는데 지금까지 먹어본 설기 중 1등이었어요.....진짜❤️‍🔥 맛있고 레터링 스티커까지 깔끔하게 해주셔서 선물하는 맛이나요 ㅎㅎ 보니까 떡케이크도 진짜 예쁘게 만드셔서 다음에 또 주문하려구요~~! 떡 좋아하시는 분들 추천합니당🩵"
23.11.20.월,꿀설기 주문햇는데 겨울시즌이라 귀여운 루돌프러 해주셨어오 맛도있는데 귀여우니까 먹기 아까웠어요ㅠㅜ식사대용으로두 좋구 엄청 맛있었어요 시간대를 30분 일찍되냐구 물어봤는데 사장님이 친절하게 가능하다고 하셔 너무 감사합니당💛🫶
23.11.19.일,"인스타 리뷰가 너무 좋아서 주문했는데, 진짜 너무 이쁜거 아니에요?? 생신 선물로 케이크만 하다가 떡 케이크 해봤는데 빵케이크 보다 더 맛있고 이뻐서 참 하길 잘했다 싶었어요~ 사장님도 친절하시고 장사 대박나면 좋겠어요💜💜"
23.11.18.토,환갑파티에 사용 할 환갑떡 주문했는데 너무 예쁘게 만들어주셨어요~! 환갑 떡 주문은 처음이라 이것 저것 많이 물어봤는데 사장님이 엄청 친절하시더라구여!! ㅎㅎ 설기 맛이 다양하게 있어서 무슨 맛으로 할 지 엄청 고민하다 꿀설기로 주문했는데 달달하니 맛있었어요. 설기가 원래 이렇게 맛있는거였나요??! 얼그레이 설기도 너무 궁금해서 같이 주문했는데 얼그레이 크림이 취향 저격이에요!! 최애 떡 돼버렸지 뭐에요?! 다음에 또 주문할게요!!😖😖
23.11.18.토,달콤담백 단호박잼 케이크 너무 맛있어요~ 떡케이크 처음 먹어보는데 건강한 재료에 맛까지 사로잡아버림..🙊 케이크 디자인이나 색감도 예쁘구 사장님도 이쁨..앞으로 특별한날 케이크 주문은 봉주공방 찜콩 단골 찜콩입니당🙌💗
23.11.17.금,부모님 선물로 봉주공방에서 떡케이크를 주문해봤어요 케이크를 받아보고 너무 예뻐서 먹기 아까웠어요 맛도 좋았어요 👍👏입자가 고아서 먹을때 부드럽고 위에 올라간 꽃 앙금과 조화가 되어서 맛있었어요😀 봉주공방 방문해봤는데 매장도 깨끗하고 친절하시고 무엇보다 떡이 이쁘고 맛도있고 케이크나 떡을 주문할때 봉주공방에서 주문할게용 부모님께 선물드렸더니 너무 좋아하셨습니다😁 이쁘고 맛있는케이크 감사합니다😊👏
23.11.15.수,어머님 생신이라 레터링케이크보단 떡케이크 찾고있었는데 봉주공방 떡케이크 비쥬얼에 홀려서 주문했어요! 단호박설기 1호로 했는데 솔직히 비주얼 예쁘면 맛은 어느정도 포기하는게 이쪽업계에 암묵적인룰? 인것 같았지만ㅋㅋㅋㅋ여긴 다르네요ㅠ 제가먹어본 떡케이크중에 제일맛있었어요!! 일단 떡이 엄청 촉촉하고 단호박잼 직접 만드셔서 그런지 인공적인 단맛이 없어서 좋았어요! 그리고 다른 앙금케이크는 앙금이 너무 달아서 솔직히 반이상 덜어냈거든요 근데 여기는 너무 달지않아서 떡에 슥슥 다 발라서 냉동실에 들어감없이 완전히 클리어!! 다음달에 엄마생신있는데 또 주문할거에요 맛도 여러가지라 질리지 않을거 같아서 앞으로 가족행사 떡케이크 주문은 여기서 뽕뽑아야겠아요🙌🏻🙌🏻
23.11.14.화,인스타그램에서 보고 평이 너무 좋길래 선물하려고 예약해서 픽업해왔어요♥︎ 선물하면서 너무 궁금해서 하나 받아서 먹었는데 진짜 여태 먹었던 백설기 중에 가장 맛있었어요.. 진짜진짜진짜 발가락 손가락 다 겁니다.. 백설기 종류도 다양한데 커피를 좋아하셔서 커피로 골랐는데 내 자신 칭찬해! 선물 받으신 지인분이 쁘띠 설기 앙금도 너무 달지도 않고 가족 모두 맛있게 먹었다며 어디냐고 물으시네요 뿌듯 뿌듯♥︎ 바아아아로 공유했습니다 봉주공방 지분 주시나요? 금방 또 예약하고 갈게요! 아 맞다 사장님이 너무 러블리해요...... 잠깐이었지만 사장님 덕분에 힐링하고 가요!
23.11.14.화,"친구 공연 선물로 특별한 선물은 없을까 고민하다가 ’봉주공방‘을 발견!!! 리뷰도 좋고 알찬구성, 비쥬얼 미췄더라고요! 바로 쁘띠설기케이크 12구 (꿀설기) 주문!! 친구가 너무 좋아하고 아까워서 못먹겠다며..ㅎ ㅎ 촉촉하니 너무 맛있다며 극찬..(쀼듯) 그리고 픽업하면서 내부를 봤는데 인테리어 깔끔하고 사장님 예쁘심 :) 다음에 또 주문할게요!! 최고 귣귣👍"
23.11.14.화,교무실 선생님들 간식 겸 케이크 선물로 주문했어요. 진짜 케이크 보는 순간 다들 탄성이 절로.. 너무 예쁘더라구요. 달달한 설기랑 담백한 수수팥떡 모두 순식간에 사라졌습니다. 또 시킬게요! 번창하세요!
23.11.14.화,"어머니 생신이라 케이크 주문할 곳 검색하다가, 인스타그램에서 봉주공방 떡케이크 비주얼 보고 바로 주문 했어요!! 앙금플라워 케이크 자체를 먹어본적도 없었고, 주문해본적도 없었는데 😅 엄마가 떡을 좋아하셔서 이번에 한번 도전해봤는데 완전 성공적이었네요 ㅎㅎ 케이크 디자인도 제가 원하는대로 맞춰서 해주시고 무엇보다 너무 맛있어서 가족들이 다들 좋아했어요~ 떡 안좋아하던 신랑도 한입 맛보더니 담에 기념일 케이크 말고 평상시 먹을 설기도 주문 하자고🤣 아무튼 넘 감사히 잘먹었습니다. 다음에 또 주문할게요~ 💗"
23.11.8.수,마침 떡케이크가 필요해서 알아보다가 봉주공방이라는 곳을 발견했어요! 생긴지 얼마 안된 곳이라 반신반의 했지만 사장님이 친절하게 상담도 해주시고 설명도 꼼꼼하게 해주셔서 믿고 주문했는데 정말 잘해주셨어요! 비주얼도 중요하지만 먹는 거라 아무래도 맛이 중요하잖아요? 맛도 정말 맛있었어요! 제가 사진을 잘 안 찍는 편이라 다 먹은 사진 밖에 없지만 진짜 최고였어요! 주변사람들한테도 홍보 많이 했어요! 다음에도 또 주문할의향이 있어요👍👍👍
23.10.22.일,"아가 100일을 맞이해서 지인들께 돌릴 떡과 백일상을 알아보다가 인스타에서 ‘봉주공방’이라는 곳을 보고 문의드렸습니다. 사장님께서 정말 친절하시고 떡 세트 구성도 알찰 뿐만 아니라 모양과 색감까지 먹기 아까울 정도로 너무나 취향저격이라 고민없이 바로 주문했어요~! 그런데 실물로 보니 사진보다 더 예쁘고 먹음직스러웠어요💕 거기에다가 사장님께서 정성스럽게 포장해주신 걸 보고 더 감동했답니다🥹 백설기는 담백하고 쫄깃쫄깃, 송편도 윤기가 차르르르르 쫀득쫀득, 그리고 제 최애 수수팥떡.. 이거 진짜진짜 맛있어요...😍 저 리뷰 잘 안 쓰는데 진짜 이건 꼭 리뷰를 달아드려야겠다고 마음 먹었답니다~ 사장님 덕분에 아가 첫 기념일을 가족들과 행복하게 보냈습니다! 다음 기념일 때도 쭈욱 주문할꺼니까 오래오래 번창하세요🥰"
23.10.20.금,"어머니 생신기념 떡케익 주문했는데 디자인 너무 이쁘고 숫자초도 센스있게 챙겨주셨어요! 캠핑가서 드린거라 사진에 다 못담아서 아쉽네요 ㅠㅠ 딸기,단호박 반반 했는데 수제쨈 듬뿍에 위에 앙금도 많이 안달구 정말 맛있었습니당:) 사장님도 너무 친절하시고!!! 매장도 엄청 깨끗했어요! 수수팥떡이랑 송편도 맛있다는 평이 많아서 다음에 먹어보려구요 !! 추천입니다!"
