date,content
9.28.일,아니 진짜 너무 맛있습니다 다음엔 남자친구와 오겠습니다 👍🏻
9.21.일,음식도 너무 맛있고 직원분들도 친절하세요 !! 인테리어 맛집... 레트로한 감성도 너무 귀여우면서 특별한 음식 먹으니까 스트레스 풀려요 ㅠㅠ 친구나 연인이랑 같이 오기 너무 좋은 곳...😍😍😍
9.6.토,파스타 진짜진짜 맛있고 치즈 퍼포먼스도 진짜 멋있었어요 이제부터 양식 집은 여기로만 올게요
8.12.화,성수 파스타 맛집 이런 곳이 있는지 몰랐네요 맛있습니다 가격도 좋은데 양도 많아요 🫶🏻 성수동 데이트 하신다면 북성수 브리비트 방문해보세요!
8.12.화,"양도 넉넉하고 플레이팅도 예뻐서 사진 찍기 좋았고, 직원분들도 친절해서 기분 좋게 식사할 수 있었어요. 친구와 함께 와도 좋고, 연인과 데이트하기에도 딱인 곳입니다❤️"
9.20.토,맛있고 음식도 금방 나왔어요! 50cm생면 파스타 머구 싶었는데ㅜ그건 한정으로 판매해서 오전에 다 나갔다고 하네요! 먹고싶으면 오전에 오는거 추천!
10.16.목,여러분 뇨끼가 대박이에요.. 가지튀김도 필수에요.. 리조또는 잠봉 시켰는데 하 너무 맛있어요.. 그냥 다 최고에요..
9.16.화,음식도 깔끔하게 잘나오고 너무 맛있었어요👍👍
8.11.월,사진과 같이 음식들이 보기에도 너무 예쁘고 맛도 있었네요~ 느끼하지 않고 매콤한 메뉴도 있어서 잘 먹었습니다~ 직원분들 친절하시고 깔끔하게 잘 먹었네요 😁
9.12.금,딸랑구와 데이뚜~~ 딸하구 대화도 편하게 하구 음식완전 맛나게 먹구~~ 고기에 소스 완전 👍(레드와인 소스인가...) 또 또 데이트 하러오장~~~~
10.8.수,스테이크가 너무 부드럽고 감자치즈랑 너무 잘 어울려요 파스타도 너무 맛있어요 감칠맛 대박
10.5.일,뇨끼 완전 맛잇어요 쫀둑한데 겉은 눅눅하지않고 파수타는 맵삭하고 연어랑 먹우니잘어울려요
8.12.화,평일 11:30에 방문해서 웨이팅은 없었어요~ 음식들 플레이팅도 예쁘고 맛있어요~! 양이 적다는 리뷰가 있어서 둘이서 메인메뉴 3개 시켰는데 배불러서 좀 남겼어요~ 성수 맛집 찾아보고 온건데 성공!!😆😆😆
9.28.일,크림파스타 진짜 짱 맛있어요!! 고기 엄청 많이 들어있어요 사실 전 밥 먹고 왔는데 흡입했다는..ㅋㅋ 다음엔 스테이크랑 뇨끼 꼭 먹어보고 싶네요 ㅎㅎ 잘 먹었습니다😆
10.15.수,너무 가보고 싶었던 곳이라 예약 후 이용했고 시킨 메뉴 다 맛있었습니다 스테이크는 꼭 시키셔야하고 연어파스타가 생각지 못한 맛도리였습니다..♡ 재방문하고싶어요!!
8.10.일,예전부터 넘 와보고 싶었는데 드디어 왔어요! 잠봉뵈르가 젤 맛있었어요 양도 많고 잠에오면 리조또는 꼭 시킬 것 같아요!! 뇨끼는 쫄깃보단 해쉬브라운 느낌이에요!
8.15.금,뇨끼랑 연어스테이크 파스타 진짜 맛있어요!! 뇨끼는 겉바속촉에 연어파스타는 매콤하니 진짜 맛있어요ㅠㅠ 성수 뇨끼맛집 파스타 맛집이에요ㅠㅠ!!
10.13.월,너무 맛있어요🤤 성수 맛집임!! 음식 양도 많고 사장님도 친절하셔요 성수 데이트하다가 여기 오면 너무 느좋이에요
9.8.월,두번째?세번째? 방문인데 사람이 더많아졌어용 성수오면 꼭 필수로 들리는곳이에요!
10.11.토,"성수동 맛집,,,ㅎㅎ 맛잇어용!!! 인테리어나 소품이 일관돼서 너무 귀여웅"
9.20.토,너무 맛있어요! 단골 할 예정입니다 ㅎㅎ 성수동 오신다면 필수코스로 오세요!!
10.11.토,스테이크와 치즈가 부드럽고 맛있었어요! 리조또도 느끼하지 않고 맛있어요😍
8.27.수,직원들도 친절하시고 새우뇨끼도 맛있어요! 파스타는 진짜 매콤하네요 잘먹었습니다
9.27.토,가지튀김이 킥! 맛있게 잘먹었습니다
9.15.월,대표 메뉴인 옥수수 뇨끼가 진짜 너무 맛있어여ㅠㅜ 완전 쫄깃하구 소스도 파향이랑 어우러져서 완쟌 존맛탱구리!!! 생면파스타 비쥬얼도 맛도 미쳤어여뮤ㅠ 다들 먹으러 오세여~~
9.6.토,맛있고 직원분들도 친절하세요! 매장 내부도 꽤 넓직해서 별로 안 기다렸어요 생면파스타 트러블 향기도 나고 강추요
7.6.일,저장해뒀던 곳인데 드디어 와보네용ㅎㅎ 시그니처는 역시 맛있네요ㅠㅠㅠ이유가 다 있어요! 연어도 안 비리도 부드러워용 파스타 소스도 살짝 매콤한데 너무 잘 어울려요~ 뇨끼도 쫀득하고 크림이 너무 맛있어요ㅠㅠ 크림 양이 더 많았으면 좋겠어요ㅎㅎㅎ 재방문해서 다른 메뉴도 먹어보고싶어요!!
10.11.토,여름에 친구들이랑 왔을때 정말 맛있게 먹어서 오늘 다른 친구 데려왔어요 ㅎㅎㅎ 진짜 맛집입니다!!
8.1.금,"그릭요거트 샐러드, 연어스테이크 파스타 맛있어요! 다음번에 방문하면 포르치니 새우 뇨끼, 브리피트 스테이크 먹어보고 싶어요!"
10.3.금,스테이크가 맛있고 파스타 진짜 짱 맛있어요. 연어 파스타 나중에 또 먹고싶어요.
10.9.목,기다린 보람이 있네요!! 특별한 메뉴 좋아요~~♡
10.4.토,가성비좋고 음식이 너무 맛있어요! 가지튀김 꼭 드세요~!
8.10.일,애매한 시간에 와서 거의 바로 앉았어요!!!! 직원분들이 너무 친절하셔서 좋았습니다 ! 메뉴 구성도 좋고 맛도 좋아서 또 올게요 :) 저의 원픽은 잠봉매콤리조또 입니다 !
8.31.일,가지튀김 진짜 맛있어요! 봉골레 파스타는 꽤 매운데 맛있구 둘이서 이렇게 세 개 시켰더니 배부르게 잘 먹었어요! 주말 런치 예약 안하고 왔는데 20분 정도 웨이팅 후 들어왔습니다🍀👍
10.10.금,전체적인 분위기도 좋고 음식도 사진처럼 너무 맛있어요!! 오픈시간 맞춰와서그런지 웨이팅없이 수월하게 엡장했습니다!!
6.20.금,첫 방문인데 성수동 맛집을 찾아보다가 뇨끼가 맛있어 보여서 친구들과 모임장소로 예약하고 방문했어요~ 담음새도 예쁘고 음식도 맛이 있었습니다. 스테이크는 넘 부드럽고 쪽파구이가 잘 어울리고 맛있더라구요😋 연어 파스타도 맛나고 시그니처 메뉴는 다 맛이 있네요. 직원 분들도 친절하시고 좋아요!
8.10.일,"우연찮게 오게된곳인데 리조또랑 뇨끼 궁합이 좋아요!! 리조또가 제일 맛있었고 뇨끼도 괜첞은데 조금 더 따끈따끈했으면,.. 하는 마음!! 맛있었어요~~"
8.10.일,"분위기도 외국 같고, 음식도 맛있어요~!! 특히 뇨끼, 가지튀김이 바삭해서 너무 맛있어요 스테이크도 부드럽고 맛있어요🤤"
9.18.목,음식이 전체적으로 맛있어요 분위기도 좋고 가볍게 놀러올 때 오기 좋은것 같아요
7.12.토,"메뉴가 다 맛있어요..... 웨이팅 없다길래 방문한건데 맛집 찾았어요ㅠ.ㅠ 메뉴마다 특색있는 재료가 하나씩 들어가는데 밸런스가 잘 어울려서 맛있게 먹었습니다. 뇨끼에 올리브, 리조또에 피스타치오 존맛... 재방문의사 낭낭임"
8.5.화,뇨끼가 너무너무 맛있어요 음식도 빨리 나오는편이고 성수인근이라 웨이팅이 있을 줄 알았는데 평일이라 웨이팅 없이 빠르게 입장할 수 있다는점도 좋았습니다!! 여직원분도 너무 친절히 응대해쥬시고 감사했습니다 맛있게 먹고 가요 !!
8.5.화,가게 인테리어도 깜찍하고 안내해주시는 직원들도 친절하셔서 기분좋았는데 음식 플레이팅도 이쁘고 음식이 다 맛있어요 근데 뇨끼가 진짜 고소하고 맛있었어요!! 봉골레 파스타는 해물맛 많이나서 좋았어요 여기있는 메뉴 다 먹어보고싶어요
8.25.월,음식들이 다 맛있고 스테이크는 같이 나오는 가니쉬들도 간이 잘되어있어서 남김없이 다 먹었어요! 평일에도 사람이 많아서 네이버 예약허고 오시는게 좋을 거 같아요🙂
6.12.목,가게가 외관 부터 내부까지 너무 예쁘고 테이블도 많고 넓고 쾌적 했어요. 토마토 샐러드도 맛있었고 뇨끼랑 파스타 모두 재료가 신선하고 맛있어서 좋았어요. 직원 분도 친절하시고 분위기도 좋아서 다음에 또 재방문 할 것 같아요.
8.28.목,사진은 못 찍었지만 옥수수뇨끼가 정말 맛있었어요 ! 직원분들도 친절하셔서 기분 좋게 식사하고 갑니다 ˃ᴗ˂ ♡
8.8.금,옥수수뇨끼 겉바속촉 미쳤어요…. 가지튀김은 엄청 바삭해서 눅눅해지지도않고 스리라차소스같은거에 찍어먹으니까 계속들어가네요! 스테이크위에 치즈는 약간 요거트?맛이 나서맛있었어요!
8.17.일,성수 맛집이라고 해서 예약했는데 파스타와 뇨끼 스테이크 다 맛있었어요! 맛있게 먹고 갑니다~
10.11.토,대파크림 뇨끼 궁금해서 왔는데 다른 메뉴도 다 맛있었어요! 뚝섬오면 생각날것 같아요:)
10.11.토,줄서있길래 한번 들어와봤어요! 특별한 양식이네요~! 넘 맛있게 잘 먹구 갑니당!
9.7.일,너무맛있어요 느기하지도 않고 먹어본 치즈중에 최고에요!! 친절합니당
10.4.토,긴 말 안 합니다 너무 맛있어서 혼자 두가지 메뉴 클리어 가능
9.28.일,파스타랑 뇨끼시켜서 먹었는데 둘다 맛있었어요! 특히 대파옥수수뇨끼가 맛있었습니당
9.28.일,뇨끼가 먹고싶어서 왔는데 너무 맛있고ㅠㅜㅠ 사이드메뉴도 너무 맛있어요 하이볼도 강추합니다🥰
10.10.금,브리비트 성수! 최근에 다른 곳에도 오픈한거 같던데 ! 앞으로도 더 기대됩니다 :)
8.25.월,"스테이크, 잠봉매콤 리조또 시켰는데 너무 맛있었습니다! 잘 알아보고 왔는데 만족스러워요~~"
9.20.토,와...대박...🫠 뇨끼랑 스테이크 너무 맛있어요... 인생 맛집이에요 증말...담에 재방문해서 다른 음식도 먹어보려구요!👍👍👍
9.16.화,"브리비트 성수의 옥수수뇨끼는 옥수수의 달콤함과 부드러운 식감이 잘 어우러져 독특하면서도 중독적인 맛을 줍니다. 쫀득한 뇨끼 위에 고소한 소스가 더해져 풍미가 깊고, 담백하면서도 씹을수록 옥수수의 고소함이 살아납니다. 성수에서 특별한 파스타를 찾는 분들에게 추천할 만한 메뉴였습니다"
9.22.월,성수에서 유명한 성수 파스타집에서 먹었는데 맛있게 먹어요! 아마 성수에서 유명한 성수 양식집 중에서 최고인듯요 ㅎㅎㅎ
8.31.일,"맛있어요, 두명이어도 3가지메뉴는 시켜서 먹길래 저희도 세가지다 맛있게 비웠어요😋"
8.25.월,가니쉬와 모든 것들이 다 맛있습니다!! 뚝섬에 놀러오면 항상 생각 날 것 같아요🥰
9.18.목,남자친구랑 데이트하러 왔어요!!! 옥수수뇨끼랑 연어파스타 먹었는데 너무 맛있었어요☺️ 분위기도 데이트하기 너무 좋아요!! 다음에 또 올게용~~
9.7.일,비트스테이크는 와인소스가 스테이크랑 너무 잘 어울리고 연어파스타도 맛있어요
8.26.화,성수 파스타 맛집이라고 해서 와봤는데 너무 맛있게 잘 먹고 갑니다💗 또 오고 싶어요 최고최고🫶🏻
10.11.토,특이한 양식 메뉴를 맛볼 수 있는 브리비트 성수!! 연어스테이크 파스타 특히 연어의 담백한 풍미가 좋았어요~^^
8.30.토,여자친구와 소중한 기념일에 스테이크랑 베이컨크림파스타 맛있게 잘 먹고 갑니다~!~!
8.19.화,"성수 데이트, 성수 친목, 성수 나들이에 정말 딱 적합한 장소예요! 뇨끼랑 리조또 넘 맛있게 잘 먹었습니다~!🫶"
6.29.일,분위기부터 플레이팅까지 완벽 그 자체. 연어 스테이크가 통으로 올라간 토마토 라구 파스타는 담백하면서도 깊은 풍미가 인상적이었어요. 무엇보다 대파 크림 뇨끼… 진짜 쫀득한 뇨끼 식감이 찰떡궁합.
8.1.금,여기 분위기가 너무 좋아요💕 옥수수뇨끼 속 베이컨이 짱 맛있구 연어스테이크 파스타도 넘 맛있어요 첫 방문인데 생각날 것 같아요ㅎㅎ 예약이 어려우니 예약 필수요~☺️☺️
7.25.금,직원분들 짱 친절하시구 넘넘 맛나요!! 인스타에서 유명하길래 예약하고 왔는데 예약하길 정말 잘했습니다 🩵🩵 다음에 또 올게요!!
9.26.금,사장님께서 매우 친절하시고 음식도 아주 맛있었습니다!! 실패 없는 선택이에요! 꼭 오세요 강추!
9.7.일,뚝섬 양식 맛집 브리비트!! 분위기 너무 좋네용 시그니처 대파크림 옥수수 뇨끼랑 봉골레파스타 먹었는데 너무너무 맛있고 다른 메뉴 먹으러 또 오고 싶어요! 완전 추천입니당
8.23.토,맛있어요 다음에 또오구 싶어요 스테이크에 치즈올라간것두 최고인거같아요
10.19.일,맛있어요 성수동 양식 성수동 데이트
9.20.토,"연어라구파스타, 그린샐러드, 대파크림 옥수수뇨끼 먹었어요! 특히 연어파스타가 너무 맛있엉요 다음에 또 오고싶어요~"
8.7.목,와우 스테이크 고기 도톰하고 넘넘 맛있어요 연어스테이크보다 스테이크 강추해요 넘 맛있게 먹었어요
8.19.화,제생일기념으로 언니가 맛있는거 사준다해서 같이왔어요! 뇨끼 처음 먹어보는데 너무 맛있구 연여파스타도 맛있어요 ♥️ 성수 데이트로 꼭 추천해요
10.7.화,"파스타, 스테이크, 뇨끼 맛집이라고해서 명절에 지인과 함께 왔어요! 인테리어도 이쁘고 음식도 기대되네요!ㅎ"
9.24.수,음식이 넘 맛있어요 !! 평일 저녁에 갔는데 비오는 날이라 그런지 웨이팅도 없이 들어갔아요 !!!!😻
10.19.일,기다릴만큼 맛이잇네요~ 뇨끼추천합니다
8.3.일,세트 메뉴가 있어서 가성비가 좋아요.  음식이 맛있어요~^^  아이도 좋아하고 데이트하기 좋을거 같은 분위기예요.  매장이 청결하고 깔끔해요.
9.12.금,"뇨끼광인이라 너무 반갑게 주문했어요. 겉바속촉 뇨끼도 너무 맛있고, 구운버섯과 새우도 탱글탱글 식감이 너무 좋아요. 혼자 왔는데도 친절하게 자리 안내 해주셔서 편안하게 식사했습니다. 다음엔 짝궁과 함께 올게요!😊 #성수 파스타#성수 양식"
9.15.월,생면파스타 신기해서 시켰는데 정말 맛있었어요 봉골레도 맛있규 나중에 남자친구 생기면 꼭 데리고 오고 싶은 곳이였어요 또 올게요!!
9.13.토,맛있게 잘 먹었어요 데이트코스로 오시는분들이 많이보였네요.
9.8.월,샐러드 파스타 스테이크 다 맛있어서 너무 즐거운 식사했습니다~!
10.9.목,분위기가 좋고 맛도 좋으며 직원분들도 친절하셔서 너무 좋았습니다 대신 핫플인터라 미리 예약 하면 좋아용! 특히 시그니처 스테이크 강추입니다 👍👍
9.7.일,스테이크가 진짜 맛있구 분위기도 좋아요!
10.16.목,가게 안도 예쁘고 옥수수 뇨끼 맛있습니다!
10.8.수,맛있게 잘 먹고갑니다 ㅎㅎ 친구들끼리 왔는데 잘 찾아온거 같아요
10.17.금,짱마싯어요 맛없는게 없어요 재료하나하나가 다 맛도리임
9.22.월,인기메뉴만 시켰는데 진짜 맛있어요!! 매장 예쁘면 맛은 별로인 곳도 많은데 진짜 맛나서 놀랐어요 왕추천
9.19.금,모든음식이 신선하고 정말 마싯어요 플레이팅도 너무 예뻐요 맛집으로 추천해요. 제 방문 하고 싶어요
8.19.화,시그니처 뇨끼랑 시그니처파스타 모두 맛있었어요! 연어 스테이크 파스타 가성비 좋아요. 식기가 아기자기해요
10.15.수,"성수 양식, 성수파스타. 지난번에 와서 뇨끼먹고 정말 맛있었어서 다시 왔어요! 오늘 먹은 음식은 제 입맛에는 조금 맞지는 않았는데 가격대비 적절했다고 생각합니다. 스탭분들은 정말 친절하세요"
9.22.월,파스타 맛집이에요~뇨끼도 너무 맛있고 다음에 또 먹고싶어요^^
9.21.일,음식도 빨리 나오고 너무 맛있어요!! 특히 봉골레 파스타가 너무 맛있습니다🤤 분위기도 좋고 추천합니다👍
9.21.일,분위기도 너무 예쁘고 음식이 맛있었습니다!! 직원분들도 친절하셔서 친구와 좋은시간 보냈어요🥰
9.6.토,옥수수크림뇨끼 역대급 이었어요! 인생뇨끼 찾았습니당 !!!!!
9.29.월,음식이 빠르게 나와서 좋았어요~ 스테이크 위에 올려진 치즈 풍미가 좋았는데 식어서도 치즈가 부드럽게 늘어나서 맛있어요~ 전체적으로 양이 적습니다. 스테이크 소스는 와인 맛이 너무 강하게 났어요 호불호가 많이 나뉠듯 합니다. 양식집 느낌보단 퓨전음식집이라 생각하고 드시면 딱 그 맛입니다.
7.27.일,뇨끼가 진짜 레전드입니다 정말 쫀득하고 크림 소스의 풍미가 정맣 멋집니다 버섯도 맛있어요 바지락 오일 파스타에도 바지락 진짜 많고 맛있었구요 가게 인테리어도 정맣 분위기있고 이뻤어요 말그대로 느좋 잘먹구 갑니당
8.18.월,부챗살 스테이크가 정말 맛있어요. 버터 향기랑 풍미가 가득 해요. 맛있어요. 분위기가 좋아서 소개팅 장소로 추천 드려요~♥
8.27.수,가지튀김운 바삭 촉촉하니 맛있고 뇨끼는 쫄깃하고 고소해서 넘 맛있었어요!! 새우도 많고 알차게 맛있습니당 성수동 양식 맛집으로 왜 유명한지알겠어요!! 다음에 또 무조건 재방문 예정입니다!
8.29.금,음식도 너무 맛있는데 가게가 너무 이쁩니다!! 👍🏻👍🏻👍🏻💛💫
10.1.수,좋아용 스테이크랑 파스타 너무 맛있었어요! 성수 데이트 오면 여기 오시면 만족하실거에요! 추천이요!
10.19.일,기다린만큼 음식이 맛있어요~
9.5.금,성수동에 데이트하러 왔다가 분위기 좋아보여서 방문했는데 분위기만큼이나 파스타가 너무 맛있어서 깜짝 놀랐어요! 특히 봉골레파스타가 살짝 매콤해서 더 좋았어요!! 다음엔 스테이크도 먹어보고 싶어요
8.28.목,맛있었어요!! 저는 연어파스타 먹었는데 연어랑 토마토소스랑 잘어울린다고 생각했어요! 분위기도 좋아요!!
8.31.일,너무 맛있어요 성수 최고 맛집 진짜 추천해요
8.16.토,뇨끼랑 리조또 모두 안에 부재료가 많이 들어있고 신경쓴 맛이 나요! 가지튀김도 맛있습니당 성수동 맛집이에요
9.26.금,와 진짜 너무 맛있어요...🩷🩷🩷 스테이크랑 연어파스타 둘다 최고예여 또올게요 ㅠ😍
10.12.일,"감자치즈스테이크 넘 맛있어요,,,, 또 먹으러 올게욤…🤤"
10.7.화,간도 슴슴하니 깔끔한 맛입니다 인테리어도 예쁘네요
9.6.토,진짜루 맛있어요 스테이크 주기 전에 치즈 올려주는 것도 넘 좋아요 맛있고 기다리면서 먹을 정도임 굳귣
9.29.월,매운봉골레 파스타 꼭 먹어보요너무 맛있어요
8.6.수,매장이 넓고 자리가 많아서 예약없이 바로 들어와서 먹을 수 있었습니다 ! 인테리어로 눈길을 끌어서 궁금했던곳인데 이제 방문하게 되었네용 너무 맛있게 잘 먹고갑니다 ~~ ♥️♥️ 브리비트 성수 추천해요 !!
9.8.월,너무 맛있어요!! 가게 분위기도 예뻐요
9.3.수,맛있어요! 세그릇 먹을까 한참 고민했지만 담에와서 먹을게요
8.30.토,성수 데이트 맛집답게 커플들이 정말 많았어요! 오픈형 주방에 맛있는 냄새가 솔솔나고 주문한 음식 모두 맛있었어요:) 성수 양식 맛집으로 인정👍🏻
9.26.금,두번째 방문이에요 여기 음식은 다 맛있는거같아요 특히 가지튀김이 특별하구 분위기도 좋아요
9.30.화,브리비트스테이크와 대파크림옥수수뇨끼 주문했어요. 양은 적었고 맛은 적당했어요. 대기하면서까지 먹고 싶진 않았고 음식맛에 비해 가격이 높다는 생각이... 다시 가고 싶진 않아요. 음악도 시끄럽고 손님말소리도 크게 울려서 정신이 없어서 더 음식을 음미할수 없었던거 같아요. 실망스러웠어요.
8.30.토,옥수수뇨끼가 입에 넘 잘맞았어요!!!:) 매콤리조또랑 같이 먹으니까 합이 딱맞아요!! 분위기랑 플리도 좋아서 성수동 에서 데이트할때 양식집 찾으시면 여기와도 넘 좋을거같아용!!!!
9.6.토,성수 양식 맛집이라고 추천 받아서 왔는데 정말 맛있어요! 리조또 하나 뇨끼 하나 먹었는데 배부르게 먹었습니다! 알고보니 여기는 파스타도 맛있다고 하는데 다음에 또 방문해서 파스타 먹으러 오고 싶어요
10.18.토,#성수파스타 #성수양식 봉골레파스타는 적당히 매콤하고 시그니처메뉴인 대파크림옥수수뇨끼는 꼭 드세요!
