date,content
"""음식이 맛있어요""",이 키워드를 선택한 인원
"""인테리어가 멋져요""",이 키워드를 선택한 인원
"""친절해요""",이 키워드를 선택한 인원
"""특별한 메뉴가 있어요""",이 키워드를 선택한 인원
"""재료가 신선해요""",이 키워드를 선택한 인원
"""매장이 청결해요""",이 키워드를 선택한 인원
"""매장이 넓어요""",이 키워드를 선택한 인원
"""양이 많아요""",이 키워드를 선택한 인원
"""가성비가 좋아요""",이 키워드를 선택한 인원
"""아늑해요""",이 키워드를 선택한 인원
"""메뉴 구성이 알차요""",이 키워드를 선택한 인원
"""사진이 잘 나와요""",이 키워드를 선택한 인원
"""대화하기 좋아요""",이 키워드를 선택한 인원
"""특별한 날 가기 좋아요""","""특별한 날 가기 좋아요"""
"""차분한 분위기예요""",이 키워드를 선택한 인원
"""단체모임 하기 좋아요""",이 키워드를 선택한 인원
"""혼밥하기 좋아요""",이 키워드를 선택한 인원
"""컨셉이 독특해요""",이 키워드를 선택한 인원
"""음식이 빨리 나와요""",이 키워드를 선택한 인원
"""화장실이 깨끗해요""",이 키워드를 선택한 인원
"""뷰가 좋아요""",이 키워드를 선택한 인원
"""고기 질이 좋아요""",이 키워드를 선택한 인원
"""음악이 좋아요""",이 키워드를 선택한 인원
"""건강한 맛이에요""",이 키워드를 선택한 인원
"""비싼 만큼 가치있어요""",이 키워드를 선택한 인원
"""음료가 맛있어요""",이 키워드를 선택한 인원
"""좌석이 편해요""",이 키워드를 선택한 인원
"""향신료가 강하지 않아요""","""향신료가 강하지 않아요"""
"""환기가 잘 돼요""",이 키워드를 선택한 인원
"""아이와 가기 좋아요""",이 키워드를 선택한 인원
"""잡내가 적어요""",이 키워드를 선택한 인원
"""야외공간이 멋져요""",이 키워드를 선택한 인원
"""코스요리가 알차요""",이 키워드를 선택한 인원
"""현지 맛에 가까워요""",이 키워드를 선택한 인원
"""오래 머무르기 좋아요""",이 키워드를 선택한 인원
"""반찬이 잘 나와요""",이 키워드를 선택한 인원
"""커피가 맛있어요""",이 키워드를 선택한 인원
"""디저트가 맛있어요""",이 키워드를 선택한 인원
"""주차하기 편해요""",이 키워드를 선택한 인원
"""룸이 잘 되어있어요""",이 키워드를 선택한 인원
"""샐러드바가 잘 되어있어요""","""샐러드바가 잘 되어있어요"""
"""집중하기 좋아요""",이 키워드를 선택한 인원
10.17.금,"성수에 있는 브리비트 왔어요! 분위기도 좋고 음식 하나하나 너무 맛있어서 정말 만족스러웠어요. 먼저 가지튀김은 겉은 바삭하고 속은 촉촉한 식감이 정말 좋았고, 위에 올라간 치즈와 소스가 조화를 잘 이루어서 하나도 느끼하지 않고 계속 손이 가는 맛이었어요.  옥수수 뇨끼는 예상보다 훨씬 부드럽고 고소해요 :), 쫀득한 뇨끼에 달콤한 옥수수 크림소스가 잘 어우러져서 정말 맛있게 먹었어요. 평소에 뇨끼를 자주 먹는 편은 아닌데, 이건 다음에 가도 꼭 다시 주문하고 싶을 정도였어요. 봉골레 파스타는 조개도 실하고 국물 맛이 굉장히 깔끔했는데, 오일 베이스임에도 전혀 느끼하지 않고 마늘향이 은은하게 퍼지면서 면이랑 너무 잘 어울리더라고요. 전체적으로 음식 퀄리티가 높고 만족족족해여옹"
10.12.일,"파스타 땡겨서 찾다보니 지난번 왔던곳이 뜨더라구요! 당장 점심시간에 호다닥 갔는데 바로입장할 수 있어서 좋았어요. 맛있어서 먹느라 사진 찍는거 까먹을뻔.,봉골레 파스타 진짜 J.M.T 다음번에 또 기회된다면 또 오겠습니다 :)♡ 강추합니당 >-<🙂"
10.19.일,사진 속 비주얼도 너무 맛있게 보이지만 실제 음식도 정말 맛있어요. 남편과 아이가 뇨끼를 먹고 싶다그래서 찾아서 왔는데 정말 뇨끼의 매력에 푹 빠졌습니다!! 쫄깃쫄깃한 뇨끼와 대파크림은 정말 맛있구요. 이곳에서 꼭 시켜야 될 메뉴 중 하나는 잠봉매콤리조또입니다! 모든 메뉴가 다 맛있었지만 리조또가 저에겐 최고 맛있었어요.ㅎㅎ 가지튀김도 매콤하니 굉장히 바삭바삭해요. 집에 가서 한 번 도전해보고 싶을 정도로요. 다음에 아이와 또 올 예정입니다^^
10.6.월,리조또 존맛탱~~ 하얀 소스가 정말 맛있어요. 뇨끼는 겉은 바삭하고 속은 쫄깃하네요. 가지튀김은 아주아주 약간 매콤한 맛이 나는데 바삭하니 맛있어요! 대신 크림 종류로만 시키면 느끼하니까 콜라 필수 !!
10.20.월,"성수동 데이트하러 왔는데, 특별한 메뉴가 많아 방문했어요! 가게 외관부터 너무 예뻤는데, 메뉴가 하나같이 너무너무 다 예쁘네오.. 음식 맛은 말할 것도 없이 다 맛있었구요, 특히 뇨끼 쫀득하니 맛나네요 ㅎㅎ 🤤 이렇게 바쁘신데 직원분들 모두 친절하셔서 깜짝 놀랐네요! 🌟 성수 파스타 맛집"
9.21.일,예약 꼭 하시길 추천!! 샐러드 새콤하고 토마토가 진짜 맛나요 파스타 살짝 매콤하데 조개맛이 나서 더 좋았던거 같아요 뇨끼는 소스가 특히해서 먹는 재미가 있었어요 스테이크는 퍼포먼스같이 치즈를 나오는 즉시 부어주셔서 좋았고 좀 소스가 달기했는데 전체적으로 맛났어요 담에 다시 오고 싶은 집이에요~^^
9.10.수,"와우! 뚝섬역 양식맛집 발견!🤤❤️ 외관부터 느좋이고 내부도 넓고 쾌적합니다!! 직원분들도 친절하세요오!  📍대파크림옥수수뇨끼 17900 대파풍미에 옥수수의 달달구리한게 크림과 뒤섞여 환상적인 맛ㅠㅠ💯👍🏻  📍잠봉 매콤 리조또 17900 잠봉진짜많고 적당히 매콤 꾸덕한게 계속 퍼먹고싶은 맛이예요오!  📍매콤가지튀김 6ps 9900 매력적인 가지튀김사이드! 튀김옷이 정말 크리스피하고 가지는 부드러워요! 치폴레소스에 찍어먹으면 환상💞  📍요크셔 푸딩 1500 빵에 리조또랑 뇨끼얹어서 먹었는데 주문안했으면 후회할뻔!! 바삭한 빵에 먹으니까 넘 찰떡,,  뚝섬역 인근 양식집 찾으시면 츄천드려용! 존맛탱❤️‍🔥❤️‍🔥❤️‍🔥"
10.8.수,파스타랑 뇨끼 맛집이에요! 둘이 왔는데 양식 메뉴 다양해서 먹고 싶은 게 너무 많아서 메뉴 고르기가 힘들었어요 다음에 와서 도장 깨기 하려구요 뇨끼 겉바속쫀 그 자체고 파스타는 간도 잘 배어 있고 연어랑 조화가 좋아요 조만간 다른 친구랑 또 올게요
9.14.일,"주말 오픈시간 5분 전에 갔는데 오픈까지 10팀은 줄선 것 같아요..!!역시 브리비트 성수 뚝섬 맛집이네요👍🏻 시그니처로 옥수수 뇨끼랑 잠봉 리조또 가지튀김 시켰는데 다 맛있었지만 가지튀김이 진짜 레전드 존맛이었어요,,ㅠㅠ🥹💖가지튀김에서 매콤 바삭한 후라이드 치킨 맛이 남,,꼭 드셔보시고 다음에 또 방문해서 다른 메뉴 먹어보려구요~~"
9.8.월,"성수동 브리비트에서 뇨끼, 파스타, 가지튀김을 맛보았는데 모두 기대 이상이었습니다.  뇨끼는 쫀득한 식감과 소스가 잘 어울렸고, 파스타는 면의 탄력이 살아 있어 풍미가 깊었습니다.  특히 가지튀김은 바삭하면서 속은 부드러워 고소하고 담백한 맛이 인상적이었습니다.  매장은 작지만 깔끔하고 세련되며 아담한 분위기가 매력적이었고, 직원분들도 친절해 전반적인 만족도가 높았습니다.  음식, 분위기, 서비스가 조화로운 곳으로 성수동에서 꼭 다시 찾고 싶은 매장입니다."
10.12.일,"일요일 오후 예약없이 방문해서 웨이팅 30분 하고 들어왔어요~ 스테이크 세트메뉴로 주문했는데 양은 조금 적었지만 구성도 알차고 맛있어요~^^ 가지튀김은 바삭촉촉, 뇨끼는 부드럽고,스테이크는 특별했어요~~"
9.12.금,"성수동의 핫한 레스토랑이에요!  네이버로 미리 예약하고 방문해서 바로 입장할 수 있었는데  워낙 인기가 많은 곳이라 평일 점심에도 대기할 수 있으니 방문 예정이라면 꼭 예약하고 다녀오세요~  분위기도 깔끔해서 좋고 음식도 독특한데 너무 맛나더라고요.  특히 옥수수 대파 뇨끼는 뇨끼의 쫀득쫀득함과 꾸덕한 소스, 그리고 맛까지 조화롭게 어우러져서 너무 맛있게 잘 먹었어요~"
10.5.일,정말 즐거운 명절이네요~^^ 행복한 식사하고갑니다~^^ 브리세트에서 나온 가지튀김은 진짜 드세요~ 그리고 뇨끼는 정말 강추! 스테이크 말해모해입니다~^^♡ 맛있게 먹었습니다. 감사합니다~ 또올께요~~~~~
9.10.수,"음식이 모두 깔끔하고 맛났는데, 특히 가지튀김과 뇨끼가 특히 맛있었어요. 예약하고 갔는데 바로 입장했고, 크진 않지만 깔끔한 매장과 친절함,맛난 음식 다 마음에 들어 다음에 다시 오고 싶네요~^^"
10.19.일,"파스타가 땡겨서 방문했습니다! 리조또와 봉골레 파스타를 시켰는데, 음식이 나오기까지는 대략 16~18분 정도 소요됐어요! 기다린 시간이 아깝지 않은 맛이었습니다. 우선 파스타 면은 쫄깃했어요! 조개도 아무런 알갱이들 씹히지 않고 깔끔했습니다. 쫄깃한 면발 좋아하시는 분이라면 이 집 파스타 추천드려요. 리조또는 일반적으로 만들어 먹는 것과는 또 색다른 맛입니다! 두 분이서 방문하신다면 꼭 파스타, 리조또 조합으로 드셔보시면 좋겠어요. 파스타 두 개만 시킨다면 양이 부족할 수 있지만, 리조또가 끼니 괜찮았습니다:) 맛집은 늘 숨겨진 골목에 있는 것 같아요~! 성수 맛집 고민하신다면 추천드립니다."
9.15.월,"연어스테이크파스타,옥수수뇨끼,가지튀김,잠봉리조또 먹었어요  가지튀김은 딱딱할 정도로 바싹 튀겼고 매콤해요. 연어스테이크파스타 연어가 잘 구워졌고 크리미 해요 옥수수뇨끼 양이 적어요 고소하고 크리미해요 잠봉리조또 새로운 맛이에요 양 많아요 맛있어요 추천 11시 30분 오픈이고 사람들 줄 서있는데 자리에 다 앉고 여유 있었어요 오이양배추 피클 셀프라서 편해요 매장에 화장실 있는데 카드키 필요해요"
9.21.일,"성수동 데이트 핫플 브리비트 드디어 다녀왔습니다. 분위기부터 메뉴 비주얼 젊음의 기운 가득가득! 너무너무 훌륭하고 멋진 곳!! 옥수수뇨끼와 브리비트 스테이크 두개의 조합과 양, 맛도 완전 최고!!! 브리비트 여기 데이트 대박대박!!!"
9.13.토,"저희는 뇨끼, 리조또, 가지튀김을 먹었는데 다 맛있어서 만족도가 진짜 높았어요. 뇨끼는 쫀득하고 소스랑 잘 어울렸고, 리조또도 풍미가 깊어서 계속 손이 갔습니다. 특히 가지튀김은 겉바속촉의 정석이라 고소하고 담백해서 꼭 추천드려요. 분위기도 아늑해서 친구랑 가도 좋고, 데이트하기에도 완전 제격이었습니다. 다음에 또 가고 싶은 곳이에요. 💛"
9.13.토,어제 인스타에서 보고 찾아왔는데 딱 애매하게 12시에 온 바람에 웨이팅이 좀 있었지만 후회없는 선택이었습니다. 음식이 한번에 나왔더라면 다 맛있게 먹었을텐데 배가 빨리 차버리는바람에 나온 음식 순서대로 맛있었던것 같아요. 재방문의사 있습니다.
10.6.월,좋아요 오픈하자마자 왔는데 짱좋; 좋네요 진짜 일단 레드와인 베이스 소스랑 고기의 부드러움이 찰떡이에요...+감ㅈ자치즈가 잘 덮는 느낌 뇨끼는 첨먹어봐서 잘모르겠는데 맛있다 는 확실히 알겤ㅅ어여!
9.23.화,예전에 와보고 싶어서 저장해놨던 곳인데 예약없이 바로 들어와서 주문하고 먹을 수 있었어요! 음식도 빠르게 나오고 파스타는 약간 매콤하고 스테이크는 부드럽고 치즈랑 잘 어울렸어요! 소스도 포도주스 느낌의 소스였어요! 잘 어울리면서 맛있었어요! 뇨끼랑 가지튀김도 맛있게 잘 먹었습니다~
10.6.월,"대파크림옥수수뇨끼랑 연어스테이크 파스타를 시켜먹었는데 너무 맛있게 잘먹습니다🥰 뇨끼는 감자맛이 잘느껴졌고 , 파스타는 연어스테이크 와 소스가 잘어울렸어요 근데 저희 언니 입에는 조금 매웠다고 하더라고요 다음에 또 방문할게요!><"
9.24.수,"매번 인스타에 보다가 드디어 와봤어요ㅎㅎ 스테이크와 뇨끼를 먹었는데, 담백하고 진짜 맛있어요 성수파스타나 성수 양식을 찾는 분들 꼭 와보세요 분위기도 좋고 직원분들도 친절하셔서 식사하기 너무 좋았어요 다음에 데이트하러 또 올게요ㅎㅎ"
9.27.토,성수동 맛집 찾아보다가 오게 된 곳인데 일단 외관 인테리어부터 너무 예뻤어요 이렇게 예쁜곳은 맛은 기대를 안하는 편인데 음식이 너무 맛있어서 같이간 친구랑 되게 놀랐어용ㅇ..!! 추천드리는 메뉴는 연어스테이크 파스타입니다!!
10.12.일,"인스타에서보고 스테이크가 너무 맛있어보여서 언젠가 한번은 가봐야지 했는데 오늘다녀왔어요~~! 계획없이 급하게 생각나서 온거라(주말 일요일) 예약은 따로 안햇구요~~현장웨이팅걸어놓고 30분 이내로 들어온거같아요~~ 특별하게 데이트하거나 분위기있고 예쁘게 나한테 맛있는 음식을 대접해주고싶을때 오기 좋습니다 주말에 방문해서 만석이라 조용한 분위기는 아닌점 참고해주세요 브리비트스테이크, 포르치니뇨끼, 베이컨크림파스타 먹었는데 스테이크에 올라간 치즈 짭짤하니 맛있구요 뇨끼 쫀득쫀득하니 맛있구요 파스타 무난무난했습니다! 직원분들도 친절했어요! #성수파스타 #성수양식 #성수동데이트"
10.11.토,인스타에서 보고 궁금해서 방문했는데 완전 성공이에요😋 비주얼도 맛도 완벽하고 양도 푸짐해서 만족했어요! 친절함까지 더해져 기분 좋은 식사 시간이었어요💛 다음에 서울 오면 꼭 다시 방문하고 싶어요!ㅎㅎ
10.17.금,"#성수파스타 #성수양식 #성수동데이트  뇨끼, 오일파스타, 스테이크 시켰어요! 치즈는 눈앞에서 직접 올려주셔서 영상 찍기 딱 좋아요 뇨끼가 담백하고 오일파스타는 적당히 매콤해서 느끼하지 않았어요. 종을 울려서 주문하는 것도 소소한 재미였습니다 성수동 데이트 코스로 추천해요!"
9.4.목,"먹보의 알고리즘은 늘 신상 맛집으로 넘쳐나는데, 이번엔 성수의 비주얼 맛집 브리비트에 다녀왔습니다. 모임 장소로 추천했는데 다행히 웨이팅 없이 바로 입장 성공! 음료부터 기대 이상이었고, 메뉴는 고민 없이 풀코스로 주문했어요. 겉바속촉 식감이 매력적인 대파크림옥수수뇨끼는 대파크림과 옥수수를 듬뿍 떠서 먹어야 진가가 발휘되고, 치폴레 가지튀김은 매콤 바삭 조합에 말모! 봉골레 파스타는 큼직한 조개와 짭조름한 간이 완벽했고, 메인인 스테이크는 수비드 부채살 위 치즈 폭포가 압도적 비주얼이자 완맛! 그릴드 채소와 통마늘까지 곁들여져 완성도가 높았어요. 성수에서 확실히 만족스러운 한 끼 원하신다면 브리비트 강력 추천합니다!"
8.20.수,11시에 도착해서 가게 문 앞에서 11시30분되기전까지 기다렸어요... ㅜㅜ 동네 언니들이랑 남양주에서 차 끌고 왔네요~ 이곳은 주차할곳이 없어서 근처 공영주차장에 주차하고 왔어요~ 12시도 되기전에 만석이 되었어요~~~ 근데 음식이 다 맛있어요~~~ 또 오고싶은 곳이예요~~~~
10.9.목,"오랜만에 성수에 와서 식사를 어떻게 할 지 고민했었는데 브리비트라는 좋은 곳을 알게되어 예약해서 찾아왔어요! 직원들이 안내도 친절하게 해주시고, 예약자 좌석도 따로 세팅된 점이 좋았고요. 음식들도 비주얼만 이쁜게 아니라 맛도 좋아서 완전 추천해요!! 추천합니다!"
9.7.일,"맛있다는 추천을 받아 와봤는데요! 연어파스타,봉골레,대파 옥수수뇨끼 주문했어요 다 너무너무 맛있고 예쁘게 나와서 사진찍기에도 좋은 것 같아요! 특히 연어파스타 너무 맛있게 잘먹었습니다!! 성수 오시는 분들은 여기 추천!"
10.7.화,"추석 연휴에 친구와 함께 브리비트 성수 방문했습니다! 오니까 데이트 코스로 딱인 것 같더라구요 ㅎㅎ 물론 친구랑 와도 손색없지만! 음식도 맛있고, 딱 양식의 정석이랄까? 다음에는 연어 파스타도 먹어보려고 합니다!"
8.22.금,"세트메뉴로 스테이크, 연어파스타, 가지튀김이랑 하이볼, 쥬스를 주문했어요. 스테이크는 질기지 않고 와인소스가 자극적이지 않아 잘 어울렸어요~ 연어 파스타는 겉은 바삭하고 속은 촉촉한 연어 스테이크 올라가 있는데 화이트라구 소스랑 잘 어울렸어요 가지튀김도 치폴레 소스랑 먹으니 너무 맛있었는데 다음에 또 가고싶은 맛이었어요~ ㅎㅎ 그때는 뇨끼도 먹어봐야겠어요^^"
9.29.월,"지방 사람이어서 남편이랑 오랜만에 연가를 쓰고 평일 데이트로 왔는데 평일이라 대기 없이 먹을 수 있었습니다!ㅎㅎ 인테리어도 너무 귀엽고 아기자기하고, 음식은 대표 메뉴 3가지로 시켜봤는데 너무너무 맛있었습니다!♡♡♡ 그리고 매장 직원분도 너무 친절하셔서 기분 좋게 먹고 나왔네요!"
9.12.금,예전부터 와보고 싶었는데 평일 대기가 적길래 방문했습니다~! 뇨끼 맛집이네요!!! 대파크림뇨끼 맛있었습니당 가지튀김도 바삭바삭해서 좋았어요! 매콤봉골레는 진짜 좀 매웠어서 맵찔이는 다른 메뉴를 드시는 게 좋을 것 같아용
9.18.목,오랜만에 성수 나들이 나와서 특별한 음식 먹으러 방문한 브리비트!! 톡톡 터지는 옥수수랑 잘 어울리는 감자뇨끼와 폭포수처럼 쏟아지는 치즈가 가득한 스테이크까지!! 완벽한 성수 데이트 즐기고 갑니다!!
8.31.일,"성수에 볼일 있어서 왔다가 인스타에서 본 맛집이 생각나서 찾아왔어요! 대기 있다는 리뷰 보고 혹시몰라 캐치테이블 보니 2팀 대기 중이어서 바로 대기걸고 갔습니다. 금방 빠졌어요! 시그니처 메뉴 위주로 시켜봤는데 흔한 맛이 아니라 처음에는 오잉 싶었는데 먹을수록 너무 맛있어져서 ,,! 끝까지 너무 맛있게 잘 먹었습니다. 스테이크로 유명한 것 같던데 파스타도 너무 맛있었어요 ㅎㅎ"
10.11.토,성수 맛집 찾다가 오게되었는데 메뉴도 다양하고 음식들이 전부 깔끔하고 맛있었어요!! 재방문 하겠습니당 ㅎㅎ #성수 양식 #성수 파스타
8.17.일,"가게 분위기도 좋고 음식들도 다 맛있게 먹었습니다😊 대파크림옥수수뇨끼는 대파크림과 고소한 옥수수크림의 조화가 신선했고, 새우뇨끼는 꾸덕하니 짭쪼름한 소스가 맛있었어요! 무엇보다 감자가 쫀득쫀득하니 식감이 좋더라구요🙌 연어스테이크파스타는 토마토라구소스와 연어가 잘 어울렸고 살짝 매콤하니 맛났어요! 사이드로 주문한 매콤가지튀김도 튀김이 바삭하고 치폴레 소스에 찍어먹으니 맛있었어요!!"
10.7.화,기대이상으로 맛있었습니다~!ㅎㅎ 스테이크 시키면 그 위에 치즈도 올려주셔서 정말 맛있어요 :) 연어 스테이크 라쿠파스타는 조합이 괜찮을까 했는데 진~짜 맛있어서 강추!
10.18.토,성수파스타 맛집을 찼던 중 발견한 곳인데 기대 이상이었어요! 직원분들도 친절하시구 음식도 빨리 나와서 좋았습니당 재료들도 아낌 없이 주셔서 부족함 없이 맛있게 잘 먹었어요 다음에는 부모님 모시고 오려구요 ㅎㅎ 성수양식집 찾고 계시면 여기 추천해용💕💕
10.12.일,연휴의 마지막날! 맛있는 음식으로 마무리 할수있어서 너무 좋았습니다!! 뇨끼도 맛있었는데요 샐러드 진짜 맛있어요!!! 추천추천! 여자친구 3명이 갔는데요! 다음에 성수 가면 또 오고 싶어요♡
10.11.토,"성수파스타 맛집 브리비트 다녀갑니다,~~🩵 분위기도 넘 좋고 맛있어요! 옥수수뇨끼랑 잠봉리조또 시켰고 둘이 양맞게 먹었어요 추천합니다~~"
10.4.토,성수 파스타집 많은데 여기도 맛집 중에 한 곳이에요 뇨끼도 너무 맛있어요!! ㅇ근데 진짜 맛도리는 가지튀김이니 꼭!! 시켜 드세요!!! 성수 양식집으로 진짜 추천드립니다~~
10.18.토,성수 양식 맛집!! 다녀왔습니다!! 치즈 스테이크 기대했는데 역시 맛있었고 메뉴 구성이 좋고 양도 적당해서 좋은 시간 보냈어요🩶
8.8.금,"뇨끼, 리조또 둘다 너무 맛있게 먹고왔어요! 음식 비주얼도 너무 예쁜데, 맛도 최고였어요. 특히 리조또가 살짝 매콤한게 너무 맛있더라구요.  사이드로 주문한 요크셔푸딩도 뇨끼소스에 찍어먹으니 넘 맛있었어요!  분위기도 좋고, 메뉴도 특색있고 맛있어서 다음에 또 방문하고 싶어요."
8.23.토,"성수 파스타, 성수데이트는 브리비트 성수 하세용~~~💕 뇨끼 진쫘 짱 맛있구 그릭요거트+토마토도 엄청 맛나용!! 매콤한거 좋아한거 조아하는분들은 잠봉매콤 리조또 하세용~~~😆 주말에 맛난거 잘 먹구 갑니다!"
10.19.일,"스테이크도 풍성하고, 음식도 너무 맛있어요 메뉴가 많아서 또 먹으러 올거에요!"
8.14.목,"성수놀러왔다가 뇨끼맛집이라고 해서 들렸는게,,인생뇨끼입니다 옥수수랑 찰떡이구요! 스테이크 위에 치즈올려주시는데 고소해서 존맛탱입니다. 와인베이스에 소스도 진짜 맛있어용 성수데이트맛집 찾으시면 강추입니댜"
9.18.목,"예전부터 가고싶어서 저장만 해두었다가 기념일이라 방문했는데 생각 이상으로 음식이 맛있었어요!! 스테이크가 정말 맛있었고 소스, 치즈 뭐 하나 빠지는거 없이 정말 맛있게 먹었어요 다들 한번씩 드셔보세요!!"
10.4.토,외부 간판에서 1차 설렘 친절함에서 2차 설렘 뇨끼랑 스테이크 먹고 3차 설렘 삼박자 다 갖춘 브리비트 안 올 이유가 없자나!!!!!!! 재방문 의사 10000%🩷🩷🩷🩷🩷🩷
8.19.화,치즈가 폭포처럼 흐르는 브리비트 스테이크가 매력적이었는데 와인 소스와 치즈를 함께 먹기를 추천드려요!! 비주얼이 좋고 안에 채소들이나 빵 등 구성이 다양해서 가성비가 좋게 느껴지는 스테이크였습니다. 뇨끼는 옥수수 대파크림뇨끼를 먹었는데 처음에는 감자튀김거 같은 느낌의 뇨끼인데 시간이 지날수록 북스프처럼 크림을 잘 머금어서 맛있었어요.
9.19.금,두번째 방문이에요!! 성수 올때마다 생각날 것 같은 맛집입니당ㅎㅎ 파스타랑 뇨끼 샐러드 다 맛있고 데이트 하기에도 좋은 것 같아요!!😋✨
10.12.일,칭구랑 성수돌아다니다가 점심 먹으러 분위기좋은곳 찾다가 방문해봤어요 메뉴 하나하나 다 맛있게 잘먹고왓어요
8.31.일,성수 놀러왔는데 맛집 찾아보다가 다른곳이랑 고민하다가 뇨끼랑 파스타보고 여기다 싶어서 왔어요! 다른곳 갔다온다고 예약은 못하고 왔는데 운좋게 빨리들어올 수 있었어요 음식맛은 뇨끼도 맛있고 가지튀김은 소스가 킥입니다👍👍 파스타는 연어파스타 처음 먹어보는데 맛나요 담번에는 스테이크먹어보고 싶어요😆
9.25.목,지인이 먹어보고 맛있다고 추천해줘서 방문했는데 파스타 맛집이에요>< 너무 맛있고 비쥬얼도 이뻐요!! 재방문의사 10000000% 입니당!
9.28.일,처음 와보는데 외관내관 매장 분위기도 예쁘고 음식도 진짜 맛있어서 데이트 장소로 적합한거 같습니다. 진심으로 다음에 또 방문할 정도로 좋아요
9.27.토,"크림 파스타가 진하고 고소해서 정말 맛있었어요. 치즈 스테이크는 부드럽고 소스가 듬뿍, 감튀도 바삭했어요. 청량한 하이볼까지 세트로 완벽한 식사였습니다."
10.21.화,시그니처 메뉴 다 너무 맛있어요!!! 코박고 냠냠냠냠냠 오늘은 지나가다가 운좋게 바로 착석했는데 웨이팅해도 또 올래요!!
8.20.수,성수파스타 성수데이트로 좋은 곳이에요! 인스타에서도 많이 보고 지도에 저장해둔 곳인데 와보니까 너무 좋네요 여자분들이 좋아할 메뉴가 많아서 데이트로 오셔도 좋을 것 같아요! 메뉴 구성도 알차서 좋아요❤️❤️
