date,content
"""음식이 맛있어요""",이 키워드를 선택한 인원
"""양이 많아요""",이 키워드를 선택한 인원
"""재료가 신선해요""",이 키워드를 선택한 인원
"""가성비가 좋아요""",이 키워드를 선택한 인원
"""친절해요""",이 키워드를 선택한 인원
10.17.금,"키오스크로 재료 선택해서 주문하는 방식이구요~매장 안에 주방도 다 보이고, 매장 자체도 아주 청결합니다 ‘ㅅ’ 마라탕집 청결은 늘 포기하곤 하는데 여기는 엄청 깔끔해요! 맛도 매운맛, 얼얼한거 별개로 세분화해서 선택할 수 있게 되어있어서 조아요"
10.8.수,"오랜만에 매장 가서 먹었는데 너무 맛있더라고요😍 배달로 먹어도 맛있지만 역시 바로 나온 꿔바로우는 이길 수 없는 거 같아요ㅎㅎ 가까우신 분들은 방문하셔서 꼭 드셔 보세요!! 매장도 깨끗하고, 빨리 나와서 점심 시간에 가시는 것도 추천드립니다ㅎㅎ 직원분들도 다 엄청 친절하세요💛 날씨가 쌀쌀해져서 저는 더 자주 시켜 먹거나 가서 먹을 거 같네요🥰"
9.22.월,우연히 급하게 마라탕검색해서 들어왔는데 너무너무 맛있게 먹고가요!! 우선 기본마라탕 가성비가 좋고 양이 진짜많아요 !! 재료도 신선해요 💖 꿔바로우는 시그니쳐루 추천해요!!!
9.14.일,샹츠마라가 마라탕중에서 젤 맛있어요!!! 다른곳에 사는 친구들도 데리고와서 먹었어용 특히 꿔바로우가 진짜 존맛탱 추천합니다
10.21.화,여친이 마라탕 먹자고 해서 왔는데 맛있어요. 남성 분들도 여자친구랑 여기 오세요 굿굿띠임 우라 입맛에도 맞음요! 굳굳 맛있고 매장이 청결해요
9.14.일,제가 가장 좋아하는 마라탕집인 샹츠마라에 오랜만에 방문했어요! 골라담지 않아도 9900원에 여러 재료들이 담긴 마라탕 을 주문할 수 있는데 맛도 끝내줍니당 ㅜㅜ... 솔직히 요정도 가격에 맛까지 있는 마라탕 정말 찾기 쉽지않은데 집만 가까웠으면 맨날 왔을거에요.. 두 분이서 오시면 꼭 꿔바로우까지 같이 드세요!! 마라탕 뿐만 아니라 마라샹궈도 진짜 맛납니당
10.9.목,연휴에 명절음식을 먹다 보니 얼큰한게 땡겨서 샹츠마라 와서 맛있게 먹고 갑니다💛
10.16.목,1인용 마라탕인데 엄청 푸짐하고 꿔바로우 세트까지 하니까 진짜 양많구 맛있어용!!
9.28.일,푸짐한 마라탕 사진 가성비 쵝오 입니다.
9.26.금,너무너무 맛있어요!!! 특히 여기는 꿔바로우가 존맛탱 약간 칠리새우 맛나요!! 친구와 함께 오기 좋습니다 추천합니다
9.10.수,항상 와서 먹는곳이예요 마라탕 마라샹궈 꿔바로우 모두모두 맛있어요~
8.19.화,오랜만에 마라가 땡겨서 방문했어요 처음와보는데 마라향 가득하고 새우도 너무 맛있어요 추천입니다!
8.21.목,가성비 짱!!!! 진짜 맛있다!!! 뷰도 예뻐요 추천~~
9.13.토,마라샹궈 배달로 먹고 너무 맛있어서 마라탕도 먹어봤어요 재료가 정해져 있는 기본 구성으로 시키면 가성비가 좋은 것 같아요! 샹궈도 마라탕도 너무 맛있어요!!
9.6.토,매장 직원분들 너무 친절하시고 원래 먹던 지점보다 300원씩 비싸서 고민했는데 양이 정말 많아요! 잘 먹었습니다 :)
9.28.일,"리뷰 좋아서 처음 와봤는데 맵기 정도, 양 모두 대 만족입니다 마라탕은 앞으로 여기 정착할게요"
8.20.수,새우 식감이 살아있아요 마라샹궈 양 많고 입에 착 붙어요!
10.1.수,"마라탕, 꿔바로우 맛나요!!"
7.20.일,마라샹궈 넘 맛있구요! 꿔바로우도 바삭바삭 새콤달콤 잘먹었습니당😊
7.13.일,오랜만에 왔는데 한결같이 맛있는곳이에요~^^ 꿔바로우+마라탕 조합이 최고에요!
8.3.일,너무 맛 최고! 사장님도 친절하시고요! 매장도 깨끗하고! 소스 만들어 먹을 수 있는 존 있으면 좋겠어요! 없어도 좋아요!
8.6.수,왕십리 맛집 친구와 같이 마라탕 먹기 좋아요!! 양도 많고 맛있습니다 추천해용
7.27.일,샹궈 땡겨서 먹으러왔어요~ 오늘도 맛있어요😍
9.28.일,또 왔어요 샹츠마라@ 최고입니당
7.9.수,회사근처 자주 오는 마라맛집이에요❤️ 마라탕 마라샹궈 엄청 좋아하고 자주 먹는데 샹츠마라가 제일 맛있어요! 샹츠마라도 여러 지점 먹어봤는데 그 중에서도 왕십리점이 제일 맛있어요!!!!!
9.24.수,너무 맛있어요~~~ 왕십리에서 마라탕은 여기만 와서 먹어용
7.19.토,왕십리오면 꼭 먹고 갑니다 ㅎㅎ
8.10.일,올 때마다 맛있게 먹고있어요. 오늘도 잘 먹고갑니다
7.21.월,매일 배달로만 시켜먹었는데 매장 가서 먹으니까 더 맛있어요!! 로제마라샹궈랑 깐풍통새우 진짜 조합 미쳤어요🥹🥹👍
7.8.화,제가 가본 마라탕&샹궈집중에 가장 맛있어요~! 양도 다른 곳보다 많은 것 같고 직원분들도 친절하세요 !! 왕십리 마라탕 요기 강추입니당~~~~
6.17.화,양도 많고 키오스크로 주문하는 방식이라 아주 편해요!! 다음에도 왕십리 오면 마라집은 여기로 고정!
7.17.목,마라탕이랑 꿔바로우 맛있어요 !
8.3.일,셀프가 아니라서 편하게 메뉴 선택하고 바로 먹는게 좋아요
6.22.일,"처음 방문했는데 너무 맛있었어요! 재료도 신선하고, 육수가 깊고 진해서 자꾸 생각나는 맛이에요. 매운 정도도 조절 가능해서 누구나 즐길 수 있을 것 같아요. 다음에 또 올게요!"
7.27.일,로제 시켰는데 맛있어요! 재료도 많이 들어있고 너무 맵지도 않고 딱 좋아요!
7.5.토,"매장도 청결하고, 직원도 친절하고, 짱맛탱이예요!"
7.6.일,"로제 마라샹궈가 맛있는 집, 살짝 매콤하고 부드러운 맛의 조화가 끝내줘요!"
6.20.금,매장도 넓어서 널널하고 음식도 맛있어요 :)
8.12.화,맛있고 직원분 친절하셔요~
4.1.화,친구들이랑 방문했는데 정말 맛있었어요☺️☺️ 마라탕 양도 정말 많고 꿔바로우도 쫄깃하고 바삭해서 맛있었어요!! 매장도 깔끔하고 자리도 넓어서 좋았습니다! 다음에 또 방문할게요:)
5.18.일,"계란볶음밥, 깐풍꿔바로우, 마라탕 다 너무 맛있어요!!!!! 양도 진짜진짜 많아요~~~ 깐풍꿔바로우가 킥입니다"
9.9.화,반응 남기기 방문일 9.9.화 2025년 9월 9일 화요일 1번째 방문 인증 수단 영수증
6.9.월,맛있게 먹구갑니다! 역시 샹츠마라!
9.7.일,반응 남기기 방문일 9.7.일 2025년 9월 7일 일요일 1번째 방문 인증 수단 영수증
7.17.목,대기 없이 바로 입장했고 음식이 너무 맛있었어요! 맛집입니다~!
5.20.화,두번째 오는건데 다른집에 비해 맛있어요ㅋㅋ 더 자주오고싶어져요
8.26.화,반응 남기기 방문일 8.26.화 2025년 8월 26일 화요일 1번째 방문 인증 수단 영수증
6.8.일,맛있게 먹었습니당 여기가 젤 맛있어오
7.7.월,서브스로 꽃빵도 주셨어요 너무 감동입니다 맛도 물론 엄청나게 맛있어요 또 오고 싶습니다
3.5.수,"N회차 방문입니다. 혼밥하러 오기도 좋습니다! 직원분들도 친절하시고, 무엇보다 맛있어요😋 마라탕 맵기도 적절하고, 땅콩 소스 가득한 맛이 최고예요! 요새 제 최애 마라탕 집이에요😍 꿔바로우도 미니 사이즈 있습니다! 추천👍"
5.14.수,바로 옆집인데 처음와봤어요! 맛있네용 ㅎㅎ 또 방문할게요!!
6.17.화,서비스도 좋고 마라탕 오랜만에 먹어보는데 맛있어요🥹
3.1.토,"예전부터 최애 마라탕집이 여기였는데, 오랜만에 와서 마라샹궈 먹으니 역시나 넘 맛있네용 또 마라탕이랑 샹궈 모두 기본 재료가 구성에 포함되어있는 점이 좋았어요!(고기 포함) 여러명이서 샹궈랑 꿔바로우 시키면 딱입니당 담에 또 올거엥ㅎ ㅎㅎ"
3.9.일,매운맛 4단계로 먹었는데 진짜 마라탕을 먹은 기분이예요! 이거 먹으러 왕십리에 다시 오고싶을만큼 맛있습니다... 강추!!
5.20.화,마라는 샹츠마라. 여전한 마라탕. 마라탕은 굿
6.12.목,항상 직원들과 맛있는 마라탕을 먹고 싶으면 찾아오는 것입니다!! 양도 푸짐하고 재료들도 신선합니다! 사장님이 서비스로 주신 연유빵도 너무 맛있었습니다☺️
4.28.월,친구가 놀러와서 데려왔는데 맛있다고하네요💛 역시 추천할 만한 마라맛집이에요~ 오늘도 잘 먹었습니다!
5.6.화,여자친구랑 맛있게 먹었습니다:)
2.24.월,오랫만에 들렸네요. 늘 좋은 맛집 감사합니다
5.24.토,맛있어서 배달로도 많이 시켜먹다가 매장 와서 먹어요 넘 맛있어요!
7.5.토,분위기가 좋고 음식이 맛있어요!
9.24.수,반응 남기기 방문일 9.24.수 2025년 9월 24일 수요일 1번째 방문 인증 수단 영수증
5.10.토,로제 마라샹궈 먹으러 왔어요!! 맛있어요!
3.29.토,쌀쌀한 날씨에는 따뜻한 마리탕 한그릇 양도 푸짐하고 좋아요.
4.23.수,너무 맛있네요 자주올게요
6.27.금,왕십리에서는 샹츠마라가 마라탕은 최고로 맛나요
4.20.일,마라탕 너무 맛있습니다 😊😊 음식도 빠르게 나왔고 만족합니다!
4.5.토,마라맛이 강하지 맛있어요..깔끔 하고 친절합니다
4.26.토,가성비있게 맛있게 먹었어요! 매장 내부도 쾌적해서 좋았습니다.
4.12.토,비오는 날에도 맛집 투어 ㄱㄱ
4.16.수,맛있어요!! 매장도 깔끔하니 조아용
4.19.토,진짜 깔끔하게 딱 맛있어요!
5.9.금,반응 남기기 방문일 5.9.금 2025년 5월 9일 금요일 3번째 방문 인증 수단 영수증
4.1.화,꿔비로우가 맛있어요! 마라탕도 맛있어요~ 양이 많아요
5.27.화,반응 남기기 방문일 5.27.화 2025년 5월 27일 화요일 4번째 방문 인증 수단 영수증
3.22.토,옥수수면 하나도 안불고 너무 잘 익었어요.. 소스 맛도 좋고 완전 맛있어요 꼭 또 오고 싶어용!!
24.10.24.목,마라탕과 마라샹궈를 매콤얼얼 맛으로 시켰고 평소에는 항상 저희가 원하는 재료를 골라 담곤 했는데 여기 기본으로 담긴 메뉴를 처음으로 시켜봤어요!! 짱맛있네용  꽃빵 쿠폰도 야뮤지게 받아서 받았답니다 ㅎㅎ 양이 진짜 푸짐하구요! 매장에는 사람이 많진 않은데 배달이 끊이지 않더라구요.. 여기 맛집 맞네용!!!! 그리고 직원분들도 친절하세요!!! 재방문 예약이용
3.16.일,N번째 방문!!!! 동네 마라탕은 샹츠에서만 먹어요!! 맵찔이는 아니지만 2단계가 적당한 매운맛이라 늘 2단계로 먹습니당~!
4.29.화,반응 남기기 방문일 4.29.화 2025년 4월 29일 화요일 2번째 방문 인증 수단 영수증
3.11.화,얼큰하고 맛있는 마라탕
5.4.일,처음에 영수증이 잘 안나와서 말씀 드렸는데 친절하게 너무 잘 해주셨어요!!!
3.28.금,4단계 진짜 얼얼하니 맛있어요ㅎㅎ
2.3.월,마라탕이나 꿔바로우 먹고 싶을때 먹으면 맛있어요~
3.23.일,음식이 친절하고 사장님이 맛있어요
24.12.16.월,로제마라샹궈 너무 좋아하는데 정말 맛있습니다😍 꿔바로우는 꼭 시키세요!! 바삭 쫄깃하니 최고에요ㅎㅎ
4.5.토,매장에서도 자주 먹고 배달로도 자주 시켜먹는데 항상 맛있고 양도 많아요! 청결해서 더더욱 좋습니다👍
24.12.1.일,취향마다 다르지만 저는 마라탕에 재료 고르는게 너무 귀찮을 때 있어서 자주 방문하는 곳이에요😉👏🏻맛은 당연히 맛있고 가성비도 좋아서 양도 푸짐합니다!!! 배달로 많이 주문하는데 매장식사 할때 식당자리도 편하게 먹고 가기 좋습니당✨️혼밥도 쌉가눙!!!
2.5.수,왕십리역 근처 마라탕 맛집. 생각날때 추천
6.10.화,반응 남기기 방문일 6.10.화 2025년 6월 10일 화요일 1번째 방문 인증 수단 영수증
24.12.29.일,오늘도 왕십리 샹츠마라 입장~~!! 언제나 방문하면 맛있는 맛집
1.20.월,마라탕은 여기서만 머거여ㅋㅋㅋㅋ 진짜 양도 많고 맛있어요!
1.15.수,적당히 얼얼하고 맛있는 마라샹궈 잘 먹고가요~ 매장 넓고 조아요 ㅎㅎ
24.12.18.수,다양한 메뉴와 매콤하게 먹을수 있어서 좋아요
24.11.19.화,마라샹궈랑 꿔바로우 먹으러 왔어요 마라샹궈는 늘 이곳에서만 먹는 느낌이에요 맛있어요👍
1.23.목,언제나 마라탕 샹 츠 마라
4.15.화,반응 남기기 방문일 4.15.화 2025년 4월 15일 화요일 1번째 방문 인증 수단 영수증
24.11.20.수,짱맛있고 양많아요ㅠㅠㅠㅠ 샹츠마라는 사랑입니당♥
24.12.7.토,왕십리 마라탕 쵝고 맛집~ 한번오면 다른 가게 못가는 마법이 일어납니다 ㅎㅎ
24.9.20.금,"진짜 제가 먹었던 꿔바로우집 원탑이에요🫶🫶 여자친구랑 비오는 날에 생각나서 왔는데 마라탕 양도 진짜 많고 너무 맛있구요, 꿔바로우가 진짜 쫀득하고, 튀김옷도 얇고 바삭해요. 인기있는 집인 이유가 있네요. 마라탕 생각나면 들르세요. 강추드립니다👍"
24.11.30.토,언제 먹어도 항상 맛있네요 왕십리 근처 마라탕은 무조건 샹츠마라입니다.
24.12.20.금,너무너무너무맛있어용 키오스크로 재료선택하니까 편해요
24.10.9.수,처음에 배달의민족으로 처음 접하게 되었어요 그때도 너무 너무 맛있어서 오프라인으로 방문하게 되었어요 오늘 마라탕을 시켰는데 볶음밥도 너무 너무 맛있고 마라탕 마라샹 거 다 너무 너무 맛있어요 왕십리 의 최고의 마라 집이에요 완전 중국 찐맛집❤❤❤
1.5.일,"진짜 .. 왕십리 주민인데 마라탕은 샹츠마라입니다. 양도 많고 야채도 신선하고, 믿을 수 있는 거의 유일한 집 🥹🥹 특히 꿔바로우 꼭 드셔보세요 !!!!!"
1.10.금,늘 잘 먹고 갑니다 감사합니다~~
24.12.20.금,샹츠마라만 n번째 포장해서 먹어요 :) 특히 마라샹궈가 맛있답니다.. 매운맛 4단계 딱 좋게 매워요! 샹츠마라에서 마라샹궈에 미니꿔바로우 추천합니다 !
24.9.13.금,"우연히 배달로 맛보고 만족스러워 방문해봄 역시👍 맛은 기본, 직원분들 일하는 분위기도 좋고, 서비스까지 너무 감사합니다🤗"
24.9.23.월,저는 4단계에 소고기 추가해서 먹었는데 얼얼하게 매콤하니 양도 생각보다 많아서 배부르게 먹고 왔습니다! 이 근처 먹어본 마라탕 집 중에서는 제일 맛있었습니다 근처사시는분들은 방문 추천드립니다 😋
24.12.29.일,너무 맛있어용 채소가 신선해요 고기가 담백해요!!
24.10.24.목,마라샹궈가 매콤하고 소스가 맛있어요 재료가 다양하게 푸짐히 들어가있어서 배부르게 먹었습니다 !! 매장도 깨끗하고 좋아요
24.11.5.화,매주 오지만 항상 맛있네요 다음에도 또 올게요!
24.12.6.금,완전 맛있고 양도 많아요!
24.12.11.수,맛있어서 마라탕 먹고 싶을 때 자주 방문하고 있어요!
24.12.12.목,매장에서 먹었는데 넘 맛있었어요ㅠ 찐마라샹궈 맛집이네요ㅠ 다음에 또 올게요ㅠㅠ🔥
24.10.24.목,로제샹궈+꿔바로우 꿀조합 완전 맛있어요💛 오늘도 맛있게 잘 먹었어요 ~^^
3.2.일,반응 남기기 방문일 3.2.일 2025년 3월 2일 일요일 1번째 방문 인증 수단 영수증
1.19.일,추운날 잘 먹고 갑니다!
24.12.21.토,반응 남기기 방문일 24.12.21.토 2024년 12월 21일 토요일 4번째 방문 인증 수단 영수증
24.11.15.금,집앞에 있어서 한번 가봤는데 그뒤로 맨날가요 ㅋㅋㅋㅋㅋ 샹츠마라 마라샹궈만한 곳 없습니다 무조건 매운맛 4단계 강추!
24.10.10.목,여기 가성비 짱이에요! 메뉴를 직접담지않아도 돼서 편해요 맛은 당연히 좋습니다!
1.4.토,음식 맛있고 청결함
24.11.11.월,마라탕 기본에 고기가 있어요!! 마싯어용
24.10.16.수,어디서도 먹어본적없는 이런 맛 정말 맛있어서 왕십리올때면 맨날 점심은 여기서 먹어요 직원분들도 넘 친절 !!!!!
24.10.18.금,마라탕 먹고 싶을때 다양한 야채와 같이 먹기 좋아요
1.4.토,맛있게 먹고 갑니다!
24.10.15.화,항상 맛있게 먹고 만족한 마음으로 쓰는 진심 리뷰 후기 맛집 추천
24.10.15.화,맛있어서 일주일에 한번씩은 오네요 왕십리 마라탕집으로 강추드립니다!
24.11.22.금,샹츠마라 재료도 신선하고 매장도 깔끔하고 혼밥하기 좋아요!
24.12.27.금,늘 잘 먹고 갑니다~
24.9.15.일,명절연휴에도 샹츠마라탕은 멈출 수 없는맛..💛 최애 마라탕 오늘도 맛있게 잘 먹었습니다:-)
24.11.18.월,자주오는데 진짜 맛있고 최고에요 !!! 양도 많아요 !!!
24.10.4.금,마라탕 먹고 싶을때 포장해서 먹기 좋아요
24.9.27.금,마라탕 먹고 싶을때 다양한 재료로 먹을수 있어서 좋아요
24.9.23.월,마라탕 먹고 싶을때 특별한 별미로 먹을수 있어서 😀좋아요
24.12.15.일,맛있어요!! 항상 여기서만 먹는듯 ㅎㅎ
24.6.9.일,진짜 미친것 같아요....어쩜 먹을 때마다 이렇게 레전드🤤🤤 마라로제는 못 먹어서 아쉬웠지만 그래도 너무너무 맛있게 잘 먹었습니다!! 저는 쫄~깃한 꿔바로우 좋아하는데 다른 어디보다도 샹츠마라가 최고입니다!! 이벤트 쿠폰으로 꽃빵튀김 먹었는데 먹자마자 감동받았어요...제 어휘력이 부족해서 맛있다는 말 외에 표현을 못하는게 아쉬울 따름입니다..ㅜㅜ 수험생활하면서 살짝 지쳐있던 제게 하루의 행복을 선사해주셔서 감사합니다 😽😽
24.9.4.수,특별한 메뉴가 있어서 매콤하니 먹기 좋아요
24.12.1.일,양이 엄청 많고 맛있어요
24.10.29.화,편하게 먹기 좋아용 굿굿
24.8.27.화,먹던 거라 양 별로 없어보이는데 양 겁나 많구 맛있어욥 꽂빵?도 서비스로 주셧어요 감사해요❤️🧡💛💚🩵💙💜 다음에 또 올게요 체고^^🥰🥰
24.7.12.금,매장방문해서 먹었는데 재료 직접 고르는 시스템은 아니고 키오스크에서 주문 가능해요! 별로 안담앗다고 생각했는데 양 진짜 너무 많아서 배 터지게 먹었네요. 볶음밥도 시킬까 고민했는데 시켰으면 그대로 집에 가져갔을듯^^; 매운맛은 2단계했는데 생각보다 순해서 조금 더 맵게해도됐을듯합니다. 꿔바로우도 맛있어요👍🏻
24.10.20.일,마라탕 맛있게 먹었습니다~~ 추천해요!
24.10.20.일,오늘도 친구들과 맛있는음식 함께먹고 즐거웠습니다. 담에는 꿔바로우도 먹어보려고요
24.9.1.일,배달도 시켜먹고 가끔씩 매장에서 먹어요 너무 맛있어요.. 처음보다 꿔바로우 두께가 얇아진것 같아서 좀 아쉬워요ㅜ 그래도 제 최애 음식점입니다.^^
24.8.22.목,늘 잘 먹는 마라탕. 더 고소해도 좋아요😄
24.8.3.토,이번이 두번째 방문인데 맛잇고 양도 많아서 조아요~ 단골될듯
24.8.30.금,가성비 양도 푸짐하고 맛있어요. 너무 만족해서 항상 리뷰 쓰고 있습니다.
24.10.25.금,반응 남기기 방문일 24.10.25.금 2024년 10월 25일 금요일 3번째 방문 인증 수단 영수증
24.7.13.토,마라샹궈 먹으러 한번씩 가는 곳 맵기를 세세하게 고를 수 있어서 좋아요 2단계 정도가 적당할듯
24.11.17.일,늘 잘 먹고 있습니다!!
24.9.26.목,음식 너무 맛있고 리뷰이벤트 및 쿠폰 이벤트도 있어서 좋습니다~~~
24.6.29.토,비오는날 마라탕이 땡겨서 샹츠마라 방문했어요~^^  로제샹궈랑 마라탕 두가지다 너무 맛있어요~ 오늘도 잘 먹었습니다^^
24.9.28.토,양도 많고 맛있고 직원분들도 친절하셔서 항상 기분 좋게 먹고갑니다!
24.6.19.수,이 가격에 샹궈도 꿔바도 먹을 수 있다니! 매장도 넓고 음식도 맛있고 다음에도 또 올게요 ㅎㅎ
24.10.7.월,너무 맛있어요~~ 마라수혈 하러 왔는데 이때까지 먹어본 마라탕 중 최고!! 담에 또 올게요 번창하세요
24.11.11.월,음식 맛있고 빨리나와용
24.7.16.화,언제나 마라는 여기서.👍🏻👍🏻👍🏻
24.11.1.금,친절하시고 분위기좋고 맛있습니다 2층이고요..홍콩 골목 분위기
24.11.30.토,반응 남기기 방문일 24.11.30.토 2024년 11월 30일 토요일 1번째 방문 인증 수단 영수증
24.9.7.토,양도 푸짐하고 엄청 맛있어요!!
24.3.13.수,"마라샹궈,로제마라샹궈,볶음밥,꿔바로우 시켰습니다!! 기본마라샹궈시켰는데 옥수수면,동두부 제가 좋아하는 재료들 모두 들어가있었고 무엇보다 양이 많아서 좋았어요!! 너무 맛있게 잘먹었습니다😆😆😆"
24.7.29.월,"꿔바로우와 마라탕, 주기적으로 먹어줘도 맛있어요🎀"
24.11.22.금,반응 남기기 방문일 24.11.22.금 2024년 11월 22일 금요일 1번째 방문 인증 수단 영수증
24.8.17.토,너무 맛있어요~ 샹츠마라가 가장 맛있어요옹
24.11.9.토,반응 남기기 방문일 24.11.9.토 2024년 11월 9일 토요일 1번째 방문 인증 수단 영수증
24.9.17.화,반응 남기기 방문일 24.9.17.화 2024년 9월 17일 화요일 1번째 방문 인증 수단 영수증
24.8.11.일,직원분들이 친절하고 푸짐해서 좋았어요!
24.7.3.수,맨날 배달만 시키다가 매장은 처음인데 깔끔해용😀
24.7.20.토,동네에서 유명하다고 해서 와봤어요 로제마라샹궈를 시켰는데 넘맛있어요… 중독성 있는 맛이랍니다
24.7.26.금,기본 마라탕으로 시켰는데 고기도 나오고 양도 엄청 많아요!! 맛있어요!
24.2.28.수,배달로만 자주 먹다가 매장은 처음 와봤어요!! 바로 먹으니 더더 맛있네여ㅎㅎ제가 여기 푸주 먹고 마라탕 먹을때 꼭 푸주 넣는데 이곳만큼이나 푹 익혀서 야들야들 맛있는 곳이 없어요.. 꿔바로우 가격도 저렴한데 맛있어서 항상 추가하게 되네요. 이제 날도 풀리니 매장 자주와서 먹어야겠어요!! 왕십리 마라탕 맛집으로 추천드립니다~
24.6.6.목,항상 맛있게 먹고 있습니다 아이가 좋아해요
24.5.27.월,매장가서 자주먹고 가끔씩 꿔바로우만 포장도해서 먹는데 항상 친절하시구 음료 서비스 주셨어요! 맛있게 잘 먹었습니다🫶🏻
24.6.6.목,요즘 샹츠마라가 뜨길래 궁금해서 먹으러 왔어요 :-) 기본 마라탕에 들어가는 메뉴가 푸짐하고 매장도 쾌적하고 좋아요 ㅎㅎ
24.7.25.목,친구들이 맛있다고 해서 와봤는데 고기도 진짜 많이 주시고 너무 맛있어요!!!!
24.2.9.금,"첫 방문입니다. 재료는 키오스크에서 고르는 방식이에요. 대다수의 마라탕집과는 조금 다른 방식이어서 약간 당황했지만 잘 골랐고요, 고수 이렇게 싱싱한걸 따로 내어주시다니👍  마라탕은 맛이 좋았구요 직원분들 다 친절하시고 밥 먹는 동안 배달 기사님 서른분쯤 다녀가신 것 같아요 배달로도 인기 맛집이다!  맛있게 잘 먹었습니다"
24.5.28.화,인스타보고 너무맛있을거같아서 찾아왔는데 정말 너무맛있고 손님도 많아요 찐맛집이라는거지요~ 또올게요
24.6.2.일,직원분들이 친절하고 마라샹궈도 진짜 맛있어용 1단계 맵찔이에게 매우 적당했어욤ㅎㅎ
24.5.19.일,"마라탕,샹궈 생각날땐 역시 샹츠마라에요..! 골고루 시켜서 오늘도 맛있게 먹었습니다:-)"
24.7.13.토,항상 양&맛&가성비 최고 맛집 입니다. 신메뉴도 많이 생겼으니 먹어보세요
24.2.12.월,"안녕하세요 샹친놈입니다... 샹츠마라에 미친놈😽 따끈한게 땡겨서 마라탕에 밥이랑 꿔바로우에 깐풍새우까지!! 너무 맛있게 잘먹었어요😭😭 깐풍새우는 튼실탱글한게 겉은 바삭하고 양념도 미쳐버려❕❕ 배달로 바쁘실텐데 사장님,직원분들 항상 친절하셔서 좋아요 다음엔 마라로제샹궈 먹으러 오겠슴돠!!"
24.8.11.일,양도 많고 엄청 맛있어요!!
24.5.2.목,음식이 깔끔하고 맛있어요! 다른지점들 보다 맛있어요!
24.5.19.일,오랜만에 들른 마라탕 맛집🍜 여전히 맛있는 맛 여전히 안 오른 가격 👏🏻👏🏻
24.9.4.수,왕십리 마라탕 제일 맛집!!!
24.1.15.월,가성비 최고의 왕십리 마라탕 추천합니다. 샹츠마라 왕십리 직영점입니다. 샹츠마라탕 9.900원으로 모든 재료를 다 넣어 먹어 보실 수 있고 푸짐하고 양 많아서 만원의 행복입니다. 꿔바로우 컷팅되서 나오고 꽂빵 바삭하고 속 부드러워요. 마라탕과 같이 드시면 찰떡입니다~
24.6.2.일,항상오는 왕십리 가성비 맛집입니다. #샹츠마라 #왕십리샹츠마라
24.4.21.일,맛있어서 한달에 한번은 꼭 와요 마라 좋아하시면 꼭 한번 가보세요!
24.7.25.목,맛있게 잘 먹었습니다!!
