date,content
24.1.9.화,마라탕 많이 안먹어본 친구랑 왔는데 너무 맛있게 잘 먹었어요 마라탕 양이 진짜 많아요 가성비 최고임🩷🩷 마라탕이 이상한 냄새 안나고 깔금하니 너무 좋았어요 마라의 얼얼함과 땅콩소스의 고소함은 있으면서 향신료 특유 기분나쁨은 없는 너무너무 맛있은 마라탕입니다❤️ 꿔바로우 미니로 주문했은데 두명이 먹기 알맞은 양이었어요 튀김이 엄청 쫀득쫄깃한게 맛있었고 소스도 새콤달콤 좋았습니다🩵🩵 직원분들도 친절하시고 가게가 깨끗해서 믿고 먹기 좋은곳 같아요 만족하고갑니다💕
24.6.24.월,빨리 나오고 양 정말 많고 맛있어요 또 오고 싶어요
24.6.26.수,맛잇게 매워서 맛잇어요
24.2.4.일,"왕십리역 맛집 마라탕 맛집을 찾으시나요? 기가막히고 코가막힙니다. 마라탕은 역시 샹츠마라~ 마라샹궈랑 마라탕이랑 꿔바로우 먹었는데 모두 맛있었어요. 마라탕의 특유한 향도 좀 적고 한국인한테 딱 맛게 재탄생 시킨 맛이에요. 성동구 맛집, 도선동 맛집, 왕십리 맛집 도장 쾅쾅!! 배달주문 엄청 들어오는거 보면 인정이쥬~bb"
23.12.30.토,"제 인생마라샹궈집입니다,, 첫 방문했는데 너무너무 맛있어서 재방문 + 배달 할 예정이에요ㅠㅠ 요즘 마라샹궈 너무 짜서 먹기가 힘들정도였는데 샹츠마라 마라샹궈는 안짜지만 마라의 풍미가 가득해서 진짜 밥없이 흡입했어요 ㅠㅠ🥹🥹 그리고 ‘한정판 시그니처 매콤 꿔바로우’ 무조건 시키세요 ㅋㅋㅋ 진짜 고급 중국집 뺨쳐요..진짜 맛있으니 꼭 시키세요!!!!!!!"
24.5.27.월,여기 주기적으로 오는 곳이에요! 마라샹궈에 라면사리 필수..너무 맛있어요👍
24.3.25.월,늘 포장만 해서 먹었는데 매장에서 먹으니 더더 맛있네요!! 근처 마라탕집중 제일 맛있는것 같아요👍👍👍 번창하세요! :D
24.3.13.수,말해 모해요 왕십리 마라탕은 여기가 젤젤 맛이썽요 야채 신선라고 양도 많고 최고 다이어트때문에 요즘 못왔지만😢…  다시 먹으니 너무너무 맛있어요!
24.10.15.화,맛있어요! 매장도 깔끔해서 혼밥하기 좋아요
24.1.7.일,"마라탕이 생각나서 들려본 샹츠 마라탕‼️ 마라탕 재료 선택하기 어려운 1인에게 딱 알맞는 마라탕 / 마라샹궈 메뉴가 있었어용🥹🥹 그리고 꿔바로우도 사이즈 별로 다양하고 배달이 아닌 매장 식사 오랜만인데 청결해서 개인적으로 만족 스러웠습니당➰️❤️ 그리고‼️ 여기는 땅콩소스, 마유소스등 기호에 따른 호불호가 있는 소스는 별도 구매를 하셔야해서 키오스크 주문 시 꼭 확인해주세용 안그러면 저처럼 추가 주문하게 됩니당 ㅎㅎㅎ.."
24.6.27.목,반응 남기기 방문일 24.6.27.목 2024년 6월 27일 목요일 6번째 방문 인증 수단 결제내역
24.7.6.토,마라탕집 자주 다니는데 여기가 제일 맛있어요! 다음에도 왕십리오면 찾아올거 같아요:)
