date,content
"""음식이 맛있어요""",이 키워드를 선택한 인원
"""인테리어가 멋져요""",이 키워드를 선택한 인원
"""기본 안주가 좋아요""",이 키워드를 선택한 인원
"""음악이 좋아요""",이 키워드를 선택한 인원
"""대화하기 좋아요""",이 키워드를 선택한 인원
"""단체모임 하기 좋아요""",이 키워드를 선택한 인원
"""술이 다양해요""",이 키워드를 선택한 인원
"""특별한 메뉴가 있어요""",이 키워드를 선택한 인원
"""친절해요""",이 키워드를 선택한 인원
"""가성비가 좋아요""",이 키워드를 선택한 인원
"""매장이 청결해요""",이 키워드를 선택한 인원
"""아늑해요""",이 키워드를 선택한 인원
"""혼술하기 좋아요""",이 키워드를 선택한 인원
"""양이 많아요""",이 키워드를 선택한 인원
"""화장실이 깨끗해요""",이 키워드를 선택한 인원
"""메뉴 구성이 알차요""",이 키워드를 선택한 인원
"""매장이 넓어요""",이 키워드를 선택한 인원
"""음식이 빨리 나와요""",이 키워드를 선택한 인원
"""재료가 신선해요""",이 키워드를 선택한 인원
"""사진이 잘 나와요""",이 키워드를 선택한 인원
"""오래 머무르기 좋아요""",이 키워드를 선택한 인원
7.20.일,"불닭볶음밥 맛집:) 가볍게 한잔 하러 들어갔다가 발견한 맛집 매콤하니 스트레스 풀리는 맛 :) 처음 가본 술집인데 괜히 기분 좋게 마시고 나온 날. 성수에서 너무 과하지 않게, 그렇다고 심심하지도 않게 가볍게 한잔하기 좋은 곳 찾는다면 백포차 한 번쯤 가볼 만해요. 다음엔 친구들이랑 다시 와보고 싶은 곳!"
8.30.토,"친구들과에 2차 모임! 식사를 하고와서 간단히 한잔 더 하기위해 찾은 포차~ 처음 방문하였는데 공간도 넓고, 음식도 깔끔하고 빠르게 나와서 너무 좋은거 같아요! 가볍게 한잔하면서 수다떨기 편하다고 해야할까요! 골뱅이 깐풍기 안주 살짝 매콤하면서 안주로 최고^^"
7.23.수,"성수동에서 단체 회식 장소를 찾고 계시다면, 전통과 맛, 분위기까지~ 두 마리 닭볶음탕과 수제 생맥주가 있는 곳, 회식, 단체모임, 친구들과의 술자리에 안성맞춤"
9.23.화,늦은 시간 대기없이 들어왔어요 골뱅이 달콤하니 넘 맛있습니다~^^ 국수랑 잘 어울려요~~~ 재방문의사 있어요ㅎ
7.17.목,성수술집 친구들이랑 놀기 좋은 술집이에용!! 무엇보다 안주가 진짜 맛있어서 완전 강추드랴옹 성수 카페거리에서도 가까워서 오기 좋아여융
6.28.토,닭도리탕 2마리메뉴라서 배부르고 맛있게 먹을 수 있어서 너무 좋았구 특이하게 위에 토핑으로 어묵과 김말이까지 너무 푸짐하고 좋았고 치킨도 반마리씩도 팔아서 사이드로 또 추가할 수 있어서 좋았구ㅎㅎ 청양마요 소스도 맛있어용 여럿이서 방문하기도 좋은듯
9.12.금,사장님 친절하시고 음식 맛있어요~
9.3.수,성수도 왔다가 2차로 맛집 찾다가 왔어요 골뱅이도 맛있고 소면도 따로 나와서 맘에 들었어요 직원분들도 친절해요~^^
8.12.화,단체 손님 환영하는 집 지하에서 먹었는데 단체 손님들 때문에 많이 시끄러웠음 알바 혼자 서빙하셔 주문하고 음식 나오는 시간이 걸렸음
5.29.목,헛~~회사근처에 이런곳이 있다니요!! 리뷰를 안쓸수가 없네요~~~~ 단체자리 검색하다 예약하고 방문했어요. 일하시는분들 어쩜 이리 친절하십니꽈^^ㅎㅎ 음식들도 맛있고 분위기 너무좋고 세상에나 즐거워도 이렇게 즐거울수가 없네요!!! 너무 반했어요~~ 다음에 친구들모임 예약하겠습니다
7.19.토,기본안주 팝콘 만점. 맥주 시원함 만점. 닭볶음탕 만점.  가게도 시원해서 느좋
8.15.금,치킨이랑 골뱅이 대박이에요 저번에 먹고 완전 단골되서 또 왔어요!! 번창하세요!!
6.14.토,사장님도 너무 친절하시고 서비스도 너무 좋으세요!! 오뎅탕이 너무 맛있어서 다먹고 중간에 찍었네요 🥲 분위기도 넘 좋고 좋은 시간보냇어용!☺️
5.30.금,"음식이 너무 맛있었고, 특히 수제맥주들 종류별로 다 마셔봤는데~ 정말 시원하고 상쾌하고 맛있었어요~!!! 음악도 너무나 좋고, 인테리어도 깔끔하고 단체로 오기에도 넘 좋았어요~!!! 특히 치킨이랑 골뱅이~~~기본으로 정말 맛있어요!! 어묵탕도~~~ ^^ 강추예용! ㅋㅋㅋ"
6.15.일,분위기가 너무 좋고 생맥주가 넘 맛있네요 ㅎㅎ 안주도 맛있는데 너무 허겁지겁먹느라 사진이 없어요🥺🤤 지하도 있어서 더 좋아요!
5.21.수,헐~~~~~ 태성골뱅이 지하에 갬성포차가 생겼네요. 기본팝콘 진짜 이거 대박이네요ㅋㅋ 분위기 너무좋고 가성비좋고 음식맛있는 갬성포차 남친과 즐기기 딱!!!!느무좋앙
8.29.금,골뱅이 진짜 맛있어요!
8.13.수,기본 안주 팝콘도 너무 맛있네요 음식은 물론 완전 잘먹었숩니다! 또 올게요!!
6.28.토,지하에서 편하게 먹을 수 있어서 좋았어오 직원분이 친절하셔서 더 좋았습니다!
8.21.목,너무 맛있게 잘 먹었습니다~
9.23.화,안주 맛있게 먹었어요~~~
7.18.금,너무 맛있게 가성비있게 먹었습니다!! 또 올께요!!!!!!!!!!!!!!!!
9.2.화,역시 술집은 성수동 백포차 양도 많고 맛있는 안주들로 즐거운 시간을 보냈습니다.
6.3.화,"오늘 저녁에 국물 생각이 나서 나가사키짬뽕집에 들렀는데, 와... 국물 맛이 정말 끝내주더군요! 🍜 해산물 우린 국물이 엄청 진하고 깊어서 한 숟가락 떠먹는 순간 속까지 다 따뜻해지는 느낌이었어요. 면발도 탱탱하니 국물이랑 궁합이 완전 찰떡이고요. 해산물이랑 야채도 푸짐하게 올라가 있어서 씹는 재미까지 있었습니다. 매장도 정갈하니 좋고, 알바생들도 친절해서 기분 좋게 먹고 왔네요. 이번주에 친구들한테 추천해서 같이 가보려고 해요!"
6.3.화,"오늘 저녁, 조금 색다른 치킨을 먹고 싶어서 찾은 곳인데, 후라이드 치킨을 냄비에 담아 주시네요! 한입 베어 물자 겉은 바삭하고 속은 정말 촉촉해서 감동이었어요. 특히 달짝지근한 양념 소스가 치킨의 맛을 완벽하게 살려줍니다. 가게 분위기도 아늑해서 친구랑 도란도란 이야기 나누며 먹기 좋았어요. 직원분들도 너무 친절하셔서 기분 좋게 식사했습니다. 날씨 좋은 주말에 다시 방문하고 싶네요. 이번에는 다른 메뉴도 도전해보고 싶습니다! #냄비치킨 #후라이드 #양념소스최고 #숨겨진맛집 #또가고싶어요"
6.21.토,사진을 못찍었어요 ㅜㅜ 후라이드 치킨에 골뱅이 셋트메뉴 시켰어요 다 흡입해버려 겨우겨우 거의 다 먹은 골뱅이 무침 사진만.... 치킨은 레전드에요 ㅎㅎ 음식이 너무 맛있어서 숨은 맛집 찾은거같아요 앞으로 자주 올게요
7.17.목,사장님이랑 직원분 너무 친절하시고 성수동에서 단체모임하기 좋은 장소인거 같아요! 분위기도 좋아요!
7.13.일,편안한 술집입니다 다음에도 또 오고싶어요!!
10.1.수,반응 남기기 방문일 10.1.수 2025년 10월 1일 수요일 1번째 방문 인증 수단 영수증
8.2.토,치킨 맛집이예요 술이 쭉쭉 들어가용
6.18.수,"아니 닭볶음탕 진짜 맛있어요 우동면 추가 필수!!! 사장님, 직원분 다 너무 친절하시구 분위기도 좋아서 성수나 뚝섬 올 일 있으면 여기는 꼭 올 것 같아요 😍"
5.23.금,"회사 벙개로 갈만한 곳 찾다가 찾은 곳! 일단 사장님, 직원분들 너무 친절하시고 센스 넘치십니다. 지하지만 엄청 쾌적하고 깨끗해요. 안주도 다 맛있어요. 테이블 붙일 수 있어서 소모임 장소로 딱인듯. 담엔 전체 회식도 함 건의해볼까 합니다. 먹고 마시고 노느라 사진이 이거밖에 없네요 ㅋㅋ"
6.21.토,"골뱅이집 다녀왔습니다! 일단 대표 메뉴인 골뱅이무침, 기대 이상이었어요. 쫄깃한 골뱅이에 양념이 딱 알맞게 배어 있어서 맥주랑 찰떡궁합. 같이 나온 소면도 간이 잘 되어 있어서 그냥 먹어도 맛있더라고요.  분위기는 전형적인 호프집 스타일인데, 시끌벅적한 게 오히려 정겹고 좋았어요. 단체 모임이나 친구들이랑 가볍게 한잔하기에 딱입니다.  단점이라면 주말엔 웨이팅이 좀 있을 수 있고, 사람이 많으면 살짝 시끄러워요. 하지만 그걸 감안해도 또 가고 싶은 곳입니다."
6.23.월,반응 남기기 방문일 6.23.월 2025년 6월 23일 월요일 1번째 방문 인증 수단 영수증
6.18.수,비오는날 닭볶음탕이랑 어묵탕 시켜서 술이랑 같이 먹었는데 맛있어요 매장도 깨끗하구 다들 친절하세요!!! 다음에 또 올게요💛
8.22.금,반응 남기기 방문일 8.22.금 2025년 8월 22일 금요일 1번째 방문 인증 수단 영수증
8.19.화,반응 남기기 방문일 8.19.화 2025년 8월 19일 화요일 1번째 방문 인증 수단 영수증
6.26.목,닭볶음탕 치킨 골뱅이 모든 메뉴가 다 맛있었고 사장님이 너무 친절하신 곳! 매장도 너무 시원하고 깔끔해서 좋았어요
5.28.수,한강 러닝하고 단체로 마실곳 찾다가 들어갔는데 분위기도 좋고 친절하고 좋네요  음식도 맛있고 다음에 또올게요
4.26.토,술이 다양하고 안주도 맛있어요! 새로 오픈이라 사람이 없었는데 대화하기도 좋고 사장님도 친절하시고 매장 분위기가 좋았어요:)
7.27.일,동호회 단원들과 뒷풀이 왔는데 분위기도 좋고 안주도 맛있어요 다음에 또 올께요^~-
6.24.화,음식도 맛있고 분위기도 좋아요 모임하기 좋습니다
8.2.토,검색해보고 처음왔는데 안주가 기대이상으로 맛있어요👍👍👍
7.8.화,치킨이 너무 맛있어요!!
8.22.금,반응 남기기 방문일 8.22.금 2025년 8월 22일 금요일 1번째 방문 인증 수단 영수증
7.8.화,인생 골뱅이와 치킨이에요 똥집까지 시켰어요 또시킬거에요
6.29.일,반응 남기기 방문일 6.29.일 2025년 6월 29일 일요일 1번째 방문 인증 수단 영수증
6.23.월,안주가 다 맛있네요!또올게요!!
8.22.금,반응 남기기 방문일 8.22.금 2025년 8월 22일 금요일 1번째 방문 인증 수단 영수증
6.15.일,뭘 시키든 맛있어요. 매콤한거 잘하시는거 같아요. 념념굿.
7.9.수,너무 맛있고 좋았어용
6.26.목,너무 맛있어요 ㅎㅎ
7.27.일,반응 남기기 방문일 7.27.일 2025년 7월 27일 일요일 1번째 방문 인증 수단 영수증
7.15.화,반응 남기기 방문일 7.15.화 2025년 7월 15일 화요일 1번째 방문 인증 수단 영수증
8.12.화,반응 남기기 방문일 8.12.화 2025년 8월 12일 화요일 1번째 방문 인증 수단 영수증
7.15.화,반응 남기기 방문일 7.15.화 2025년 7월 15일 화요일 1번째 방문 인증 수단 영수증
8.1.금,반응 남기기 방문일 8.1.금 2025년 8월 1일 금요일 1번째 방문 인증 수단 영수증
5.10.토,반응 남기기 방문일 5.10.토 2025년 5월 10일 토요일 1번째 방문 인증 수단 영수증
5.9.금,반응 남기기 방문일 5.9.금 2025년 5월 9일 금요일 1번째 방문 인증 수단 영수증
