date,content
"""음식이 맛있어요""",이 키워드를 선택한 인원
"""재료가 신선해요""",이 키워드를 선택한 인원
"""친절해요""",이 키워드를 선택한 인원
"""특별한 메뉴가 있어요""",이 키워드를 선택한 인원
"""고기 질이 좋아요""",이 키워드를 선택한 인원
"""반찬이 잘 나와요""",이 키워드를 선택한 인원
"""양이 많아요""",이 키워드를 선택한 인원
"""매장이 넓어요""",이 키워드를 선택한 인원
"""단체모임 하기 좋아요""",이 키워드를 선택한 인원
"""가성비가 좋아요""",이 키워드를 선택한 인원
"""매장이 청결해요""",이 키워드를 선택한 인원
"""메뉴 구성이 알차요""",이 키워드를 선택한 인원
"""건강한 맛이에요""",이 키워드를 선택한 인원
"""아늑해요""",이 키워드를 선택한 인원
"""대화하기 좋아요""",이 키워드를 선택한 인원
"""음식이 빨리 나와요""",이 키워드를 선택한 인원
"""잡내가 적어요""",이 키워드를 선택한 인원
"""차분한 분위기예요""",이 키워드를 선택한 인원
"""직접 잘 구워줘요""",이 키워드를 선택한 인원
"""인테리어가 멋져요""",이 키워드를 선택한 인원
"""비싼 만큼 가치있어요""",이 키워드를 선택한 인원
"""혼밥하기 좋아요""",이 키워드를 선택한 인원
"""주차하기 편해요""",이 키워드를 선택한 인원
"""기본 안주가 좋아요""",이 키워드를 선택한 인원
"""화장실이 깨끗해요""",이 키워드를 선택한 인원
"""컨셉이 독특해요""",이 키워드를 선택한 인원
"""환기가 잘 돼요""",이 키워드를 선택한 인원
"""좌석이 편해요""",이 키워드를 선택한 인원
"""아이와 가기 좋아요""",이 키워드를 선택한 인원
"""샐러드바가 잘 되어있어요""","""샐러드바가 잘 되어있어요"""
9.29.월,아주 그냥 통통부들 생삼겹 그 자체 오랜만에 이런 삼겹 먹어요 로컬 맛집인듯 들어오는 손님마다 다 인사하심 반찬이 존맛인데 그 중 동치미 볶은게 대존맛 이게 진짜 이 집 킥임 담에 또 갈게요 예약했는데 늦어서 죄송해요ㅜㅜ 반갑게 맞이해주셔서 감사합니다 넘 맛있었어요 다음 회식도 여기로.
10.12.일,삼겹살 맛집 찾다가 제가 딱 원하는 느낌이라 방문했는데 !!! 진짜에요 .. 너무 맛있어요 ㅎㅎ 무생채도 특별하고 고기랑 밑반찬들이랑 사이드메뉴까지 맛있어요 그리고 사장님이 정말 정말 친절하세요 ㅋㅋㅋㅋㅎㅎ 잘먹었습니다 또 올게요 !!
10.11.토,"진짜진ㅋ자진짜진짜진짜진짜 맛있어요 단골집인데 이제야 리뷰를 작성하네요! 반찬도맛있구 이가게만의 반찬이있어요! 무 볶아서 고기에 상추싸서드시면 극락갑니다 사장님 적게일하시고 돈 많이버세요 ,,"
10.12.일,고기 두께가 너무 얇지도 두껍지도 않고 넘 맛있고 사장님이 구워주신 첫판도 너무 맛있어요 반찬도 다 직접 만드셔서 무쌈 깻잎쌈도 너무 맛있고 동치미 무침 구이는 완전 킥!! 된장찌개랑 볶음밥까지 넘 좋았습니다. 친절하신 사장님은 덤이예요
10.18.토,"진짜 너무 맛있어요!! 😭 삼겹살 퀄리티도 미쳤고, 직접 만드신 쌈무가 진짜 예술이에요 — 상큼하면서 고기랑 찰떡🥹 사장님도 너무 친절하셔서 기분까지 좋아지는 곳이에요. 이게 우리 동네에 있었으면 진짜 일주일에 한 번씩 갔을 듯…!! 완전 인생 삼겹살집 인정합니다 👍💕"
10.18.토,동치미무 삼겹살 기름에 볶아먹으면 환상이에요 계속 리필해서 먹었습니다.. 김치나 콩나물 등 다른 반찬도 깨끗하고 맛있었어요 볶음밥까지 존맛ㅋㅋ계란후라이까지 올려주심 무조건 재방문 할거에요
10.18.토,여지껏 이런 삼겹살은 없었다!! 언제나 맛있는집!!♡상암에서 왔어요~~ 신나신나 ~~
10.15.수,고기질도 너무좋고 볶음밥이 진짜 맛나요 사장님도 친절하셔서 기분좋게 먹고갑니다!
10.12.일,사장님 너무 친절해요. 올해 본 사장님 중에 최고심. 아 물론 고기는 개존맛탱 최고임.
10.17.금,여자친구때문에 알게 되어서 처음왔는데 너무 맛있네요!! 사장님께서도 너무 친절하시고 맛도 보장된 맛입니다. 다음에 무조건 재방문!!
10.11.토,사장님이 너무 친절하세요 같이 시킨 쌀밥이랑 된찌도 맛있고 안바쁠 때 고기도 꾸워주셔서 더 맛있네요 같이 구워먹는 동치미? 그게 별미에요 ㅎㅎ
8.27.수,"여기 진짜 리뷰 쓰면 유명해질까봐 걱정되는 곳인데 ㅠ ㅠ 사장님의 번창을 위해서 씁니다,, 여기 고기 맛도 맛인데 사장님 때문에 가요 !! 사장님이 넘 친절하시구, 서비스도 주시고 밑반찬도 겁나 맛있어여.. 김치랑 무말랭이? 개 맛도리임"
10.13.월,누무 ㅏㅅ있게 잘 먹았어요 !!!! 엄청 친절하시고 고기도 반찬도 다 맛있아요 다음에 또 올게요
10.12.일,간만에 먹어보는 너무 맛있는 삼겹살 최고
10.19.일,밖에서 삼겹살집 가면 맛있다는 생각 잘 안하는데 여긴 너무너무 맛있었어요!!ㅎㅎ 재방문 의사 200%입니다 ㅎㅎㅎ🥰
10.18.토,다른 말 필요 없어요 … 사쟌님 …. 정말 맛있어요 최고 .. 이거 머그러 성수 왔어요!!!!!!!!!❤️
7.10.목,지나가다가 들렀는데 너무 맛있어요!!! 일부러 나중에 찾아올 것 같은 맛이고 고기 질이 진짜 좋고 맛있어요👍 사장님도 친절하시고 편안합니다! 근데 진짜루 고기 너무 맛있음👍👍👍👍👍👍👍👍
10.18.토,친절하고 고기 질이 좋내요 너무 맛있어요 단순한 구성인데 정성이 느껴져요 또올게요
8.3.일,크으… 역시 인생삼겹맛집 8년째 단골인데 여전히 그 맛 그대로 맛있습니다 … 우리 사장님 최고♥️ 여기 모르는 사람이 바보야잇!!!!
8.28.목,진짜 진짜 진짜 진짜 진짜 진짜 맛있어요 꼭오시고 예약하고 오시면 좋습니당 반찬진짜 핵마싯어용
10.12.일,고기도 너무너무 맛있고 사장님도 친절하시고 반찬도 맛있어요
9.23.화,급하게 먹느니라 고기 사진을 못찍었는데 진짜 너무 맛있었어요.여기 고기 질이 너무 좋고 여기 사이드로 나오는 반찬들 하나하나가 간이 쎄지 않고 너무 맛있더라고요.그리고 여기 사장님이 한가하시면 직접 나와서 구워주시면서 어떻게 먹어야하는지 상세히 설명해주시는데 너무 친절하더라고요.너무 기분좋게 잘 먹었습니다.
10.17.금,반응 남기기 방문일 10.17.금 2025년 10월 17일 금요일 2번째 방문 인증 수단 영수증
9.6.토,"우연히 오게 된 곳인데 단골집 확정 됐어요! 😋 고기는 당연히 맛있고 어디서도 맛보지 못한 유자청에 담군 쌈무랑 무 무침이 고기랑 너무 잘 어울리고 따로 먹어도 맛있어요 볶음밥 안 드시고 가면 후회 합니다 ,,, 꼭 드셔요!"
8.27.수,짱맛 존맛ㅠㅜ 냉면이 메뉴에 없는데 존맛임다 사장님이 엄청 친절하시고 맛조합을 잘 알려주세요
7.10.목,성수 잘 안와서 맛집하나도 모르고 근처 음식점 검색하다가 순전히 고기 때깔이 좋아보여서 왔는데 잭팟 터졌고요?? 최근 몇년간 먹은 삼겹살 중에 제일 맛있었고 된장찌개랑 볶음밥을 꼭 드셔야 합니다 곁들여먹는 깻잎 쌈무 콩나물 다 넘 마싯고.. 이것만 먹으러 성수 다시 올거임
8.25.월,고기가 너무너무 맛있고 같이 구워먹는 무가 너무너무 맛있어요 사장님 너무 친절하시고 꼭 또 다시 올거예요!!
6.27.금,"진짜 넘 맛있어요~!! 삼겹살 집 여러군데 다녀봤는데 고기도 너무 맛있고 김치랑 쌈무, 도라지무침까지 반찬들도 너무 맛있습니다~!~! 킥은 마지막 볶음밥인데 계란후라이까지 진짜 너무 중독성있어요 집에서 멀지만 재방문 의사 완전 있습니다~!!"
6.25.수,옛날 삽겹살이 먹고 싶어서 방문 했는데 너무 제 취향이에요 !! 삼겹살 맛집 아지트 느낌! 어디서도 못먹는 동치미 무채를 불판에 구워먹을 수 있고 모든 재료를 사장님이 직접 만드시는지 특별한 반찬 진짜 많고 다 너무 맛있어요!!!! 고기도 신선하고 너무 강츄함
5.20.화,생삼겹과 대패삼겹살만 파는곳이니만큼 고기가 진짜 신선하고 맛있어요!! 👍 국내산 냉장삼겹에 주문 즉시 썰어서 주십니다!! 밑반찬도 다 너무 맛있고 삼겹살 육즙이 너무 맛있어요 !!! 구워먹는 동치미무도 너무 특이하니 맛있었고 볶음밥은 칵입니다 ! 👍
10.12.일,"고기 너무신선하고 맛있고, 모든 재료랑 야채 너무 맛있습니다… 직접 무랑 깻잎도하시구.. 단골됩니다!"
6.24.화,여라분 일단 생삼겹살 자체도 미치게 맛있지만 복금밥이 진짜 도른도른맨이니까 제발 먹어보삼 ㅠ 치즈도 추가해서 이 계란사랑폭탄볶음밥을 꼭 야무지게 드시길 바랄게요 심지어 모든메뉴가 다맛잇음 막국수도 꼭드세요
10.18.토,사장님도 친절하시구 삼겹살과 곁들여서 먹는 뻔하지않은 특별한음식이 있어서 삼겹살이 더 맛있었습니다 ! 진심 인생 최애 삼겹살집 등극했어요 또 방문 할 예정이에요 감사합니당
10.17.금,고기는 맛있는게 기본!!~~ 밥도 맛있으면 반칙이죠~~^^
10.17.금,반응 남기기 방문일 10.17.금 2025년 10월 17일 금요일 1번째 방문 인증 수단 영수증
7.27.일,성수 최고 삼겹살집!!!🤩 구워먹는 무말랭이랑 사장님이 직접 만드신 쌈무까지 완벽합니다>< 진짜 넘 맛있어요…🥹♥️
8.25.월,고기랑 밑반찬 등등 다 맛나고 사장님께서 매우 친절하십니다!! 동료들이랑 왔는데 맛있고 서비스도 짱짱해요❣️🍀
8.31.일,아진짜너무너무맛있어요!!!!!!!일단 기본 반찬으로 나오는 무쌈이 개맛잇음 ... 기본반찬 맛잇으면 끝인거 다들 아시죠 나 진짜 다음에도 성수 올 일 잇으면 또 여기 올거임 ..... 😭 사장님 다음에 또 뵈어요 💕💕
8.24.일,"너무너무 맛있어요!! 고기는 느끼하지않고 고소하고, 같이 먹을 수 있는 동치미가 진짜 킥입니다..! 단백하고 아삭한 식감까지 추천합니다!!"
5.7.수,말로만듣던 순심이네 첫방문입니다! 질좋은 생삼겹 감동적ㅠㅠ 리뷰에 무를 구워먹는다길래 무슨말이지 싶었는데 동치미 무를 잘라서 같이 구워먹는데 넘 맛있어요🩷 김치볶음밥은 직접 만드신 소스를 넣어서 볶아주심ㅜㅜㅜ 넘 맛있음 배불러도 꼭 드시길!
8.6.수,생삼겹은 너무너무 맛있고 무 볶아서 같이 올려먹으면 환상 완전 하룰라라입니다 마지막으로 볶음밥까지 따악 먹으면 하루가 든든하쥬? 왕추천 성수가면 함번씩 들러보세오
8.7.목,"진짜올때마다 너무 맛있어요 고기는 당연히맛있구 함께 구워먹는 동치미무가 정밀 미쳐쏘용 ,,,, 국수도 양 진짜 많고 모든게 존맛입니당"
5.1.목,"사장님도 너무 친절하시고 삼겹살두 너어어어무 맛있어요 😭 동치미를 구워먹으라고 하셔서 신기했는데, 바짝 구워 먹으니 무생채 곁들여 먹는 것처럼 맛있더라구요 반찬도 하나하나 직접 만드셔서 그런지 기본찬이 진짜 감질맛나던 ,, 로컬맛집 추천합니다 ♥"
10.2.목,성수가 아니라 서울 근처에서 이렇게 맛있는 고깃집 진짜 없습니다 안유명해졌으면 싶을 정도에요
4.28.월,"고기 질도 괜찮고, 잘 구워 주셔서 간만에 맛있는 삼겹살 먹었습니다! 😍 여기에서 나오는 반찬 중 무말랭이가 있는데 이게 진짜 킥 이예요!! 저희 언니가 두그릇이나 더 갖다 먹었어요ㅋㅋㅋ 구워주신 무말랭이도, 안 구운 무말랭이도 다 맛있다네욬ㅋㅋ 쌈무랑 깻잎이랑 마늘 쌈장 같이 먹으면 존맛탱 입니다!! 🌷🌷"
9.25.목,미쳤슴다 개맛있어요 단골각 밑반찬 다맛있어요
5.15.목,고기가 너무 신선하고 맛있어요! 고기 냄새에 예민해서 여지것 족발이나 곱창도 한 번도 안 먹어봤는데 여기 고기는 냄새 하나도 없이 너무 맛있어요! 친절하신 사장님깨서 직접 농사 지으신 상추랑 삶아서 만든 깻잎 짱아찌까지… 정성 가득한 밑반찬이랑 같이 철판에 구워 먹으니 극락입니다..♥️♥️♥️
6.10.화,재방문입니다 사장님 정말 언제와도 친절하시고 고기질은 말할것도 없습니다 사진에서도 느껴지는 미친 지방과 살코기의 비율.. 그리고 여기 반찬중에 동치미 무 말린거를 주시는데 이게 고기기름에 볶아져서 완전 별미에요.. 집앞에 있어서 행복합니다😆
7.3.목,"인생 생삽겹살입니다. 여기때문에 성수로 이사오고 싶어요. 사장님 진짜 정말로 너무 친절하시고 러블리하시고,,,, 문제는 음식 맛도 러블리 그 자체입니다. 왜 여기 웨이팅 안 하는건지,,,,,,,,,,볶음밥까지 꼭 드세요. 진짜진짜로"
8.31.일,이곳 처음 왔는데 고기가 진짜 맛있고 사장님이 고기도 구워주시고 친절합니다 다음에 또 올게욤~~
6.10.화,너무너무 애정하는 곳~~ 오고싶어서 기회보다가 왔숩니당~ 역시 국수도 맛나~~~ 특히 무말랭이 구워 먹어야 합니당 그리고 마지막으로 볶음밥~
10.20.월,너무 많이는 오지마세여 저 먹어야댐ㅋ
10.17.금,고기 자체가 너무좋아요 볶음밥은 꼭 드셔보세요! 사장님 너무 친절쓰~
6.23.월,"너무너무 친절하시고 무무침, 깻잎, 무쌈까지 다 정말 맛있어요! 주차장도 가깝고 다음에 또 올라구요♥️♥️"
7.12.토,고기 너무 맛있고 사장님도 너무너무너무 친절해요🩷
6.8.일,생삼겹이라 진짜 맛있어요. 그리고 반찬도 사장님이 직접하신거라 더 맛있네요
7.3.목,아 진짜 진심 너무 맛있습니다 역대급으로 진짜 맛있고 제가 목살만 먹고 삼겹살 잘 안먹는데 하 인생 삼겹살 만났어요 ㅠㅠㅠㅠㅠ 같이 굽는 저 동치미 무 하….유명해지지 않았으면 좋겠기도 해요…. 사장님 작게 일하시고 많이 버시길 너어무 친절하십니다 ♥️
5.24.토,일단 고기가 너무 싱싱해요. 같이 나오는 나물 바삭하게 구워서 고기랑 같이 먹으면 미쳤어요. 기본 반찬 깻잎도 양념 적당히 잘 되어 있어서 고기랑 먹으면 꿀맛 마지막 볶음밥까지 진짜 최고입니다
7.17.목,너무너무 맛있었습니당.. 일찍 갔더니 거의 삼겹살 오마카세마냥 구워주심.. 김치 너무 맛있어여......
7.13.일,고기가 너어무 맛있고 밑반찬도 다 맛있어요 사장님도 유쾌하시구 추천합니다 👍👍👍
5.16.금,"사장님 손맛으로 하나하나 만드신 반찬이며, 생삼겹이라 더 맛있는 맛집! 김치에 무나물 무침까지 구워 쌈싸먹으면 동공 확장 되는 맛임 🤍🤍"
6.16.월,성수동에서 강추하는 삼겹살맛집중 최고👍볶음밥도 꼭드세요!
6.23.월,무김치 굽는게 킥킥킥킥입니다....... 고기 삼겹살인데 부들부들부드럽고 사장님 손맛이 좋으세요 술이 술술이에요
6.24.화,고기 질이 정말 좋아서 엄청 부드럽고 무김치 엄청 맛있어요 그리고 볶음밥이랑 메밀국수 매우 맛있습니다!!
6.9.월,요기 삼겹살 너무 맛있어요! 글고 무 무침 볶아먹는게 킥이에요..♥️ 반찬도 넘 맛있고 찐 동네맛집 ㅎㅎㅎ 성수동 노포 맛집 가고싶으면 여기 무조건 추천!!!!!
6.26.목,앞치마까지 센스~♡매번 고기에 눈이뒤집혀 못찍고 마지막에 볶음밥만찍는 집~~너무맛있는집~
3.22.토,고기랑 밑반찬들이 너무 맛있어요!! 특히 직접 메뉴 개발하셨다는 동치미를 같이 구워주셨는데 와.. 이게 진짜 간판메뉴로 내놔도 될만큼 맛있어요ㅋㅋㅋㅋㅋ 비트와 유자청으로 색내고 절이셨다는 쌈무도 맛있고.. 쪄서 만드셨다는 깻잎 장아찌도 맛있고.. 진짜 거짓말 안치고 우리동네였으면 주1회는 갔을텐데 너무 아쉬워요ㅠㅠ 볶음밥도 너무 맛있구요.. 사장님이 너무너무너무 친절하셔서 손님 안계시면 오셔서 직접 고기랑 반찬도 구워주시고 익은거 먹어도 된다며 접시에 덜어주시는데 스몰토크 센스도 짱짱맨이에요bb 아무에게도 알려주고싶지 않은 나만 알고싶은 맛집인데 사장님이 친구들한테는 알려주라하셔서 홍익인간의 정신으로 널리 알리겠다고 약속해서 내돈내산 리뷰 남깁니다^^♡ 근처 가게되면 꼭 가보세요 진짜 후회없을거에요!!
3.26.수,순심이네생삼겹 정말 다시 가고싶은 고깃집중 하나로 기억될 것 같아요! 생삼겹으로 고기는 너무 신선했고 다양한 밑반찬이 나오는데 시그니처인 동치미무김치는 특히나 구워먹으면 정말 맛있습니다! 깻잎장아찌도 직접 찌고 만드신거라고 하시는데 짜지않아서 너무 좋았고 고기를 야무지게 먹고 볶음밥을 먹는데 볶음밥이 특히 너무너무 맛있어서 다먹고 또시켜서 먹었습니다 ㅜㅜ 혹시라도 순심이네를 방문하시는 분들은 고기도 좋지만 배부르더라도 볶음밥은 절대 놓치지 마세요..!!!
6.29.일,고기가 너무 신선하고 맛있어욥 사장님도 친절하셔서 기분 좋고 맛있게 먹었어요🤍
5.13.화,성수동 생삼겹살 맛집 순심이네 생삼겹 방문했어요! 맛있어서 두번째 방문했습니다!  생삼겹이라 육즙도 많고 반찬도 너무 맛있어요! 특히 마무리로 먹는 볶음밥 직입니다… 꼭 드셔야되요ㅠㅠ 볶음밥은 선택 아닌 필수❤️
6.20.금,너무맛있어서 먹기전에 못찍음요~~동치미무에 싸서 먹음 너무맛있어요~♡♡
5.10.토,진짜 삼겹살 질이 너무 좋아요!! 사장님도 친절하시고 고기도 맛있고 된장찌개도 맛있고 볶음밥도 맛있고 여긴 다 맛있네요 친구랑 리뷰보고 찾아왔는데 후회없어요 짱맛❤️
5.8.목,삼겹살이 어쩜 이리 맛있나요ㅠㅠㅠㅠ성수 올때마다 맨날 들릴거같아요ㅠㅠ마늘이랑 김치랑 구워먹으면 댕맛있어요ㅠㅠ고기가 숙성이 잘 됐고 사장님이 수제로 썰으셔서 그런지 더 실하고 맛있는거같아요ㅠㅠㅠㅠ또 올게요!!!
6.7.토,마무리까지 쵝오네요ㅋ고기 먹고 볶음밥에 계란찜까지 너무 맛난 저녁입니다 순심이 식당은 여사장님이랑 직원언니야가 참 친절해요~~~
7.8.화,정말 맛있어요 대박입니다
4.28.월,역시나 순심이네 생삼겹은 맛이 변하지 않아서 너무 좋습니다… 행복해요❤️
6.25.수,진짜 맛있어요!!!! 고기 자체가 너무 맛있고 같이 먹는 반찬도 다 맛있어서 정말 좋았어요! ㅎㅎ 사장님도 아주 친절하십니다~~ 또 와서 먹을 것 같아요!!
6.28.토,"고기, 국수, 보끔밥... 이럴수가 있나요? 여기는 서울 아니 한반도에서 제일 맛있는 곳이에요❤️ 내일 또 올래요"
6.27.금,걍 미친 존맛집 나만 알고싶음....
6.30.월,사장님도 너무 친절하시고 무엇보다 고기질이 너무 좋아서 마지막까지 맛있게 먹었습니다! 여름에 와도 시원하게 에어컨 빵빵하게 틀어주셔서 행복했습니당^^ 다음에 또 올게요~!
6.7.토,완전 고기 맛있고 친절하세요^^ 볶음밥 정신없이 먹어서 사진이 없네요
6.6.금,대박 볶음밥 짱 고기도 생삽겹이 두뚬하니 쵝오네요ㅎ
5.18.일,진짜 너무너무너무 맛있어요ㅠㅠ 30년 고기인생 중 한 손에 꼽을정도로 너무 맛있었어여ㅠㅠㅠ 고기더 신선하고 볶음밥도 맛도리 성수 온 사람들 다 여기 필수로 가봐야됨
6.30.월,항상 맛있는 가게 볶음밥은 필수 삼겹살 최고의 집
3.28.금,성수동삼겹살 맛집 순심이네생삼겹♡  ㄹㅇ 동네맛집인듯 사람들도 많고 반찬도 다 하나하나 하시는거라 레알 맛도리 고기 퀄리티 좋고 된찌 볶음밥 다 추천해용♡   #협찬
6.25.수,사장님이 너무 친절하시고 고기도 맛있어요 !! 특히 직접 만드신 반찬들 최고👍🏻 그 중에 동치미무채가 고기랑 잘 어울려서 계속 생각나요 ㅠㅠ 삼겹살 땡기실 때 순심이네 추천합니다~!~!
6.28.토,여기 솔직히 동치무 김치랑 삼겹살이라우 특제 무쌈이랑 먹으면 먹으면 여기 모수 입니다.
6.24.화,성수에서 여기 오래된곳으로 알고있는데 오래운영하신 이유가 다 있엇네요 성수동 토박이인데 여길 이제야 처음와본다니 직원분들 다 유쾌하시고 친철하십니다 음식도 맛있고 고기가 굉장히맛있어요~~ 추천합니다
6.22.일,진짜 너무너무 맛있고 처음 방문했는데 리뷰대로 사장님이 너무 친절하시고 유쾌하세요!! ☺️ 재방문의사 100% 입니다!
6.23.월,고기 신선하구 맛있어용🤍🤍
7.1.화,오늘 너무 많이는 점심 먹어서 기운도 뿜뿜~ 행복도 뿜뿜~ 생고기에 너무 맛난 사장님의 시그니처 깨잎찜 정말 죽여줘요~~~ 여러분 직접 오셔서 먹어봐야 해욤 ^^
8.7.목,삼겹살+무+김치+메밀 국수 조합 최고에요! 순심이네에서만 먹을 수 있는 무는 아주 키포인트!! 오늘도 잘 먹고 갑니다
6.30.월,사장님이 너무 친절하시고 고기도 너무 맛있어요! 반찬도 맛있게 잘나오고 들어오자마자 맛있는냄새납니다!☺️
4.6.일,"사장님이 지인짜 친절하시고 음식이 정말 정말 맛있어요!! 서이축산 고기랑 비슷한데, 질이 더 좋아요!!! 반찬도 수제로 다 만드시고 특히 동치미 무김치가 별미입니다. 이 집에서만 먹을 수 있다는데, 먹자마자 헉 했습니다👍 또 방문하고 싶은 맛집이에요."
4.17.목,고기 질은 물론이고 직접 만드신 반찬들이 너무 맛있었어요ㅠㅠ 맛있게 먹는 방법도 다 알려주셔서 대만족이었습니다!! 성수에서 조용하게 고기 드시고 싶은 분들 추천입니다~!
6.25.수,너무 맛있어요~~~ 사장님도 너무 친절하세요!!
6.25.수,성동구 삼겹살 최고 맛집 …. 추천받고 왔다가 감동받고 갑니다 ….. 소주도 얼음소주입니다 ^^ 느낌 알죠
6.30.월,모임으로 친구들과 너무 맛있게 항상 가는집. 삼겹살 하면 항상먹으로 가는집.
6.23.월,고기도 반찬도 전부 너무 맛있어요!!!! 그리고 사장님이 너무 친절하세요!!!!!! 배부르지만 볶음밥은 필수🤗 강추
6.23.월,진짜 너무맛있고 사장님 너무 친절하세요!!! 기분안좋았는데 기분 너무 좋아지는 맛딥이에오
6.23.월,이집은 이제 마이플레이스에 등록입니당!!!! 밑반찬도 다맛있고 사장님도 거엄나 친절해요 기분좋아지는집
3.22.토,성수 주민 맛집이라고 추천 받고 갔는데 일단 사장님이 너무 친절하시고 고기 질도 좋아요! 반찬도 사장님이 다 만드신거라고 들었는데 하나도 빠짐없이 맛있었고 특히 동치미 무를 구워주시는데 충격적으로 삼겹살이랑 잘 어울려서 너무 맛있었어요! 일본에서 온 친구가 삼겹살 좋아해서 데리고 갔는데 한입 먹더니 진실의 미간 나왔구요ㅎㅎㅎㅎ생일이라고 했더니 사장님이 계란찜 케이크에 볶음밥 서비스까지 해주셨어요ㅜ0ㅜ 성수인 단골들만 오는 찐맛집 인정이요👍🏻👍🏻👍🏻 앞으로 성수 오면 삼겹살은 무조건 순심이네생삼겹 입니다!!! 맛&서비스 하나도 빠짐없는 맛집 인정이요!!! 조만간 친구들 데리고 또 방문하겠습니다❤️
9.7.일,여기 너무 맛있어요 ㅜㅜ
6.22.일,사장님이 굉장히 친철하시고 고기랑 같이 먹을 반찬들이 아주 맛있었어요!! 계란찜도 강추합니다!!
4.1.화,우와 여기 찐맛집이예요!! 오자마자 빨리 고기 먹고 볶음밥 먹어야 겠다고 생각했는데 너무 맛있어요 일단 묵은지 묶음 킥이고요! 반찬 전부 맛있어서 고기랑 조화가 좋아요 요기 무조건 와야됨!
4.1.화,"고기랑 밑반찬, 볶음밥, 찌개까지 다 맛있어요,, 사장님이 처음부터 맛있게 먹는 법 다 알려주시고 그렇게 먹으면 너무 맛있어요ㅎㅎ 재료도 다 신선하고 구워먹는 무생채가 특히 엄청 맛있어요~! 손님 연령층도 다양하고 단체도 많이 오는 것 보니 진짜 맛집인 것 같아용!"
6.19.목,무나물이랑 같이 구워 먹으면 진짜 꿀맛입니다. 야채도 직접 재배하셨다고하도 무엇보다 고기질이 최고임!
3.28.금,고기 질이 너무 좋고 동미치를 구워먹는데 완전 별미에요!!!!! 사장님도 친절하시고 볶음밥도 맛있습니다 강추~~~
6.27.금,여길 안왔으면 성수동에 온게아님 ㅋㅋ 바보가 되기 싫으면 먹으러 오세요
5.20.화,사장님이 친절하고 너무 맛있어요!! 무말랭이랑 비빔국수 추천합니다!
