date,content
"""음식이 맛있어요""",이 키워드를 선택한 인원
"""재료가 신선해요""",이 키워드를 선택한 인원
"""가성비가 좋아요""",이 키워드를 선택한 인원
"""친절해요""",이 키워드를 선택한 인원
"""특별한 메뉴가 있어요""",이 키워드를 선택한 인원
"""혼밥하기 좋아요""",이 키워드를 선택한 인원
"""양이 많아요""",이 키워드를 선택한 인원
"""매장이 청결해요""",이 키워드를 선택한 인원
"""메뉴 구성이 알차요""",이 키워드를 선택한 인원
"""인테리어가 멋져요""",이 키워드를 선택한 인원
"""아늑해요""",이 키워드를 선택한 인원
"""매장이 넓어요""",이 키워드를 선택한 인원
"""주차하기 편해요""",이 키워드를 선택한 인원
"""차분한 분위기예요""",이 키워드를 선택한 인원
"""음식이 빨리 나와요""",이 키워드를 선택한 인원
"""건강한 맛이에요""",이 키워드를 선택한 인원
"""아이와 가기 좋아요""",이 키워드를 선택한 인원
"""대화하기 좋아요""",이 키워드를 선택한 인원
"""단체모임 하기 좋아요""",이 키워드를 선택한 인원
"""고기 질이 좋아요""",이 키워드를 선택한 인원
"""음악이 좋아요""",이 키워드를 선택한 인원
"""뷰가 좋아요""",이 키워드를 선택한 인원
"""좌석이 편해요""",이 키워드를 선택한 인원
"""디저트가 맛있어요""",이 키워드를 선택한 인원
"""잡내가 적어요""",이 키워드를 선택한 인원
"""비싼 만큼 가치있어요""",이 키워드를 선택한 인원
"""집중하기 좋아요""",이 키워드를 선택한 인원
10.13.월,"리뷰는 무조건 좋게 쓰는 편인데 직원분 응대가 최악이라 이런리뷰는 첨써봐요  계산할 때 인스타 이벤트가 있길래 작성하고 보여주려는데, 비공개 계정이면 안된다 하시더라구요?  그럼 해제하고 보여준다구 하니까,  원래부터 공개계정인 경우만 된다고, 사람들이 결제 끝나고 다시 비공개로 전환해서 안된다고 쳐다도 안보시고 말하는데  이유야 충분히 이해는 되는데 그렇다고 저희가 그렇게 한 건 아니잖아요?  직원 분 말투나 태도만 보면 저희가 이미 그렇게 한것처럼 쳐다도 안보시고 말하시는데 기분 나쁘더라구요  그럴거면 차라리 인스타 이벤트는 없애시는 게 나으실 거 같아요 초밥먹고 싶어서 나름 검색하고 첨 간건데 최악의 경험이였어요~  동네장사인데, 손님 대하시는 태도에 놀랬습니다.."
7.14.월,동천동에서 젤 맛있는 초밥집이에영ㅎㅎㅎ새우랑 육회 초밥이 특히 존맛입니당🥰 원하는 초밥 있으면 말씀드리면 바로 만들어주세용ㅎㅎㅎ
10.12.일,"살다살다 회전초밥집에서 앞에 있으니까 찾아서 드세요 하는 집은 처음 봤어요 참돔마스까와 궁금해서 시켰는데 ""앞에 있으니까 드세요"" 하시길래 어 몰라서 그러는데 뭐가 마스까와죠? 하니까 대답도 안 하고 갑자기 주방 들어가시네요 많이 먹게 유도하려고 간장은 아예 간이 없고 와사비는 종지에 냉장보관해서 향도 다 날아가서 스시 풍미를 전혀 못 느꼈습니다 부모님 모시고 갔는데 최악이였어요"
7.30.수,"2000원 회전초밥에서 볼 수 없는 식재료들을 먹을수있어 맛은 동급대비 전국제일일겁니다. 다만 홀매니저 아주머니가 많이 아프신분같습니다. 다른 손님하고 소리지르고싸우더니, 제게는 앉으라는 좌석에 앉지않았다는이유로, 따뜻한 차를 달랬는데 '장국 줬잖아요~' 라는 식으로 동문서답 보복성 멘트를 하며 안주거나,, 영수증도 안주다가 달래니까 이렇게 다꾸긴걸 줬습니다(보복성이었음이 추후 녹화에서 다 증명됨) 홀매니저만 정상적인 분으로 변경된다면 자주 갈 의향있어요 ps : 실수아닙니다. 차는 주방장님이 그다음 안내해주셨고, 그 홀직원분이 제가 지시?에 따르지 않았기 때문에(가장자리 앉을테니 간장통 치워달라니 그건 또안된대요) 차 있는거 알면서 앙심을 품고 고의로 그러신겁니다. 못믿겠으면 대화 영상도 업로드하겠습니다"
8.26.화,오후 햇빛을 막을 블라인드가 없다. 생선도 햇빛을 싫어 할 텐데. 오늘은 흰살 생선이 부족. 오늘만 그러기를.
3.17.월,아이가 스시가 먹고싶대서 왔어요 계란찜도 서비스로 나오네요 올때마다 바뀌는거 같아요 아이 최애는 육회스시와 한치 스시구요 저는 광어지느러미와 도미양념뱃살 연어양파소스 입니다 맛도 좋고~가성비 좋아요 잘먹고 갑니다~
8.24.일,아이랑둘이 24접시나 먹었어요… 워낙 스시를 좋아하기는 하지만 신선도나 퀄리티? 뭐 이런거땜에 비싸도 비싼거 찾아먹었는데 여기는 대 만족이였어요~ 굿굿~
8.9.토,자주 가보면서 알게된 건데 비정기적으로 신메뉴가 나옵니다. 소스나 조합이 바뀌기도 합니다. 레일에 모든 종류가 나오진 않지만 요청하시면 금방 만들어 주십니다. 단 참치류는 해동이 덜 된 경우도 많아 받고 나서 기다렸다 먹는게 좋습니다. 성게소가 항상 있어서 기쁜 곳
6.26.목,집근처에있어서 너무좋아요 항상 싱싱하고 너무맛있습니다. 오늘 이거 먹었는데 뭔지모르겠는데 ㅠ 진짜너무맛있어서 3접시먹었어요
4.8.화,아이가 급 초밥이 드시고 싶대서 참새방앗간 가듯이 또 왔네요ㅎ둘이 열심히 먹고 갑니다 맛있고 친절하고 가성비 좋아요
3.28.금,배가고픈데 스시가 먹고싶어서 스시백과에 또 왔네요 계란찜 맛있고요 스시도 신선하고 맛있어요 친절하시고요 브레이크타임 끝날시간 딱 맞춰 왔네요 맛있게 잘먹고갑니다~
9.7.일,집 근처 초밥집인데 맛있어서 자주 갑니다
8.6.수,역시 육회초밥 굿입니다 다른초밥도 맛잇네요
3.20.목,너무맛있어요-! 우니도 묵은지초밥도 새우도 소라도 다 너무 맛있습니다-!! 늘 잘먹구 있어용 감사합니당!
2.13.목,고급진 초밥으로 집앞이라 올때마다 극찬하는곳입니다 수지에서 초밥먹을때 꼭와보세요 엄마도 좋아하셔서 저녁에 부담없이 먹기좋아요
4.8.화,처음으로 혼자왔는데 평일 점심 혼밥하기도 정말 좋아요~~ 가성비 초밥집 동네에 있어서 좋습니다! 맛있게 잘 먹었습니다!
1.11.토,"동천역 근처 맛집찾다가 회전초밥 먹고싶어 방문했어요🍣 토요일 12시20분쯤 웨이팅 없이 방문했고 10분정도 지나니까 테이블이 꽉 차더라구요 초밥은 밥양이 적당하고 한접시에 1900원으로 많이 비싸지 않은 편이에요 회초밥 외에 종류도 다양해서 생거 못먹는 언니도 맛있게 먹었어요 대부분 맛있는데 그중 제 최애는 육회랑, 계란새우, 방어묵은지 초밥!! 짱 맛있어요🤤 생새우 위에 노란소스있는 초밥도 특이하니 괜찮더라구요 멘보샤는 궁금해서 주문해봤는데 새우보다 빵이 더 두꺼워서 개인적으론 별루였어요  회전초밥 좋아하시는 분들 스시백과 강력추천드립니다. 직원분들도 완전 친절하셔서 좋아요👍👍"
2.25.화,1주년 이벤트로 주신 차완무시 완전 맛있었어요! 따뜻하게 속 데우고 시작하니 너무 좋네요! 그리고 여전히 너무 맛있습니다. 우니와 소라갈릭 특히 너무 맛있어요!! 자주 방문 하겠습니다!
4.4.금,재료가 신선해서 스시가 너무 맛있어요!
3.14.금,너무 맛있어요!!! 가성비 좋은데 맛있고 돈아깝지 않은 스시집이에요 👍👍 동료들이 추천해줘서 처음 왔는데 또 올게요~
6.29.일,친절하지만 초밥만들때 마스크를 안하는것과 만드시는분과 서로 대화하면서 침티지않으려면 마스크해야할것같습니다.
4.4.금,오늘은 오픈런? 해서 대기없이 입장했어요. 가게 깔끔하고 가성비 최고예요. 맛있게 잘 먹었습니다.
5.6.화,항상 혼밥 하러 가고 목판접시 위주로 먹어서 방문때마다 주문서 이용 하곤 했습니다. 주문서 달라니까 주문서 없다는 거에요. 원래 주셨었다 했더니 홀 직원 아줌마 왈 우린 주문서 없다 그냥 필요하면 앞에 말해라 다른사람 다 그렇게 하니까 그냥 말씀하셔라  만석이엇는데 큰소리로 사람 민망하게 하시더라고요  운영상 방침이 바뀌었으면 전에는 어땠는지 모르겠지만 지금은 홀 손님에겐 주문서를 안드리고 있다고 말하셨음 끝났을 문제인데 왜 사람 불쾌하게 하시는지?  날 좋은날 밥 먹으러 갔다가 양껏 먹지도 못하고 기분만 잡치고 왔습니다 그 아줌마 청하 병 치워달라니 갯수 봐야된다고 치워주지도 않더라고요 ㅋㅋ 접시도 아니고 포스는 폼으로 있나요? 참 여러가지 하는 대단한 직원 쓰십니다 사장님!!
2.24.월,"날씨가 추워도 항상 초밥 생각날때마다 오는 가게에요 직원분들 모두 친절하시고 매장도 깨끗해서 늘 만족합니다 신선한 초밥에, 매장에 냄새도 하나 안나요 가성비 좋아요!!"
3.12.수,연어랑 저 생선 강추 진짜 싱싱하고 맛있음! 우동도 기본으로 한그릇 주심
8.17.일,반응 남기기 방문일 8.17.일 2025년 8월 17일 일요일 1번째 방문 인증 수단 영수증
1.23.목,자주 오는 동네 맛집이에요!!  힘든 날 위로가 되어주는 초밥집 오래 했으면 좋겠습니다!!
3.14.금,진짜 맛있어요!!!ㅎㅎㅎ가성비 좋아서 든든하게 먹었어요!!!ㅎㅎㅎㅎ
6.22.일,반응 남기기 방문일 6.22.일 2025년 6월 22일 일요일 3번째 방문 인증 수단 영수증
3.25.화,아늑한 공간에 스시가 맛있어요~~ 1주년 기념으로 미니 우동 서비스~~~^^ 너무 맛있게 먹었네요~~^^
3.15.토,처음 방문했는데 회도 도톰하고 좋네요~~ 아이와 방문하기도 좋습니다~~ 새로운 회전초밥집을 발견해서 너무 좋아요~~~
4.5.토,항상 오면 맛있게 먹는 곳이에요~~ 아들하고 잘 먹고 갑니다~~^^
3.22.토,"1접시 1,900. 광어 스시 배터지게 먹었다. 사이즈가 작은 것 같아 보이나, 가격을 생각하면 문제가 안 된다. 와사비는 셀프. 괜찮다."
3.29.토,"2번째 방문인데도 역시나 저렴한 가격에 질 좋은 스시입니다 👍 👍 👍 줄서서도 먹을만한 곳인데, 여유로운 공간이라 오잉? 했어요 ㅎㅎㅎ 여기 완전 강추입니다!! 혼밥도 좋아요~~ 최고!!"
2.16.일,너무 맛나요 민물장어 도미양념뱃살 강추~
7.3.목,가성비 최고 맛집
1.5.일,집근처 초밥 하면 바로 생각나는 곳! 그 중 항상 이 우니 먹으러 와요 가성비 짱좋구 맛까지도~~!
2.23.일,친절하시고 적당히 괜찮아요 ~~~
1.14.화,초밥 먹고싶을 땐.. 언제나 스시백과~~ 항상 맛있어요~~  친절하시고. 주문하면 바로만들어주셔서 더 맛있네요
3.2.일,항상 오지만 너무 좋습니다
3.14.금,참치 연어 진짜맛있음 서비스도죻고
3.9.일,가성비 초밥집이라지만 육회초밥도 있고~ 목판접시 초밥은 고급스럽습니다. 적당히 대접받는 기분으로 즐기러 오기에 그만인 동네 맛집^^
4.1.화,자주 오는 단골이에요! 스시가 신선하고 다양할뿐 아니라 맛도 있어요👍 추천합니다🔥
3.16.일,매번 즐겨가는 곳이에요 수지에서 제일 맛난 초밥집!
2.23.일,언제나 늘 맛있어요!! 오늘도 아이들과 함께와서 배부르게 잘 먹고갑니다-^^*
3.1.토,종류가 많아요! 배부르게 먹고 가용
2.23.일,남자친구가 회전초밥먹고싶다해서 찾아보구 왔어요! 종류도 많고 회두 신선하구 가성비좋습니다 ㅎㅎ 츄천
1.22.수,오징어튀김도맛잇고 다른초밥들도 맛있어요 🐸🐸💚 재방문의사 있습니당~~~!~!~~!~!~!~
2.13.목,아이가 초밥 먹고 싶대서 생일을 맞아 간만에 찾아왔는데...그사이 양이 엄청 늘어서 저랑 비슷하게 접시을 비웠어요 ㅋㅋ 많이 컸네^^ 암튼 잘 먹어서 너무 좋아요!!
3.15.토,맛있어요 혼자서도 편하게 먹기 좋고 자주 올 거 같아요
3.5.수,정말 맛있는 고등어 초밥이 있어요!
3.6.목,메뉴가 다양하고 신선도도 높아서 맛있게 잘먹었습니다^^ 안키모나 시메사바 같이 회전초밥집에서 보기힘든 메뉴들도 있어서 좋네요!
24.12.27.금,정말 자주 오는 회전초밥 맛집입니다!!  퇴근길에 먹고 가면 너무 좋아요!!
3.22.토,가성비 좋은 것 빼면... 거의 대분분이 신선하지 않아 처음 방문이었는데 많이 실망함
3.14.금,와 진짜 동천 초밥집중 제일 맛있어요 점심에 11접시 뚝딱 비우게 되네요ㅎㅎㅎㅎ
2.4.화,가족끼리 오랜만에 모여서 저녁식사 했는데 분위기 좋고 음식이 가성비 있고 맛있어요!! 다음에 또 올게요~
3.9.일,집앞이라 항상가는데 신선하고 가성비도 좋아요 이만큼이나 먹고왔어요
24.12.25.수,크리스마스라서 왕창 먹었어용 자주 오는곳인데 너무 맛나요!! 담에 또 올듯
1.10.금,가격이 합리적이고 음식 하나 하나가 다 맛있습니다. 냉모밀 시원하고 초밥도 각각의 맛이 살아있어요.
1.6.월,가성비 좋은 회전 초밥집! 광어랑 고등어 강추!
3.23.일,가격도 저렴한데 퀄리티가 정말 좋아서 종종 오는 곳이예요~~ 너무 맛있어요!
24.10.17.목,첨엔 내가 먹고 아이를 데리고 와서 먹어보라고 했으나...이젠 아이가 먼저 가자고 하는^^ 아이가 잘 먹어서 좋아요!! 둘이서 몇접시를 먹아치웠는지...ㅎㅎ 오늘은 우동까지 추가해서 배가 터질 듯~ 먹었으니 열심히 운동해야죠~☆ 고고!!
3.3.월,브레이크타임 지나서 바로 돚삭해서인지 기다리지 않고 맛있는 초밥 잘 먹었습니다~^^ 회도 도톰하고 싱싱했어요~
3.14.금,동네맛집이에요~ 여기 가까워서 자주 오는데 늘 올때마다 초밥도 신선하고 맛있고 주방장님도 너무 친절해서 기분이 좋습니당❤️ 추천이요🙏
3.15.토,가격도 좋고 회도 신선하고 맛있습니다!
24.12.19.목,항상 초밥 생각날때마다 오는 곳인데 늘 만족하고 갑니다! 회전율도 좋아 초밥도 신선하네요 늘 사람많은 곳이에요 동천동에선 스시백과가 초밥집 일티어같아요
2.27.목,맛있어서 자주 찾게 됩니다!! 추천해요!! 또 올게요 ^^
2.3.월,처음 방문했는데 맛있게 잘 먹었어요. 민물장어 스시 좋았어요~~!
3.19.수,맛있게 잘 먹고 갑니다! 항상 인기가 좋네요.
3.6.목,집앞이라 종종 옵니다 회 신선하고 가격도 좋은 것 같아요 추천해요
3.21.금,혼밥 하기도 좋고 퀄리티도 뛰어납니다ㅡ 자주 옵니다. 건승하세요~~
3.8.토,반응 남기기 방문일 3.8.토 2025년 3월 8일 토요일 1번째 방문 인증 수단 영수증
2.21.금,세번째 방문인데 정말 맛있게 먹었습니다:)
2.16.일,집앞에 있는 최애 맛집입니다^^ 초밥이 낯선 아이들도 넘나 좋아해요 ! 회전율이 좋아 초밥들이 신선하고 디저트도 맛있어요^^
1.24.금,가성비최고! 근데 많이 먹으니 돈이 많이 나오긴하네요 ㅎㅎ 동네라서 자주 갈 듯 합니다!
24.11.21.목,"여기 새로 생겼다는데 너무 맛있네요 균일가접시 1,900원 목판는 3,000원인데 목 판 고퀄리티 메뉴들이 아주 끝내줍니다 👍 👍"
2.13.목,가격과 맛 모두 좋아서 가족끼리 자주 오는 곳 입니다! 오늘도 맛있게 잘 먹었습니다!
2.26.수,스시 생각날때 혼밥하러 옵니다. 매장도 깨끗하고 친절하세요.
1.14.화,항상 맛있게 먹고 있습니다! 장국도 맛나고 스시도 맛나요! 자주 오겠습니당 ㅎㅎ
3.7.금,친절하고 맛도 있어요. 음식 종류도 많고 신선합니다.
1.18.토,"연어초밥 좋아하는, 입맛 까다로운 중등 아이가 좋아하는 곳입니다. 한 접시에 2p 나와서 엄마도 좋아요. ^^ 오징어튀김 주문하면 바로 해주시는데 매콤하고 매우 맛있네요!"
24.11.26.화,"스시 종류가 많아서 좋아요 자주찾는곳,, 맛있어요!! 가성비 끝판왕~!!"
24.10.24.목,집근처에 스시집 찾다가 왔는데요. 완전 가성비 회전초밥이네요! 특히 연어뱃살이 맛있구요~ 육회초밥도 맛있습니다! 기본 광어 연어도 맛있구요 ^^ 다음엔 같이와서 먹어야겠어요 ㅎㅎ
2.16.일,음식이 맛있고 정갈하네요!
3.19.수,깔끔하고 너무 맛있어요! 가성비도 좋아용
3.19.수,너무 맛있어서 23접시 먹었어요
2.22.토,"예약없이 가도 자리잡기 편하고, 조용하고, 무엇보다 일단 맛있어요! 자주 가고 싶어요!"
2.11.화,초밥 먹고싶으면 꼭 오는 집 가성비 갑 맛있어요
24.12.28.토,우리동네 최고 스시집이네요..퀄리티가 진짜 좋아요!!
24.10.26.토,"새로 이사와서 밥먹을 곳 찾다가 스시집이 있어서 들어왔어요! ""균일가"" 라는 소리에 설마.. 하고 들어왔는데 진짜 가성비 맛집 스시집입니다!! 스시 좋아하시는 분들은 진짜 자주오실 듯.. 저도 혼자왔는데, 혼밥 하시는 분들도 많네요!! 강추 강추! 입니다."
1.2.목,두번째 방문인데 맛있고 가성비 좋아요 :) !!! 잘 먹었습니다!
1.14.화,다섯번이상왓는데 올때마다 맛잇게먹어요 또올게용
24.11.12.화,계새초 너무 러브. 여기 가성비도 좋고 너무너무 맛있네요 !!!! 자주 오겠습니다 ~~~^_^
1.5.일,매장 깔끔하고 분위기 좋고 가성비도 정말 좋아요. 음식도 다양한편입니다
24.9.10.화,동네에서 제일 맛있어서 두번째 방문 했습니다-! 우니도 듬뿍 주시고 먹고싶은거 바로바로 말씀드리면 해주시니 더 맛있습니다. 아보카도메뉴 있어서 더 좋은것 같아요-! 너무 맛있게 잘먹었습니다 또 올게요!
1.3.금,아이들도 좋아하는 곳이라 자주 방문하는 곳입니다~^^ 늘 맛있게 먹고 갑니다!
24.11.1.금,너무 맛있고 친절하게 아기가 먹을꺼면 우동 매운것도 빼주셔서 감사했습니다 아보카도연어목판접시.꼭 드세요!!!! 어른 둘이서 열판씩 조지고 갑니다 너무 맛있네요 아이가 다 먹고 여기 다음에 또오자~ 하더라구요 이사 와서 우리가족 맛집 찾은것 같아서 좋네요 !
1.13.월,맛있었어요 연어 바로 해주신거 먹었는데 엄청 맛있었습니다 !! 매장 안도 따뜻했어요 스시 먹고싶을때 가볍게 오기 좋습니다
24.11.24.일,오픈 후 바로 방문해서 먹었는데 직원분들도 친절하시구 정말 맛있게 식사하고 갑니다 : ) 초밥 생각날때마다 자주 방문할게요 :D
1.4.토,저렴하면서도 맛있어요 여러군데 다녀보지만 싼곳은 밥이 너무 딱딱하고 맛이 없는데 여기는 밥이 보드랍고 간이 맞아요 아이도 맛있다고 잘먹고 새우튀김도 맛있어요 집 가까이 가장 가성비 좋은거 같아요 분당 다른 스시집보다 반값이네요
24.12.21.토,맛있고 메뉴가 다양해요!!! 짱 👍
24.11.3.일,항상 맛있게 먹는데 오늘 우니도 역시 맛나네여
1.14.화,집들어가다가 급히왓어요. 깔끔하고 맛잇어요.친절하시구요~~ 다음에 또올께요
1.1.수,음식이 정말 맛있고 정갈합니다! 친절하시고 다음에 또 올게요~
3.22.토,맛잇게 잘 먹고 갑니다 ㅎㅎ
24.12.14.토,"오늘 식사하다 여자 종업원분이 지나가며 옷걸이를 쳐서 가족 패딩이 모두 바닥으로 쏟아졌습니다. 치우시던 스시 접시도 패딩위로 좌르르 다 쏟으셨구요. 스시의 잔해와 소스들이 패딩에 범벅이 되었는데, 대응이 너무 황당하더군요. 미안하다는 말 단 한마디도 없이 ""물티슈로 닦아드릴게요."" 이 한마디만 하고 제 자리 앞에 꽂아진 물티슈 하다 뜯어서 쓱쓱. 겉에만 묻었네요. 이러고 끝. 장난하십니까? 서비스업 하시면서 기본 태도가 안되어 있네요. 가운데 스시 만드시는 세분도 상황 다 지켜보시면서 아무도 죄송하다는 말 한마디 없으시더군요. 사장님 찾으니 그제서야 세탁비 영수증 가져오시면 드릴게요. 하시는데 기본이 안되있는 음식점이네요. 입맛 싹 사라지게 해주셨고, 오는길에 패딩에 스시냄새와 집에와서 보니 군데군데 얼룩이"
24.12.13.금,■전화 포장주문은 절대 비추입니다■ 평소 배달어플로 주문하거나 방문해서 먹어왔는데 주문이 안되서 네이버 검색해 전화하니 저녁배달은 이제 안하신다고 앱포장주문도 안되고 전화 주문만 가능하다고 해 방문포장했습니다. 26접시와 목판 3개 주문했는데 가격이 2만원 넘게 차이나 연락했더니 홀 가격과 포장가는 다르다고 하더라구요. 왜 다른지 문의하니 어플 수수료와 배달비 이야기 하셔서 저는 가게 전화 주문인데 같은 가격이냐고 물었는데 맞다고 하시네요. 전화주문 당시 가격이 다르다고 말해주거나 매장에 포장 메뉴판이 따로 있어야 하는거 아닌가요? 방문포장 고객한테도 어플수수료와 배달비를 청구하시는 기적의 논리로..이제 다시갈 일은 없을것 같네요 꼭 홀이나 앱주문만 하세요.
24.10.23.수,자주 방문하는 곳인데 이제 리뷰 남기네요 전반적으로 재료들이 신선한거 같아요 잘 먹고 갑니다 🍣🦪🍤
2.27.목,쉽게 볼 수 없는 고등어도 있고 맛있게 잘먹고 갑니다.
1.3.금,초심 잃으셨네요.. 10번 이상 방문한 단골인데 점점 양이 줄더니 오랜만에 왔더니 회 크기가 절반으로 줄었네요. 나가는 길 인사도 안하시구요 직원분들끼리 크게 떠드셔서 우리가 브레이크타임에 식사하고 있는 줄 알았네요. 그리고 주방에서 너무 시끄러워요 식사 분위기 하나도 형성 안됩니다.  멀리서도 찾아갈 맛집이라 생각했는데 그건 처음처럼 양과 서비스 유지했을 때의 얘기구요.. 이제 다시는 갈 일 없을 것 같습니다
24.12.21.토,연어초밥 킬러 초등 아이들과 종종 오는 곳이에요 가성비 매우 좋고 신선한 초밥집입니다 오래간만에 오니 메뉴가 리뉴얼되어 새로운 초밥도 많아졌어요^^
24.12.27.금,직원분들 친절하시고 맛있어요. 종류도 다양해서 골라먹는 재미가 있었어요.
24.12.20.금,아이들과 먹기에도 좋아요. 메뉴가 다양합니다.  아이들이 너무 좋아합니다.^^ 너무 맛있어요.
24.12.9.월,수지구청 근처 회전 초밥집 검색하다 우연히 왔는데 기대 이상으로 맛있네요~! 메뉴도 다양하고 주차도 편하고 아이들도 좋아하네요. 앞으로 자주 올 거 같아요.
24.12.31.화,테이블석 안내해 주셔서 아이와 편하게 잘 먹었습니다. 맛있었어요. 다음에 또 갈거예요!!
1.14.화,반응 남기기 방문일 1.14.화 2025년 1월 14일 화요일 1번째 방문 인증 수단 영수증
1.14.화,음식도 신선하고 친절하셔서 즐겁고 맛있게 먹고 갑니다~!!
24.12.14.토,너무 맛잇는 회전초밥집이에요 직원분들도 너무 친절해요 다들 꼭 오세요
2.15.토,"맛있고, 가격도 합리적이라 좋았어요!"
24.12.27.금,처음 와봤는데 정말 맛있게 먹었어요~ 초밥 못먹는 아이도 먹을 메뉴가 많아서 같이 잘 먹었습니다^^
24.11.15.금,매장이 깨끗하고 음식이 신선하고 가격까지 착함! 너무 맛있게 먹어서 다음에 또 방문하고 싶다~😃
1.2.목,회전초밥이 땡겨 근처 가장 가까운 곳으로 왔는데 맛있게 먹고 갑니다 :)
3.8.토,반응 남기기 방문일 3.8.토 2025년 3월 8일 토요일 2번째 방문 인증 수단 영수증
24.12.29.일,재방문입니다 언제나 맛있어요^^
24.8.16.금,아이가 초밥먹고싶다고 노래를 불러서 갑작스레 왔네요 브레이크타임 끝난지 얼마안됐는데 금방 자리가 차네요 맛도좋고 신선하고 가성비좋아요 아이도 좋아하구요
24.11.14.목,아이 학원끝나고 함께 왔습니다. 맛있어요
24.12.9.월,아이가 좋아해서 자주가는데 오늘은 포장해왔네요. 포장 서비스도주시고 좋아요. 감사합니다
24.9.28.토,맛도좋고 메뉴가 참 다양해요. 주중 늦게 이용하다가 주말에 오니 더 다양한메뉴를 먹을 수있어서 좋았어요! 계속 단골 할게요!!
24.12.31.화,맛있어서 엄청 먹었어용 ㅎㅎ 굿굿
24.12.31.화,사장님도 친절하고 음식도 맛있어요!!
24.10.21.월,역시나 초밥이 생각나서 온 스시백과 일주일에 한번은 꼭 오는 것 같아요 매번 올때마다 만족스러운 식사를 하고 가서 좋아요 :) 신선함은 기본이고 맛있어요
1.4.토,항상 잘 이용합니다
