date,content
24.5.18.토,가족들과 함께와서 맛있게 먹었습니다. 재료도 신선하고 맛있어요! 재방문 의사있습니다!
24.5.24.금,첫 손님으로 간것 같은데 음식이 준비되있네요 기다림없이 빨리 먹고 나왔습니다!
24.5.3.금,초밥은 무조건 스시백과..🩷 아직까지 여기 뛰어넘는 곳은 못 찾았는데 앞으로도 못 찾을 것 같아요~~🤤
24.2.19.월,당근에서 추천하는 글 보고 방문 해봤어요 오픈하신지 얼마 안 돼서 그런지 깨끗하고 여러가지 리뷰 이벤트도 진행하고 있어서 좋았어요! 수지에 딱히 마음에 드는 초밥집이 없어서 늘 제대로 된 초밥집 하나 있었으면 좋겠다.. 싶었었는데 남자친구랑 먹어보고 초밥 먹고 싶을 땐 여기로 오기로 했어요!ㅎㅎ 초밥에 들어간 회도 두껍고 특히 우니감태가 달달하고 고소하니 진짜 맛있었어요😋 주차도 한 시간이나 지원 해주시고 주로 차로 이동하는 저희에게는 너무 감사한 일이었답니다! 소문도 많이 내고 또 자주 찾아 뵙겠습니다🥹🩵 번창하세요😎
24.7.7.일,너무 맛잇어요!!! 가성비 좋고 혼밥하기도 좋아요! 강추~~~😋
24.2.17.토,아기포함 셋이 방문하여 27접시 먹었어요. 회전율이 빠른편이라 초밥도 신선하고 맛있습니다. 당근에서 쿠폰으로 받은 미니우동도 꽤 푸짐해서 좋네요. 맛있게 잘 먹었습니다~~
24.1.20.토,">와! 레일에 성게가 돌아다닌다!< 사실 저희가 시키고 몇개 돌아다니게 두셨는데 저희가 다먹음 . 그래도 양심상 두 바퀴 도는 것 기다렸다 먹었습니다. 첫 방문때 반해서 일주일 뒤에 바로 갔습니다. 직장이 늦게 끝나서 평일에는 먹을 수 없는데, 주말에 가기로 정하자마자 목요일부터 무슨 어린왕자 기다리는 여우마냥 하루하루 행복하더라고요. 그리고 역시 대만족했습니다.. 여기 생기기 전엔 갓X스시 갔었는데, 2배 먹어도 가격이 같으니까 너무 좋습니다. 오늘은 전에 없던 단새우초밥에 새우 머리 튀김이 하나 같이 있었는데 그게 아주 별미더라고요. 새우 머리만 돌아다녀도 신나서 잘 먹을 것 같습니다. 참치뱃살 1등급이라고 슬쩍 자랑하셨는데 자랑하신 만큼 맛있었습니다. 많이 알려져서 장사가 잘 됐음 좋겠습니다 제발~!"
24.2.16.금,동천동에 퀄리티좋은 스시집이생겨 넘 좋아요 신선하고 맛도 좋고 소스 간들어간 음식들도 다 맛나요 맛도좋은데 다들 친절하셔서 더 기분좋고 맛나게 먹고왔네용 해산물 좋아하는 남편따라 오늘을 시작으로 단골될듯 합니다
24.2.15.목,저번에 친구들이랑 와서 너무 맛있게 먹은 기억이 있어서 혼밥하러 와봤습니다! 점심에 오픈하자마자 와서 손님 없이 조용히 혼밥하고 갑니다 너무 맛있어요 또 올게요~
24.6.26.수,너무 맛있어서 자주 오게 되네요 또 오겠습니다!!😄
24.3.10.일,새로 생겨서 생각나서 왔는데 저렴하면서도 맛있네요 초밥 실컷 먹구 왔어요~^^ 무엇보다도 주차가 편하고 친절 하셔서 자주 찾을 것 같아요 ☺️
24.6.17.월,메뉴가 다양하고 신선합니다. 맛있게 잘먹었습니다.
24.1.14.일,"집 근처에 회전초밥 생겼길래 아내랑 같이 가봤는데 완전 만족하고 갔어요. 담에 또 가볼 생각입니다. 손님이 많아서 회전율도 좋을거같고, 초밥들도 정말 맛있어요."
24.5.24.금,몇번째 오는지 모르겠습니당..ㅎㅎ 너무맛있어서 자꾸 생각나요
24.5.2.목,항상 가자마자 정신없이 아이챙겨주고 먹다보니..아쉽게도 사진찍는걸 깜빡했네요.. 그치만 저희집 막내가 매주 가자고 할정도로 스시가 맛있고 애정하는곳이에요~! 항상 뭐먹고싶니? 물어보면 스시백과에 가자고해요..너무 자주가서 눈치가 보이네요..ㅎㅎ
24.8.10.토,반응 남기기 방문일 24.8.10.토 2024년 8월 10일 토요일 1번째 방문 인증 수단 영수증
24.4.12.금,동료들과 점심식사로 다녀왔습니다 가성비좋고 맛나게 먹었습니다
24.1.13.토,슈는 그냥 같이 올려 놓고 찍은거지 초밥과 같이 나오지 않습니다ㅎㅎ 진짜 너무 맛있고 신선해요! 우니랑 고등어도 하나도 비리지 않았어요 다들 친절하시고 오픈 행사로 10% 할인도 해주셨어요 왕맛도리 도라방스 ㅜㅜㅜ
24.7.21.일,반응 남기기 방문일 24.7.21.일 2024년 7월 21일 일요일 4번째 방문 인증 수단 영수증
24.1.28.일,새로 오픈하셨다길래 한번 가봤는데 신선하고 가격도 좋았어요! 락커가 있어서 소지품 보관 할수 있는 부분도 👍🏻
24.3.16.토,스시 종류가 다양하고 맛있어요!! 잘먹었습니다~
24.1.16.화,회전초밥집중 제일 푸집하고 종류많고 신선한거같아요!!! 맛은 그냥 뭐 말할필요도없네요 ㅜㅜㅎㅎ 여기저기 귀여운 디테일도 있고 ㅎㅎ 가게인테리어도 너무 예뻐요!! 재방뮨의사9999%%%
24.2.24.토,동네에 회전초밥집이 생겨서 정말 기뻐요! 벌써 두 번 방문했는데 메뉴도 다양하고 맛도 있고 가격도 좋아 만족합니다 ^^
24.8.25.일,반응 남기기 방문일 24.8.25.일 2024년 8월 25일 일요일 1번째 방문 인증 수단 영수증
24.6.24.월,반응 남기기 방문일 24.6.24.월 2024년 6월 24일 월요일 1번째 방문 인증 수단 영수증
24.3.30.토,디저트가 다양했고 스시가 신선하고 맛있었어요 ^^
24.4.27.토,아이가 너무 너무 좋아해서 매주 방문하는곳이에요^^ 회전초밥집이라 눈이 즐겁고요~맛도 좋고 가성비 최고에요~~ 아이는 연어초밥이 젤 맛있다고하네요~~ 재료도 신선한것같구 다 좋아요~!!
24.5.12.일,맛있고 친절해요 먹고싶은거 주문하면 신선하고 양많게 잘 만들어주세요 가성비짱 회전초밥집이네요
24.3.2.토,가성비 좋은곳같아요 맛도 좋아요 주차도 좋아요 깔끔해요
24.3.29.금,스시를 합리적으로 먹을 수 있는 곳이에요.젊은 사람들이 정말 많이 찾아 요. 동네에서 자주 가고 싶은 곳. 맛있어요.
24.4.20.토,종류도 많고 맛있었어요 가성비 좋아요
24.2.17.토,전에 방문해서 먹고 너무 맛있어서 이번엔 잔뜩 포장해서 먹었습니다 ㅎㅎㅎㅎ 가족들이 입맛이까다로운데 다들 맛있다고 칭찬!!!! 비린맛 하나없고 생선이 너무 싱싱해서 좋아용~~~🩷
24.3.16.토,여기 매번 와도 맛있음. 리뷰이벤트도 처음 써보는데 바로 바로 할인 해주시고 스시를 정말 동네에서 부담 없이 먹을 수 있는 그런곳. 매주 오는 듯
24.3.9.토,깔끔하고맛있어요~ 특히 광어초밥 강추입니다!
24.4.5.금,세 번째 방문입니다. 회전 초밥 집이지만 많이 먹어도 가격이 부담되지 않아요~ 맛도 변함이 없습니다~ 갈 때 마다 만족합니다~ 또 갈 거에요~
24.8.6.화,반응 남기기 방문일 24.8.6.화 2024년 8월 6일 화요일 1번째 방문 인증 수단 영수증
24.1.20.토,송파에서 소문듣고 왔습니다~! 수산물 유통하시는 사장님이 오픈하셨다고 해서 그런가 정말 신선하고 가성비 너무 좋습니다~~ 다른 회전초밥집 하고는 생선 퀄리티가 다릅니다!!
24.1.17.수,혼밥하기도 좋고 사장님직원분들 다친절하세요!! 회도못먹는데 익신해산물많아서 좋습니다!^^ 자쥬 올예정~~
24.1.20.토,"울산에서 놀러왔는데, 회 본고장인 울산보다 너무 맛있어서 감탄을 금치 못하고 갑니다  회전초밥하면 싸고 질좋지 않다고 생각해서 꺼려했었눈데, 비주얼부터 시작해서 초밥의 다양성, 신선도를 보고 제 편견을 깬거 같습니다.  무엇보다도 착한가격에 이렇게 신선하기가 쉽지않을텐데, 사장님께서 맛과 품질을 유지하기 위해 노력한다는 모습이 몸소 느낄 수 있었습니다  또 놀러오면 또 방문할거 같아요. 정말 맛있었어요. 사장님 또 방문 약속 드릴게요!!!"
24.1.20.토,동네에 얼마전에 생긴 회전초밥집 눈여겨 보고있다고 오늘 방문했는데 가격도 저렴하고 맛도 너무 맛있어요!! 자주 올 예정이에요!
24.3.23.토,포장은 할인이 있다. 포장은 와서비를 따로 주고 초밥에는 넣지 않는다. 맛은 한번 더 가보고 판단.
24.3.7.목,운동하고 잠깐 들러서 혼자 흡입했네요 ㅎㅎ 맛있게 잘 먹고 갑니다!
24.5.10.금,반응 남기기 방문일 24.5.10.금 2024년 5월 10일 금요일 4번째 방문 인증 수단 영수증
24.6.23.일,반응 남기기 방문일 24.6.23.일 2024년 6월 23일 일요일 1번째 방문 인증 수단 영수증
24.2.5.월,이틀 연속으로 왔어요! 너무 신선하고 녹아요! 맛있게 잘먹었습니다 :) 단골 확정이여요~~!
24.7.15.월,반응 남기기 방문일 24.7.15.월 2024년 7월 15일 월요일 1번째 방문 인증 수단 영수증
24.2.16.금,사진을 못찍었네요. 남편이 배고프다고 허겁지겁 먹다보니 사진도 잊었어요. 동네 회전초밥집이 없어서 멀리 가야했는데 넘 좋네요. 맛도 양도 위생도 만족입니다. 아들도 나중에 데려와야겠네요~ 초심 잃지 말고 신선하고 맛있는 스시 부탁드립니뎌~
24.2.18.일,4인테이블 있어서 항상 모임하기 좋아요! 매장도 깔끔하고 신선해서 또 오게 됩니다 ㅎㅎ
24.1.20.토,너무 잘 먹었습니다. 가격대비 퀄리티 너무 좋고 재방문 무조건입니다
24.4.2.화,너무 맛있게 잘 먹고 갑니다^ ^ 가성비 굿굿
