date,content
22.11.21.월,김치우동 닭껍질 만두 존맛 ㅠㅠ 다들 꼭 드시길 급하게 약속 잡혀 간 곳인데 음식이랑 술 너무 맛있어서 저녁 안먹고 간 보람이 있었네요 ㅜ 술도 추천 너무 잘해주셔서 음식이랑 너무 잘 어울렸어여
22.10.30.일,"일단 바텐더님이 술에대해 친절히 설명을 해주시고, 술을 어렵게 대하는 것을 지양하려는 바입니다. 간단한 안주와 함께 먹는 시원한 진피즈는 이즈굳,,"
22.10.30.일,칵테일 잘 몰라도 원하는 느낌을 말씀드리면 취향에 맞는 술로 추천해주시는 점이 가장 좋았습니다 매장도 너무 밝지 않아 편안한 분위기에 음악도 굿!! 🎶 서울숲 갈 때면 또 들를 것 같아요
22.11.17.목,"칵테일 2잔을 마셨고, 첫잔은 클래식 칵테일, 두번째는 시그니쳐 칵테일을 시켰어요! 둘다 너무 맛있었습니다 :) 특히 시그니쳐 칵테일인 미드나잇 퍼플은 시소가 들어갔다 하더라구요. 향 도 너무 좋고 맛도 시큼하고 달달하니 맛있었습니다 :) 안주메뉴도 맘에드는데 시켜먹어봐야겠어요 !"
22.10.31.월,혼술 좋아하시는 분들은 뚝섬 가시면 필수코스에요. 원하는 취향에 맞는 술을 내어주고 맛있게 잘 만들어주시네요! 음악도 좋아서 혼자서 세 잔은 금방입니다. 진이나 위스키 좋아하시면 추천드려요!
22.11.13.일,"하나하나 추천도 잘해주셔서 재밌는 추억 하나 남기고 갑니다!! 친절하시고 메뉴판에 없는 칵테일도, 논알코올 음료도 만들어주셔서 더 좋았던 것 같아요🍸"
22.10.31.월,술을 잘 몰라도 사장님께서 개인 취향에 맞게 추천을 잘해주세요! 칵테일 맛도 너무 좋습니다 :) 음악도 너무 좋고 전체적으로 편안한 분위기로 시간 가는 줄 모르고 오래 편안하게 머물다가요🤭
22.11.12.토,사장님도 친절하고 음악도 너무 좋고 술맛이 절로 나는 곳이었습니다 ! 퇴근하고 종종 들려서 한 잔 하기 좋습니다
22.11.6.일,분위기도 좋고 인테리어도 깔끔하고 좋아요 사장님이 추천도 해주셔서 기분좋게 먹고 갑니다 연말에 또 가고싶네요!
23.3.19.일,반응 남기기 방문일 23.3.19.일 2023년 3월 19일 일요일 1번째 방문 인증 수단 결제내역
22.11.6.일,"처음 방문하였는데, 인테리어 분위기가 제 스타일 ㅎㅎ 요즘 술집이나 바에 가면 사람많고 시끄러운곳이 많은데, 여기는 혼술 하거나, 연인&커플 끼리 둘이서 조용히 이야기 하면서 마시고 싶을때 딱 좋은곳 입니다.  사장님도 하이볼이나 칵테일에 대해서 대게 자부심도 있으셔서, 다음에 재방문하게되면 추천해주시는걸로 마셔볼까 합니다. ㅎㅎ"
22.11.9.수,반응 남기기 방문일 22.11.9.수 2022년 11월 9일 수요일 1번째 방문 인증 수단 결제내역
