date,content
2.25.화,"생에 첫 아이롱 펌을 해봤는데 다른 펌과는 다르게 세세하게 진행이 돼서 놀랐고, 디자이너 선생님이 굉장히 꼼꼼하게 잘해주셨습니다..  꼼꼼한만큼 엄청 고생하시는 모습이 보여서 마음속으론 죄송하고 고마웠습니다  덕분에 복학해서 잘 꾸미고 다닐 것 같습니다 오늘 고생 많으셨습니다 감사합니다 !"
5.19.월,차원이 다른 컷트를 경험했습니다. 감사합니다
4.26.토,도예님이 샴푸 드라이해주셨는데 추천입니다~👍
3.11.화,항상 믿고 머리 맡기는 선생님이십니다! 상담도 자세히 해주시고 스타일 추천도 해주셔서 너무 감사합니다!!
5.18.일,스타일 좋게 상담 잘 해주시고 잘 잘라줘요
2.16.일,항상 깔끔하고 맘에 쏙 들게 잘라주셔서 감사합니다. 대강 스타일만 얘기하면 점장님이 알아서 예쁘게 짤라주시니 너무 편하고 좋아요. 게다가 미용을 잘 모르는 제가 봐도 바쁜 와중에도 디테일 잡으시는게 느껴져서 너무 만족스러운 결과가 나오는거 같아요. 다음에 또 자르러 갈게요
4.5.토,특별한 날에 맞춰서도 요청사항을 잘 반영해주셔서 만족스러웠어요~ 아르테이 가신다면 선주 실장님 추천드립니다~
3.11.화,선주실장님에게 받았어요!  머리스타일에 대한 고민이 많았는데 얼굴형에 맞게 상담해주시고 컷트해주셔서 너무 예쁜 인생머리를 찾았어요!!!! 감사합니다!!  시술 받으면서도 계속 불편한건 없는지 챙겨주셔서 기분좋게 손질받았어요!! 👍👍👍👍
3.4.화,"선주실장님 너무 꼼꼼하시고 세심하게 스타일링 해주세요 커트 하나하나 이렇게 섬세하게 해주시는 곳 잘 없는데 늘 감사합니다 예약도 보통 예약해도 기다려야하는 곳 많은데 칼같으시구, 스타일 실력 무엇하나 빠짐없는 실장님🙆‍♀️"
4.4.금,반년 째 선주 실장님께 커트 받고 있습니다 :) 남자 머리 너무 잘해주셔요!
4.17.목,너무맘에들어요 선생님들너무잘하시고 친절하십니다😍
4.21.월,매번 잘 잘라주셔서 감사합니다.
1.17.금,시우 디자이너님께 머리 스타일링을 받았는데 정말 만족스러웠습니다. 제 얼굴형과 두상에 딱 맞는 스타일을 추천해 주셔서 결과가 아주 자연스럽고 세련됐어요. 특히 오늘 당장 놀러 가도 될 만큼 손질이 간편하고 자연스러운 머리로 만들어 주셔서 너무 감사했어요. 세심한 상담과 실력 덕분에 믿고 맡길 수 있는 디자이너를 만난 것 같아 기분이 좋습니다!
2.5.수,"꼼꼼하게 최적의 방법으로 스타일링 해주셔서 감사드립니다! 늦은시간까지 어떻게 머리 관리 하는지, 어떤 방식으로 머리를 펌했는지 친절하게 알려주셔서 감동했습니다🙂 앞으로 자주 이용하고 주변 분들에게 추천해 드릴 예정입니다👍 감사합니다 ^^"
4.14.월,만족입니다 ~펌하러 갈께요 감사합니다
2.28.금,머리에 컬감을 주셔서 머리 손질하기도 편하고 볼륨감있어 너무 이쁩니다  고민되는 부분도 친절히 설명해주셔서 더 이쁘게 자를 수 있습니다
3.14.금,굿~👍🏻 친구들이 머리 예쁘대요~~
3.8.토,제 머리 상태에 어울리면서 손질하기 쉬운 레이어드 컷으로 잘라주셨어요. 제가 하고 싶은 머리 시안을 보여드렸더니 커트 후에 고데기로 cs컬도 넣어주셔서 너무 좋았어요! 학교 앞 다른 미용실에서 레이어드 컷 잘랐을 때는 매번 마음에 안들었었는데 처음으로 제 마음에 쏙 드는 머리로 해주셨어요🤍 다음에 또 머리 자를 때 방문하겠습니다~
2.3.월,머리가 부시시하고 곱슬이 심해서 손질하기 어려웠는데 깔끔하고 예쁘게 머리가 잘돼서 너무 좋습니다 ㅎㅎ 하나하나 세세하게 잡아주시고 혼자서 관리 잘 할 수 있도록 스타일 어떻게 만지는지 등 여러가지 꼼꼼하게 알려주세요. 기다리는 동안 간식이나 음료등 준비해주시는 등 서비스가 지금까지 다녀본 곳 중에 가장 맘에 들었습니다! 앞으로 여기 단골 될 거 같습니다!!
3.3.월,"테이쌤 유튜브를 보고 처음 아르테이 왕십리점을 알게 되었습니다. 테이쌤께 받는건 어려운거 같았지만, 다른 디자이너 쌤들도 잘 하실 거 같아서.. 네이버 평점도 높고 그러다보니 신청하였는데.. 선주 실장님께서 친절히 상담해주시고 알려주셔서 좋았습니다. 추천해주신 헤어스타일은 앞 머리를 더 길러야 한다고 말해주셔서.. 그날을 기대하고 있습니다. 선주실장님 다음달에 뵙겠습니다. 감사합니다."
2.23.일,얼굴형과 두상에 맞는 머리를 추천해주십니다. 제가 숱은 많은데 얇고 곱슬이라서 난이도가 매우 어려운데 최대한 제가 원하는 스타일로 해주시려고 노력해주십니다. 머리 손상 안 되게 하려고 중간 중간 서비스로 영양도 넣어주셨고요. 다음에 또 방문해보려고요. 추천합니다.
3.2.일,예약 시간에 조금 늦었는데 다행히 머리 잘받았습니다. 친절하시고 모르는것도 질문하면 잘알려주시고 머리도 엄청 만족스럽습니다 멀리서 간 보람이 있습니다 추천합니다 감사합니다 얼음없는 아이스아메리카노 주신 여자쌤 이쁘세요 !
3.1.토,첫 방문인데 지금 머리상태 정확히 진단해주시고 앞으로 어떻게 스타일링하면 좋겠다고 방향까지 제시해주셔서 좋아요 시술도 꼼꼼하고 두상에 맞춰서 섬세하게 봐주십니다 쭉 정착해서 다니려구요! 남자분들 미용실로 완전 추천합니다
4.19.토,매번 원하는 스타일로 잘 다듬어주세요😎
6.13.금,머리 잘 짤라주셔서 좋아요. 어디가냐고 매번 물어보시다 맨날 집에간다니 이젠 안물어보시네요~ㅋ😉🥲
4.10.목,실장님 두번째 방문때도 신경 써주시고 얼굴에 맞는 스타일로 잘 해주시는 거 같아요 완전 짱짱걸👍👍
4.13.일,시스루댄디펌 딱 원하던 느낌으로 나왔어요
2.21.금,꼼꼼하게 잘 봐주셔서 만족하면서 다니고 있습니다. 앞으로 여기만 다닐것 같아요
3.9.일,이번에도 역시나 대대대 만족이에요☺☺ 저처럼 머리 관리 어렵고 머리 손질할 시간이 없다?? 클리닉 하십쇼!! 선주쌤 항상 센스있는 컷트와 적절한 추천 감사해요!! 최고최고🫶
3.8.토,정말 친절하게 머리 잘해주세요~^^ 이런 리뷰 남기면 더 인기가 많아지니 이거 예약하기 어려울 수 있는데 항상 갈 때마다 감사하니 남겨야죠~
3.28.금,2번째 방문인데 아주꼼꼼하게해주시고 매번 머리 너무이쁘게해 주십니다 👍👍👍👍
3.16.일,제가 리뷰 진짜 잘 안쓰는데 인스타보고 기대하고 갔는데 실망했습니다. 저는 예약을 분명 커트+다운펌으로 했는데 남자친구한테 갑자기 시간이 안된다는둥 제가 말하니까 커트 한게 본인이 생각한 그림이 아니라서 다운펌이 안된다는둥 이럴거면 예약은 왜받나요..? 커트만 했는데도 가격도 이가격 주고 짜를만큼 좋지도 않았네요.. 앞머리는 삐뚤빼뚤했습니다
3.17.월,1달간의 약속을 지키려고 꾹 참고 방문해서 머리를 해주셨습니다. 제 스타일과 두상에 맞는 맞춤 머리를 해주셔서 백만배 만족하고 있습니다. 1달뒤에 뵐께요! 감사합니다~
1.4.토,헤어스타일리스트도 예술가라고 생각이 듭니다. 생기가 없던 머리에 활기를 불어 넣어주시네요 ㅎㅎ 덕분에 새해 기분 좋게 시작하네요 ㅎㅎ 감사합니다!
2.18.화,"처음 방문했는데, 친절하게 잘 대해주시고 어색하지 않게 말도 걸어주십니다! 얼굴에 맞게 스타일도 추천해주시고 개인사정 때문에 빨리 가야하니까 헤어쌤들 세분께서 신속 + 정확 + 안전 하게 해주셨습니다~ 다음에 또 방문할게요😌"
3.8.토,두번째 방문 했어요 너무 친절하시고 니즈를 잘 파악해주세요. 그동안 유목민이었는데 도원실장님으로 정착~ 다음달에 만나용
3.2.일,펌 할때 스타일보다도 더 보는게 머리 손상인데 지금껏 이렇게 머리 손상이 없었던 시술은 이번이 처음인것 같아요~! 멀리서 가고 있지만 항상 만족하면서 다니고 있어요 항상 감사드립니다 ㅎㅎ
1.14.화,처음으로 미용실에 정착하고 싶은 마음이 든 미용실이네요!! 머리 상담부터 시술까지 꼼꼼하게 하나하나 정성스럽게 대해주셔서 너무 기분이 좋았습니다! 보조햐주시는 디자이너님도 너무 친절하고 기분 좋았습니다! 끝나고는 머리 손질법 부터 머리 관리법까지 알려두셔서 다음번에도 또 방문하고 싶은 느낌이 들었습니다! 남자 머리라면 시우 디자이너님 추천드려요!!
3.30.일,저희 남자 아이 둘 모두 믿고 맡길 수 있는 바쁘신중에도 친절하고 꼼꼼하신 최고 선생님!
4.10.목,언제나 너무 너무 감사합니당! 1~2달내 뵙겠습니다!
1.12.일,말씀하시는것도 재밌고 미용실 이곳저고 많이 다녀봤는데 숱가위도 안쓰고 처음부터 끝까지 정성스럽게 잘라주시는거보고 왜 다들 예약해서 오시는지 알것같더라구요💖 요즘 남자분들만 오셔서 여자 머리손질이 엄청 오랜만이라고 몇번이나 설레하시는것도 웃겼어요ㅋㅋㅋ 염색도 하고싶었는데 시간이 안되서 못했는데 원장님 솜씨보고 다른 디자이너분 추천받아서 바로 예약했습니다!!👍 예약이 너어~~무 어려워서 일회성인것 빼곤 다만족🙃
3.13.목,커트 염색 다 너무 잘해주시고 꼼꼼하게 원하는대로 맞춰서 해주셔서 넘 좋아용 쌤도 친절하시고 최고👍🏻
24.12.29.일,머리 진짜 잘 해주시는데 사진으로 하하 담지를 못했네요 ㅠ0ㅠ 하지만 진짜 친절하시고 각각 사람마다의 머리 특징에 따라 손질해주시는 것이 너무 좋습니다 머리에 대한 연구를 꾸준히 하시는 것 같아요 늘 항상 잘해주셔서 감사합니다!!!!!
2.5.수,"다들 너무 친절하시구요!! 원하는 스타일 있는지, 중간중간 괜찮은지 확인해주셔서 너무 좋아요. 특히 머리 손질하는 법이나 드라이기 이쁘게 하는 법 알려주셔서 혼자서도 이쁘게 관리할 수 있어요. 기다릴때 간식이나 음료도 같이 주셔서 더더 좋습니다!!"
2.5.수,"타 플랫폼으로 예약한 것까지 포함하면 4번째 방문입니다!  갈때마다 상담도 세심하게 잘 해주시고, 컷트 도중 전체 기장과 앞머리 기장감 등등 괜찮은지 계속 확인해주셔서 언제나 맘에 쏙 드는 결과를 얻어 재방문하게 됩니다.  컷트 완료 후에도, 컷트 도중 놓친 부분이 있다면 편하게 재방문하라고 해주셔서 마지막까지 케어받는 기분이었습니다 (언제나 꼼꼼히 잘 잘라주셔서 추가 방문 할 필요는 한번도 없었습니다 ㅎㅎㅎ).  이번에도 결과물도 너무 맘에 들고, 방문 자체가 힐링되는 시간이었습니다.  다음에도 재방문하겠습니다! 감사합니다 ㅎㅎㅎ"
2.17.월,다음달 입대 예정자입니다. 4급 공익 출퇴근이지만 시우쌤 덕분에 현역 입대하는 기분입니다...!! 트렌디함을 추구하는 저에겐 항상 시우쌤께서 같이 계셨기에 다음 방문엔 삭발입니다 기대하세요 시우쌤!
3.15.토,머리 스타일 추천도 잘해주시고 어울리는 머리를 알아서 잘 해주십니다. 감사합니다.
1.13.월,"이 미용실 저 미용실 다니다, 이곳에 정착한지 벌써 반년이 넘었습니다. 실장님께서 정말 꼼꼼하시고 개인 맞춤 스타일에 맞게 다듬어주십니다. 다음 방문에는 쉐도우펌한다고 말씀드렸습니다. 그랬더니 고데기로 미리 머리 모양을 잡아보기도 하고 제 두상에 맞게! 맞춤 스타일링까지 해주셨습니다. 세심함에 감동받고, 원하는 머리를 만드는 실력에 놀랍니다. 개인 맞춤이고! 또, 본인이 원하는 스타일로 만들어주는 미용실을 찾으신다면, 선주 실장님을 정말 추천드립니다! 먼 거리에도 찾아오게 만드는 가치가 있는 미용실입니다. ^_^"
2.14.금,도원 실장님은 처음부터 지금까지 늘 친절하시고 잘 해주시고 니즈를 잘 파악해서 세심하고 확실하게 스타일링 해주세요. 그리고 스탭 선생님들도 다들 친절하시고 모든 과정을 열심히 도와주십니다.
24.12.31.화,"바람때문에 머리가 좀 지저분해졌는데도 정말 마음에 들고 이쁘게 펌해주셨습니다 :) 매장에서 손질해주셨을 때부터 정말 이뻤어요!!  가격도 합리적이고, 선생님이 친절하게 관리랑 손질법까지 디테일하게 설명해주셔서 더 좋았습니다!"
24.12.23.월,커트인데도 엄청 꼼꼼하게 해주시고 실장님 솜씨가 너무 좋으셔서 항상 만족하면서 머리 받고 있습니다!! 덕분에 사진 잘 찍었네용!
1.19.일,"오랜만에 방문했는데도 기억해 주셔서 놀랐습니다 ㅎㅎ첫 방문 때 얼굴형에 맞는 스타일을 세심하게 추천해 주시고 끝까지 꼼꼼하게 신경 써 주셨던 기억이 나서 다시 찾아왔는데, 이번에도 역시 너무 만족스러웠습니다. 감사합니다!"
2.7.금,아이롱 펌 하고 왔어요! 왕십리역 넓어서 헤메느라 조금 늦게 방문했는데 너무 반갑게 맞이해주셔서 감사햇습미다 ㅎㅎ 머리 어떻게 할지 몰라서 맨날 대충 투블럭만 하고 다녔는데 얼굴형이랑 헤어라인 봐주시고 스타일 추천해주시는데 너무 디테일하셔서 놀람.. 본인도 모르는 본인 스타일 찾을 수 있습니다! 리뷰 쓰고 인기 많아지면 곤란하긴 한데 그래도 많은 사람들이 좋은 곳에서 머리 하면 좋은 일이니까요... 시우 디자이너님 강추 입니다! 너무 광고 같이 쓰는거 같아 걱정이지만 어쩔수 없네요 같이 펌 진행해주신 디자이너님들도 너무 친절하고 재밌어서 즐겁게 자르고 왔습니당
4.13.일,원하는 스타일에 맞춰 잘해주십니다
3.11.화,첫방문이었는데 머리에 대해서 잘 몰라서 상담신청했는데 너무 잘 알려주시고 친절하셨어요 ㅎㅎ 머리도 정말 잘 잘라주시고 이번엔 컷트만 했지만 다음엔 파마도 하러구요! 감사합니다 선주실장님 ~
3.11.화,컬러 추천해 주셨는데 컬러 너무 이쁘게 나왔어요 ☺️ 염색이랑 클리닉 같이 했는데 머리결 너무 좋아졌네용 :) 만족합니당~~>< 다음에 또 방문할께요 ☺️
2.25.화,지금까지 갔던 미용실 중에서 제일 만족감이 높았습니다! 강서구 사는데도 계속 방문하게 되네요 시우 디자이너님께서 원하는 스타일을 잘 찾아주셔서 잘 되는 것 같아요!
24.12.9.월,"너무 조심조심 하시면 오히려 손님 입장에서도 불안한데, 프로페셔널하게 샥샥 거침없이 자르시면서도 모질 파악하시면서 조절하시고, 단발이 여자 머리중에 제일 신경 많이 써야 한다며 찰나도 놓치지 않으시려 이리저리 계속 꼼꼼히 봐주시던 실장님!ㅎㅎ 맘에 진짜 쏘옥 들어요!!! 제 얼굴에 아주 찰떡인 기장감을 찾아주셔서 감사합니다~"
3.1.토,"일찍 도착했는데, 주차공간이 없어서 근처 주차장에 차를 대러 갔다가 자리 없고 북새통에 15분 예약시간 초과. 그러나 홈페이지나 그 어떤곳에서도 주차혼잡에 대한 안내는 없었음. 예약시간에 좀 늦을수 있다고 얘기했는데, 힘들게 주차하고있는데 전화오고, 뛰어가는데 전화와서 예약에 15분 이상 늦으면 자동취소되는데 어떻게 할껀지 재차 물음.. 아... 탈모치료 받고있는중이고 머리를 계속 기르는 중인데 깔끔하게 다듬어 달라고 했더니 뭔가 할게없다고 하면서 끝부분만 아주 조금 만져주심. 경험이 많지 않은 분이셨던것 같고, 여자들을 위한곳은 아닌것 같았음. 유튜브 보고 정착할 미용실이 필요해서 찾아갔는데 두번다시 가고싶지 않음"
1.22.수,머리에 자신감이 없고 스타일링에 고민이 많았는데 드라이 하는 법도 가르쳐주시고 얼굴형에 맞는 머리스타일을 추천해주네요!! 앞으로도 계속 이용하겠습니다 ㅎㅎ
1.28.화,"처음에 도원쌤께 커트 받고 마음에 들어서 또 방문했어요ㅠㅠ! 머리숱이 많은 편인데 항상 꼼꼼하게 잘라주시고 관리 방법까지 알려주셔용..🩵 여러분 저 웬디 됐어요 ㅎㅎ ~~😅🙏🏻 화사한 봄맞이 웬디컷 하러 다들 도원쌤 방문하시길,,!! 매장도 깔끔하고 쌤들 다 친절하셔서 분위기가 너무 좋아용 이제 여기로 정착합니닷 !!! 그리고 너무 저렴해..... 맛집이햐,,~ 무적권 강추.❤️‍🔥"
2.3.월,시우선생님 이쁜 머리 맘에 들게 잘해주셔서 너무 감사합니다!!! *^^* 너무 맘에 들어요 제가 무턱대고 추천해주실 수 있냐구 물어봤는데도 친절하게 하나하나 설명해주고 추천해주셔서 안심하고 받았습니당. 관리법이나 어떻게 잘라달라고 말해야 하는지도 알려주셔서 감사해요 너무 이쁜데 제가 똥손이라 카메라에 머리를 못 담네요... 찍어달라구 할 걸 그랬어요. 새해 복 많이 받으세요 또 뵐게요 ☺
2.15.토,이번에도 정말 만족스러운 머리에요 정말감사합니다 역시 시우선생님은 안성의 보물입니다ㅜㅜ 다음에 또 방문하겠습니다 건강하세요!!!!
1.22.수,자고일어나서 부스스할때도 이쁜머리입니다. 이분께 머리자르고 이쁜 여자친구 생겼습니다. 거짓말 아닙니다.
2.12.수,매달 한 번은 꼭 하늘 원장님께 커트 받고 있습니다~! 제 머리 두상 등을 고려한 완벽한 커트로 매번 큰 만족하며 재방문하고 있습니다 :)
4.3.목,역시 테이 원장님!! 멀리에서 온 보람이 있습니다!!!
1.28.화,처음으로 머리 스타일링을 받았는데 제 얼굴형에 맞게 추천해주셔서 좋았습니다. 마침 리프 쪽을 생각하고 있었는데 세미 리프를 말씀해주셔서 더 좋았습니다 오늘 머리 스타일링 잘 해주셔서 감사합니다 :) 손질법도 친절하게 알려주시고 고생 많으셨습니다 재방문 의사 확실합니다!!
3.1.토,머리도 잘 해주셨고 예약 시간에 조금 늦긴 했는데 그래도 친절하게 해주시고 입담도 좋으셔서 만족했어요 앞으로 자주 갈 것 같아여
4.29.화,일 끝나고 머리자르러 가면 물에젖은 양말상태가 되는데 머리자르고나면 갓 건조기에서 나온 뽀송한 수면양말이되는것 같아 너무 좋습니다. 금요일에 양말 말리러 갑니다~
4.2.수,덕분에 뽀글머리에서 탈출했습니다 감사합니다^^
2.9.일,남자머리 고민 끝?? ㅎㅎ 진짜 이쁘게 잘 잘라주세요 진짜 여러군데 다녔는데 정착했네요 고민 하시는 분이라면 그냥 한번 믿구 머리를 맡기심이.... 아마 저처럼 오~ 하면서 정착하실겁니다
3.17.월,진짜 역대급 만족스럽습니다 인기 많으신 이유가 있습니다 서울살면 여기만 올꺼같네요 지방이라 자주못와서 ㅠㅠ
3.15.토,스타일을 잘 잡아주세요
24.12.4.수,선주 실장님이 추천해 주신 색으로 염색했는데 머리 감고 나오자마자 얼굴이 훨씬 밝아 보이고 저와 찰떡인 게 보여서 마음에 들었어요🥳 갈 때마다 느끼지만 손도 빠르시고 바쁘신 와중에도 손님 한 명 한 명 세심하게 케어해주셔요 ᄒ~~~! 조만간 또 염색하러 갈게요 실장님~~덕분에 기분 전환 아주아주 잘했습니다ㅜ💞💞💞
24.11.26.화,"제 얼굴형과 두상, 모질에 어울리는 스타일을 잘 알려주시고 엄청 자세히 설명해주셔서 놀랐어요! 두상도 특이하고 손질도 어려운 머린데 특징을 바로 캐치하시고 어떻게 하면 더 잘어울릴지 추천해주셨는데 딱 원하는 서비스였어요 제가 머리 주인이긴한데 어떤 스타일이 어울릴지 어떻게 잘라달라고 설명해야 하는지 잘몰랐거든요(머리가 ㅈ랄맞아서ㅠ) 아무튼 너무 만족했습니다:)👍👍"
24.12.2.월,"전능하신 테이원장이시여, 영원한 가위로 날 다듬어주소서. 거룩하신 손재주로 날 이끄시고 내 꾸밈의 길 어둠에 싸여 있어도 신성한 빛으로 내 영혼을 이끄소서."
2.1.토,"최근 머리랑 권태기와서 어떻게 머리를 해야하나 고민이였는데 일단 생각 없이 예약하고 왔습니다 하지만 역시 갓쌤,,, 헤어스타일에 대해 잘 알려주시면서 저에게 잘 어울린 머리를 추천해주면서 최대한 제 마음에 들때까지 만져주셔서 너무 좋았습니다🥹 여기 올려고 이번에 지방에서 올라왔는데 앞으로도 종종 올라와야겠어요,,, 여기에 무덤을 파야겠습니다.. 진짜 최고👍 감사합니다 !!!"
2.24.월,제가 원하는 머리 말고 저한테 잘 어울리는 머리로 진짜진짜 잘 만져주세요 직원분들도 너무너무 착하시고 주위 반응도 너무 좋네요 감사합니다ㅎㅎ
2.8.토,"항상 머리 스타일에 고민이 많았는데 제 두상과 얼굴형에 어울리는 스타일 추천대로 시술을 했습니다. 너무 이쁘게 잘해주시고 친절하게 스타일링 하는 방법까지 알려주신 시우쌤, 연우쌤 감사합니다~~"
2.4.화,항상 섬세하셔서 너무 좋습니다 자연스러운 머리 스타일 추구하는데 딱 그에 맞는 스타일이랑 스타일링 방법도 알려주셔서 항상 자르고 오면 기분이 좋네요
1.12.일,진짜 머리 스타일 추천을 잘해주세요 어울리는것과 안어울리는거 잘 해주시고 세세하게 손 잘봐주세요  머리 정말 마음에 듭니다~~~!!!  다른데 가다가 여기 정착 게다 가격은 다른데 반값도 안되요...
1.18.토,본인한테 맞는 헤어스타일 추천 너무 잘해주십니다:) 첫 스타일링이라면 강추드려요.
24.11.15.금,벨라헤어 단골 입니다 ! 제가 많은 미용실을 다녀봤는데 이곳 시우 디자이너 선생님 아니면 머리 손질 이라던지 머리 관리 이런 것들을 하기 쉽지 않은 것 같아요.. 그만큼 엄청 꼼꼼하게 신경 써주시고 저의 많은 요구에도 정말 친절하게 상담 해주시고 섬세하게 원하는대로 커트 해주십니다 ㅎㅎ 마땅한 사진이 없어서 머리 자르고 당일에 사진관 가서 찍은 사진 첨부 합니다 ! 매번 만족하고 있습니다 감사합니다 ~!
1.18.토,"유튜브를 보고 예약한 지 반년 만에 찾아간 거였는데 막상 서울까지 가는 게 쉽진 않았지만 테이 원장님께 스타일 상담을 받고 추천을 듣고 나니 정말 오길 잘했다는 생각이 들었습니당 연예인을 보는 것처럼 설레기도 했고요 시술이 끝나고 사인도 받았는데, 지금은 코팅해서 소중히 보관 중입니다 원장님이 상담해주신 대로 머리도 잘 기르고 있어요 정말 감사드리고 한국 최고 디자이너이신 것 같아요!"
24.12.24.화,"한달 만에 다시 왔는데 시우 디자이너 님이 제 머리 보시고 상담하면서 지금 제 머리 상황에 맞는 디자인을 해주셨어요, 그리고 나중에 어떻게 관리를 해야하는지, 왁스랑 스프레이를 어떻게 사용해야 하는지 알려주셨어요  시우 디자이너님이랑 상담을 하면서 제 머리 질이 어떤지도 알려 주셨어요!"
1.17.금,헤어 스타일을 잘 모르지만 시우 디자이너님께서 얼굴형과 헤어 상태에 맞는 스타일을 제안을 해주셔서 제 스타일에 딱 맞은 머리를 찾은 느낌이었습니다 저처럼 미용에 대해 잘 모르시는 분들한텐 강추입니다 또 오겠습니다 새해 복 받으세요😀
3.1.토,저에게 어울리는 스타일을 찾아주셔서 좋았어요 자주 방문하겠습니다~
2.9.일,커트하러 갔는데 자연스럽고 이쁘게 잘라주셨어요! 스타일링도 얼굴형에 맞게 꼼꼼하게 해주셨구요 다음에도 이쁜 커트 부탁드려용~
2.2.일,이사와서 미용실 어디갈지 고민했는데 정착할 곳 찾았어요 !!! 그냥 생각없이 컷하러 갔는데 머리숱 많아보이게 예쁘게 잘 잘라주셨어요ㅎㅎㅎ!! 담엔 펌하러 가고 싶네요🤓🤓
24.12.17.화,방문할 때 마다 너무 친절히 대해주시고 머리도 잘 해주셔서 거리가 있어도 매번 재방문합니다 !!
1.16.목,친구 추천으로 왔는데 스타일링 추천도 잘해주시고 결과적으로 펌이 잘나와서 넘 만족스럽습니다!!! 친절하고 꼼꼼하고 실력있는 실장님을 찾아 뿌듯합니다👍
