date,content
"""친절해요""",이 키워드를 선택한 인원
"""원하는 스타일로 잘해줘요""","""원하는 스타일로 잘해줘요"""
"""시술이 꼼꼼해요""",이 키워드를 선택한 인원
"""스타일 추천을 잘해줘요""","""스타일 추천을 잘해줘요"""
"""가격이 합리적이에요""",이 키워드를 선택한 인원
"""관리법을 잘 알려줘요""",이 키워드를 선택한 인원
"""상담이 자세해요""",이 키워드를 선택한 인원
"""트렌디해요""",이 키워드를 선택한 인원
"""손이 빨라요""",이 키워드를 선택한 인원
"""매장이 청결해요""",이 키워드를 선택한 인원
"""남자 머리를 잘해요""",이 키워드를 선택한 인원
"""고급스러워요""",이 키워드를 선택한 인원
"""손상이 적어요""",이 키워드를 선택한 인원
"""맞춤 케어를 잘해줘요""",이 키워드를 선택한 인원
"""좋은 제품을 사용해요""",이 키워드를 선택한 인원
"""분위기가 편안해요""",이 키워드를 선택한 인원
"""자연스러워요""",이 키워드를 선택한 인원
"""대화가 즐거워요""",이 키워드를 선택한 인원
"""과도한 권유가 없어요""",이 키워드를 선택한 인원
"""비싼 만큼 가치있어요""",이 키워드를 선택한 인원
"""가격 안내가 명확해요""",이 키워드를 선택한 인원
"""예약이 편리해요""",이 키워드를 선택한 인원
"""필요한 대화만 오가요""",이 키워드를 선택한 인원
"""관리 효과가 좋아요""",이 키워드를 선택한 인원
"""A/S가 세심해요""",이 키워드를 선택한 인원
"""클리닉 효과가 좋아요""",이 키워드를 선택한 인원
"""유지력이 좋아요""",이 키워드를 선택한 인원
"""주차하기 편해요""",이 키워드를 선택한 인원
"""대기공간이 잘 되어있어요""","""대기공간이 잘 되어있어요"""
10.16.목,"이번에 예지디자이너님에게 처음 커트를 받게 되었는데, 기대 이상으로 완전 꼼꼼하고 예쁘게 시술해주셨어요! 또 시술 후 약속이 있다고 하니 스타일링도 예쁘게 해주셔서 정말 좋았습니다ㅎㅎ 앞으로 제 머리 믿고 맡길 생각입니다😀"
9.29.월,굉장히 친절하시고 남자 머리 두상이랑 모질 관련해서 컨설팅 설명과 관리법을 잘 설명해 주세요 머리도 너무 잘하시면서 대화하는것도 즐거웠습니다. 잘모르시는분들은 믿고 맡기셔도 될거같습니다.
10.19.일,언제나 믿고 찾는 선주 실장님. 제가 원하는 스탈로 딱 맞게 넘 맘에 들게 잘 나왓어요. 감사합니당 손질법도 알려주시고. 실장님 덕분에 20년 똑같은 지겨운 머리 벗어나서 감사드려용 😊👍
8.31.일,"시우쌤께 아이롱펌 시술 받았습니다. 어렸을 때부터 모질이 굵고 곱슬이 심한 제 모발이 고민이었는데 얼굴형, 두상, 이마 넓이까지 세심하게 고려해 맞춤 컨설팅 해주셨어요. 남자 아이롱펌 전문이라 그런지 결과도 자연스럽고 만족스럽습니다. 특히 남자 머리는 아이롱펌은 물론이며 커트까지 모두 믿고 맡길 수 있는 곳이에요!"
9.29.월,"벌써 9번째 재방문인데 올때마다 너무 만족스럽게 잘라주셔서 계속 오게되네요~ 어떤 머리스타일이 어울릴지 잘 모르시는 분들에게는 얼굴형,두상등을 고려해서 스타일을 추천해주시고, 원하는 머리가 있어서 그 머리를 말씀 드리면 얼굴형과 두상에 맞게 원하는 스타일을 최대한 살려서 해주셔서 너무 만족스럽습니다!"
9.28.일,"“선주실장님께 늘 머리하다가, 남자친구 머리도 예쁘게 잘라주실 것 같아 오늘은 예지쌤께 예약했어요. 결과는 대만족! ✨ 세심하게 스타일 잡아주시고 어울리는 분위기까지 살려주셔서 남자친구도 너무 좋아했답니다. 덕분에 저까지 기분 좋게 나왔어요. 다음에도 믿고 예약할게요 :)”"
10.8.수,선주쌤한테 레이어드커트먼저해보고 예뻐서 몇일잇다가 펌했습니다😄😍원래 유목민이였는데 레이어드가 너무 예쁘단소리를 많이듣고 이거다싶어서 그대로 펌까지 했습니다🥰 역시 원하는 느낌대로 딱나와서 너무좋앗어요 ㅎㅎ나이뚜합니다 👍👍 친절하고 손도빠르시고 너무좋앗어요 !! 염색도 하고싶은데 좀더 잇다가 월급받고 또갈게요 !!
10.12.일,얼굴형이랑 두상에 어울리게 커트해주시고 이후 드라이랑 손질 방법도 너무 잘 알려주세요. 그리고 예지쌤 패션감각도 진짜 좋으셔서 헤어컨설팅 뿐만 아니라 코디 추천까지 잘 해주십니다. 멀리서 힘들게 오는데도 예지쌤 너무 착하셔서 올 때마다 이런저런 스몰토크 하면서 항상 힐링하고 가요 ㅎㅎ
9.29.월,첫 방문이라 걱정반 기대반으로 방문 하였는데 정말 만족합니다 아이롱펌 맛집!! 가격도 상대적으로 저렴하고 당일 오후에 유튜브 촬영 말씀드리니 예지 선생님이 꼼꼼하게 신경 써주셔서 촬영 잘하고 왔네요 정말 감사드립니다 ^^ 재방문 의사 있음!! 인스타 sung_hoon0704 팔로워나 게시물 좋아요 한번씩만 부탁드립니다!
10.16.목,"매번 동네원장님 계신 곳에서만 자르다가 준비해야 하는 자리가 생겨 검색해서 트렌디한 느낌의 아르테이로 가게 되었습니다.  예지샘께서 저의 얼굴을 분석해주셨습니다. 기억나는게 + 얼굴이 긴형인데 여러조건들이 더 길게 보이게하고 있음 + 이마비율좋음 + 모질이 안좋고 + 앞머리, 윗머리가 짧고 + 눈썹끝이 옅어서 채워주지 못함  이런 점들을 채워주는 방향으로 커트와 머리스타일을 잡아주셨습니다. 스타일잡는게 실패한 적이 많아서 기대크게안했는데 이제 기대가 되네요  + 아직 펌할 정도 기장이 안 되어서 한 달 뒤에 다시 뵙기로 하였습니다 아이롱펌과 다운펌 진행하기로 했는데 어떻게 될지 궁금합니다!!  예지 샘.수고많으셨습니다. 최고입니다 감사드려요!"
10.13.월,머리 원하던대로 너무 잘하고가요 !  커트 예쁘게 잘해주시고 파마도 원하는느낌으로 잘하고 가요
10.2.목,예지쌤 본지 1년 넘어가는데 섬세한 습관때문인지 엄청 꼼꼼하게 잘라주세요! 분위기에 따른 스타일링 방법도 세세하게 알려주셔서 집에서도 알려주신 그대로 잘 쓰고 있습니다!😀 남자머리 강추드려요!
10.8.수,요새 너무 바빠서 머리할시간도없었는데 드디어 시간내서 선주실장님께 머리받으러 다녀왔어용 매번올때마다 항상 섬세하게 클리닉해주시고 관리법도 잘설명해주셔서 긴머리유지 잘하고있어욧👍🤍🩶 분위기전환드할겸 몇년만에앞머리도 잘라봤는데 딱 앞머리 원하는숱양과 길이 딱 완존 제스탈이예요 굿굿👍👍⭐️⭐️⭐️ 완전마음에들어용🫶🫶🫶 다음재방문때 다시뵈어요 선주실장냠🐰🥰
9.6.토,"그동안 히피펌만 하다가 새로운 머리 스타일 해보고 싶어서, 레이어드 C컬펌 해봤는데 커트 했을 때부터 레이어드 된 느낌이 너무 좋더라구요🤭 페이스 라인에 맞게 예쁘게 잘라주셔서 마음에 쏙! 들었어요. 시술 끝나고 손질법도 친절하게 알려주셔서 방문할 때 마다 기분 좋게 머리하고 가요🥰🥰"
10.3.금,친절하시고 설명도 이해하기 쉽게 해주시고 머리도 꼼꼼하게 잘라주시는게 너무 좋았습니다! 그리고 헤어 스타일도 어떻게 자를까 고민하고 갔는데 꼼꼼히 봐주시고 추천해주셨는데 헤어 스타일이 너무 맘에 드네요!
9.25.목,이번에 해주신 머리 완전 대박 마음에 들었어요!! 여자친구도 이번에 한 머리 보고 갑자기 왜 이렇게 확 잘생겨졌냐고 좋아했어요 ㅎㅎ.. 머리 하는 중간 중간에 계속 뭐 질문드려도 다 친절하게 답변해주셔서도 감사합니다!!
10.5.일,선주 실장님께 머리 자르러 갔는데 너무 맘에 들어요! 원하던 스타일을 딱 잡아주셔서 거울 볼 때마다 만족스러웠습니다😊 분위기도 밝고 편해서 시간 가는 줄 몰랐어요 다음에도 또 방문하고 싶어요🤍
10.19.일,"제 현재 두발 상태와 저에게 어울리는 헤어스타일을 잘 설명해주어서 도움이 많이 되었어요. 집에서 혼자 스타일링 하는 과정, 관리 방법등도 자세히 알려주셔서 잘 배웠습니다. 질문에 대해서도 잘 알려주셔서 새로 알게된 점도 많았습니다. 커트하거나 다듬어야하는 주기에 맞춰서 자주 예약하고 이용 할 예정입니다!"
10.8.수,여자친구 따라서 같이 예약하고왔어요 머리가 직모라 주기적으로 파마하는편인데 선주실장님께 파마 받아봤는데 스타일 마음에 듭니다 😀 옆머리 쪽 볼륨을 신경써서 부탁드렸는데 원하는 스타일대로 잘나와서 매우만족합니다.!! 특히 파마하고 말릴때 손질하는 꿀팁도 자세하게 알려주셔서 집에서도 혼자 잘 말릴수 있을거같네요~! 다음번여자친구와 다시 한번 더 방문예정입니다
10.7.화,선주쌤한테 클리닉이랑 뿌리염색 받았는데 너무너무 맘에 들어용~~~💜💜💜 선주쌤이 제 머리를 잘 만져주셔서 점점 비단결 되는것 같아용ㅎㅎ 다음달에도 부탁드릴게요 쌤 항상 감사해여😍😍😍
10.20.월,"원래 펌을 예약하고 방문하였지만, 예지 디자이너님께서 얼굴형과 기장, 모질을 체크하시고 파마는 부분 부분의 기장을 기른 후에 하는 것이 훨씬 이쁘게 나올 것 같다고 합리적인 이유를 들어 말씀해 주시고 간단하게 커트만 하는 것을 추천해 주셨습니다. 왕십리 또는 그 주변의 여러 미용실을 짧게 짧게 옮겨가며 여러 디자이너분을 경험하였는데 물론 처음 방문하였고 커트만 하였지만 예지 디자이너님의 고객 맞춤으로 해주시는 전문성과 과도한 시술 권유 없이 고객에게 가장 적절한 시술 시기와 스타일을 제안해 주시는 솔직함에 감동받았고 다음에도 다시 방문 드릴 것 같습니다. 덕분에 편안한 분위기 속에 기분 좋게 머리 정리하였고, 다음 펌 때 방문하겠습니다!"
10.18.토,시술전 상담을정말이해쏙쏙되게 잘해주십니다 그리고 시술후결과물이 설명해주신것처럼똑같이이쁘게되서 너무놀랐어요 정말이런게 실력이구나했습니다 다음에 또 방문할게여 주혁디자이너쌤 추천이요👍
10.10.금,6년동안 장발 하다가 큰 맘먹고 짧은 머리를 도전을 했는데 너무 마음에 들었어요!! 어제 처음으로 방문했었는데 도원 실장님께서 어떤 머리가 어울리시겠다 추천도 잘해주셔서 너무나 감사했었습니다!!
10.16.목,"집에서 머리 만질때 헤어제품들 얼마만큼 어떻게 사용해야 하는지, 커트 후에도 추가로 수정하고 싶은 부분 물어봐 주시고 수정했을때 안어울릴것 같은 것들은 안어울릴것 같다고 말씀해주시면서, 그럼에도 최대한 제가 원하는 방향대로 커트해 주셔서 너무 감사했습니다! 리뷰 보시는 다른 분들도 처음 방문이시라면 예지 디자이너님께 머리 하시는거 추천드립니다~"
10.4.토,계속 고민하다가 단발하게 됐는데 어울리는 스타일 추천해주셔서 너무너무 마음에 드는 단발 했어요!! 마음에 안 들까봐 자르면서도 계속 걱정했는데 너무 잘 잘라주시고 혼자서도 쉽게 손질하는 법도 알려주셔서 혼자서도 잘 손질하고 다녀요!!!
9.26.금,선주 실장님께 커트 받았어요! 원하는 대로 빠르게 커트 해주십니당 레이어드스타일로 했는데 딱 원하는 층에 얼굴형도 보완한 스타일로 해주셔서 좋았어욤💗 다음에 또 방문할게요~~!!!
9.27.토,"시우쌤, 도예쌤께 시술 받았어요 😊 두상과 얼굴형에 맞는 스타일을 세심하게 상담해주셔서 편하게 믿고 맡길 수 있었습니다. 제가 머리 손질을 잘 못하는 편인데 친절하게 방법을 알려주셔서 정말 큰 도움이 됐어요. 시술 과정도 편안했고 원하는 스타일을 딱 맞게 완성해주셔서 결과에 너무 만족합니다 ☺️☺️ 스타일링 팁까지 알려주셔서 이제 집에서도 쉽게 손질할 수 있을 것 같아요. 분위기도 따뜻하고 직원분들도 다들 친절해서 기분 좋게 다녀왔습니다. 다음에도 꼭 다시 방문하겠습니다! 🙌"
10.17.금,미용실 유목민이었는데 이번엔 정착할 거 같아요~ 거리가 있어도 찾아올만 합니다. 선주실장님 관리법이나 커트 세심하게 봐주시고 너무 친절하세요!! 머릿결이 너무 부스스해서 막막했는데 얼굴구조에 맞는 스타일 추천해주시고 그 이상으로 예쁘게 잘라주셔서 너무 만족스러웠습니다~ 무엇보다 제 머릿결에 고려해서 펌권유 하지 않고 커트 관리 후 재방문 하도록 설명해주셔서 더 신뢰가더라구요. 스타일 고민되는 분들은 선주실장님께 방문해보면 만족하실 듯 해요.
8.1.금,제가 서울산지 13년되고 여러군데에서 너무 많이 망쳐서 미용실 유목민이었는데 여기 10번째 방문중이에요! 왠만하면 만족해도 후기까지는 귀찮아서 안쓰는데 제가 했던 긴머리중에 오늘 제일 맘에 들어서 너무 감동했어요 ㅠㅠㅠㅠ 그동안 혼자서 유투브 보고 고데기도 해보고 다 해봤는데 똥손인지 안됬는데 도원실장님과 IT 유투버 잇섭 닮으신(칭찬이에요 ㅎㅎ) 남자분이 설명을 너무 잘해주셔서 머리 손질을 제 머리 두상과 뿌리 방향에 맞게 하는지 잘 알게 됬어요. 잘 신경써주셔서 감사해요 미용실 나오는데 오늘 덕분에 기분이 너무 좋아졌어요 ㅠㅠ!! 감사합니다!!
10.4.토,예지쌤한테 제 두상과 모질 바탕으로 추천받아 아이롱펌 처음 해봤는데 적합한 추천이었던 것 같습니다. 남자 머리를 잘 다루시는 거 같고 머리하는 동안 궁금한 거 물어보면 친절하게 대답해주십니다. 덕분에 머리 예쁘게 돼서 감사합니다~ 다음에 기회되면 또 부탁드리겠습니다
10.3.금,커트를 하였는데 평소대로 하던 커트와 다르게 좀 더 저에게 맞는 커트를 해주시고 또 그 이유를 상세히 알려주셔서 공감이가고 이해가 가서 좋았습니다 제 얼굴형이나 두상과 같은 특징을 집어주시며 설명해 주셨음 그리고 앞으로 미래에 할 스타일링과 방향성을 제시해주는것도 너무 좋았고 그루퍼를 이용한 커트 이후에 관리법도 상세히 알려주셔서 너무 감사했습니다!
9.28.일,(머리한 당일날 찍은 사진입니다.) 평소 남자친구는 항상 같은 스타일로 다니는데 인생머리를 찾기 위해 유튜브로 차아서 방문했습니다. 그냥 잘 어울리는 스타일로 해달라고 했고 그 결과입니다. (아이롱펌 + 애즈펌) 남자친구가 앞머리가 많이.. 아니 무척 없는데 단점이 더 드러나는 스타일이 되었네요.. 전문가라 믿고 추천받아 한건데.. 얼굴형엔 맞을지 모르겠지만 단점이 더 부각되니 얼굴형이고 뭐고 눈에 잘 안 들어옵니다.. 심지어 단점이 너무 심하게 부각되니 스트레스 받는지 남자친구가 그날 애즈펌을 가리는 형태로 드라이를 해도 되는지 묻고 이틀이 지나니 앞머리 펌이 다 풀려있고.. 잘 어울리는 스타일을 하신건지 그냥 본인이 잘 하시는 스타일을 하신건지.. 현타 가득입니다.. 저는 여긴 주변에 비추할 것 같습니다
10.7.화,선주쌤은 사랑입니다🫶🏻 염색부터 펌 커트까지 모든게 다 찰떡으로 맘에들어요 ㅎㅎ 탈색모라서 머릿결이 안좋았는데 결까지 살려준 선주쌤 ! 한번 방문하고 단골됬어요~
10.7.화,아르테이 헤어 여자머리도 남자 머리도 잘합니다 ^^ 적극추천!
9.21.일,머리스타일도 좋았지만 처음에 어떤 스타일이 어울릴지 머리외에도 어떻게하면 외모가 좋아보일지 친절하게 알려주셔 좋았습니다 만족하면서 집에 도착하고보니 눈썹정리를 깜박한게 떠오르네요 그래도 좋았습니다 감사합니다
9.27.토,두피 상태를 보고 펌을 할지 말지 잘 얘기해주시고 현재 상태에서 최대한 머리를 잘 잘라주십니다 여성분 리뷰가 많은 것 같아서 처음엔 망설였지만 남자도 잘 잘라주십니다 자르실 때도 계속 괜찮은지 물어보셔서 좋았고 제가 원하는 머리가 안 어울릴 것 같을 때 거기에 맞춰서 최대한 잘 잘라주셔서 좋았습니다 앞으로도 계속 다닐 것 같습니다 :)
10.13.월,"모발상태가 좋지 않아서 머리를 어떻게 하고 다니는게 최선인지도 모르겠다 싶었는데, 생각했던것 이상의 결과물을 보여주셔서 놀랐습니다.  신경 안쓰고 있던 얼굴의 여러 부분들까지 고려해서 디테일하게 최대한 커버해주시려는 모습이 인상 깊었고 세팅방법도 자세하게 알려주셨습니다."
10.17.금,잘생긴 시우쌤과 미모의 보조쌤의 콜라보 돌멩이를 다이아로 가공해버리는 무에서 유를 창조하는 실력 2시간 반동안 엄청 공들여서 해주신 머리.. 첫날엔 컬감이 과한 줄 알았으나 다음날 스타일링을 해보니 너무 예뻐서 손질하면서도 저도 놀랬네요😅 시우쌤.. 잠시나마 살짝 아쉬운 마음을 가진 제가 죄송합니다. 진짜 그냥 믿을게요 의심하지 않겠습니다 어떤 머리 해야할지 모르겠다면 다들 지갑만 챙기고 시우쌤께 달려가세요
7.27.일,넘넘 귀여우신 선주실장님께 신데렐라 클리닉 받았습니당^-^ 머리도 정말 잘 자르시구 과도한 권유 없이 딱 저에게 맞는 스타일 추천해주셔서 아주 만족스럽게 다니고 있습니당!! 덕분에 기분 좋은 미용이었어용 감사합니다❣️
10.19.일,헤어스타일 상담 받으러 갔는데 정말 친절하시고 꼼꼼하게 봐주셨습니다!! 기장이 짧은 상태여서 뭘하기 어려운 상황이었어도 제가 생각한 것보다 훨씬 예쁘게 잘라주셔서 정말 만족스러웠습니다! 다음에는 머리 최대한 길러서 가겠습니다~
10.19.일,"유튜브 보구 테이쌤 예약하려다가 예약이 꽉차서 ㅠㅠ 아쉬웠는데, 그런 마음 싹 가실 정도로 친절하고 스타일 추천도 잘해주셨어요!. 다른 곳 비싼데 여기저기 가봤는데, 수동적으로 해달라는 스타일만 해주고 적극적으로 어떤게 어울린다라는 추천은 없어서 나한테 맞는 스타일인지도 모르겠고. 관리법도 알려주긴 했으나 어려워서 금새 원상복귀 되곤 했는데. 꾸밀줄은 1도 모르는 저같은 놈도 알아먹기 쉽게 차근차근 설명해줘서 너무 좋았어요. 예약했던 선생님, 보조 썜들도 다 선남 선녀에 정말 다 친절해서 너무 편하게 시술 받고 왔습니다. 집이 수원 근처라 먼곳에서 왔는데 정말 후회없어요. 컷트도 이제 앞으로 여기와서 할까봐요. 벌써 다음 달이 기대되네요. 정말 감사합니다~!!"
8.22.금,시우쌤과 환도쌤에게 머리를 맡겼는데 정말 맘에 듭니다! 사진에 다 안 담기는 게 조금 아쉽기는 한데 정말 머리 이쁘게 잘해주고 맛집입니다 맛집 후회 절대 안해요! 그리고 환도쌤도 편하게 대해주셔서 더 즐겁게 시간을 보냈네요 감사합니다~~
9.29.월,항상 방문할때마다 만족하고 가는거같아서 주기적으로가요 원래 남자분이 봐주다가 이번엔 여자분이 봐주셧는데 스텝분도 친절하시고 좋았어요 매번 감사해요
10.18.토,"주혁 디자이너님, 엄청 친절하시고 상담도 디테일하게 해 주셨어요. 사진 한장으로 다 표현이 안 되지만 강추입니다 다음에 또 올 의향이 100% 입니다"
10.16.목,늦게 갔는데도 미용사분이 너무 친절하게 시술해주셔서 감동받았습니다.  게다가 가격까지 합리적이었어요. 유튜브 프리미엄 이라 가격이 비쌀줄알았지만 의외로 전에 했던 마용실보다 아이롱펌 가격이 저렴했습니다.  무엇보다 머리 스타일이 정말 만족스러웠습니다! 이전에 했던 아이롱펌과는 확실히 달랐어요. 자연스러움이 살아있어 손질도 너무 편합니다. 같은 아이롱펌인데도 이렇게 다를 수 있다니 신기하네요. 실력과 서비스 모두 최고입니다! 강력 추천!
10.15.수,첫 방문이었는데 모질과 두상을 고려해서 자세히 커트를 진행주셔서 좋았습니다! 중간중간 커트 진행 방향을 친절하고 꼼꼼하게 설명하면서 진행해 주셔서 편하게 시술 받을 수 있었습니다. 부담스럽지 않게 스타일 추천도 해주셔서 너무 좋았아요! 머리 엄청 마음에 듭니당
10.8.수,시술받는 동안 편하게 해주셔서 기분 좋게 머리했어요 손이 빠르셔서 오래 걸리지 않았는데 마무리까지 꼼꼼하게 해주셨어요!! 머릿결도 많이 안상하구 말리기만 해도 자연스럽게 예뻐서 만족입니다👍
7.8.화,미용실 유목민이었는데 여기로 정착하려구요! 우선 커트를 깔끔하게 잘 해주시고 중간에 괜찮은지 물어보면서 진행해주시니 세심함이 느껴졌어요! 그리고 불필요한 시술 추천은 안해주셔서 마음이 편안했습니다. 마지막으로 어울리는 스타일을 못찾았다고 얘기하니 어울릴 거 같은 스타일을 추천해주시고 맛보기스푼마냥 고데기로 스타일링하여 경험할 수 있게 해주셨어요..! 오늘 고데기 해주신 머리를 좀 즐겨보나 했더니 바람이 머리카락을 내비두지 않더라구요.. ㅠ 엘리베이터 거울을 본 순간 소가 핥고 지나간 거 마냥 헝크러진 머리에 놀랐지만 오늘 커트가 마음에 들어 리뷰를 남겨야겠다는 마음에 나름 정리를 하고 사진과 함께 리뷰를 남깁니다! 좀만 더 길러서 펌하러 방문하겠습니다 😆
10.8.수,선주 실장님한테 머리 받았어용 실장님 완전 기엽구 친절하십니다 머리 추천도 잘 해주시고 드라이도 이쁘게 해주십니당 스탭분들도 친절해여😘 완젼 만족 ✨
9.3.수,자신에게 어울리는 헤어 스타일을 잘 모르시는 분은 정말 꼭 한번 방문 하면 좋을거 같아요!  원장님께서 얼굴형과 특징에 맞게 보일부분은 보이고 가릴부분은 가릴 수 있는 헤어 스타일을 잘 설명해주셔서 방문 후 정말 많은 도움이 됐어요 머리 관리도 세세하게 잘 설명해 주셔서 평소 하던 머리보다 훨씬 더 깔끔해진 느낌입니다🙂  직원분들도 너무 친절 하시고 예약만 성공하면 또 방문하고 싶네요!!
8.2.토,선주실장님 몇년째 단골이에요! 이번에 스타일변화 주고싶어서 뿌리쪽부터 파마 시도해봤는데 자세히 상담해주시고 같이 고민해주시고 영양 듬뿍넣어주셔서ㅜㅜ 정말 손상없이 너무 이쁜 컬 나왔어요!! 파마하기 전 보다 더 부드러워진 내 머릿결ㅎㅎ 딱 제가 원하는대로 컬 나와서 대대대만족입니다!
10.5.일,아르테 선주실장님 친절하시고 상담도 잘해주시고 편하게 원하는 스타일도 이야기하고 조언도 받으며 맞는 스타일을 찾아주셨어요 만족한 결과물을 얻게되어 리뷰를 쓰게 되었네요 불편한점도 성의껏 들어주시고 해결해주시려는 노력이 넘 감사하더라구요 계속 찾게 될것 같고 친구들에게 소개도 해주고 싶어요~
10.5.일,여러 미용실을 다녀봤지만 선주실장님이 최고인듯! 제 두상과 얼굴에 맞게 스타일 추천도 잘 해주시고 꼼꼼하게 관리방법도 잘 알려주셔서 너무 좋아요!!
10.8.수,유튜브 보다가 우연히 알게 되서 가게되었는데 너무 친절하시고 머리스타일도 추천 잘해줘서 예쁜 펌 하고 왔습니다 ㅎㅎ 앞으로 여기 정착 할 것 같아요!
8.17.일,"아이롱펌 전에 다른데서는 실패했었는데 시우쌤이 제대로된 아이롱펌이 뭔지 보여주셨네요~ 머리도 잘해주시고 스타일링 방법, 앞으로 어떻게 기르면 되는지 방향성, 관리법 상세하게 알려주시고 친절하셔서 재방문 의사 200%입니다! 머리 이쁘게 해주셔서 감사해요~~"
9.5.금,도원쌤 최고예요👍👍 이번에는 염색까지 완벽하게 마무리해주셔서 너무 만족합니다👏👏 항상 세심하게 신경 써주셔서 믿고 맡겨요!
10.16.목,제 두형에 어떤 머리가 잘 어울리는지 알려주시고 꼼꼼하게 잘해주세요 다음에 또 올게요~
10.19.일,미리 꼼꼼히 상담해주시고 원하는 스타일대로 잘 해주셨습니다 머리 앞으로 어떻게하면 좋을지도 친절히 알려주었어요
