date,content
"""음식이 맛있어요""",이 키워드를 선택한 인원
"""친절해요""",이 키워드를 선택한 인원
"""특별한 메뉴가 있어요""",이 키워드를 선택한 인원
"""양이 많아요""",이 키워드를 선택한 인원
"""혼밥하기 좋아요""",이 키워드를 선택한 인원
"""재료가 신선해요""",이 키워드를 선택한 인원
"""매장이 청결해요""",이 키워드를 선택한 인원
"""인테리어가 멋져요""",이 키워드를 선택한 인원
"""가성비가 좋아요""",이 키워드를 선택한 인원
"""건강한 맛이에요""",이 키워드를 선택한 인원
"""차분한 분위기예요""",이 키워드를 선택한 인원
"""아늑해요""",이 키워드를 선택한 인원
"""아이와 가기 좋아요""",이 키워드를 선택한 인원
"""잡내가 적어요""",이 키워드를 선택한 인원
"""반찬이 잘 나와요""",이 키워드를 선택한 인원
9.1.월,만두속 실하고 안에 고추 들어가 있어서 매콤하니 칼칼해서 딱 좋아요~국물도 얼큰해서 해장 하기도 좋고 만두집 중에 평양냉면 같은??마성의 매력이 있어요 막 자극적이지도 않으면서 매콤 하면서 삼삼하니 뒤돌아서면 계속 생각나는 만두국이에요~사장님도 친절 하시고 푸짐해서 너무너무 잘먹었습니다^^
9.26.금,집만두인데 매콤~ 입맛 돋는 맛이에요  사장님이 매우 센스 있으세요
4.11.금,"맵찔이긴한데 맛있어서 먹게되네요,, 땀흘리면서 먹었네요ㅎㅎ 사장님도 친절하세요"
5.1.목,매콤하지만 깔끔하고 맛있어요
4.10.목,매운만두국만 판매함 만두가 하얀색이라 안매워보이는데 되게 매움
24.11.7.목,"고추만두가 꽤 매워요 ㅎㅎ 집에서 만든듯한 맛인데, 생각보단 특별하지 않아서 경험해본걸로 만족했습니다!☺️ 사장님이 혼자 조리부터 서빙까지 하시느라 시간이 좀 걸리니 여유있게 방문하는게 좋을 것 같아요~"
24.11.4.월,고추만두국 고기가 듬뿍들어가있는데 고기냄새 전혀 안나고 만두안 야채식감도 무르지 않아 맛있어요 다만 매운맛을 그다지 좋아하지 않아서 🥲 그럼에도 만두는 너무 맛있네요
2.11.화,반응 남기기 방문일 2.11.화 2025년 2월 11일 화요일 7번째 방문 인증 수단 영수증
24.11.30.토,고추냉이만두국.문안.가게테이블 몇개없어요.주인아주머니?혼자하시는듯.단일메뉴로 인당만두국주문해서먹음.가볍게?잘먹고왔어요
24.7.29.월,매운고추지가 들어간 매콤~~한 만둣국!! 즈희는정말 맛있게 먹고왔습니다. 고기냄새 하나도 안나고 담백칼칼힌 만두 진짜 매력적이에요. 국물도 깔끔하고 시원하고 함께나오는 얇은 단무지도 제 스탈이라 좋았습니다. 매운음식 호! 이신분들께 추. 천!! 저는 또 가고싶은 맛집이에욥!!!
24.10.23.수,추운날 맛있게 잘먹고 갑니다 🥟
24.9.10.화,깔끔한 만두국집! 점심으로 먹기 좋았습니다ㅎㅎ
24.10.23.수,반응 남기기 방문일 24.10.23.수 2024년 10월 23일 수요일 6번째 방문 인증 수단 영수증
24.10.4.금,반응 남기기 방문일 24.10.4.금 2024년 10월 4일 금요일 5번째 방문 인증 수단 영수증
24.5.11.토,비가 오는 날이면 참을 수 없이 생각나는 맛이에요. 매번 갈 때마다 아이 간식까지 챙겨 주셔서 감사할 따름입니다.
24.5.10.금,"고기 가득한 손만두, 국에 들어있는 얼큰한 고추맛이 너무 맛있고 떡도 들어가 있어서 든든해요. 보양식 같아요 ㅋㅋ 단무지도 맛있고 잘 어울려요. 서울숲 주변 최고 점심식사에요"
24.6.14.금,"사진은 이래보여도 맛은 미친놈임😭😭😭 맵찔이가 먹었는데ㅣ 매워....!!! 근데맛있어,,,.!!! 이러면서 한그릇 뚝딱햇어여ㅠㅠㅜ 존맛탱"
24.2.2.금,일단 청양고추맛이 너무 좋아요.. 만두국은 적당히 매콤해서 국물 싹싹 마셨고 만두도 많이 들어있어 배불리 먹었어요. 여기 만두는 고기로만 만드시는데 이정도면 가격 좋은것 같아요.. 단무지도 맛있어서 리필해서 먹게되요! 처음으로 만두찜도 먹었어요. 시간이 조금 걸릴수있어 바쁘실땐 주문을 안받으시는데 바로 그자리에서 만두를 빚어 즉석으로 쪄주시더라고요?! 국과 다르게 매운맛이 덜해서 맵찔이들에겐 국보단 찜을 추천할 것 같아요 ㅋㅋ 너무 친절하셔서 기분 좋게 식사하고 갔어요.
24.4.10.수,매콤한 만두속과 맛나는 국물~😋😋😆 얼큰하게 한그릇~~☺️☺️❤️
24.11.25.월,뜨끈하고 얼큰한 만두국 단일메뉴 입니다. 4명 테이블 2개. 2인 테이블 2개로 다소 협소해서 웨이팅은 필수 입니당 ㅎㅎ
24.3.16.토,아이가 아직 매운건 익숙치 않아 매번 아이만 간단히 먹이고 방문하는데 사장님이 그때마다 아이를 신경써주시고 챙겨주시는데 그 마음에 늘 감사할 다름입니다. 칼칼한 국물이 땡길땐 매번 방문하는 만두국 맛집이예요.
24.1.12.금,너무 맛있는 고추만두국이에요❤️‍🔥❤️‍🔥 평소에 만두를 너무 좋아하고 많이 먹으러 다니는데 최애 만두국집이에요! 오늘은 다른날보다 좀더 웨이팅이 있었어요 추운날이라 더 많이 찾는거 같아요!! 오늘따라 더 맛있었던거 같아요❤️❤️ 직접 만드신 만두에 깔끔하게 매운맛으로 회사 근처였으면 매일 왔을거 같아요!! 늘 친절한 사장님도 너무 좋으시고 저만 알고 싶은 맛집이에요🤭
24.6.20.목,반응 남기기 1 명 방문일 24.6.20.목 2024년 6월 20일 목요일 4번째 방문 인증 수단 영수증
24.3.30.토,맵싹한 청양고추만두가 매력적! 국물이 정말 시원 칼칼해서 쌀쌀한 날에 제격이에요 ㅎㅎ
24.4.23.화,너무 너무 맛있어요 힘들고 지칠때 얼큰한게 마구 땡길때 생각나는 성수동 얼큰 떡만두국 먹고나면 스트래스가 확 풀리고 션합니다 ㅎㅎ 오늘도 잘먹었습니다 ^^
24.5.16.목,반응 남기기 방문일 24.5.16.목 2024년 5월 16일 목요일 3번째 방문 인증 수단 영수증
24.1.17.수,맵찔이는 어려운 맵기에요! 고기만 꽉 차있는 만두라 당면 안좋아하는 사람으로써는 너무 좋았어요. 혼자 하시는것 보면 직접 만들어서 주중에만 팔시는 것 같아요. 저는 빨리 들어갔는데 이후로 웨이팅 있었어요. 친절하시고 너무 맛있어서 시간나면 또 올것 같아요!
24.2.13.화,반응 남기기 방문일 24.2.13.화 2024년 2월 13일 화요일 1번째 방문 인증 수단 영수증
23.10.26.목,메뉴이름 하나 적어놓은게 다인 포스에 반해서 들어가봄 왕 큰 만두 5개 떡 약간 간 고기 고명. 고춧가루푼 국물이 특별한 맛은 아닌데 만두는 당면없이 고기로 꽉차있어서 좋았어요~~!
23.11.24.금,오랜만에 또 방문했지만 여전히 맛있어요. 사장님이 바쁘셔서서 찐만두는 주문 못했어요ㅎㅎ
24.3.14.목,반응 남기기 방문일 24.3.14.목 2024년 3월 14일 목요일 2번째 방문 인증 수단 영수증
23.10.2.월,서울숲에 위치한 암암리 만두국과 만두만 나오는 맛집이라고해서 다녀온곳!~~ 만두를 직접빚어서인지 맛도 있구 정성이 듬뿍!~~
23.12.7.목,마치... 엄마가 끓여주는 것 같은 그런 다정함이 묻어나는 만둣국입니다! 게다가 맛있어서 만두를 다 먹을 때까지 숟가락을 놓을 수가 없습니닷! 사장님도 엄마처럼 다정하셨습니다... 자취해서 엄마손맛 그리우신 분들 가세욧!
23.12.14.목,"정말 심각하게 매워요. 일반 고추들어간 음식이라 생각하시면 전혀 못먹습니다. 솔직히 이정도라면 가게 내외부에 적어주시거나 설명을 해주셔야 맞는것같아요.  다들 알고올거라는 생각은 착각인거같습니다. 저희만해도 모르고 들어갔고, 이미 손댄음식 맵다고 환불받거나 클레임을 걸진 않았으니 말이에요. (따진다고 달라질건 없으니;)그런사람이 대부분이지 않았을까 싶습니다. 정-말 핵매운걸 좋아하는 매니아분에겐 입맛에 맞을수도 있어요. 국물은 맹탕느낌이라 또 아쉬웠어요. 맑은 고춧가루국의 만두국 입니다.  아! 그리고 만두국에 밥 안나옵니다. 1천원에 햇반 추가하셔야해요!"
24.4.10.수,만둣국 맛있어서 재방문 하려고요!
24.1.18.목,반응 남기기 1 명 방문일 24.1.18.목 2024년 1월 18일 목요일 3번째 방문 인증 수단 영수증
23.6.15.목,만두 5개 밖에 안들어가서 처음에 배부를까? 했는데 속이 꽉 차있고 너무 맛있어용…푸짐하게 잘 먹었어요~
23.9.22.금,칼칼한 만두에요 맛있어요 사장님이 엄청친절하세요
24.2.3.토,반응 남기기 방문일 24.2.3.토 2024년 2월 3일 토요일 1번째 방문 인증 수단 영수증
23.6.30.금,넘 맛있어요 종종 생각나는 맵칼한 만두국. 나오는데 시간 좀 걸려요 타이밍 잘 맞춰가야지 아님 웨이팅 지옥입니다..!! 그럼에도 불구하고 또 찾게되는 이곳
23.3.21.화,얼큰한 고추 만두국이 정말 맛있는 집이예요! 국물도 맛있고 만두에 송송 들어있는 고추 덕분에 속이 시원합니다. 위가 더 크면 햇반에 국물까지 다 먹을거 같은데 제 위가 작은게 아쉬워요ㅠㅠ
23.4.5.수,손만두가 정말 맛있어요. 만두도 큼지막하고 양도 많아서 다 못먹나 했는데 칼칼한 맛때문에 물리지 않고 다 먹을수 있어요. 만두 좋아하는 사람에겐 대 추천!!! 다만 청양고추 매운맛 못먹는 친구들하고는 못올거 같아요.
23.4.28.금,맵찔이라 눈물콧물 빼면서 먹지만 멈출 수 없는 맛 😋😋 사장님 넘 친절하셔요🫶🏻
23.5.1.월,반응 남기기 방문일 23.5.1.월 2023년 5월 1일 월요일 2번째 방문 인증 수단 영수증
23.5.11.목,저에게는 너무 자극적이고 맵기만했습니다. 라면국물에 볶은 청양고추를 넣은 맛이예요. 특히 공기밥을 판매하지 않으니 햇반을 직접 사오면 데워주는 방식은 정말 별로네요. 화장실도 없고 가격도 음식대비 많이 비싼 것 같아 재방문의사 없습니다. 밑반찬도 단무지 하나예요. 사장님은 친절했어요.
23.5.13.토,반응 남기기 방문일 23.5.13.토 2023년 5월 13일 토요일 1번째 방문 인증 수단 영수증
24.2.5.월,반응 남기기 방문일 24.2.5.월 2024년 2월 5일 월요일 1번째 방문 인증 수단 영수증
23.4.8.토,많이 매워요..양도 넉넉해요.
23.3.15.수,일주일만에 재방문... 매운 거 얼큰한 거 좋아하는 분들은 좋아하실거에요!
23.3.3.금,매운데 칼칼해서 맛있어요. 밥도 같이 팔면 좋을 것 같아요. (이미 있는데 제가 모르는 것일수도..)
23.3.2.목,반응 남기기 방문일 23.3.2.목 2023년 3월 2일 목요일 1번째 방문 인증 수단 영수증
23.2.21.화,맵찔이라 먹을때 눈물 콧물 난리지만 넘 맛있어요 🍲🍲 양도 많아요
23.2.8.수,서울숲에서 제일 맛있는 최애 만두집이에요.
23.3.9.목,얼큰만두국 최고 ㅠㅠㅠ
23.3.28.화,가격이 좀 올랐지만 그래도 여전히 맛있고 양이 많아요 ㅎㅎ
23.3.24.금,든든하게 먹고싶을 때 찾는곳
22.12.4.일,또 방문했어요! 고추만두국 얼큰해서 넘나 제 스타일..!!! 뜨끈하고 얼큰하고 겨울에 먹기 딱좋아요. 양도 많고 엄청 배불러요! 강아지 동반 가능한점도 짱짱
23.3.27.월,반응 남기기 방문일 23.3.27.월 2023년 3월 27일 월요일 1번째 방문 인증 수단 결제내역
23.1.8.일,얼큰하고 단메뉴라 너무 맛있어요👍
22.12.23.금,한그릇 따뜻하게 먹기 좋고 :) 맛있어서 고추양념장도 구매했습니다 ㅎㅎ
23.3.16.목,반응 남기기 방문일 23.3.16.목 2023년 3월 16일 목요일 1번째 방문 인증 수단 영수증
23.3.2.목,반응 남기기 방문일 23.3.2.목 2023년 3월 2일 목요일 1번째 방문 인증 수단 영수증
22.8.2.화,고추만두국 넘 맛있어요 얼얼하게 맵지만 얼큰한 국물맛과 속꽉찬 만두 양이 정말 푸짐해서 배불러도 싹싹 다 먹고 왔어요 여름에도 이열치열로 스트레스 풀리는 맛이에요. 전에 없던 찐만두 개시하셨길래 궁금해서 포장해왔어요 한알한알 포장해주시는 정성에 감동👍찐만두 맛은 더 감동👍👍 식은 후에 먹어도 만두피가 쫄깃해져서 더 맛있고 양념장이 왜 두개지? 했는데 들기름 정말 최고에요 찐만두에 들기름 조합 넘넘맛있어요 고추양념장은 같이 먹은 가족들이 맛있다고 해서 선물용으로 추가 구매까지ㅎㅎ 만두 크게 감동없는 사람인데 암암리만두는 계속 생각나요 또 갈게요~~
23.3.3.금,반응 남기기 방문일 23.3.3.금 2023년 3월 3일 금요일 1번째 방문 인증 수단 영수증
23.3.16.목,반응 남기기 방문일 23.3.16.목 2023년 3월 16일 목요일 1번째 방문 인증 수단 영수증
23.2.21.화,반응 남기기 방문일 23.2.21.화 2023년 2월 21일 화요일 1번째 방문 인증 수단 영수증
22.8.23.화,"-암암리 고추 만둣국 (13.0) 만둣국 치고 조금 비싼데..? 싶은 가격일 수 있지만 이 근방 물가랑 음식 퀄리티를 생각했을때 괜찮다 생각되는 꽤 괜찮은 점심 메뉴… 국물은 시원 칼칼하고, 만두가 상당히 많이 들어있어서 맛있게 먹었다. 원래 먹고 난 후 특유의 텁텁함 때문에 만두를 별로 안좋아하는 편이었는데 암암리 만두는 그런게 없어 정말 맛있게 먹었단 점에서 플러스. 다만 보기보다 꽤 매워서 식후에 장이 약한 일행과 함께 싸르르함을 느끼긴 함."
23.2.21.화,반응 남기기 방문일 23.2.21.화 2023년 2월 21일 화요일 1번째 방문 인증 수단 영수증
23.5.22.월,반응 남기기 방문일 23.5.22.월 2023년 5월 22일 월요일 1번째 방문 인증 수단 영수증
22.12.1.목,"그날그날 메뉴가 바뀌는거같은데 모르고 들어갔는데메뉴1개로통일, 칼칼한 만두국물과 실한 만두 매웠지만 맛났어요"
22.9.4.일,만두너무 맛있어요!! 맵찔이들 맵긴하지만 참고먹어요!!! ㅋㅋㅋㅋㅋ
22.7.15.금,고추만두국 넘 맛있어요~ 매운 음식 싫어하는데 여기 만둣국은 항상 맛있게 먹어요~ 인위적인 매운맛이 아니고 만두 속에 고추가 씹힐 때 매운맛이 나는 정도? 국물도 완전 진하고 완전 요리잘하는 엄마의 집밥 느낌!!!
22.12.19.월,반응 남기기 방문일 22.12.19.월 2022년 12월 19일 월요일 1번째 방문 인증 수단 영수증
22.8.4.목,계속 생각나는 맛이에요 국물이 너무너무 얼큰하고 맛있어요~~
22.9.17.토,만두는 담백하니 맛있고 국물은 얼큰하니 아주 좋아요.제가 만두 5알을 먹으려니 배불러서 1알 남겼습니다.남편하고 가면 남편 1알주면 남자양으론 맞을거 같아요.
22.11.25.금,"힐을 신고 명품 시계, 쥬얼리를 착용하시고 주방과 홀을 오가시던 사장님이 인상적이었어요~"
22.5.8.일,만두국 진짜 맵고 맛있어요 불고기비빔밥도 맛나고! 아이랑 둘이갔는데 아이먹을 것 따로 내어주셔서 정말 감사했습니다!
22.6.1.수,이른시간 오픈함 식당을 찾다가 예전 인스타 추천글 기억나서 첫 손님으로 들어갔습니다. 매운걸 잘 못 먹어서 걱정이 되긴 했는데… 역시나 조금 고난이도 매운맛이었어요. 매운맛 좋아하거나 해장 원하시면 강추합니다.
22.9.22.목,반응 남기기 방문일 22.9.22.목 2022년 9월 22일 목요일 1번째 방문 인증 수단 영수증
22.1.7.금,평소 한식을 굉장히 좋아하는데 메뉴는 딱 2가지인 소고기비빔밥과 고추만두국만 존재합니다🤭  매장은 2인석 2개 4인석 4개가 존재하며 깔끔한 인테리어와 노래선곡도 조용한 은은한 노래들😃  저는 소고기 비빔밥을 주문했고 깍두기 두부구이 콩자반 북어국이 같이 나왔어요😍  소고기비빔밥은 소고기도 굉장히 푸짐하게 들었고 표고버섯도 아낌없이 들어가 있었습니다👍  계란노른자 톡 터트려서 쓱쓱 비벼 반찬들과 맛을 보는데 어머니가 정성스레 차려준 밥 한끼를 먹는 느낌이였고 북어국도 깔끔했어요🤤  반찬과 국은 정해진 메뉴는 아니고 날마다 다른 반찬이 나오는거 같았습니다😄  반찬도 수시로 리필해 주시고 새로운 반찬도 맛보라고 더 가져다 주셨어요🥰  너무 친절하셔서 편안하게 한끼 먹을 수 있었어요☺️
22.10.6.목,반응 남기기 방문일 22.10.6.목 2022년 10월 6일 목요일 1번째 방문 인증 수단 영수증
22.7.12.화,적당히 매콤하고 맛있게 먹었어요!
22.11.4.금,반응 남기기 방문일 22.11.4.금 2022년 11월 4일 금요일 1번째 방문 인증 수단 영수증
22.3.12.토,맛은 있는데 맵질이는 웁니다 ㅠㅠ 처음에는 이정도면 괜찮겠지 했는데 점점 더 매워지는 느낌… 먹고나서 시간 지나니 속이 쓰려서 좀 고생했어여 ㅠㅠ 그래도 사장님께서 친절하시고 플레이팅도 예쁘게 잘 해주셔서 기분은 좋았습니더!
22.4.8.금,메뉴가 두가지인데 만두국이 괜찮고 친절한 느낌은 없어요^^;;
22.2.6.일,집밥 느낌의 떡만두국! 사장님도 엄청 친절하시고~혼자 밥먹기도 좋은곳！
22.1.26.수,"이미 4번째 방문!!!  진짜 정갈하고 깔끔한 집밥 느낌인데  확실히 밖에서 사먹은 느낌도 주는 감칠맛과 플레이팅.  한국인이라면 무.적.권 맛있게 드시고 갈듯합니다.  맛, 양, 친절, 청결 5점만점 5점"
22.1.11.화,맛있게먹었어요! 먹을땐 괜찮았는데 좀 지난뒤에 살짝 속쓰렸어요 참고하세요~
22.4.20.수,반응 남기기 방문일 22.4.20.수 2022년 4월 20일 수요일 1번째 방문 인증 수단 영수증
21.10.24.일,계획없이 들어간 식당이였는데 너무너무너무너무너무 맛있어서 잘 먹고 갑니다!!
22.10.25.화,반응 남기기 방문일 22.10.25.화 2022년 10월 25일 화요일 1번째 방문 인증 수단 영수증
21.11.27.토,"사장님이 너무 친절하셨고, 음식도 정갈한 집밥 느낌으로 넘 맛있었어요💖 정말 오랜만에 손만두를 먹어본건데, 딱 알맞게 매콤하고 정성이 느껴져서 참 좋았습니다!"
21.11.21.일,친절해요. 엄마밥 먹는 느낌
21.12.31.금,반응 남기기 방문일 21.12.31.금 2021년 12월 31일 금요일 1번째 방문 인증 수단 영수증
모호록,"광야의 13시 모호록장소 10 조회수 2765 업체명 암암리 업체명 면화 테마리스트 업체 +8 곳 업체명 짬뽕위에더짬뽕 -암암리 고추 만둣국 (13.0) 만둣국 치고 조금 비싼데..? 싶은 가격일 수 있지만 이 근방 물가랑 음식 퀄리티를 생각했을때 괜찮다 생각되는 꽤 괜찮은 점심 메뉴… 국물은 시원 칼칼하고, 만두가 상당히 많이 들어있어서 맛있게 먹었다. 원래 먹고 난 후 특유의 텁텁함 때문에 만두를 별로 안좋아하는 편이었는데 암암리 만두는 그런게 없어 정말 맛있게 먹었단 점에서 플러스. 다만 보기보다 꽤 매워서 식후에 장이 약한 일행과 함께 싸르르함을 느끼긴 함."
