date,content
23.2.19.일,성수동에 생긴 이탈리아 감성 에스프레소 바 에빠! 유럽에 온 듯한 분위기와 차분한 음악덕에 정말 이탈리아에 온 듯한 느낌이 들었던 공간이에요 무엇보다 에스프레소잔이 화려해서 눈에 띄었는데 직접 이탈리아에서 가져오셨다고 해요 특별한 잔에 마시는 것 같아서 에스프레소가 더 맛있다고 느껴졌습니다😌 에스프레소 자체는 쓴 맛이 덜해서 초심자가 도전하기 좋은 맛이었고 미니 휘낭시에도 겉바속촉 넘 맛있었어요☺️
23.5.7.일,"평소에 에스프레소 좋아해서 자주 찾아다니는데, 여기 커피맛도 너무 향긋하고, 잔이 너무 예쁘네요"
23.3.11.토,성수동에 새로 생겼다고해서 인스타보고 방문해봤는데 안에 인테리어도 깔끔하고 요즘 감성에 맞게 잘 배치해놓은거같아요. 아메리카노랑 에스프레소 먹었는데 원두도 좋은거 쓰시는지 평소에 먹던 커피보다 더 깊고 진한맛이 나서 개인적으로 너무 좋았어요:) 성수동에 작은 아지트를 발견한거같아서 오늘 성수투어는 성공적!
23.9.18.월,분위기 차분하고 사케라토 진짜 맛있네요 👍 맘에드는 뚝섬역 에스프레소바 찾았네요:)
23.6.7.수,오늘도 아침 방문 도장찍었어요!!ㅎ 역시나 커피가 맛있고 이 시간~ 이 가격~이 맛~ 즐길 수 있는 곳 많지 않은데 에빠는 너무 좋아요 오래오래 함께 했음 좋겠어요~♡
23.4.9.일,커피맛을 즐기고 싶으시다면 꼭 에빠 추천요  단점은 카페 찾기 힘들어요~  사장님도 친절하시고 에스프레소와 휘낭시에 넘 맛있어요
23.6.2.금,성수동 에스프레소맛집발견! 작지만 분위기도 좋음
23.3.19.일,"실내에는 3~4개, 야외에도 3개 정도 테이블이 있었고, 에스프레소바 특성상 좁아서 오래 앉아 있을 수는 없었는데, 화창한 날에는 야외도 괜찮겠네요."
23.6.16.금,분위기 좋고 하겐다즈가 들어간 에스프레소☕️ 정말 잘 어울리네요 커피잔도 너무 예뻐요🤎
23.5.21.일,에스프레소와 하겐다즈 조합 👍🏻👍🏻👍🏻
23.5.1.월,커피 너무 맛있어요😍 아메리카노가 이렇게 맛있기 힘든데 맛있는 곳 찾아서 너무 좋아요^^ 자주올게요❤️
23.4.7.금,커피 잔이 마음을 작정하고 홀리는 곳 모카프레소의 초콜릿은 수제라고 하네요! 한모금 한모금 마실때마다 다양한 맛 :)
23.6.23.금,성수동에 유럽이 생겼네요..🫶🏼 에스프레소가 유행이지만 저한테는 너무써서 못먹어서 좀 가벼운걸로 시켰는데 민트맛이 독특해서 좋았어요  휘낭시에진짜맛있고!
23.7.26.수,커피가 너무 맛있어요!!! 사장님 넘 친절하시고 주차까지 편리해서 자주 오겠어요!!!! 성수동에서 이런 곳이라니 갓벽흡니다 정말
23.3.4.토,채광이 너무 좋고 예쁜 카페에요!!! 네이버 검색하다 우연히 알게됐는데 덕분에 너무 예쁜 카페 알게됐네요 :) 사장님 두 분도 너무 친절하시고 특히 휘낭시에가 맛있어요! 이렇게 예쁜 카페 널리널리 알려졌으면 좋겠는데 또 한편으로는 나만 알고싶은.... 종종 들릴거같아요
23.6.13.화,"커피도 원두를 직접 블랜딩해서 사용하신다고 하더니 정말 맛있더라구요, 신메뉴라고 추천해주신 샤케라또랑 레몬에이드도 정말 맛있고 특별하네요 자주 놀러올게요 감사합니다"
23.5.10.수,분위기도 좋고 커피도 맛있어요
23.8.31.목,친절하신 사장님 커피 인테리어 다 좋아요
23.9.6.수,분위기도 커피맛도 일품이었어요~~ 인테리어 예쁘고 잔하나하나 얼마나 신경을 썼는지 느껴지네요^^ 예쁩니다 예쁘고 예뻐요😊 잔은 정말 집에 모셔가고 싶을 정도였네요 ㅎㅎ
23.9.6.수,"내부 엄청 이뻐서 사진 엄청 찍었네요 꽃이랑, 커피잔, 디저트 까지 안이쁜게 없어요 ㅋㅋ 커피 맛도 좋구요!!공간도 엄청 넓어서 수다떨기 좋아요 휘낭시에랑 커치랑 같이 먹었는데 최고의 조합인거 같아요😍 다음에 또 올게요"
23.9.6.수,에스프레소 맛집이네요:) 내부가 유럽에 온것처럼 감성 카페 너무 좋더라구요 꽃장식도 많고 커피도 너무 맛있었어요 뚝섬역에 이런 카페가 있는줄 몰랐네요 자주 올거 같아요 건물 주차도 가능하고 다 만족해요! 추천 합니다
23.7.8.토,신상 에스프레소바 맛있고 친절하신 사장님
23.3.1.수,유럽에 온듯한 느낌! 디자인이 너무 예뻐서 정말 좋았어요💗 커피 맛은 말해모해 에스프레소라서 쓰기만 할줄 알았는데 커피 잘 못 마시는 저도 너무 맛있게 먹을수 있더라구요 자주자주 오게 될 거 같아요 단골예약~
23.4.11.화,커피가맛있고 사장님이 친절해요~~^^
23.7.17.월,"늘 올때마다 감동스러운 에빠, 사장님 정말 찐으로 응원하고 오래오래 이 맛난 커피 먹을 수 있게 해주세요🥹"
23.3.12.일,새로 생겼다해서 가봤는데 사장님 진짜 친절하시고 하나하나 설명도 완벽하고 성수에서 에스프레소바 1등 먹을 예정이에요 웨이팅 생기기 전에 다들 방문하세요 !!
23.2.17.금,"성수동에 에스프레소바가 생겨서 방문해보았어요 :-) 에빠 서울에서는 하겐다즈 아이스크림 하나가 통째로 들어가는 아포카토 스페셜한 메뉴가 있고요, 에스프레소를 주문하면 너무 귀여운 휘낭시에도 하나 같이 나와요 :) 공간도 너무 멋지고 통유리창으로 들어오는 햇살도, 따뜻한 커피가 나오는 에스프레소잔마저 완벽합니다❤️ 에빠 근처에 비슷한 카페가 있어서 헷갈렸는데 일심교회 검색하고 안쪽으로 쭉 들어오시면 에빠서울의 시그니쳐 컬러의 건물을 보실수 있습니다 ☺️☺️"
23.6.7.수,여기 커피 맛집입니다!! 공간이 예뻐 여자친구 인생샷 찍어줘서 칭찬받음ㅋㅋ 참새가 방앗간 못지나치듯 친절한 사장님때문에 근방 지나면 맨날 들르게됨
23.4.28.금,우와~사람들 정말 많네요~~오픈 초기때 왔다가 또 생각나서 얼마 전에 왔는데 역시나 맛있는 곳은 이렇게 잘될줄 알았네요~~ 저역시도 다시찾는거보니말이죠 ㅋ 더 대박나세요^^
23.3.29.수,"“에스프레소바”라서 특별한 느낌이 들고, 이태리 감성이 넘쳐서 매일 오고 싶은 곳이예요😆 테라스에 앉으면 프랑스 느낌도 나구요, 커피 맛도 진짜 좋고 특히!! 컵이랑 접시가 이탈리아 느낌 물씬나는 그릇에 주셔서 여행온거 같은 기분이 드네요💕 인테리어도 유럽감성으로 맘에 쏙 들어서 자주 오게 될거같아요 ㅎㅎ 오래오래 단골할게요!"
23.7.17.월,사장님이 넘 친절하시고 커피가 맛있어서 좋은 기분으로 방문했네요^^ 즐거운 시간 보내고 왔어요 감사합니다ㅎㅎ 주차가 되니까 편리했어요!!
23.4.23.일,분위기도 너무 좋고 직원분도 친절하시네요👍아포카토가 먹고싶어서 주문했는데 여기는 하겐다즈 하나를 통째로 넣어주셔서 깜짝놀랬어요😍완전 제스타일 입맛이네요^^혜자스러운곳찾았어요
23.3.1.수,"서울숲 놀러와서 친구들이랑 커피마시러 갑자기 방문했는데 생각보다 커피도 맛잇구, 분위기도 좋은데 사장님도 친절해서 너무 좋았습니다~나중에 꼭 한번 방문해도 좋을거 같아요👍"
23.7.10.월,반응 남기기 방문일 23.7.10.월 2023년 7월 10일 월요일 1번째 방문 인증 수단 결제내역
23.4.11.화,벨벳 스팀 커피 풍미가 최고
23.7.7.금,반응 남기기 방문일 23.7.7.금 2023년 7월 7일 금요일 1번째 방문 인증 수단 영수증
23.3.19.일,에스프레소 메뉴가 다양했어요. 잔도 예쁘고 이것저것 마시는 재미가 있었어요
23.5.11.목,커피도맛있고 주차가 잘 되어있어서 편해요
23.7.1.토,반응 남기기 방문일 23.7.1.토 2023년 7월 1일 토요일 1번째 방문 인증 수단 결제내역
23.3.3.금,에스프레소 바 첫 도전이었는데 넘 맛있게 즐기고 갔어요!! 사장님도 친절하세요🫶
23.3.26.일,요즘 새로 등극한 성수동 핫플!!! 이태리를 그대로 옮겨놓은 듯한 ㅜㅜ 사진도 너무 잘나오구 커피까지 완전 퍼펙트✨✨ 콘파냐 최애등극 🫶🏻
23.3.1.수,와 지나가다가 길 잘못 들은김에 들렸는데 커피가 너무 맛있네요. 향이 너무 좋아서 사진도 안찍고 먹어버렸습니다. 강추
23.3.19.일,커피 알못이어도 에스프레소를 즐길수있는곳 ~ 사장님 너무 친절하시네요 ! 커피와 어울리는 휘낭시에랑 초콜렛까지 모두 꼭 드셔보시길
23.3.2.목,커피가 맛있고 친절해요~^^
23.3.1.수,"오늘 에스프레스바 처음 와 봤는데 디저트랑 커피 너무 맛있어요ㅠㅠ 사장님도 친절하시고, 카페 분위기도 너무 좋아요 서울숲 놀러오시면 꼭 와보시면 좋을 것 같습니다!"
23.4.20.목,커피가 너무 맛있어요~~ 카페 내 분위기도 좋아서 자주 방문하는곳이에요 오픈시간이 빨라서 출근길에 도장찍고가요! 오늘도 잘먹었어요:)
23.3.4.토,너무 좋아요 위치 헷갈려서 가지않게 주의하세요
23.5.30.화,반응 남기기 방문일 23.5.30.화 2023년 5월 30일 화요일 1번째 방문 인증 수단 영수증
23.4.20.목,☕️ 에스프레소 맛집 ☕️
23.4.11.화,반응 남기기 방문일 23.4.11.화 2023년 4월 11일 화요일 1번째 방문 인증 수단 영수증
23.3.10.금,분위기좋고 커피 넘 고급스럽고~~
23.4.8.토,인테리어가 너무 예뻐요! 햇살도 잘들어오고 그래서인지 커피맛도 더 좋았어요☀️🩷
23.4.11.화,친절하고 커피향이 좋아요
23.2.21.화,에스프레소는 마시기 너무 부담스럽다고 생각했는데 가볍게 마시기 좋고 카푸치노 진짜 너무너무 맛있어요ㅜㅜ 고소함과 산미가 둘 다 적당하게 있는 맛? 분위기도 좋고 또 올게요!!
23.3.4.토,이태리 감성의 카페 성수동에서는 찾아보기 힘든 바이브여서 색다르고 좋았습니다.
23.3.10.금,커피가 너무 향이 좋습니다
23.3.10.금,사장님이 친절하고 커피에 대한 지식이 해박합니다
23.2.18.토,"제일 먼저 커피가 맛있고, 분위기 좋고, 이탈리아에 온 느낌이랄까..? 우리의 토요일을 행복하게 해준 곳 감사합니다😊"
23.3.6.월,인테리어가 아기자기 예쁘네요. 커피가 맛있어요.
23.3.1.수,맛있고 너무 이뻐요
23.3.5.일,반응 남기기 방문일 23.3.5.일 2023년 3월 5일 일요일 1번째 방문 인증 수단 영수증
23.3.18.토,에빠 23.3.21.화 에빠 서울만의 특별한 아포가토 맛있죠! 자주 놀러오셔서 무더워지고 있는 이 날씨를 더 행복하게 즐겨보세요 :)
23.3.11.토,반응 남기기 방문일 23.3.11.토 2023년 3월 11일 토요일 1번째 방문 인증 수단 영수증
23.3.2.목,반응 남기기 방문일 23.3.2.목 2023년 3월 2일 목요일 1번째 방문 인증 수단 영수증
23.5.1.월,간단하게 에스프레소 즐기기 좋아요
23.3.19.일,에빠 23.3.21.화 예쁜 사진 남겨주셔서 너무 감사합니다. 에빠 서울에서 머무셨던 시간이 즐거우셨기를 :)
23.2.28.화,근사한 곳에서 근사한 잔에 마시는 에스프레소
23.3.19.일,반응 남기기 방문일 23.3.19.일 2023년 3월 19일 일요일 1번째 방문 인증 수단 영수증
23.3.15.수,반응 남기기 방문일 23.3.15.수 2023년 3월 15일 수요일 1번째 방문 인증 수단 영수증
23.3.5.일,반응 남기기 방문일 23.3.5.일 2023년 3월 5일 일요일 1번째 방문 인증 수단 영수증
23.5.24.수,"에빠 23.5.26.금 감사합니다, 머무시는 동안 즐거운 시간 보내셨기를 바래요! :) 자주 놀러오세요"
23.4.9.일,반응 남기기 방문일 23.4.9.일 2023년 4월 9일 일요일 1번째 방문 인증 수단 영수증
23.4.9.일,반응 남기기 방문일 23.4.9.일 2023년 4월 9일 일요일 1번째 방문 인증 수단 영수증
