date,content
8.22.금,믹스덮밥이랑 치즈가츠 주문! 치즈 쭈욱! 튀김 맛집이다 시원하게 맥주 마시고
8.17.일,우연히 들른 연남토마 골고루 시켜 가족 모두 맛나게 먹었어요~ 덮밥이 밋있었어요~~
10.18.토,추천받아서 왔는데 메뉴도 많고 특히 야끼니꾸동 맛있어요 !
9.21.일,아이랑 함께 먹기 너무 맛이좋네요 바질파스타 맛있어요♡♡
8.2.토,지나가다 맛나보여 들른 연남토마! 소고기 치즈카츠 너무 맛있어요 나베도 매콤하니 잘먹엇구요~ 잘 온것 같아서 다음에 성수 오면 또 들를게요~~
10.18.토,맛있어요~~ 직원분들도 친절하시고 브레이크타임 없어서 좋아용
10.18.토,성수동 맛집 파스타 맛집 맛있어요 직원분 친절하세요
10.18.토,너무 맛있어요 강추입니다!
10.9.목,양도 많구 아늑하구 분위기도 좋구해서 데이트 장소로도 좋을 거 같아여 가성비도 짱이에여!! 고기가 진짜 부드럽고 달콤한 소스가 밥이랑 찰떡이에여 직원분들도 좋으세여!!
8.9.토,"맛있게 잘 먹었어요! 벌써 3번째 방문입니다 ㅎㅎ 맛있어서 자주 찾게 되는 맛집이에요 차돌중화크림파스타, 돈카츠카레 추천합니당"
8.15.금,커플 부부끼리 왔었습니다~ 바질파스타 시그니쳐 할만하네요 너무 맛있게 먹구 왔습니다
8.21.목,첫 방문인데 음식도 예쁘게 나오고 분위기도 좋아요! 맛있게 잘 먹고 갑니당💗
7.22.화,문도픽사왔다가더운날 젤가까운맛집찾다가 들어왔어요~ 서울숲안쪽으로들어와서골목나오니 금방이네요! 맛있는음식에 착한가격 너무좋아요!!! 맛있게먹고갑니다!!
8.1.금,첫 방문인데 너무 맛있어요ㅎㅎ👍👍 아기랑 같이가서 걱정했는데 바로 입장해서 음식도 빨리나와서 너무 좋네요 담에 또 방문할게요!!
6.17.화,가게 내부가 협소한 편이라 안전하게 예약하고 가는 걸 추천합니다!! 매장 엄청 깔끔하구 좋아용 음식도 다양한데 여기 완전 파스타 맛집이에요 바질 좋아하는 분들은 명란바질오일파스타 꼬오오옥 드세요 바질향 진짜 진하구 맛있어요!! 부채살크림파스타는 전체적으로 불고기버거? 맛이에요 ㅋㅋㅋ 느끼한 거 못 먹는 편인데 한 그릇 싹싹 긁어 먹었숨다 치즈감자고로케는 말뭐~ 사이드로 먹기 딱 좋았어요!! 데이트 할 때 꼭 가 보셔용
10.3.금,맛있어요 분위기 좋아요:)
10.18.토,반응 남기기 방문일 10.18.토 2025년 10월 18일 토요일 1번째 방문 인증 수단 영수증
6.15.일,"차돌 파스타는 새로운 맛이어서 너무 맛있고 좋았어요! 나머지 음식들은 다른 곳에서도 먹을 수 있지만, 맛있는 맛이어서 잘 먹었습니다 ¨̮ 그리고 직원 분께서 너무 친절하셔서 기분이 좋아졌어요!"
10.15.수,음식도 맛있고 매장도 시원하고 조아요
8.6.수,전체적으로 다 맛있습니다. 양도 괜찮고요. 면익힘정도 적절하네요. 저 개인적으론 덮밥이 가장 맛있었어요!
8.18.월,미용실왓다가 맛집추천해달라고햇더니 연남토마를 추천해주더라구요 분위기도 넘 좋구요 딸이랑 맛잇게 먹었답니다
9.28.일,매장이 협소해서 조금 기다렸지만 기다릴만한 맛이었어요~! 마싯네요! 특히 돈가스가 마싯어요!
8.20.수,바질 파스타 진짜 맛있어요 향긋하고 면도 딱 적당해요💗 돈가스도 너무 맛있어요 치즈가 좋은 치즈 같아요 부모님이랑 왔는데 좋네요 또 올 의향 있어요!
9.21.일,아주 맛도리라고 볼수있음적인 장소지요 산단히 만족적이에요
10.15.수,처음 온 곳인데 넘 맛있어요~~담에 무조건 재방문입니다~~
8.17.일,연남토마 성수점도 방문했어요. 음식모두 맛있게잘먹엇어용 일찍와가지고 웨이팅없이 들어왔습니당❣️
8.9.토,양도 많고 맛있어요~ 친절하시고 음식도 빨리 나옵니다 시킨 거 다 맛있었어요! 다음에 또 방문하겠습니다🖤
10.8.수,왕 양 많고 왕 맛있어요~ 최고~~~
10.10.금,"맛은 무난했습니다. 다만, 점장님(으로 보이시는 분)의 손님 응대 태도와, 손님이 많은 상황에서 주방 직원을 나무라며 한숨을 쉬는 모습 때문에 식사하는 동안 다소 불편함을 느껴 식사를 빨리 마치고 나왔습니다."
10.19.일,정말 맛있고 인테리어가 깔끔해요!
10.14.화,"연남토마 성수점 10.17.금 안녕하세요! 연남토마 성수점입니다 😊 음식 맛있게 드셨다니 정말 기뻐요! 저희 음식에 만족하셨다니 너무 뿌듯하고, 덕분에 오늘 하루도 힘차게 시작할 수 있을 것 같아요! 앞으로도 맛있는 음식으로 고객님들께 행복을 드릴 수 있도록 항상 노력하겠습니다. 소중한 후기 정말 감사합니다 👍 접기"
9.30.화,음식이 따뜻하고 맛있어요 매장이 넓고 쾌적해요 !
10.17.금,인생 돈까스집이에요 완전 바삭하고 가성비있습니다!!
10.12.일,"양도 많고 넘 맛있게 먹었습니다!!♥️영수증 리뷰 이벤트로 치즈감자고로케도 먹게됬는데,, 치즈감자고로케도 존맛이네용🥹👍🏻"
10.5.일,퓨전식 좋아하는데 상당히 맛있습니다!
10.18.토,음식이 맛있숩니다 매장도 청결해요!
9.13.토,뮤지컬 보러 서울숲에 왔다가 방문한 연남토마. 서울숲과도 너무 가까워 방문하기도 편했습니다. 가츠덮밥을 파는 데를 찾기 힘들어 오랜만에 먹어보는데 너무 맛있어서 다음에 또 방문하고 싶습니다. 뮤지컬을 또 보러 오면 여기로 올 것 같습니다.
8.17.일,여자친구랑 방문 했는데 너무 맛있었고 양도 푸짐했어요 일식 덮밥류를 엄청 좋아하는데 믹스덮밥 너무 좋았어요. 성수에 오면 또 올것 같아요 리뷰 서비스로 주신 치즈감자고로케 추천!! 다 좋아요!
8.24.일,김치나베가 진짜 너무 맛잇었어요!! 다음에 또 와서 먹고 싶은맛입니다 추천!!! 얀어덮밥도 맛잇고요!! 치즈 감자고로케도 알차고 너무 맛나네요 추천합니다!!!
9.14.일,소고기카츠 정말 부드럽고 오일 파스타인데 바질맛이 너무 향긋해용 다른 퓨전 메뉴도 많은데 다음에 와서 먹을생각입니다 매장도 깔끔하고 분위기도 좋아요!!
10.11.토,분위기도 너무 좋아서 친구나 애인 가족이랑 오기 딱 좋아요 !! 저는 혼자왔는대도 엄창 친절히 대해주시고 눈치 안보고 먹을 수 있었습니다
7.9.수,파스타 맛집👍 카레 맛집👍 파스타 크림소스 왜이렇게 맛있나요? 토핑된 부채살도 부드러워서 입에서 사르르 녹아요~ 카레도 카레 전문점에서 나오는 소스처럼 진하네요~ 싹싹 비우고 가요. 다음엔 치즈 돈까스 먹으러 올래요!!
9.7.일,양도 적당라고 비주얼도 좋고 막있어용 ❤️ 깨끗
8.7.목,평일 점심시간에 방문했습니다. 사람 적당히 많은데 운좋게 자리가 나서 바로 들어왔어요. 성수점은 처음인데 역시 맛있네요. 둘이서 메뉴셋 잘먹구 갑니다!
8.5.화,메뉴 하나하나 너무 맛있어요!❤️❤️❤️ 주문한 모든 메뉴가 성공적🤤 단골 예약이요!
9.9.화,음식도 맛있고 직원분들도 친절하세요. 소고기치즈카츠 강추합니다.
9.29.월,이근처 덮밥중에서는 여기가 가장 맛있어서 자주오고 직원분들도 친절해서 또 오고 싶네요
8.3.일,바질페스토 명란 파스타랑 야끼니꾸 덮밥 먹었는데 너무 맛있었어요❤️ 음식자체도 너무 예뻐서 먹는 즐거움이 더 있었어요
8.23.토,"주말 낮인데도 웨이팅 없이 바로 입장했어요! 안심가츠정식이랑 명란바질오일파스타를 시켰는데, 둘 다 느끼하지 않고 너무 맛있었어요! 특히 명란파스타 추천합니다bb"
7.26.토,"양식 짱이에요!! 가게분위기도 좋고 직원분들도 친절하세요🙂 돈까츠가 진짜 대박이에요!!! 카츠덮밥도 진짜 마싯어요,,,!! 파스타도 굿굿😋😋"
10.11.토,매장도 넓고 깔끔하고 좋아요! 음식도 너무 맛있게 먹고 갑니다!
6.3.화,데이트하기 좋은 성수동 맛집입니다. 분위기도 깔끔하고 음식도 아주 맛있어서 젊은 손님들이 많습니다. 직원분들도 친절하시고 돈까스도 맛있어서 아이 동반 가족끼리 방문하기 괜찮은 서울숲 맛집이네요.
10.15.수,배고파서 방문했는데 빨리나오고 맛도 좋아요
7.20.일,성수동 카페거리에서 접근성 좋고요. 음식 여러개 시켜서 먹었는데요. 다 맛 괜찮았습니다. 다시 또 올거 같아요. 애들 먹기에도 좋았어요.
8.28.목,명란바질오일파스타랑 경양식돈까스 먹었습니다. 경양식돈까스 엄청 크고 소스도 고기도 맛있었고 바질파스타는 향이랑 풍미 좋았습니다. 가성비도 좋고 데이트때 오기 좋아보여요.
9.28.일,맛있어요ㅎㅎ 믹스덮밥이 젤 맛났고 치즈돈가스도 치즈가 부드러워서 맛있어요
9.30.화,맛있어요🩷 연어덮밥 연어가 너무 신선합니당
10.19.일,예전에 인스타에서 보고 지나가다가 우연히보고 들어왔는데 넘 마싯어요!!👍🏻
9.24.수,명란바질오일파스타 너무 맛있어요 ㅠㅠ 혼자 성수 나들이 와서 온 식당인데 후회없이 너무 맛있게 먹고 갑니다 ♥
10.15.수,"친목, 점심 다 괜찮습니다~ 개인적으로 바질 파스타 맛있어요!"
10.12.일,김치나베 엄청 맛있어요 직원분도 친절했습니당 잘먹고가요!
8.31.일,동네 근처 맛집이라 방문했는데  가성비 좋고 맛집입니다!
7.26.토,아이와 서울숲 나들이 나왔다가 너무 맛있어보여서 들렀는데 주문한 메뉴 모두 다 정말 맛있었어요!!👍👍 아이와 오기 좋고 다음번에 방문하면 꼭 다른메뉴 먹어보고 싶네요~~
9.21.일,차돌중화크림파스타는 생각보다 더 맵네용 중독적으로 맛있는 매운맛!! 둘다 맛잇었습니당!! 강추!
6.21.토,양 진짜 많았습니다! 차돌중화크림파스타는 적당히 매콤해서 전혀 느끼하지 않았고 새우튀김덮밥은 완전 부드러움 그 잡채였어요♡♡ 사이드로 치즈감자고로케먹었는데 디따 컸습니다ㅋㅅㅋㅅㅋ 완전 강추👍👍👍
6.3.화,픽사 전시회보고들럿어요 진짜맛잇네요 주차가안되서 좀 헤멧지만 가격더 합리적이고 4개시켯는데 6만원 나왓다고 왜케 적게나왓냐고 신랑이놀랏어요 ㅋㅋ  맛도 너무맛잇어요 파스타는 명란바질 오일파스타인대 아이가 먹을거라 바질 빼달라고 부탁햇는데 들어주셔서 아이가 너무맛잇게먹엇어요
7.13.일,파스타가 양도 많고 특히 부채살크림파스타가 크림의 고소함과 살짝 매콤함도 섞여있어서 중독적으로 진짜 맛있게 먹었어요!! 명란바질도 새우와 함께 먹으면 그 풍미가 어마어마해서 여자친구꺼까지 다 먹었어요!! 추천추천
10.13.월,세 번째 연남토마! 맛나게 잘 먹고갑니다!
8.16.토,아이와 함께 찾은 맛집인데 성공이라고 엄지척입니다 특히 부채살스테이크파스타 정말 맛있고 돈까스도 맛있어서 제대로 찾은 맛집입니다 분위기도 깔끔하고 재방문 의사 100프로 입니다.
10.8.수,메뉴판에 있는 음식 사진과 똑같은 정말 보기 예쁜 음식이 나오고요 또 예쁜만큼 맛도 매우 좋은 음식을 맛볼 수 있었습니다 분위기도 아늑하고 편안해서 소중한 사람들이랑 오기 좋습니다
8.9.토,본점에서도 먹고 여기서도 먹어봤는데 사람도 붐비지 않고 덮밥 기준 본점보다 맛있었던 것 같아요!!ㅎㅎ 연어도 비린 맛 없고 맛있어요!
10.10.금,믹스 덮밥 먹으러 종종 오는데 늘 맛있어요 ! 치즈카츠도 맛있네요:)
10.3.금,지난번에 먹고 맛있어서 재방문했어요 ㅎㅎ 가라아게 강추입니다 튀김종류도 다 넘 맛있어요
8.8.금,"음식이 깔끔하고 맛있어요. 알쌈리조또는 크리미함과 매콤함이 잘 어울렸고 , 가끔 씹히는 통후추가 맘에 들었어요. 그리고 깻잎에 싸먹는 방식이 특이해요. 덮밥의 연어는 두툼해서 맛있었어요."
9.4.목,메뉴가 다 맛있어서 다음에 또올것같아요. 돈까스 특히맛있..🥹✨
8.30.토,아이와 성수동와서 맛있는 음식 먹고가요~~ 너무 맛있어요~~^^
9.11.목,두 번째 방문인데 직원분이 친절하세요 차돌중화짬뽕 넘 마싯어요 데이트할 때 오기 좋은 곳입니당!! 재방문 의사 있어용
7.20.일,"파스타랑 샐러드 먹고왔어요. 음식도 상당히 빠르게 나오고, 바질오일 파스타가 진짜 맛있었어요😄. 원래도 바질 좋아하는데 여자 친구는 지금까지 먹은 바질 파스타중에 최고라고 합니다. 스테이크 크림 파스타도 고기향과 크림이 어울러져 좋았습니다 전체적인 분위기도 좋고 성수오셔서 파스타 먹고싶을때 꼭 오세요"
7.20.일,"돈가스랑 파스타 먹었는데, 돈가스는 겉은 바삭하고 속은 촉촉해서 정말 맛있었어요. 튀김옷이 두껍지 않고 기름기도 적당해서 느끼하지 않게 먹을 수 있었어요. 같이 주문한 파스타도 면이 퍼지지 않고 소스와 잘 어우러져서 만족스러웠고요. 두 메뉴 다 퀄리티가 좋아서 다음에도 또 먹고 싶네요!"
10.7.화,대기없이 바로 입장했음. 양식 메뉴구성도 다양함 연인과 함께 추천
10.7.화,음식이 다양하고 맛있어요!! 특히 파스타가 제일 맛있었어요 사람들도 적당히 있어서 부담가지지 않고 오기 좋았어요🥰🥰 다음에 또 올 수 있으면 또 오고싶네요👍👍
