date,content
"""커피가 맛있어요""",이 키워드를 선택한 인원
"""친절해요""",이 키워드를 선택한 인원
"""디저트가 맛있어요""",이 키워드를 선택한 인원
"""음료가 맛있어요""",이 키워드를 선택한 인원
"""대화하기 좋아요""",이 키워드를 선택한 인원
"""인테리어가 멋져요""",이 키워드를 선택한 인원
"""매장이 청결해요""",이 키워드를 선택한 인원
"""특별한 메뉴가 있어요""",이 키워드를 선택한 인원
"""집중하기 좋아요""",이 키워드를 선택한 인원
"""사진이 잘 나와요""",이 키워드를 선택한 인원
"""가성비가 좋아요""",이 키워드를 선택한 인원
"""아늑해요""",이 키워드를 선택한 인원
"""음악이 좋아요""",이 키워드를 선택한 인원
"""차분한 분위기예요""",이 키워드를 선택한 인원
"""화장실이 깨끗해요""",이 키워드를 선택한 인원
"""빵이 맛있어요""",이 키워드를 선택한 인원
"""좌석이 편해요""",이 키워드를 선택한 인원
"""재료가 신선해요""",이 키워드를 선택한 인원
"""음식이 맛있어요""",이 키워드를 선택한 인원
"""야외공간이 멋져요""",이 키워드를 선택한 인원
"""비싼 만큼 가치있어요""",이 키워드를 선택한 인원
"""뷰가 좋아요""",이 키워드를 선택한 인원
"""컨셉이 독특해요""",이 키워드를 선택한 인원
"""아이와 가기 좋아요""",이 키워드를 선택한 인원
"""메뉴 구성이 알차요""",이 키워드를 선택한 인원
"""주차하기 편해요""",이 키워드를 선택한 인원
"""오래 머무르기 좋아요""",이 키워드를 선택한 인원
9.14.일,제가 성수동에 사는데 위치가 조금 구석에 있어서 이제야 커피 맛집을 발견했네요😅  평소 커피를 잘 안마시는데 여기는 커피의 진하고 고소한 맛이 되게 맛있네요. 위치가 좀 아쉽지만 맛있는 커피를 먹기에 되게 좋은 카페인 것 같아요!!  맛있는 커피를 드시고 싶으신 분이시라면 이곳을 강추드립니다.
8.22.금,"맛있어용👍👍☕️ 콜드블루 구매해서 두고두고 잘먹었습니당🍀 (다만, 유통기한은 아직도 모릅니다..ㅋㅋㅋ) 상하지않게 빨리 다먹었어요✌️💕"
8.29.금,성수동 뚝섬 일대 맛집 많다지만 사실 커피 맛도 밸런스 다양성 중요시한다면 예셰숄 너무 괜찮은 것 같아요. 가격도 합리적인데 커피맛 품질도 옴춍 좋은 편이라 생각해요. 다음 방문은 친구와 와서 디저트도 먹으러 와야겠어요!! 오늘 아아 고소하고 기분 좋은 단맛 만족하고 갑니다:)
9.29.월,조용하고 인테리어도 깔끔하고 사장님도 친절하십니다. 드립커피 먹기전에 따로 샘플로 시향해볼 수 있는것두 좋았구요.
6.10.화,크림라떼 맛집! 율무크림라떼가 최애에요🤩
7.24.목,올 때마다 느끼지만 커피향이 넘 좋음. 특히 드립커피도 있어 굿.
6.29.일,원두 종류가 다양해서 좋아요. 분위기도 말끔하고 직원분들도 다들 친절하셔서 기분 좋은 커피 한 잔 입니다~
6.4.수,드립 커피 종류도 많고 디저트 종류도 많아서 좋아요!
4.13.일,커피가 맛있고 원두도 다양하고 사장님이 정말 친절하십니다 인테리어도 좋고 원두 따로 파시는 것도 보면 정말 좋은 카페 같아요
5.25.일,성수에 이렇게 맛있으면서도 조용한 카페가 있었다니요! 율무티라미수는 처음이라 신기해서 시켜봤는데 고소하고 피넛버터향도 나는 것 같고 암튼 맛있어요.
2.28.금,지나가다 분위기 괜찮아보여서 들렀습니다. 깔끔하고 차분해서 마음이 편안해집니다.  아인슈페너 주문했는데 아인슈페너 역시 깔끔했습니다. 에스프레소 베이스인듯한데 적당한 선을 잘 타는듯 은은한 향이 좋았습니다. 크림이 오버휘핑된 느낌이라 제 취향하고는 거리가 있었네요.
5.25.일,맛있는 커피가 마시고 싶다면 이곳 추천드립니다!♡ 스페셜티커피가 다양해서 좋아요😀
5.4.일,"혼자 와도, 누군가와 함께 와도 참 좋아요. 북적이는 성수 속에서 잠시 숨 쉴 수 있는 공간. 여유롭게 커피 한 잔 즐기기에 딱입니다. 🌟 (무엇보다 커피 맛이 사기...)"
4.14.월,원두가 진짜 좋아요! 직접 내려주시는 필터커피도 향도 맛도 너무 좋습니다:)
7.18.금,카페오레 맛집!! 맛있는 메뉴가 많아서 좋아요~~ ㅎㅎ
7.18.금,율무라떼 마시러 또 왔어요// 디카페인 있어서 너무 잘 애용하고 있습니다~ 맛있어요^^♡
5.16.금,사무실 근처라 종종 방문하는데 필터커피 먹을수 있는곳 많이는 없는데 필터커피 가능해서 좋아요!
5.23.금,필터커피 종류가 다양하고 커피도 맛있고 친절해요!
7.3.목,커피도 맛있고 자두에이드랑 레몬티도 맛있어요~! 커피 마시고싶을때마다 생각나는 곳이에요!
7.10.목,여기 진짜 맛있어요~ 커피는 여기서 즐겨마셔요~ 진짜 찐이에요!
6.14.토,커피 맛이 좋다고 해서 방문!!
4.12.토,"필터커피와 카페라떼,말차 티라미수를 주문했는데 모든게 맛이 적절했어요~사람많은 토요일 성수에서 한줄기 빛처럼, 시끄럽지 않고 편안했어요^*^"
4.6.일,아메리카노 (스윙) 맛있어요. 가게 인테리어도 멋지고 선곡도 센스 있어요.
6.13.금,반응 남기기 방문일 6.13.금 2025년 6월 13일 금요일 1번째 방문 인증 수단 영수증
3.14.금,커피가 맛있습니다. 맛이 진하고 향이 좋습니다. 인테리어도 깖금하고 좋아요.
2.20.목,특별한커피를 마실수있는 조용한 카페네요~~! 필터커피 종류많고 설명도 잘 해주세요 ☺️
3.3.월,커피맛있네요 :) 자주올거같아요!
6.29.일,반응 남기기 방문일 6.29.일 2025년 6월 29일 일요일 1번째 방문 인증 수단 결제내역
1.6.월,커피 너무 맛있어요~♡ 분위기도 좋고 인테리어도 예뻐서 자주 옵니다  특히 커피 맛집~♡♡
1.5.일,휘낭시에 한입에 쏙 넣고 커피 호로록 하러 자주 얼꺼같아요 커피 맛집 인정🫶
1.4.토,커피도 너무 맛있고 분위기가 편안해서 좋아요 ㅎㅎ
3.24.월,커피가 맛있고 장소가 좋아요 날씨 좋은 날은 밖에서 여유있게 마실 수도 있겠어요
24.11.18.월,특별한 메뉴들이 많은 카페예요. 율무크림라떼랑 미숫가루 먹었는데 넘 맛나고 분위기도 좋네요🥰 휘낭시에도 강추해요! 다음에 또 올게요.
1.12.일,깨끗하고 청결한 매장 편안한 무드 그리고 무엇보다도 맛있는 커피!!! 사장님도 아주 친절하십미당 ㅎㅎ
3.2.일,분위기 좋고 커피 필터커피 맛이 너무 좋아요
4.2.수,커피도 맛있고 매장 분위기도 좋습니다!
24.12.3.화,배달만 시켜먹다가 직접 와봤는데 커피가 귀엽고 브라우니가 고소해요
2.3.월,필터커피 유명한 곳이라 왔어용 아아도 종류별로 있고 맛있네요 !
1.4.토,사장님이 너무 친절하시고 커피가 맛있어요! 커피 시향도 도와주셔서 좋았습니다:)
3.9.일,너무 맛있고 세련된 느낌이 있어요
24.10.21.월,넓지 않지만 심플한 실내 공간과 잔잔한 음악. 부담없는 가격의 커피. 직접 가져다주시고 블렌딩에 대해 한 번 더 설명해주셨다.
24.11.3.일,친절하시고 맛도 좋아요ㅎㅎ 피넛버터브라우니 드셔보세용 추천
24.12.23.월,커피설명도 친절하시고 커피도 훌룡해요!
24.11.2.토,그라니따가 생각보다 재미있었어요. 커피 잘 마셨습니다
24.11.22.금,커피 추출 전 분쇄된 원두 시향도 해주시고 커피 맛도 훌륭합니다. 분위기도 좋고 커피 잘 마시다 갑니다!
1.18.토,다양한 종류의 커피가 있어요. 친절하게 설명해 주시고 커피도 맛있어요.
24.12.23.월,보기도 좋은게 먹기도 좋다! 음료가 예쁘고 맛있어요! 음악도 잔잔해서 대화하기도 너무 좋아요 💛
24.12.14.토,커피 고소하니 넘 맛있어요~~~ 사장님도 친절하시고 잘 마시고 갑니당🤍🤍
24.12.25.수,좌석간격이 그래도 떨어져있는편이라 대화하기 좋았습니다. 율무크림라떼도 맛있어요
24.12.23.월,자두티 정말 맛있어요!! 분위기도 좋고 직원분들도 친절해요.
1.11.토,첫 방문인데 커피가 맛있어서 드립백 구매해갑니다^^
24.11.27.수,카페가 이쁘고 커피가 맛있어요!
24.10.16.수,강아지랑 산책하다 너무 힘들어서 들어가도되는지 여쭤봤는데 너무 친절하게 알려주셨어요🥹.. 커피잔도 너무 예쁘고 커피도 맛있고 휘낭시에가 정말 맛있습니다..😻 커피 원두도 고를수있는데 다음번에 갔을때는 다른 원두로 먹어보려고합니당
24.11.2.토,날씨가 좋아서 야외에서 커피한잔 할 곳을 찾다가 들렀어요. 분위기 좋고 음료도 맛있어요 ❤️ 아이를 위한 메뉴와 구움과자도 다양하네요.
1.18.토,카피 너무 맛있어요~~
24.9.22.일,저 밀크티 러버인데 여기 강강추요 !!!! 밀크티 진짜 달고 좋아요💖💖✨아메리카노도 깔끔하고 좋더라고요~~~ 직원분들도 친절하시고 조용하고 감미로운 음악에 너무 힐링되는 시간이었어요>.< 종종 방문하려구요~~~~~~
24.10.27.일,반응 남기기 방문일 24.10.27.일 2024년 10월 27일 일요일 5번째 방문 인증 수단 영수증
24.12.1.일,맛있어요 원두 냄새가 좋아용
24.9.30.월,우선 저는 보늬밤에 들어가는 밤의 익힘 정도를 아주 중요하게 여기거든요… 이 밤의 익힘정도는 타이트 정말 타이트하게 좋았습니다.. 근데 이 밤은 아주 완벽해요.. 밤의 럼과 설탕을 조리고 간장을 첨가하여 간장카라멜을 만들고 단맛을 끌어올리기 위한 소금도 아주 완벽했어요.. 전체적으로 같이 시킨 커피와 아주 조화로웠습니다 사장님 생존하셨습니다.
3.2.일,반응 남기기 방문일 3.2.일 2025년 3월 2일 일요일 1번째 방문 인증 수단 영수증
24.12.6.금,맛있는 드립커피 마시고 가요! 자주 올게요
24.8.15.목,"더운 성수에서 지친 친구와 저에게 희망을 준 카페,, 사실 넘 더워서 더이상 돌아다닐 힘이 없는데 자리가 있어서 우연히 들어온 카페에요! 근데 커피도 맛있고 디저트도 맛있어서 너무 기분좋은 하루를 보낼 수 있었어요💖 커피 왕 추천합니다!!"
24.10.12.토,친구 추천으로 왔는데 분위기 좋고 야외석이 있어서 지금 날씨에 앉아서 여유 즐기기 넘 좋아요! 음료랑 디저트도 맛있어요😆💚
24.9.28.토,조용하고 커피도 맛있고 메뉴도 좋아요!!!
24.8.9.금,음료 기다리는 중인데 매장 인테리어도 너무 깔끔하고 시원하고 음료가 기대되용 성수카페추천!!!!!
24.10.14.월,"사무실 옆 분위기가 참 마음에 드는 카페입니다. 특히 콜드브루는 깔끔하고, 라떼도 맛이 진하네요!! 재방문 고고~~~"
24.12.6.금,드립커피가 너무 맛있어요 ☺️ 또 오겠습니다
24.9.22.일,추석때 못와서 오늘 와봤는데 커피도 너무 맛있고 휘낭시애도... 맛도리💜 오늘은 필터커피를 안먹었지만 다음엔 도전해볼 예정입니다!! ㅎㅎ 집 옆인데 자주올거같아요🥹🫶🏽
24.7.24.수,더워서 우연히 들어왔는데 분위기 너무 좋고 음료가 맛있네요 :) 또 방문하고 싶은 집이에요!!
24.9.19.목,"너무 더워서 지나가다가 들렸는데 분위기도 너무 좋고, 커피도 너무 맛있어요. 빵, 쿠키도 다 직접 구우셔서 맛이 진짜 맛있어요."
24.11.27.수,"커피가 맛있고, 분위기가 기가 막히네용👍"
24.9.23.월,나 커피 또마시러 가야게쏘
24.10.12.토,사장님이 매우 친절하시고 분위기가 너무 좋았어요❤️❤️
24.10.17.목,필터커피 종류가 엄청 다양합니다 커피향도 좋아요.!
24.10.1.화,"커피랑 디저트가 정말 맛있어요 ! 또, 가게 분위기가 좋고 직원분들이 친절하세요 ╰(*´︶`*)╯♡ 자주 오고 싶은 카페를 찾아 기분 좋네요 ◡̈"
24.4.13.토,약속시간보다 일찍나와서 책읽고 싶은 카페를 찾다가 오게 되었는데 차분한 분위기가 너무 맘에 듭니다. 커피원두는 선택이 가능한데 저는 가벼운 느낌의 원두를 골랐습니다. 산미가 강하지 않으면서 상큼한 향이 넘 좋아요 ☕ 오늘 같이 더운날 아이스로 마시니까 기분까지 상쾌한 느낌 ~
24.9.19.목,3시33분에 마시는 커피맛 333😚😚😚
24.10.9.수,반응 남기기 방문일 24.10.9.수 2024년 10월 9일 수요일 1번째 방문 인증 수단 영수증
24.4.23.화,근처에 있다면 매일 데일리커피하러 가고싶은 카페입니다☺️ 사장님이 취향에 맞게 원두를 추천해주시고 저는 부드러운 산미와 단맛이 매력적으로 느껴지는 커피를 마셨는데 디저트와 함께 먹으니 기분전환 재대로 했습니다😘 예셰숄 강추 드려요!
24.7.14.일,유튜브에 나온거 보고 찾아왔어요 커피 맛있고 좋아요. 성수에 번잡음을 피해서 놀러오세요-!
24.11.22.금,반응 남기기 방문일 24.11.22.금 2024년 11월 22일 금요일 1번째 방문 인증 수단 영수증
24.9.22.일,분위기가 너무 좋네용~~~ 한적하고 데이트하기 좋은거 같아요!ㅎ
24.6.6.목,안스타 핏블리 유튭 보고 방문해보고 싶었어요 필터커피는 맛있었어요. 쇼룸이라 작은 공간이고 여름이라 문이 다 열려 있어서 벌레가 좀 들어온거 빼곤 좋았습니다. 커피는 진짜 잘하시는거 같아요.
24.7.15.월,미숫가루 맛집을 찾다 방문했습니다 저는 꾸덕한 농도가 진한 미숫가루를 좋아하는데 예셰솔 미숫가루가 딱 그 맛이라 너무 좋았구요 필터커피 중 라즈베리 향이 나는 커피를 맛봤는데 필터커피 중에 이렇게 맛있는 곳은 구라없이 진짜입니다
24.10.13.일,반응 남기기 방문일 24.10.13.일 2024년 10월 13일 일요일 1번째 방문 인증 수단 영수증
24.4.25.목,매장이 너무 깔끔하고 커피와 수제 밀크티가 너무 맛있어요!!! :) 커피에 진심이셔서 더 좋습니다. 다음엔 브라우니도 도전해보겠습니다 ㅎㅎ
24.4.15.월,"안스타 유튜브에서 보고는 정말 와보고싶었는데, 드디어! 도장찍기 클리어♡ 예셰숄 시그니처인 율무크림라떼 시켜봤는데, 오오! 맛있어요😉"
24.8.10.토,휘낭시에는 맛있는데 라즈베리 갸또는 가격대비 그냥 그랬어요..! 엄청달지 않아서 휘낭시에는 바로 다 먹었습니당~! 커피 맛집이라던데 다음번에는 커피 먹으러 가보려구요!
24.3.23.토,책 한권 가볍게 들고 가서 머무르기 좋은 성수의 보물 같은 카페라고 생각합니다.. 음료도 공간도 디저트도 군더더기 없이 깔끔해서 좋아요! 아늑하고 편안했어요 🖤
24.6.23.일,갈때마다 좋아요. 커피도맛있고 디저트도 다 맛있었음.
24.3.21.목,2번째 방문 👍🏻 - 에티오피아 시다마 벤사 가타 허니 - 추천해 주신 아이스로 마시니 노트에 나오는 맛들이 다 느껴집니다 특히 단맛이 좋아요 👏🏻👏🏻👏🏻
24.9.15.일,반응 남기기 방문일 24.9.15.일 2024년 9월 15일 일요일 1번째 방문 인증 수단 영수증
24.3.12.화,추천해주신 브루잉도 너무 맛있고 브루잉 마실땐 항상 들르는 곳이에요 :) 갈때마다 사장님도 친절하시고 분위기도 좋아요! 강추 합니다!
24.6.1.토,다른 곳에서 먹어볼 수 없는 커피네요. 맛있고 분위기도 자유롭고 좋아요!
24.7.3.수,"설명도 친절하게 잘 해주시고, 무엇보다 매장이 깔끔해서 좋아요!"
24.9.6.금,반응 남기기 방문일 24.9.6.금 2024년 9월 6일 금요일 2번째 방문 인증 수단 영수증
24.6.19.수,반응 남기기 방문일 24.6.19.수 2024년 6월 19일 수요일 1번째 방문 인증 수단 영수증
24.9.14.토,반응 남기기 방문일 24.9.14.토 2024년 9월 14일 토요일 5번째 방문 인증 수단 영수증
24.4.25.목,"처음 와봤는데 분위기도 좋고, 직원분들도 친절해서 기분이 좋아지는 까페에요"
24.4.19.금,커피가 고소하면서 부드러워서 정말 맛있어요! 휘낭시에도 커피하고 딱 어울려요~ 성수 오면 다시 방문할 거에요.
24.3.23.토,커피 좋아하시는 분들에게 추천받아서 성수에 예셰숄에 왔는데 커피좋아하시는 분들은 드립커피로 대중적 입맛에는 시그니쳐 라인의 음료까지 다양하게 매료되기에 충분한 카페인거 같아요~ 직원분도 사장님도 친절하셔요 기분좋은 하루되었습니다~ 감사합니다. 사는곳과 거리는 있지만 성수에 온다면 잠깐이라도 다시 들릴고 싶은 장소입니다 ㅎㅎ
24.8.14.수,반응 남기기 방문일 24.8.14.수 2024년 8월 14일 수요일 1번째 방문 인증 수단 영수증
24.4.12.금,커피맛있구. 원두선택가능하구. 디저트도 맛있구. 친절하시구.감점없는곳.ㅎㄹ
24.1.27.토,사장님이 엄청 친절하셔요!! 커피 짱 맛있고 타르트 대존맛👍🏻
23.12.23.토,카페쇼 참석카페로 갔을때 맛있어서 다시 먹고싶어서 찾아갔어요  원두도 따로 팔고 설명도 잘해주셔서 잘 모르는데 재미있게 먹고왔어요!  브라질 원두 커피도 있는데 첨 보는 원두 지만 부드럽고 편견도 깨지고 맛있습니다.   휘낭시에도 직접 굽는데 진짜 밤휘낭시에 진짜 맛있어요   커피는 드립! 빵은 밤맛 휘낭시에 !
24.4.9.화,커피가 맛있고 사장님이 친절해요.
24.5.29.수,반응 남기기 방문일 24.5.29.수 2024년 5월 29일 수요일 1번째 방문 인증 수단 영수증
24.3.15.금,커피 전문점이라 맛 설명도 잘 해주시고 맛있어요. 아메리카노가 달아요 😄
24.1.11.목,머신 아메리카노 맛있네요.. 그런데 맛살짝 보라고 핸드드립하신걸 서비스로 주셨는데.. 정말 맛있네요.. 머신 만족도 80정도라면 핸드드립은 120..
24.6.28.금,반응 남기기 방문일 24.6.28.금 2024년 6월 28일 금요일 1번째 방문 인증 수단 영수증
24.6.28.금,반응 남기기 방문일 24.6.28.금 2024년 6월 28일 금요일 1번째 방문 인증 수단 영수증
24.6.28.금,반응 남기기 방문일 24.6.28.금 2024년 6월 28일 금요일 1번째 방문 인증 수단 영수증
24.3.17.일,맛있는 커피 드리서 오세요오 완전 맛나요..
23.12.21.목,전체적으로 모던하고 커피완전 맛집👍 추운날 따뜻한 에티오피아 시다모 벤사 코코세 내츄럴 마셨는데 향과 단맛이 잊혀지지 않네요🙂
24.2.8.목,컵 노트 뉘앙스가 고스란히 느껴져서 음미할 때 기분이 좋았습니다
24.4.15.월,커피가 맛있고 친절해서 분위기도 너무 좋아여 !
24.1.26.금,필터커피 맛집이에요 에티오피아 시다마 벤사 하마쇼 진짜 추천드립니다👍 포도 뉘앙스가 입안에 터지고 뒷맛이 깔끔하네요
24.3.19.화,항상 사장님이랑 매니저님이 친철하게 맞이해주세요!! 커피랑 디저트도 항상 너무 맛있게 잘 먹고가는 곳이에요!
24.2.25.일,필터커피. 아메리카노 다 맛있어요
24.3.17.일,설명을 친절하게 잘 해주셔요!
24.1.3.수,☕️☕️☕️☕️☕️ 매장 분위기도 좋고 커피와 디저트 너무 맛있어요. 다들 반갑게 맞이해 주시고 너무 친절하세요~😆😆 기분 좋게 즐기다 갑니다.👍👍
24.1.4.목,필터커피 진짜 맛있어요 커피 좋아하신다면 꼭 방문해보세용 굿굿
24.1.22.월,매번 커피 설명을 잘해주시고 캠핑 느낌의 공간을 지니고 있어서 좋습니다!
23.12.27.수,여기 존맛탱 두번세번갑니다 돈쭐냅시다
23.12.27.수,매장 분위기도 좋고 깔끔합니다. 핸드드립 커피가 굉장히 맛있어요! 기본적으로 단맛이 풍부하고 질감이 굉장히 부드럽습니다! 휘낭시에랑 다양한 디저트류도 판매하시는 엄청 맛있어보이네요.. 바리스타님들도 친절하시고 좋아요 😊😊
24.1.26.금,필터커피를 좋아해서 들렀는데 사장님이 친절히 커피에 대해 설명해주시고 설명해주신대로 맛이 느껴져서 좋은 경험이었어요!
23.12.16.토,성수 올때마다 들르는 카페 브루잉 위주로 마시지만 음료 메뉴와 디저트도 정말 맛있어서 너무 애정하는 곳..!😊 사장님도 정말 친절하시고 분위기도 좋습니다 성수에서 꼭 들려야할 카페 예셰숄👍
23.12.18.월,커피가 맛있습니다! 사장님도 친절하시고 커피에 대한 철학이 느껴져서 좋습니다 :)
23.12.16.토,유튜브 보고 왔습니다! 친절하게 대해주시는 사장님 감사합니다 커피 맛나요🫡🫡🫡
23.12.18.월,설명도 잘해주시고 친절하게 해주셔서 잘즐기다갑니다 다음에 오면 또 오고싶은곳이예요! ;)
23.12.30.토,"사장님도 친절하시고, 목소리도 나긋나긋하셔서 커피 마시는 경험이 너무 좋았습니다. 혼자 일하러 오기도 좋아요. 커피 자체가 되게 다채롭고 맛있어요. 가성비 굿닙니다"
24.1.3.수,커피 설명을 자세히 설명해주셔서 커피 맛을 더 잘 느낄 수 있었어요. 커피 맛이 특별해서 또 방문할 것 같아요.
23.12.10.일,커피는 물론 디저트도 너무 맛있게 먹고 왔습니다 ! 매장도 아늑해서 친구랑 쉬어가기 좋았어요 특이한 메뉴들도 있었는데 다음엔 다른 메뉴도 먹으러 가봐야겠어요
23.12.26.화,디카페인 바닐라라떼도 기본 라떼도 진짜 맛있었어요! 휘낭시에도 맛있어서 맛있는 시간 보내고 갑니다~
23.8.13.일,엄빠들 시원하게 잘 마시고 갑니다:)
23.10.27.금,아쉬운 아인슈페너 ㅠㅡㅠ
23.6.10.토,딸아이 헬로우뮤지엄 아트동동에서 마이터틀 전시연계교육 받을 동안 커피 수혈 했어요. 산미있는 커피 마셨는데 맛있었어요ㅜㅜ
23.11.15.수,반응 남기기 방문일 23.11.15.수 2023년 11월 15일 수요일 1번째 방문 인증 수단 영수증
23.8.30.수,테이크 아웃하기 좋아요
23.10.27.금,반응 남기기 방문일 23.10.27.금 2023년 10월 27일 금요일 1번째 방문 인증 수단 영수증
23.8.30.수,여기는 돈으로 혼내줘야합니다
23.4.7.금,"내 커피 인생의 기연과도 같은 곳, 커피 세상이 이렇게나 넓다는 것을 깨우쳐준 고마운 카페 제가 애정합니다."
23.10.12.목,반응 남기기 방문일 23.10.12.목 2023년 10월 12일 목요일 4번째 방문 인증 수단 영수증
23.6.19.월,반응 남기기 방문일 23.6.19.월 2023년 6월 19일 월요일 2번째 방문 인증 수단 영수증
23.4.1.토,반응 남기기 방문일 23.4.1.토 2023년 4월 1일 토요일 1번째 방문 인증 수단 영수증
22.12.10.토,헬로우뮤지움겄다갸 들러봤는데 세상에 바밀라빈라떼 왜이리 맛있나요..최고 최고!!
23.3.24.금,반응 남기기 방문일 23.3.24.금 2023년 3월 24일 금요일 2번째 방문 인증 수단 결제내역
23.3.20.월,반응 남기기 방문일 23.3.20.월 2023년 3월 20일 월요일 1번째 방문 인증 수단 영수증
23.2.4.토,반응 남기기 방문일 23.2.4.토 2023년 2월 4일 토요일 3번째 방문 인증 수단 영수증
23.2.9.목,시리얼휘낭시에 미친놈이구요 얼그레이크림라떼도 미쳤어영⭐️ 성수1등맛집입니당
23.3.16.목,반응 남기기 방문일 23.3.16.목 2023년 3월 16일 목요일 1번째 방문 인증 수단 결제내역
22.12.20.화,커피만 맛있는 줄 알았는데 딸기라떼도 맛있어요!! 쿠키도 너무 귀여워요:)
23.10.7.토,반응 남기기 방문일 23.10.7.토 2023년 10월 7일 토요일 2번째 방문 인증 수단 영수증
23.5.15.월,반응 남기기 방문일 23.5.15.월 2023년 5월 15일 월요일 1번째 방문 인증 수단 결제내역
23.2.1.수,커피 맛잇는데 그때그때 조금 맛차이가 있어서 아쉬워요
22.11.2.수,응대해주셨던 여자 사장님이 너무 친절하셨어요🫶🏻 커피도 맛있어용👍🏻
23.3.17.금,예~ 셰~ 숄~
22.11.6.일,반응 남기기 방문일 22.11.6.일 2022년 11월 6일 일요일 1번째 방문 인증 수단 영수증
22.4.27.수,사장님이 드립커피 종류도 다양하고 원두설명도 친절히 해주셔서 좋았어요! 골라마신 커피가 민초향인데 커피인?? 담에 가서 다른커피도 도전해볼라구요!!! 친구가 시켜마신건 이름이 기억안나지만 비쥬얼 쩌는ㅋㅋㅋㅋ 원두도 추천받아서 사왔는데 맛날거같아요! 성수갈일있으면 자주 커피마시러갈듯🤤
22.12.19.월,반응 남기기 방문일 22.12.19.월 2022년 12월 19일 월요일 1번째 방문 인증 수단 결제내역
22.12.4.일,반응 남기기 방문일 22.12.4.일 2022년 12월 4일 일요일 1번째 방문 인증 수단 영수증
