date,content
"""음식이 맛있어요""",이 키워드를 선택한 인원
"""양이 많아요""",이 키워드를 선택한 인원
"""친절해요""",이 키워드를 선택한 인원
"""가성비가 좋아요""",이 키워드를 선택한 인원
"""재료가 신선해요""",이 키워드를 선택한 인원
"""직접 잘 구워줘요""",이 키워드를 선택한 인원
"""고기 질이 좋아요""",이 키워드를 선택한 인원
"""매장이 청결해요""",이 키워드를 선택한 인원
"""잡내가 적어요""",이 키워드를 선택한 인원
"""특별한 메뉴가 있어요""",이 키워드를 선택한 인원
"""혼밥하기 좋아요""",이 키워드를 선택한 인원
"""메뉴 구성이 알차요""",이 키워드를 선택한 인원
"""인테리어가 멋져요""",이 키워드를 선택한 인원
"""아늑해요""",이 키워드를 선택한 인원
"""반찬이 잘 나와요""",이 키워드를 선택한 인원
"""단체모임 하기 좋아요""",이 키워드를 선택한 인원
"""차분한 분위기예요""",이 키워드를 선택한 인원
"""음식이 빨리 나와요""",이 키워드를 선택한 인원
"""특별한 날 가기 좋아요""","""특별한 날 가기 좋아요"""
3.8.토,저번에 한번 갔다가 반해서 자주 먹어요! 원래 포장하면 오뎅국이랑 떡볶이는 안 주시는줄 알았는데 주시네요!  아이랑 같이 먹기도 좋고 매장 가면 분위기가 차분해서 좋아요.여기 진짜 추천합니다!
5.9.금,동네에 이런 맛집이 있는지 몰랐네요. 진짜 맛있게 먹었어요 ! 소주 땡길때 또 주문하겠습니다 💕
24.11.7.목,배달로만 먹다가 남편과 매장에서 직접 먹었는데요~ 매장에서 먹으니 떡볶이와 오뎅까지 서비스로 주시고~ 배달도 맛있었지만 매장에서 먹으니 더 맛있었습니다. 가격도 가성비 있구요~ 무엇보다 사장님이 너무 친절하셔서 재방문 예정입니다.
24.10.6.일,"기본 안주로 오뎅이랑 떡볶이가 나와요! 메인메뉴 나오기 전에 술 한잔 하기 너무 좋았고 메인 메뉴인 곱창, 막창 모두 맛있었어요! 양도 많고 야채곱창이 자극적이지 않게 적당히 매콤했어요! 막창도 쫄깃하고 특히 곱창이랑 막창 모두 잡내가 하나도 안나서 먹기 편하고 좋았어요. 사장님도 친절하셔서 기분좋게 먹고 좋은 저녁 되었어요! 번창하세요!"
24.10.15.화,오랜만에 친구랑 간맥하기로 금호동 방문하면서 곱창 먹으러 방문한 오남매곱창! 우연히 방문했다가 맛집 발견했어요 😆 매콤 쫄깃함 가득한 야채곱창부터 순대야채볶음까지 완벽한 식사였는데 기본안주도 오뎅이랑 떡볶이까지 나와서 안그래도 양 많은 곱창으로 배터지는 식사했어요 ㅎㅎㅎ 🙌🏻
24.10.5.토,야채곱창 증독자로서 금호동에 있는 야채곱창집은 다 가봤는데 진짜 여기가 1등...🥹🩷  다른 데는 갈 때마다 잡내 날 때도 있고 누린내? 라고 해야 되나 그런 뭔가 먹기 찝찝한 냄새가 나서 안 가게 되는데 오남매곱창은 갈 때마다 균일한 맛에 사장님도 넘 친절하시고 서비스도 좋아서 자주 와요!  특히 주먹밥 야채곱창이랑 진짜 미친 궁합이니 꼭꼭 추가하시길 추천드립니다 번창하세용🩷
1.8.수,1인분 포장했는데 10분만에 준비되고 양도 적당히 많고 맛있었어요! 어묵 서비스랑 상추도 주셔서 맛있게 잘 먹었습니다🙂
24.9.25.수,사장님 너무 친절하시구 곱창이랑 막창 너무 맛있어서 오랜만에 과식 했네요 볶음밥도 완전 취저❤️ 동네여서 자주 올거같아요!! 맛있게 잘 먹었습니다 ^3^
24.9.25.수,"밑반찬부터 양이 너무 좋았던 곳이네요. 야채곱창, 피자야채곱창, 볶음밥이 너무 맛있는 곳이에요!! 가성비갑입니다. 고물가시대 잘 먹구가네요"
24.10.15.화,금호역 곱창 막창 맛집 오남매곱창! 오뎅 과 떡볶이 가 나오는곳 :) 기가막히게 맛있습니다 막창 과 곱창 이 너무 맛있어요!! 재방문 하겠습니다
24.11.15.금,곱창보다 서비스 오뎅이 맛있음. 그거 먹으러 시키는 듯
24.11.17.일,돼지곱창전골 잡내없이 넘 맛나게 잘먹었읍니다 추운 날씨에 딱이네요
24.8.19.월,지나다가 충동(?) 포장 했어요 몸이 좀 아파서 식사를 못하던 차에 옛추억으로 주문했는 너무 맛나게 먹었어요  서비스 주신 어묵탕 국물까지도 맛나요 집나간 입맛이 돌아 왔네요 순대볶음 먹으로 다시 가려고요
24.10.8.화,곱창에 서비스 오뎅이 일품임.
24.11.10.일,동네 30년 산 사람으로 금호동에 잇는 곱창집 중에  가성비에 맛잇는 곳은 여기입니다
24.9.11.수,맛있어요!!!!!! 너무 친절하시고 필요한거 계속 체크해주시고 아낌없이 반찬 리필해주셔서좋아요 막창은 잡내도 안나서 소쥬 안주에 딱이였어요 동네 아지트 하기에 너무 좋은곳 같아요! 잘먹었습니다~~~!
24.10.10.목,반응 남기기 방문일 24.10.10.목 2024년 10월 10일 목요일 1번째 방문 인증 수단 포장주문
24.4.18.목,맛도 맛인데 분위기가 최고입니당!!👏🏻🤍 맛도 분위기도 일석이조예요ㅠㅠ 와인바같은 느낌으로 곱창집에서 볼수없는 무드예요 ! 데이트로 추천합니댱 곱창도 넘 맛있어요
24.9.21.토,맛있고 곱창집에서떡볶이와 오댕 이 서비스나와서 좋았어요
24.5.18.토,깨끗하고 맛있고 사장님이 친절하셔서 너무 좋습니다! 이사가서 배달 못해서 오랜만에 포장하러 왓네요ㅠㅠ
24.2.8.목,가볍게 들러서 먹기 좋은 곳이애요. 기본 안주로 떡볶와 어묵이 나옵니다.
24.3.24.일,옆지기가 야식 먹자고 하여 지나는 길에 방문 포장했어요. 한참을 기다려 받아와 먹었어요. 내가 좋아하는 건 야채와 당면. 곱창은 별로 좋아하지 않아서 한 개만 먹고 패스. 약간 매운 맛. 자꾸 손이갔어요.
23.10.25.수,기본으로주시는 떡볶이. 오뎅이 마싯음 반칙아닌가요~ㅎㅎ 담백한 소금막창구이 양념배합이 찐. 야채곱창 둘다 컨텍 굿굿임다  가을바람살랑 야장같은곳은 더 마싯는 너낌~♡ 사장님들 넘 친절하세요♡
24.2.28.수,양도 많고 각 메뉴마다 다 맛있어요 같이 주시는 떡볶이도 쫄깃하니 맛있어용
24.5.9.목,반응 남기기 방문일 24.5.9.목 2024년 5월 9일 목요일 3번째 방문 인증 수단 영수증
24.2.17.토,너무 맛있고 양도 많고 사장님도 친절하세요! 야채볶음도 곱창 많이 들어가있고 오뎅도 떡볶이도 너무 맛난 집입니다. 자꾸 방문하게 되어요
23.10.19.목,직접 구워주셔서 바로 먹을 수 있는 막창 :) 소금구이도 데리마요도 넘나 맛있게 잘 먹었습니당ㅎㅎ 서비스로 나오는 오뎅탕도 넘 맛있구 떡볶이도 자꾸 손이가는 맛이었어용😀
24.1.12.금,진짜 너무 맛있어서 급하게 먹느라 사진을 못찍었네요...진짜 너무 맛있고 사장님도 친절하시고 증말 맛있었습니다 잘먹었습니다!!!!!
24.1.12.금,데리마요 곱창 너무 맛잇꾸 ㅠㅠ 야채곱창두 맛나여🩷🩷 사장님두 친절하시구 너무 재밋게 먹구 얘기하다 갑니다아 번창하세여 그래야 또 올쑤잇우니까여!!!>_<
23.10.14.토,"돼지야채곱창,막창 생각나면 매번 가는 찐 단골집!! 자주먹어도 질리지 않는 맛!! 매번 먹어도 맛있어요!!👍 잡내 없고 신선하고 야들야들하니 엄청 맛있어요!😆"
24.1.12.금,진짜 너무 맛있고 사장님도 친절하시구 메뉴 구성도 알차요 인생 곱창집 ㅠㅠ 너무 맛있게 잘 먹고 갑니당!!
24.1.12.금,양도 많고 완전 맛나요!! 사장님 번창하세요~~
23.10.20.금,데리마요 막창 진짜 강추입니다!!! 존맛탱 이동네 젤 양 많고 맛있어요ㅠㅠ 중독성있는맛👍🏻 오늘하루 마무리도 오곱입니다💕
24.4.7.일,반응 남기기 방문일 24.4.7.일 2024년 4월 7일 일요일 1번째 방문 인증 수단 영수증
23.8.5.토,다른 분들은 양이 많다시는데 저는 맛있어서 그런지 아쉬운 맘이 들어요. 그래서 담엔 2배로 주문해야겠어요. 맛있어서 재주문할거예요. 번창하세요~~~~^^
23.10.2.월,곱창 진짜 맛있어요!
23.8.29.화,사장님 서비스도 좋고 넘 맛있습니다^^
23.10.25.수,반응 남기기 방문일 23.10.25.수 2023년 10월 25일 수요일 1번째 방문 인증 수단 영수증
23.8.6.일,반응 남기기 방문일 23.8.6.일 2023년 8월 6일 일요일 1번째 방문 인증 수단 영수증
23.4.3.월,금호동 곱창 1등!! 진심 너무 맛있고 너무 친절하심
23.4.1.토,단골끼리 마주치는 곳!! 나만 알고 싶은 맛집😆 양념막창도 너무 맛있다😍😋 술안주로 최고예요!!👍👍 양도 많고 맛도 최고입니다!❤️
23.1.23.월,설 연휴인데 열려있어서 친구랑 맛있게 먹고왔네요! 개인적으로 야채곱창은 저에게 좀 간이 삼삼한 편이었지만 데리마요막창? 얘는 완전 취향저격이네요💗 다음번에 데리마요막창 먹으러 또 가고싶어요ㅎㅎㅎ
23.7.18.화,냠냠 잘 먹었습니다:)
23.2.24.금,동네 단골집!! 매번 여기만 가면 이것만 시켜먹는당 ㅎㅎ 너무 맛있어요!! 제가 먹어본 야곱중에 제일 맛있어요😋 단골손님 많은 집! 다들 한번 먹어보면 여기서만 먹게 될거예요! 꼭 다들 먹어보세요 ㅎㅎ
23.3.31.금,"소막창구이와 양념막창 주문 픽업했는데 양도 많고 각종 소스와 쌈채소, 오뎅탕과 떡볶이까지 주셔서 놀랬어요. 푸짐하게 맛있게 잘 먹었습니다"
23.4.21.금,냉삼을 먼저 먹은 후 곱창을 먹으면 환상의 조합인것같아요~ 넘 맛있어용🫶🫶
23.4.21.금,진짜 맛있고 또 생각나는 맛입니다 곱창이 쫄깃하고 양념 맛이 맛있어서 입에서 계속 맴돌아요 앞으로도 많이 방문할겁니다 !
23.4.21.금,집 근처 곱창집 맛집 입니다 양 많고 냄새 안나서 여자친구랑 자주갑니다! 떡볶이랑 오뎅 서비스로 주시는데 떡볶이 찐맛집
23.4.30.일,반응 남기기 방문일 23.4.30.일 2023년 4월 30일 일요일 1번째 방문 인증 수단 영수증
23.2.17.금,매번 올때마다 항상 맛있게 먹고있어요 자주와서 그런지 사장님도 알아봐주시고 많이 주셔서 감사합니다. 매번 사모님이 밑반찬도 계속 신경써서 챙겨주시고 다음 회식장소는 여기서!!!!
23.2.4.토,냄새도 안나고 양이 많아서 넘넘 좋았어요 ~!
23.2.2.목,여기 냄새도 안나고 양도 푸짐하고 맛있습니다! 요즘 오뎅꼬치 비싼데 여기는 서비스로 떡볶이랑 같이 주시고 사장님최고예요~! 근처사시면 꼭 추천드립니다!!이동네 숨은 맛집이예요
22.9.29.목,오남매곱창. 금호역 근처에있어요. 오~~~래간만에 갔는데 여전히 푸짐하고 맛있어요. 볶음밥도 아주 푸짐했고요. 가족끼리 방문해서 아주 만족하면서 돌아갑니다!!! 가끔씩 다시 와야겠어요!
23.3.18.토,오남매곱창 23.3.18.토 감사합시다 오뎅국물에 오뎅을 드려야되는데 ^^ 떡복이 오뎅범벅으로 대처했는데 마음이 드시는지는 모르겠네요 다음에도 주문 부탁드려요 ^^
22.12.31.토,반응 남기기 방문일 22.12.31.토 2022년 12월 31일 토요일 1번째 방문 인증 수단 포장주문
22.11.28.월,곱창이 많이 들어있어서 맛있게 먹었습니다 같이 주신 오뎅도 따끈하니 좋았어요
22.10.22.토,단골집인데 너무 양도 푸짐하고 맛있어요🤍 오늘은 포장하고 가네요 매장안에서 먹어도 맛있어여 근처 곱창집 찾으시면 꼭 오세요 맛집인정 !!!! 서비스로 주시는것도 꿀맛
22.10.12.수,야채곱창 생각나면 늘 요기로 와요! 진짜 맛있어용 단골각
22.9.1.목,저 너무 감동이에요 1인분 포장인데 콩나물 국에 쌈야채까지 한가득 주셨어요 요새 배달 시켜도 상추없이 깻잎만 주는 곳도 많고 아예 안 챙겨주시는 곳도 많은데...곱창도 너무 맛있네요 곱창은 여기서 사먹을게여🍚
22.9.12.월,간단하게 술안주로 사가기 좋은 메뉴입니다
22.11.11.금,반응 남기기 방문일 22.11.11.금 2022년 11월 11일 금요일 1번째 방문 인증 수단 영수증
22.7.26.화,곱창은 늘 여기! 깨끗해서 좋아요 :) 떡볶이까지 맛있는 집…
22.10.7.금,1인분인데도 양이 많고 어묵 서비스까지 최고예요!
22.7.1.금,오뎅도 주시고 맛있게 잘먹었습니다.
22.10.21.금,반응 남기기 방문일 22.10.21.금 2022년 10월 21일 금요일 1번째 방문 인증 수단 영수증
22.10.19.수,반응 남기기 방문일 22.10.19.수 2022년 10월 19일 수요일 1번째 방문 인증 수단 영수증
22.6.12.일,기대했는데.. 막창은 질기고.. 야채곱창은 좀 짜네요.. 조금만 개선되었으면 합니다
22.6.7.화,맛있어요 맛있어요 맛있어요
22.7.15.금,반응 남기기 방문일 22.7.15.금 2022년 7월 15일 금요일 1번째 방문 인증 수단 영수증
22.2.3.목,한 입 먹고 찍어서 사진이 좀 이상하지만 맛있습니다. 집앞에 있어서 퇴근길에 포장 주문해서 먹었습니다. 일단 가격대가 참 좋습니다. 요새 기본 2인분 가격인 곳이 대부분이라 한번 사먹으려고 해도 부담스러운데 여긴 1인분이 있어서 좋네요. 양도 푸짐하구요. 곱창도 냄새 나거나 하지 않고 매콤하니 맛있습니다. 앞으로도 자주 주문할 생각입니다.
22.2.28.월,냄새도 안나고 맛이써용
22.6.6.월,반응 남기기 방문일 22.6.6.월 2022년 6월 6일 월요일 1번째 방문 인증 수단 포장주문
22.1.27.목,사진 찍기전에 다 먹었네요. ㅎㅎ 양도많고 맛납니다~^^
21.10.8.금,가끔 시켜먹기도 하고 포장도 해먹는데 오늘도 역시 맛있네요 😋 비오는 금요일 곱쏘가 땡겼는데 덕분에 제대로 불금 즐겼습니다 감사합니다 😆
21.11.3.수,넘넘맛있어요!!! 다른메뉴들도 저번에 먹어봤는데 맛있었어욤
21.11.13.토,"일단 양이 많아 좋아오, 맛은 그냥 그럭저럭 다른 동네 곱창집이랑 비슷해요"
21.9.13.월,자주가는 최애 맛집❤️ 1인분 포장용기가 바뀌어서 대중교통 탈 때에도 냄새가 안나서 좋아용!! 맛도 맛이지만 부부사장님께서 늘 요청사항을 특별히 더 신경써주셔서 좋아요!!! 번창하세요!
21.11.27.토,곱창도 막창도 다 맛나요~~!!!!
21.10.15.금,항상 양도 많고 맛있어요! 제 최애 곱창💕
21.9.30.목,가성비 짱짱 테이크아웃은 처음 먹는데 퇴근후 스트레스 풀기 딱이네요
21.8.18.수,올때마다 너무너무너무 맛있어요!!!! 항상 잘 챙겨주셔서 감사합니다! 곱창 냄새안나고 야채 신선하고 곱창이 야들야들하면서도 양념이 잘 베어있어서 너무 맛있어요!
21.9.25.토,종종 애용합니다. 곱창 막창 맛있어요 서비스주시는떡볶이도 맛나요
21.7.16.금,항상 맛있게 먹고 있습니다 오늘은 혼자 먹느라 가볍게 ㅎㅎ. 코로나때문에 힘드실텐데 단골이라구 서비스 챙겨 주셔서 너무너무 감사드려요! 힘든 시기지만 힘내세요! :)여기는 돈쭐 나야함 너무너무 맛있고 사장님부부 넘 친절하심 !!
21.12.8.수,반응 남기기 방문일 21.12.8.수 2021년 12월 8일 수요일 1번째 방문 인증 수단 포장주문
21.7.15.목,막창이 가성비 갑... 서비스로 주시는 떡볶이도 후추? 카레?맛 나고 존맛. 금호 이근방에서 홀 되는 곳 중 가성비 최강인듯해요. 데이트하다가 왔지만 4명 이하면 모임도 괜춘할듯 합니다~
21.8.7.토,양도많고 맛도있고 사장님 사모님이 친절하세요 ~ 그래서 자주먹으러 갑니당 !
21.7.16.금,갑자기 막창땡겨서 포장주문했는데 너무 맛있어요 냄새도 안나고 서비스도 최고입니다 집이랑 가까워서 자주 시켜먹을게요:)
21.7.30.금,양도 많고 냄새도 안나고 질기지도 않고 너무 맛있어요!!!
21.7.22.목,음식도 다 맛있고 사장님이 너무너무 친절하세요 ❤️ 단골 예약입니다
21.6.18.금,곱창도 맛있고 떡복이도 맛있어요
21.5.27.목,제가 자주가는 곱창 최애맛집입니다 곱창을 거의 주식으로 먹는데 탑3안에 드는거같아요 기본적인 매콤한 양념이지만 냄새도 안나고 정말 맛있고 질리지않아요!
21.7.16.금,데리야기곱창 존맛탱이에요 또 가고싶은 곱창집
21.9.22.수,반응 남기기 방문일 21.9.22.수 2021년 9월 22일 수요일 1번째 방문 인증 수단 포장주문
21.2.28.일,곱창 냄새나면 못먹는데 이집은 냄새도 안나고 사장님이 친절하셔서 자주갑니당 데리마요 너무 맛있어요💛 오뎅서비스로 주시는데 파는거 못지않게 너무 맛있어요 다들가셔서 곱쏘하세요 존맛탱입니다 두번가게되는 맛집이니다~~
21.7.10.토,반응 남기기 방문일 21.7.10.토 2021년 7월 10일 토요일 1번째 방문 인증 수단 영수증
21.3.3.수,아니 별 다섯개가 끝이라는게 아쉬울정도네여 진짜 맛있습니다. 다른프렌차이즈들 보다 훨씬깔끔하고 사장님들도 너무 친절해서 친구랑 몇인분을 시켜먹었는지모르겠습니다 코로나 때문에 힘드실텐데 웃으면서 응대해주시고 양도 넉넉하니 성인남자 3명이서 먹다가 배불러서 나중엔 포장까지 해서 가족들한테도 드렸는데 다들 너무 맛있게 잘먹었다고 하네요 곱창은 잘못하면 잡내가 심한데 잡내없이 너무 깔끔하게 잘먹었습니다 사장님 다음번에 또 찾아갈게요 !!
21.6.18.금,반응 남기기 방문일 21.6.18.금 2021년 6월 18일 금요일 1번째 방문 인증 수단 영수증
21.3.3.수,혼자자취하는데 1인분도 포장되요!!그리고 너무 맛잇어요 제 최애곱창집 공유합니다~~
21.2.28.일,양념도 맛있는데 덜 볶아즈신거 같아여..당면도 다 안 익고 곱창도 좀 질겨서 속상했어여ㅜㅠ손님 없어서 바쁘지 않아보이단데 조금만 더 천천히 정성껏해주셨으면 좋았을 것 같아요ㅜ
21.1.26.화,맛잇어여 친절해여 자주가여
21.2.28.일,갈때마다 항상 맛있게먹고 오네요 ~~ 또 방문하겠습니다~~
20.12.5.토,여기 데리막창 진짜진짜 맛잇어요 서비스로 주는 떡볶이랑 오뎅도 맛잇구 부부사장님 너무친절스바운스 :)
20.7.30.목,맨날사먹는곳 맛있어여 굿굿 #금호동
20.8.3.월,반응 남기기 방문일 20.8.3.월 2020년 8월 3일 월요일 2번째 방문 인증 수단 영수증
20.8.29.토,맛있고 양도 많아요❤❤
20.10.21.수,반응 남기기 방문일 20.10.21.수 2020년 10월 21일 수요일 1번째 방문 인증 수단 영수증
20.4.22.수,여기 데리마요 야채곱창 진짜맛있음ㅠ
20.5.25.월,솔직히 이정도로 깔끔하게 잘하는집 드물어요~ 넘 맛나게 항상 잘 먹고 갑니다 ^^
20.4.8.수,가격도 착하고 맛도좋아요
20.3.18.수,반응 남기기 방문일 20.3.18.수 2020년 3월 18일 수요일 1번째 방문 인증 수단 영수증
