date,content
"""음식이 맛있어요""",이 키워드를 선택한 인원
"""고기 질이 좋아요""",이 키워드를 선택한 인원
"""양이 많아요""",이 키워드를 선택한 인원
"""친절해요""",이 키워드를 선택한 인원
"""매장이 넓어요""",이 키워드를 선택한 인원
9.21.일,최애 치즈퐁듀도 먹었어요 오늘따라 고기가 더 신선하고 살코기가많은느낌입니다 느끼함을 잡아주는 순두부도 금방나와서 고기먹기전에 더 입맛을 돋구어주네요~^^ 셀프바도 있어서 야채 눈치안보고 더먹을수있어요
10.1.수,내 최애 등갈비맛집👍🏻👍🏻 초벌되서 나와 금방 익고 육질 엄청 부드럽고 양념 깡패임 ㅜㅠ 순두부찌개는 술도둑😆 사장님 팁!! 고기는 한면씩 1분 골고루 4분 구워서 냠냠 하시면 천상의 맛!!!!🧡
10.8.수,등갈비가 생각날 때마다 왕코로 옵니다! 너무 맛있어요! 등갈비 한입에 순두부찌개까지 캬~~ 겨울에 더 자주찾게 되는 등갈비집이예요
9.26.금,남편이랑 술 생각날 때마다 진짜 자주 오는 곳이에요^^ 오늘은 사촌동생이랑 같이 왔는데 잠실에서도 자주 온다고 할 정도로 완전히 맛집이라고👍👍👍 하네요.❤️ 진짜 최고의 등갈비집이에요 여기서 서비스로 나오는 순두부찌개는 무조건 먹어야 돼요😁
10.10.금,순두뷰찌개도 넘넘맛나고 고기도 넘넘맛나요! 반찬도 셀프바라 눈치안보고 편히 있다 왔어요 ㅎㅎ 오랜만에 왔는데도 그대로인맛 너무 좋아요!
9.24.수,믿고먹는 왕코등갈비 항상변함없는맛 아이가좋아해서 한달에한번은 꼭방문 맛있게먹었어요
10.5.일,"추석연휴에 엄마 모시고 왔는데 칭찬 받았어요😜 방문 전 전화로 주차문의 하고 예약 했는데, 사장님 바쁘신중에 친절한 응대 감사드립니다🙏 너무 너무 맛있게 먹고 갑니당😋💯💯"
10.8.수,아이가 좋아해서 자주 와요~^^ 고기도 부드럽고 양념도 맛있습니다~ 순두부찌개도 너무 맛나요. 리필도 해줘서 넘 좋아요~~~~~~ 번창하세요^^
10.20.월,친절하시고 음식도 맛있어여
10.9.목,N년째 단골임돠 왕코는 사랑이에요 💕 순두부찌개가 존맛탱
9.6.토,"결혼하면서 남편이 소개해줘서 왔던 곳인데 이제는 아이와 함께 방문하고 있어요. 중간에 사장님은 한번 바뀌신것같은데 맛도 같고, 순두부가 여전히 맛있어 계속 오고 있어요. 직원분들도 친절하시고 너무 좋아요."
9.21.일,넓은공간으로 쾌적하고 부대끼는거 없이 편하게먹을수있습니다 등갈비또한 잡내없이 숯불로 먹을수있어서 너무 맛있네요 등갈비 순한맛 추천드립니다!
9.27.토,집 앞이라 10년 넘게 먹어도 질리지 않고 계속 생각나는 맛❤️ 배달로도 자주 시켜 먹지만 역시 매장에서 먹는게 훨씬 맛있어요👍🏻 순두부 찌개 완전 맛있구요 이거 먹을려고 고기 더 먹는거 안 비밀🙊
8.21.목,늘 맛있는 등갈비집! 순찌도 너무 맛있고 등갈비는 말햐뭐해 여기 소막창도 진짜맛있음! 안질기고 부드럽고 양념도 되있는데 맛있어요!!!
10.5.일,찐맛집 리뷰등록하면 서비스주지만 진짜 맛나요 친정와서 오랜만에 먹는데 정말맛있어요ㅎㅎ
10.16.목,진짜 너어무 맛있어요 등갈비도 맛있는데 순두부찌개는 말해뭐해 여기가 최고입니다bb
10.11.토,등갈비도 등갈비지만 왕코는 순두부찌개 때문에도 오는 고기맛집 찌개맛집 ❤️
10.3.금,부모임과 아이와 함께 방문했는데 여전히 너무너무 맛있는 맛집입니다^^ 특히 순두부찌개가 킥이에요~
9.13.토,오랜만에 왔는데 역시나 등갈비 최고입니다✨️ 지인들 데리고 와도 누구나 좋아하는 곳!! 등갈비 2인분 시키면 나오는 순찌도 맛있어용!! 등갈비 먹고 싶을때 강추!
10.18.토,등갈비 찐맛집 ㅜㅜ 근데 순찌까지 넘 맛있어버리는..🤍
10.19.일,등갈비가 너무 맛있어요👍🏻👍🏻
9.30.화,의정부로 이사가는바람에ㅜㅜ 이거 먹으려고 의정부에서 택시타고 달려왔으요 존맛탱탱ㅠ
10.16.목,한시간 걸려서 옴. 그정도로 맛있음.
10.16.목,맛있어요! 등갈비 생각나면 꼭 오는 집입니당!!
10.12.일,너무 맛있아요! 소막창도 맛있고 등갈비도 맛있고 순두부찌개도 맛있어요👍🏻👍🏻
9.9.화,남자친구 추천으로 방문했어요! ㅎㅎ 등갈비 2인분 시키면 순두부찌개가 공짜인데 넘 맛있어요! ㅎㅎ 등갈비도 맛있어요! 슌한맛 보다는 매운맛이 조금 더 맛있는 듯!! ㅎㅎㅑ
10.4.토,안매워 보이지만 매운 등갈비 입니다 매콤한게 맛있네요 술이 쭉~~ 들어갑니다. 그리고 서비스로 나오는 순두부가 은근 계속 들어가네요~~~ 맛있습니다~~
9.14.일,등갈비 직접 구워먹으면 불편한데 다 구워져사 나오니 편하게 먹기 좋아요!! 양이 부족할까봐 더 시킬까도 생각했는데 먹다보니 딱 배불르게 먹었어요 다음엔 삼겹먹느러 오겠습니다 ㅎㅎ
7.22.화,"등갈비 먹을만합니다 막 맛있는건 아닌데 순두부가 맛있어서 가게됩니다 2명갔는데 찌개2개 서비스 등갈비에 소맥마시고 순두부찌밥으로 마무리 3인분 소주 맥주 각2병 공기밥1 69,000에 저렴하게 먹고왔네요 주차는 길건너 안경점 골목에 유료주차하세요"
10.8.수,오랜만에 와도 예전 그맛 그대로예요~~ 아이도 좋아하는 등갈비 가까운 거리면 더 좋았겠지만 이 맛 못잊어 계속 올것 같아요
10.2.목,고기 맛있어요. 순두부 서비스 주셔서 맛나게 먹었어요.
9.20.토,맛있어요~초벌이 잘되어 나와서 쏙쏙~잘 발라져요~^^
10.11.토,왕코등갈비 너무 맛있어용♥️ 자주 오게되용♥️
9.21.일,매장도 분위기있어요 맛ㄷ느 좋고 직원분들 친절해여
8.17.일,등갈비라고해서 살코기가 없을줄 알았는데 살코기가 굉장히 많아서 놀랐어요. 심지어 불향이 나니 고기에서 더 감칠맛이 나더라구요! 동네라서 또 올것 같아요~ 많이 파세요☺️
7.18.금,"와 여기 진심 등갈비 끝판왕🔥 육즙 팡팡 터지는 숯불 등갈비에 버섯까지 구워먹으면 그냥 환상 조합🤤💥  비주얼 미쳤고, 맛은 더 미침… 양념도 과하지 않아서 고기 맛이 진짜 살아있어요! 사진 찍다가 식을까봐 얼른 먹느라 바빴다구요 📸"
10.9.목,역시 맛있는 장안동 맛집ㅋㅋ 다들 와서 드셔 보세요
9.24.수,등갈비 너무너무 맛있어요!!👏🏻👏🏻 순두부지개도 너무 맛있고 버섯드조차 맛있어요 소막창은 별미로 너무 꼬독하고 안질기고 맛잇러요!!! 그리고 사장님 넘 친절하세용ㅋㅋ
8.22.금,2인 시키면 순두부찌개 1개 서비스 3인 시키면 순두부찌개 2개 서비스로 나와요 콩가루나 마요네즈 찍어먹으면 고소 하고 맛있어요 너무너무 맛있어요 또올게요 ♡
9.14.일,너무유명해서 왔는데 고기종류도 많고 금방나와서 좋네요 또올게요 맛있게먹겠습니당
10.9.목,예약없이 바로 평일저녁 들어가서 이용했어요 등갈비가 맛있고 순두부 찌개가 진짜 맛있습니다 공간도 넓고 직원분들이 친절하세용 음식도 빨리나옵니다 추천드려용
10.18.토,등갈비 생각날때 찾아오는곳 갈비도 맛있고 매운맛 안매운맛 선택할수 있어 좋아요 주차할곳만 있으면 더 좋겟어요
10.8.수,왕코 ! 역시장안동이최고맛있어요!!!!!또올께요!!
7.13.일,"등갈비, 순두부찌개 찐맛집! 등갈비 매운맛 시켰고요. 다 익어서 나와서 1분정도만 뎁혀 먹으면 되어서 먹기도 편합니다. 적당히 매콤해서 맛있고 손으로 잡고 뜯는 재미도 있어서 술술 들어갑니다. 오랜만에 왔는데 전에 먹었을때보다 더 맛있는 것 같아요. 순두부찌개도 진짜 칼칼해서 맛있어요! 저희는 고기 3인분 시켰더니 순두부찌개 2개 주셨어요. 주말 저녁에는 웨이팅이 있을수도 있어요."
8.30.토,등갈비는 왕코등갈비 미만잡..입니다 서비스로 나오는 순두부찌개도 너무 맛있어요!
9.5.금,너무 맛있어서 먹다가 그만...사진찍는걸 잊었다... 이런....그래서 마지막 남은 등갈비 두대로 인증함... 여기서 먹으면 뜯고 씹고 맛보고 즐기는 과정을 한꺼번에 느낄수 있다.... ㅈㅁㅌ 이다...내가 장담한하는데넘 맛있다
9.20.토,집 근처라서 자주 오는데 역시 맛있네용~~ 주말 6시라 사람 많을 줄 알았는데 웨이팅 없이 들어왔어요! 순두부찌개 넘 맛있어여 ㅠㅠ
10.19.일,등갈비랑 막창 시켰는데 신선하고 맛있네요~ 같이 나온 순두부찌개도 얼큰하니 밥이랑 먹기 좋습니다 번창하세요!
9.26.금,처음왔는데 너무 맛있어요~~ 또 올께요~~순두부찌개도 2개나 주시고~~ㅎㅎ
8.29.금,집 근처 맛집이라 해서 왔는데 금요일 일곱시 넘으니까 와글와글 하네요! 맛있게 잘 먹구 갑니당 순한맛이 더 맛있어용 😋
10.11.토,올때마다 너무 맛잇게먹어요! 쪽갈비는 왕코가 최고입니다👍🏻👍🏻순두부찌개도 끝내줘요ㅎㅎ
9.14.일,동네맛집으로 유명해서 와보고싶었어요. 등갈비 맛있고 서비스.순두부찌개도 맛나요.
9.13.토,늘 지나다니며 궁금했는데 사람이 많은 이유가있네요^^ 맛있고 가성비좋은 특별하지않은듯 특별한 메뉴^^ 남편이랑 둘이왔는데 아이들 데꼬 다시 와야겠네요
8.17.일,지나가는길 늘 보던곳이었는데 부모님모시고 아이들과 방문했어요 등갈비메뉴 외에도 삼겹살 양념갈비등 다양한 메뉴가 있어서 가족모임하기에도 좋아요 순두부찌개 서비스로 주셔서 식사하기에도 너무 좋습니다
9.17.수,믿고 오는 맛집입니다 고기도 너무 맛있고 순두부가 계속 생각나요!! 🤣🤣
8.20.수,종종 외식하러 들리는 왕코 등갈비! 여기순찌 진짜 맛나요! 등갈비도 숯불향가득하고 살집도 많아요! 매운맛 순한맛 반반 먹었는데 매운맛이 은근히 올라옵니다!! ㅎㅎ
7.13.일,등갈비구이가 먹고싶어서 검색해보니 왕코 등갈비 가 서울권 에서는 독보적인거 같아서 한번와봤는데 굉장히 만족스럽습니다 고기판도 청결하고 고기도 살이 많고 양도 많아서 정말 만족스럽게 먹을수 있는 곳입니다 등갈비 먹고 싶어서 찾아온다면 강추 합니다
8.17.일,여자친구랑 등갈비 먹고싶어서 찾아보다가 맛집이라고 소문나서 방문했는데 역시는 역시네요 너무너무 맛있게 잘 먹고갑니다 정말 최고에요 직원분들도 너무 친절하구요
8.9.토,"등갈비는 여기~다른데 없습니다. 오랜 단골이고 진짜 맛집이구요~일하시는 직원분들 진짜 열심히 일하세요~친절하시고, 오늘도 맛있게 잘 먹고 갑니다.  #왕코등갈비 #등갈비맛집"
8.15.금,두툼한 쪽갈비와 보글보글 순두부찌개가 맛있네요 쪽갈비살도 두툼하고 버섯구이도 좋아요 매장이 좀더 청결했음 더좋을것같아요
10.9.목,가까운곳으로 이사와서 자주오게 되네요 역시.등갈비는 왕코등갈비 서비스순두부도 칼칼하니  맛있어요~~ 올때마다.손님이 많은 바글바글 이유가 있지요
10.4.토,"지나면서 보다가 와봤어용 등갈비 1차 초벌되어 나와서 좋고, 순두부찌개도 주셔서 좋아용, 늦게까지 영업해서 늦게 식사 필요하면 오기 좋은 것 같아요!"
9.6.토,직원분들도 친절하고 맛도있어요 소막창 도 맛나요
10.2.목,올때마다 친절한 직원들과 너무 고기도 맛있어요 부드럽고 양도 많아요 자주 오지만 이런곳이 집주변에 있다는게 너무 좋네요
10.17.금,자주 가는 곳이에요 고기 질도 좋고 순두부 일품 맛집입니다
9.14.일,고기양념이랑 조화가 잘맞아서 너무 맛있게 먹었어요~ 순두부찌개도 서비스여서 고기랑 잘어울려서 맛있게 먹었습니다!!
8.14.목,언제나 맛있는 등갈비 서울에서 최고인듯~ 순두부는 고기많이시키면 계속주시는데 굉장히 맛있습니다~ 식당보다 맛있는 순두부~~~등갈비도 최고입니다
10.20.월,항상 변함없이 방문해용 정말 맛있어용❤️❤️
7.13.일,"너무 맛있어요! 늘 오는 가게지만 , 순두부찌개 밥말아 먹음 술이 쑥쑥 들어가고 등갈비는 순한맛 넘 맛있어요!! 최애맛집🫶🏻"
10.9.목,본점만 가보다가 장안동으로 왔는데 매장도 더 넓고 무엇보다 반찬이 셀프여서 더 넉넉하고 좋은거같아요 강추입니다
10.8.수,서울 삼촌 추천으로 먹으러 온 등갈비인데 너무 맛있게 먹었네요 ㅎㅎㅎ 메뉴 구성도 알차고 같이 나오는 순두부 찌개 넘 맛있어요!
8.8.금,오랜만에 왔는데 더 맛있어진거같아요 순두부가 더 칼칼해진거같고 고기도 살이 더 실해졌어요 맛있게 잘먹고갑니다
9.17.수,정기적으로 방문 하는 맛집이에요 ! 순두부도 판매용 못지 않아서 술 안주로 너무 좋아요 !
9.16.화,맛있어서 재방문했어요. 잘먹었습니다~
9.13.토,맛있고 순두부찌개 서비스 좋아요~ 딱 자극적인 순찌 ㅎㅎ 사람이 많아서 정신은 없지만 맛있게 먹었습니당
9.18.목,등갈비 생각날때마다 왕코등갈비옵니당ㅎㅎ 순두부 서비스로 줘서 너무 좋아요💛 등갈비도 맛있고 순두부고 맛있고 사장님과 직원분들도 친절해서 올때 마다 맛있게 먹고 갑니당ㅎㅎㅎ
5.25.일,속이 느끼한데 매운순두부가 생각나더라고요 시간도 늦었고 우리동네 늦게하는곳은 앙코밖에 없어서 왔는데 현재 소고기 양고기류만 먹을수있어서 소갈비살주문했는데 냄새도안나고 너무 맛있네요 예전에 조금질긴감이 있었는데 마늘과 과일로 부드럽게 한다네요 어쩐지 맛나더라고요 맛있게잘먹고갑니다~^^
7.27.일,오래만에 방문 버섯을 이제 많이 주네요 순두부.밥말아먹구 매운등갈비2인분 치즈추가해서 맛나게먹구갑니다
9.10.수,오랜만에 먹었는데 맛있어요~
9.6.토,아이가 이곳을 너무 좋아해요 갈비도 맛있고 같이 나오는 순두부찌개도 맛이있어요 재방문할꺼옝ᆢㄷ
8.30.토,가족들이랑 외식하러 왔는데 등갈비도 있고 다른 고기 종류도 많아서 좋아요! 맛있게 잘 먹었습니다~
10.16.목,등갈비 크기가 튼실하거 아주 좋았어요!!
9.22.월,등갈비도 맛있지만 소막창 찐맛집입니다 넘넘 맛잇어요 ^^
8.3.일,맛있고 친절합니다~^^서비스로나오는 순두부찌개가 예술이예요
10.12.일,양도 많고 엄청 맛있어요~ 직원분들도 친절하네요 자주 올거 같아요!
9.6.토,"비오는 날 가족 연인과 함께하는 시간 오랜만에 편안한 분위기로 맛있는 왕코갈비로., 이사가서 오랜만에 다시 찿아와도 항상 그맛"
10.2.목,여기 자주 오는데 진짜 맛있어요!! 바쁘신데 친절하시고 분위기 좋습니더!!
10.9.목,반응 남기기 방문일 10.9.목 2025년 10월 9일 목요일 1번째 방문 인증 수단 영수증
10.9.목,고기맛있어요 서비스로 나오는 순두부찌개는 술이 술술들어가요
10.12.일,순두부찌개랑 등갈비 맛있어용!! 다음에 또 올 것 같아용😚
9.28.일,동네여서 조용하고 맛있게 먹을 수 있었습니당 사이드 찌개도 맛있어요 😍😍
10.9.목,진짜맛있오요..왜 사람이 많은지알겟어요 또올게요!
10.12.일,너무 맛있어요 자주 와요 항상 사람 많아요 맛있고 친절해요 치즈퐁듀 짱짱
9.19.금,유명한데 온다온다하고 한번도 못왔는데 와서 먹어보니까 증말 너무너무 마싯네여 ㅠㅠㅠ또 오겠습니다
10.10.금,왕코등갈비 너무맛있어요 유명맛집인가서 그런건가요. 순두부찌게 얼큰 맛있고. 등갈비도 너무. 맛있어서 자주방문합니다 강력추천합니다
9.21.일,10년만에 다시찾은 동네 맛집~~ 데이트할때 자주왔던 곳인데.. 아이와 함께왔는데 아들이 폭풍흡입~~♡ 역시 변함 없이 넘 맛있어요~~!!!
10.2.목,등갈비 맛있고 순두부찌개 맛있었어요~
10.17.금,오랜만에 왔는데 역시 최고로 맛있엉·능 ㅎㅎ🫶🏻🫶🏻🫶🏻💜🩷💛
9.7.일,등갈비가 땡겨서 왔는데 뼈에 붙은 살도 많고 맛있습니다 매운맛을 주문했는데 한국 보통 매운맛보다는 약한 매운맛인데 맛있어서 잘 먹었습니다 직원분들 모두 친절하셔서 좋았습니다
10.19.일,맛있어요~~~늦은시간에왔는데도 반겨주셔서 정말맛있게먹고있어요~~순두부도 별미예요 재방문 의사 콜이예요
8.28.목,어릴때부터 왔던 동네 찐맛집 순두부 소주 그냥 들어갑니다 매장시원하고 넓고 등갈비에 술맛있게 한잔하실분들 오셔요👍
10.8.수,너무너무 맛있어옄ㅋㅋ 또 먹으러 올거에요~~ 순두부찌개로 최고에요!
9.22.월,가격 대비 맛이 끝내주네요. 다시 꼭 재방문을 하고 싶습니다. 꼭 오셔서 맛보세요^^
9.19.금,등갈비 순두부찌개 다 맛났어용 ㅋㅋㅋ 맛집이라 그런지 손님도 많고 좋았어요 나중에 또 올꼬야
6.30.월,"등갈비랑 순찌,껍데기,치즈가 맛잇어요 대체로 주말보다 평일이 맛잇는거같아요 자주 왔었는데 올은 옆에 11명단체가 너무 시끄러워서 별로였어요 남자 알바생이 순찌 놓다가 젓가락 떨어트렷는데 보고도 그냥가서 저희가 가서 가져왁어요 크게 불러도 분명 들었을텐데 안보더라그여"
9.24.수,맛있고 좋아요 처음왔는데 친절하고 좋아요!!
10.5.일,오랜만에 왔는데.고기질도 좋고 양도 많아서 잘 먹고왔습니다~~
10.18.토,매운맛 기본맛 있어서 맛있게 잘 먹었습니다 다음에 또 올거 같아요 진짜 맛있어요!!
8.1.금,너무 맛있늠 최애맛집 또 방문했어요!! 사장님도 직원들도 친절하시고 등갈비는 말해뭐해 별미로 소막창 진짜 너무 맛있어요!!!!!
8.1.금,갈비가 너무 맛있어요 살이 많고 특히 순두부가 너무 맛있어요~ 자주 올래요~~~
10.12.일,자주자주 오는데 비오는날 순두두 죽네오...ㅋ
10.2.목,순두부가 맛있는 집이에요 항상 생각남
10.10.금,너무 맛있아용 고기도 싸고 질이 너무 좋네요
7.31.목,매장도 넓고 맛있어요!! 직원분도 친절하시고 다 남김없이 먹었어요!! 주말이 아니라서 웨이팅은 없지만 사람은 많았어요! 등갈비에 살도 많고 순두부도 서비스로 주시는데 진짜 맛있어요! 가까운데 맛집 강추!
6.15.일,장안동 맛집♡왕코 등갈비! 퇴근후 한잔 하러왔다가 아이랑 낮에 오니 더 맛있음♡매운맛과 순한맛과 순두부까지 그리고 밥까지 뚝딱하니 배가 든든하고 중딩 아이도 대만족! 내돈내산 정직리뷰! 촉촉한 육즙에 순두부찌게는 소주가 생각나지만 운전으로 참아서 아쉽!🤣 가족외식 강추 주차는 근처 공영으로 고고! 하세용♡
7.18.금,가족모임으로왔어요 지난번에오고 맛있어서 재방문했는데 역시나 맛있네요 등갈비가초벌이되서 금방익었어요 맛있게잘먹었습니다 다음에 또방문할게요
10.12.일,등갈비 순한맛 먹었는데 맛있어요~ 초벌되어 나와서 금방 먹을수 있어요~ 같이 나오는 순두부도 엄청 맛있어요 최고에요!!
8.1.금,늘 그자리를 지키던 단골맛집입니다. 변함없는 맛과 변함없는 퀄리티를 자랑합니다. 자리가 있다면 꼭 들어오십쇼. 생각하면 늦읍니다.
10.4.토,고기가 맛있고 아이들도 잘먹어요!
9.6.토,늘 맛있는 왕코등갈비! 주에 한번은 방문하는듯한 ㅋㅋ 넘맛있어요! 배고파서 폭풍흡입.. 막창도 꼭 먹어야해요..!!
10.19.일,등갈비먹고 삼겹살먹고 맛있니다!!!
8.19.화,순두부 맛집이에요 둘이 와도 무조건 3인분시켜서 1인1순두부합니다
8.15.금,말 로만듣던 왕코등갈비 진ㅊ자맛집인정 이요! ㄷ 친절하고 맛있어요
10.5.일,10년 넘은 단골집이에요 올때마다 늘 맛있어요. 특히 순두부!!
9.15.월,외국인이 계산해서 말도 못알아듣고 다시는 안갈듯 주방은 더럽고
8.25.월,의자에 이물질 있는데 모르고 앉았음 대처 방법 융통성 zero. 예전 그 느낌이 아님 ㅠㅠ 왕코 사랑하는데 아쉬웠어요… 셀프바에 벌레 날파리 대박 ! 끔찍 외국인 직원분들은 친절한듯 그래도 오랜만에 가서 야무지게 냠냠 주먹밥 5천원 무슨일 —??!!!!!!
8.14.목,언제 와도 항상 맛난곳~^^ 행복한 맛입니다~ 일인 이인분은 뜯어야제맛~♡
10.3.금,반응 남기기 방문일 10.3.금 2025년 10월 3일 금요일 2번째 방문 인증 수단 영수증
10.5.일,쪽갈비도 맛있고 칼칼한 찌개도 맛나요 퐁듀 츄가는 필수
9.20.토,고기 질이 좋고 너무 맛있어요👍
8.14.목,등갈비 너무맛있네요! 맥주랑 먹으니까 꿀맛이에요
7.13.일,기본으로 나오는 순두부 찌개도 등갈비도 너무 맛있어요. 켈리 2병시키면 이벤트도 있고 리뷰 이벤트도 있어서 저렴하고 좋아요~~맛나요
8.21.목,등갈비와 순두부찌게의 조합이 좋음!
9.25.목,동네맛집입니다~~! 편하게 가족들과 외식하기에 좋아요!
8.16.토,등갈비 정말 부드럽고 맛있어요💕✨
9.4.목,배봉사거리 맛집#왕코등갈비#쪽걸비 맛집#순두부 맛집
7.23.수,삼겹살 가성비 정말 좋아요 !!!! 배부르게 잘 먹고 갑니당 서비스로 치즈퐁듀도 주시고 최고 .. 🤍🤍
9.21.일,맛있고 친절하세요 추천해요
9.19.금,와 등갈비가 진짜 맛있어요! 매운맛드세요 진짜!! 순두부맛있어유
8.21.목,오랜만에 먹으러 왔는데 너무 맛있어요
7.22.화,"메인메뉴 시키는 양에 따라 순두부도 추가로 더 나오고, 셀프바 있어서 너무 좋아요! 만족합니당ㅎㅎㅎ"
9.7.일,동대문구 등갈비 원탑입니다..! 특히 같이 나오는 순두부찌개가 정말 일품이에요!! 고민마시고 방문 추천드립니다😊😊
9.1.월,오랜만에 왔어요 양도 충분하고 맛있어요 서비스로 주는 순두부찌개도 굿입니다!
9.5.금,등갈비 오랜만에 먹는데 넘 맛있어요~ 순찌가 진짜 맛나요:) 동네맛집 좋아여
8.31.일,등갈비가 초벌되어 나와서 더욱 맛있어요! 서비스로 나오는 순두부찌개도 등갈비랑 너무 잘 어울려요👍👍
8.4.월,너무 맛있어요! 가족들이랑 같이 왔는데 다들 너무 맛있다고 감탄하면서 먹었습니다 등갈비 먹고 싶으신 분들은 꼭 한 번 와보세요!!
8.3.일,여기등갈비는등갈비계에예르메스에영 ㅋㅋㅋㅋㅋ 진짜 찐맛집입니다 서비스순두부탕도일품입니다 비오는날에도멀리까지와서먹고갑니다 짱짱짱^^
9.20.토,너무 맛있어요 특히 순두부찌개는 쵝오!!
9.13.토,늘 맛있어요! 순두부찌개는 엄매야👍🏻🧡 불금 마무리 구웃!!
10.18.토,아기랑 먹기 좋고 너무 맛있어요 또 올게요!
9.25.목,맛있어요 가족외식으로 자주오는곳!! 👍
8.29.금,매운맛 맵찔이인 저는 맵네여 호호홍 맛있게 맵다기보다 캡사이신 느낌?ㅜㅜ 보통맛으로 또 시킴 >.< 맛있어요요오
10.19.일,항상 믿고 먹는 우리 왕코등갈비 역시 오늘도 너무 맛있었습니다
8.4.월,몇번째인지 모르겠습니다 와도와도 맛있고 먹어도먹어도 맛있다 🧡🧡 담주에 또오겠습니당
7.26.토,등갈비도 맛있지만 소막창 대박 맛있어요 장안동 맛집 인정합니다
8.30.토,맛집으로 소문났다고 해서 딸들과 방문했어요~~^^ 등갈비 냄새도 없고 맛있고 순두부도 얼큰하니 밥에 먹으면 딱이예요
9.15.월,다른 등갈비 많이 먹어봤는데 여긴 처음 먹어보는 집인데 정말 맛있습니다.
9.21.일,친절하고 바로 먹을 수 있어서 더운날 이용하기 좋네요
9.8.월,우리동네 맛집이예요~ 항상 변함 없는맛!!👍🏻
8.18.월,맛있어서 자주 오는데 주문실수가 조금 있어서 서운할뻔 했어요~~그래도 맛있으면 땡!!!! 잘 먹고 갑니다.
7.27.일,오랜단골임..폭염에도 놓칠 수 없는 맛ㅋ순두부가 더 땡기고 그로인해 술을 더 마시게 된다는 함정
9.1.월,언제 먹어도 정말맛있어요~ 오늘같은 날씨에 순두부에 소주 좋아요~~
7.19.토,음식도 정성이 보이고 맛도좋아요 사장님 과 직원분들도 친절해요 또 재방문의사 있어여
7.26.토,장안동 오래된 맛집..오랜만에 방문인데 역시 사람들 만석!!친절한 직원들과 맛난 고기..역시 이곳의 순둡 찌게는 말해 뭘해요..찌게만 먹으러도 오고싶은곳..오늘도 맛난시간 감사요^^
