date,content
23.8.3.목,"두번 방문 했는데 처음 방문했을때 일정 쟁반이랑 묵은지참치말이 그 두개가 너무너무너무 맛있어서 그때 같이 갔던 친구랑 또 방문했었어용!!! 묵은지참치를 또 먹고싶었지만 친구가 위가 작아서 자제하고 새로운걸 도전해봤어욤! 낙지젓카펠리니랑 삼합 먹어봤는데 으..역시 요기 정말 다 맛있어용!!! 안주가 전문식당요리 그이상이라 정말 최고예여,, 또 방문하겠습니당💛💛"
23.7.7.금,분위기도 너무 좋고 안주도 짱짱 맛있었습니다. 페퍼로니 감자전은 바삭바삭 미쳤구요 라구파스타도 걍 미쳤습니다. 그릇 싹싹 긁어먹었어요. 진짜 진짜 맛있어요. 리뷰 안쓸 수가 없어요…….직원분들도 친절하시고!! 간단하게 먹으려고 간건데 안주도 추가하고 술도 엄청 마셨습니다🥹 다음에 꼭 또 방문할게요..
23.8.15.화,인테리어두 깔끔하구 안주도 맛있어요 :D
23.5.27.토,남자친구나 여자친구들 데려와서 분위기 좋게 전통주 마시기 좋은 곳🩷 분위기 좋고 음식이 진짜 맛있어요!! 아롱사태스지전골은 고기가 엄청 많고 육수가 맛있어요. 미나리 새우전은... 엄청 엄청 맛있어유🫶🏻🫶🏻👍 육회도 저렴한데 양 많고 술이 술술 들어가요. 친절하고 맛있어서 재방문 의사 있아요!
23.5.31.수,"친구 생일이라 분위기 있는 곳에서 축하 파티하고 싶어서 알아보다가 새로 오픈한 일정 인테리어 보고 바로 여기다 싶어서 방문했어요 ! 안주도 하나같이 다 이쁘고 맛있고 ,, ~ ~ 다양한 술도 권해주셔서 새롭고 맛있는 술도 많다는걸 느꼈습니다아 !! 콜키지도 돼서 다음엔 와인사서 갈라구용 🤍 의정부에서 분위기 있는 술집 찾으시면 무조건 여기 방문 해보세요 다둘~~➰ 유자 하이볼 넘 맛.. 그리고 “일정 쟁반”,, 진짜 너무 맛있어서 그릇 설거지 했어요 ~,,!!"
23.7.20.목,"담에 전메뉴 다 먹어볼거고용 ? 맛도리 ㅇㅈ 다 안먹어봣는데용??-,- 전메뉴 필수탱이용 ;"
23.7.17.월,지금까지 먹어본 메뉴들 다 맛있었어요~~
23.7.3.월,술도 다양하고 안주도 맛있고 가성비 좋아요:)
23.9.17.일,메뉴가 특별해서 좋았어요~~
23.5.26.금,의정부에 드디어 전통주를 마실 수 있는 술집이 생겨서 너무 좋아요!! 술 종류도 친절하게 설명이랑 추천도 해주시고~ 안주들도 다 맛있어요ㅠㅠ 서비스도 챙겨주시고 기분 좋게 먹고와서 또 가고 싶어요😛😛
23.5.29.월,동네에 이런 핫한 술집이 생겨서 너무 좋네요! 기본 안주 가격도 좋구 다 맛있어요👍 다음엔 오늘 못먹은 다른 안주들 먹으러 또 가야겠어요 ㅎㅎ단골 할게용!!!
23.6.1.목,진짜 미친 맛집입니다 저만 알고 싶은 술집이에요 ㅠㅠ 단골 예약임둥 의정부에 내주셔서 감사합니다🤍
23.12.11.월,반응 남기기 방문일 23.12.11.월 2023년 12월 11일 월요일 1번째 방문 인증 수단 영수증
23.9.19.화,일정 24.1.29.월 안녕하세요! 의정부 일정입니다. 긍정적이고 쿨한 리뷰 감사드립니다😁 또 방문해주세요~~~🫡 접기
23.5.27.토,새로 생겼다고 해서 방문했는데 안주 맛 가성비 좋네요~ㅎㅎ 메뉴가 남녀노소 다 좋아할만한 메뉴입니다 강추~!
23.7.8.토,일정 23.9.28.목 안녕하세요 일정입니다! 짧지만 와닿는 리뷰네요. 감사합니다 앞으로도 열심히 하겠습니다🫡🫡
5.2.금,음식이 너무너무 맛있고 분위기가 너무 좋아요!!
2.25.화,일정 음식 최고에용 ㅠㅠㅠㅠㅠ 넘넘넘 넘넘넘 맛나서 안주 열개시켜서 먹고싶어요 자주자주 방문할게게요🩷🩷🩷
1.26.일,"샤브전골,,,,,,,,,,,,,,,,,,,,,,,,,,,,국물이 미쳐버렸든데요 원래 술 먹으면서 안주 잘 안 먹는데 샤브전골 제 뱃대지로 다 들어갔어요🙂‍↔️ 다른 안주들도 정말 맛있고 조명도 음악도 아주 많이 좋았지만 저는 샤브전골,,, 정말 육수 훔쳐가고 싶었슴니다,,, 먹는 내내 으음~ 대면서 먹다가 친구들한테 시끄럽다고 욕먹었네요🤗 또 가고 또또 가고 또또또 가고 또또또또 가고 또또또또또 가고 계속 갈게요! 👍일정 최고👍"
24.4.12.금,음식도 맛있고 직원 분들이 너무너무 친절하시네요 ㅠㅠ 의정부에 이런 술집이 있다니 놀랬어요 🫣 다시한번 맛과 친절함에 놀라고 갑니닷 !!
