date,content
"""음식이 맛있어요""",이 키워드를 선택한 인원
"""친절해요""",이 키워드를 선택한 인원
"""인테리어가 멋져요""",이 키워드를 선택한 인원
"""특별한 메뉴가 있어요""",이 키워드를 선택한 인원
"""재료가 신선해요""",이 키워드를 선택한 인원
10.10.금,"흑백요리사에 출연했던 후포리촌놈 셰프님이 운영하는 제이드앤워터에 다녀왔어요!! 방송에서 느꼈던 정갈한 요리 감각이 그대로 살아 있어서 한 접시 한 접시가 정말 인상 깊었어요. 요리의 밸런스가 훌륭하고, 식재료 본연의 맛이 느껴져서 과하지 않은 고급스러움이 있답니다. 공간 분위기도 차분하고 조용해서 데이트나 가족 모임에도 잘 어울렸어요. 전체적으로 만족스러운 식사였고, 재방문 의사 100%입니다 :)"
10.17.금,오렌지치킨 꼭 드세요. 두 번 드세요 정말 부드럽고 맛있어요. 오렌지?는 없고 자몽이어서 더 궁금해졌어요. 그리고 김치라이스도 드세요. 밥 메뉴가 하나 밖에 없어서 고민했는데 후회 안하실 겁니다. 분위기도 좋고 직원분들고 친절하셔서 대만족이에요!
10.11.토,카프레제샐러드의 바질향과 신선한 토마토로 시작해서 몬테크리스토 샌드위치에 수제딸기잼이 건강한 맛으로 조화로웠음. 봉골레파스타 또한 건강한 올리브 맛이 좋았고 트러플크림 리가토니는 크리미함과 토핑된 통베이컨이 너무 맛있었음^^
10.17.금,"제이드앤 워터!! 여긴 사실 우리 부모님이 젤 좋아하셔요...ㅋㅋㅋ 분위기도 음식도 편안하고 고급스럽고, 가족끼리 오기 딱 좋은 곳이에요 😊"
10.19.일,이전부터 와보고 싶었던 곳이에요~ 먹고싶은메뉴가 많아 신중하게 메뉴골랐네요. 다 맛있게 먹었어요. 다음에 다른메뉴도 먹어봐야겠어요~
8.14.목,몬테크리스토가 그리운분들 제이드앤워터 가세요!  오렌지치킨에 화이트와인/맥주 즐기기 좋고 파스타 라자냐 메뉴 모두 실패없고  아늑하고 따뜻한 분위기에서 즐기는 요리들이라 대화하면서 즐기기 좋은 공간이에요.  후포리촌놈 셰프가 말아주는 옥수역 맛집 메뉴들! 👍
10.12.일,친구 생일파티 기념으로 방문 너무 맛있고 모임하기 딱 좋아요!!! 음식도 맛있고 담에 또 방문할게여
10.11.토,단호박 스프 먹고 싶어서 왔어요! 너무 맛있어서 만족 ㅎㅎ 몬테크리스토도 색다른 맛 리카토니도 맛있어용
10.11.토,장소 이전하고 처음 와 봤는데 접근성도 더 좋아지고 분위기도 편안해요. 스테이크 리가토니 봉골레 다 맛있고 재료가 신선한게 느껴져요! 동네주민이라 행복합니다 :))
10.19.일,음식이 너무 맛있어요! 이전하기 전에 방문했었는데 지금도 분위기 좋네요! 남자친구 생일 기념으로 왔는데 오길 잘했어요🥰
10.19.일,오고 싶었던 식당이었는데 부모님과 함께 오게되었어요. 분위기도 좋고 음식도 최고에요💕
10.16.목,분위기도 좋고 음식도 맛있어요!
10.11.토,리가토니 파스타 너무 맛있어요! 직원들 친절하고 음식 빨리나와요 ㅎㅎ
10.15.수,분위기도 좋고 예약이 가능하여 좋습니다! 옥수에 자주 오는 곳이에요 💝💝
10.16.목,매장도 이쁘고 너무 친절하시네요 무엇보다 너무 맛있어요~ 가족들과도 오고싶어요♡
10.19.일,오랜만에 데이트하러 왔는데 분위도 좋고 음식도 맛있었어요!!🫶🏻
10.15.수,분위기도 좋고 음식도 맛있어요
10.17.금,동네맛집 애정합니다!!! 새우산도 아주 맛있네요!
7.25.금,라구파스타에 들깨 조합이 개인적으로는 좋아하진 않는 스타일이었네요 하지만 메뉴가 많고 세트메뉴도 있고. 무엇보다 몬테크리스토를 맛 볼 수있다니!!!
10.15.수,"역시 흑백요리사 출신 셰프님!@ 음식 너무 맛있었고, 오랜지치킨이 너무 맛있고, 직원들도 넘 친절 분위기도 굿굿"
10.17.금,너무 맛있고 매장도 깔끔하고 친절해요 👍🏻
8.11.월,오렌지치킨 너무 맛있구요 ^^ 서울역도 맛있었지만 본점이 최고네요~ 다시 또 방문할 계획이에요^^
10.12.일,공간이 넘 아늑하고 다 맛있게 잘먹었어요🤍
10.19.일,트러플 파스타? 특히 너무 맛있었어요 너무 친절하시고 매장도 깨끗해요! 잘 먹었습니다😊
10.13.월,일단 뷴위기가 너무 좋습니다 몬테크리스토 드이어찾음
10.12.일,동네 소문난 맛집!! 이사하고 더 분위기 좋아요~ 맛은 그대로 최고고 친절하셔서 저녁에 자주 찾게 되네요~!
10.15.수,"동네 맛집!! 이전하기 전이랑 메뉴구성이 바뀌었는데 여전히 맛있어요! 데이트,친목,가족모임 모두 만족할 맛집입니다!!"
10.18.토,"패밀리세트로 먹었는데 맛있어요!! 깔끔하고, 인테리어도 전보다 더 아늑해진것 같네요~~ 옥수역 맛집입니당"
6.21.토,예약하고 방문하였습니다.역시 옥수동 핫플답네요~이전하셔서 분위기도 인테리어도 훨씬좋아요♡저의 원픽은 단호박스프예요💛
8.9.토,독특한 조합이라 맛있었어요! 아페롤 좋았음
8.28.목,옥수동 오름길 맛집입니다. 카프레제 샐러드는 미리 먹어서 사진 없네요~~  식전빵이 있었으면 하는 개인바램이 있습니다
10.12.일,우연히 들렸는데 분위기도 좋고 대화하기 좋아요💛😍옥수에서 손에 꼽을 맛집이네요👍👍 재방문의사 1000%🥰🥰
6.27.금,너무 맛있게 잘 먹고 왔어요. 스프는 고소해서 빵이랑 잘 어울리고 오렌지치킨은 이탈리아 중국 미국이 다 느껴지는 요리 같았어요.
10.15.수,세트 메뉴가 합리적이고 매장이 깨끗합니다.직원분도 친절하세요!
10.16.목,파스타 너무 맛있습니다. 자주 방문하겠습니다.
8.7.목,집 근처 동네 맛집인데 드디어 갔습니다. 왜 유명한지 알 겠음 ㅠㅠㅠ 진짜 메뉴 다 존맛탱........ 이번에 이전해서 인테리어 싹 다시 하셨는데 너무 쾌적하고 좋슴다 ㅜㅜㅜㅜㅜㅜ또 가야지!!
10.11.토,집 근처라 한번씩 오는데 장소 옮기고 나서 접근성이 더 좋아졌어요~ 음식맛은 항상 맛있어요 특히 추억의맛 몬테크리스토는 올때마다 먹습니당
8.31.일,메뉴가 다 신선하고 알차요~! 샐러드랑 몬테크리스토 제 취향이었는데 또 먹고싶네요 ㅠㅠ 이 동네 또 약속잇으면 여기서 모이자고 해야겠어요 ><
10.11.토,동네 맛집이라고 친구한테 소개받고 왔어요. 음식이 하나같이 다맛잇어요. 매장도 쾌적합니다~!
10.17.금,친구생일이라 예약하고 방문했어요 맛있어요
3.20.목,옥수동 핫플이라고 해서 방문했어요 🍤 🍤 새우 산도 통통하고 탱글탱글 오묘하게 맛있었어요 몬테크리스토는 딸기쨈이 익숙해서 그런가 ㅎ 스테이크 진짜 맛있고 알감자 아스파라거스 소스까지 전부 👍 봉골레는 배가 불러서 조금 남겼네요 ㅎ 스파클링와인 🥂 (1시간제한) 많이 마셨네요
10.10.금,쾌적하고 분위기도 좋고 맛있어요~ ❤️❤️
5.5.월,"몬테크리스토, 김볶, 베이컨어쩌구 다 너무 맛있어요ㅠㅠㅠㅠ 사장님도 친절하시구 조아요"
8.29.금,지나는길에 들렸는데요. 몬테크리스토!! 먹어본 것중 제일맛났어요. 꼭드셔보세요^^ 테라미슈도 맛날꺼같아 포장해갑니다^^
7.14.월,인생 먼데이 아이스크림 입니다.
1.25.토,"옥수역의 유명한 블루리본 브런치 맛집입니다. 옥수역 부근의 낡은 상가 2층을 리모델링해 분위기도 너무 좋고 주문한 옥수 카프레제 샐러드 너무 신선하고 맛있었구요. 조리조라구는 일반적인 라구와 다른 소스여서 특이했고 순대국밥에 올라가는 들깨가루가 곁들여져 있어서 신선하지만 밸런스 있었습니다. 무엇보다 옥연수 몬테크리스토가 킥이였는데요, 겉은 바삭하면서 안은 또 촉촉하고 안에 살라미, 혹은 햄을 잘게 간 재료들이 푸짐하게 들어 있어서 식감이 재밌었습니다. 또한 그 위에 특제 체리 계열의 소스를 발라서 먹으니 이건 꼭 드셔야 겠다고 생각이 들었습니다."
5.5.월,전체적으로 다 맛있었어요~ 제 원픽은 리가토니입니다. 가격도 적당하고 종종 갈것 같네요.
10.10.금,반응 남기기 방문일 10.10.금 2025년 10월 10일 금요일 1번째 방문 인증 수단 영수증
3.29.토,새우산도는 말할것도 없이 맛있고 트러플 라가토니는 와 중독성있는 맛입니다 통베이컨과 꾸덕한 트러플 소스에 라가토니  트러플 좋아하시면 계속들어가요ㅋㅋ  새우산도+트러플 라가토니 해서 소스에 새우산도 찍어먹는걸 추천드려요!   JMT 가보자고~
1.25.토,"처음 갘ㅅ을 때 너무 맛잌ㅅ우서 2번째 방문이에요~ 여기가 맞나? 싶은 곳에 위치한 식당 ㅎㅎ 이야기하기 편한 분위기고 항상 손님이 가득해요. 아마 예약 안 하면 주말엔 웨이팅할것 같아요! 음식들 다 정말 맛있어요~ 오늘의 스프는 처음 먹어봤는데 매일 다르다고 들었어요, 저는 단호박 스프 먹었는데 좀 많이 붉어서 국 같았던..?ㅎ 근데 항상 직원들이 바빠서 그런지 불러도 잘 모르시더라구요ㅠㅠ"
1.28.화,"흑백 요리사에 나왔다고 해서 기대하면서 갔는데 역시나 맛있네요 ㅎㅎ 명절 직전에 가서 사람이 유독 많지는 않았지만 오히려 여유있게 먹고 대화할 수 있어서 좋았어요 !! 지하철역에서 올라오는데, 살짝 언덕이 있는 편입니다"
8.4.월,반응 남기기 방문일 8.4.월 2025년 8월 4일 월요일 1번째 방문 인증 수단 영수증
5.9.금,이런곳에 이런가게가 있다니.. 그러나 음식들이 하나하나 다 맛나긴해요. 양에 비해 음식단가가 쫌 있긴해요. 특별한 메뉴들이 많아서 새로워요!
1.31.금,"동네에 이런 가게가 있는 줄 몰랐어요. 명절연휴 끝나고 게으름피우며 브런치메뉴 찾다가 발견해서 방문해봤습니다. 모르고 지나칠 만 했다 싶네요. 가게의 얼굴이라 할 만한 입구가....흠. 눈 오는 날이어서 계단 매우 미끄럽구요. 올라가면서도 여기가 맞나 싶었구요. 문에 덜렁 일반 인쇄지에 프린트되어 붙어있는 매장명. 또 한번 흠...컨셉인가.... 어쨌든 신박하게 느껴지지 않고 지저분하게 느껴졌어요. 개취일지도요. 음식은 괜찮았어요. 카프레제샐러드에 방울토마토가 나와서 당황했지만, 바질페스토 소스는 새로운 맛이었습니다. 그런데 모든 음식이 좀 달더군요. 바질페스토도 달고, 새우산도의 새우속도 달고.... 저는 한번 가봤다로 만족합니다~"
5.21.수,트러플버섯파스타가 특이하고 맛있었음.
2.25.화,분위기도 좋고 음식이 하나같이 다 진짜 너무너무 맛있었어요~~~ 특히 김치볶음밥 강추입미다!!!👏🏼👍🏼
2.25.화,"진짜 너무 맛있어요,, 메뉴하나하나 다 맛있어서 폭식해쒀용 여자둘이서 거의 다 먹었숨미당..... 직원분들도 너무 친절하셔서 친구생일에 기분좋게 먹고가요~~~! 뷴위기도 좋아서 데이트코스로도 좋을 것 같아용"
6.30.월,반응 남기기 방문일 6.30.월 2025년 6월 30일 월요일 2번째 방문 인증 수단 예약
2.1.토,두번째 방문이에요. 맛있어요. 특히 몬테크리스토가 너무 맛있어서 자꾸 생각나요. 오렌지치킨은 양념도 잘 베어있고 상큼해요. 또 가고 싶어요.
1.16.목,"재방문했어요. 여심을 저격하는 인테리어와 메뉴, 플레이팅!! 조용한 옥수동에 이런 보석같은 공간이 있어서 좋아요!! 사전예약 후 방문하니 편해요!"
4.25.금,너무 맛있게 잘 먹었어요 또 올 것 같아요
24.11.30.토,❣️담예또 ❣️ 다음에 예약 또 예정입니다!!! 다음에 또 방문예정🥰🥰입니다~~오렌지 치킨 먹구싶어서 급하게 예약하고방문하게 되었는데 역.시.나 오늘도맛있게 먹었어요^^bb조만간 또 다른메뉴들 먹으러갈꺼에요!친절하고 분위기도좋고 아늑하게 잘먹고 잘쉰~ 토요일 이었습니다🩷 감사합니당!!!!💘💘💘
3.29.토,처음 갔을 때 너무 맛있어서 재방문했어요 근데 지난번엔 안그랬던거같은데 배달서비스를 시작하신건지 배달 주문이랑 같이 준비하느라 음식이 엄청 늦게나오고 매장에 계속 배달기사분들이 들락날락하셔서 되게 어수선한 느낌이었어요 주말에 브런치먹으면서 기분내러 간건데 음식도 늦고 어수선하고 그렇게 좋은 경험은 아니었네요ㅠ
4.5.토,오랜만에 갔는데 맛있게 잘 먹었어요~~!
3.3.월,몬테크리스토랑 스프가 맛있어요 오렌지치킨은 별루였어요
3.22.토,반응 남기기 방문일 3.22.토 2025년 3월 22일 토요일 1번째 방문 인증 수단 예약
24.11.13.수,3명이서 6개 시켰는데 키큰 아줌들이라 그런건지 양은 적당했구요 대체적으로 맛있었는데 친구가 새우산도 먹을때 작은 모래 씹힌거랑 스테이크에서 냄새가 좀 난 것 이 아쉽네요 스테이크대신 다른 메뉴 시킬걸 하는 아쉬움이 있었어요 수제 라즈베리 잼 넘 맛나구요 김치볶음밥도 맛있었네요
7.4.금,샐러드가 상큼하고 맛있었어요
2.12.수,옥수동의 대표적인 맛집 제이드앤워터 핫한장소인데도 사장님께서 매우 친절하고 음식도 맛이 변하지 않고 꾸준한 퀄리티를 자랑하는 곳입니다👍
24.10.12.토,또 가고 싶은 곳 ! 토요일에 햇살 받으면서 브런치 먹으면 얼마나 행복하게요~❤️ 맛도 기본에 충실하면서도 집에서 쉽게 해먹기 번거로운 가치있는 맛이었어요~ 커피도 맛있고 음식도 맛있고 재방문 의사있습니다 🙂
24.12.23.월,음식도 맛있고 와인도 좋고 재밌는 시간 보내고 가요
24.9.8.일,너무너무 가고 싶었던 제이드앤워터! 새우카츠산도는 꼭 먹어주기... 오렌지치킨은 약간 동파육 같았어요 너무 기대했는가ㅠㅠ 하나의 갤러리같은 공간 같았는데 맛도 맛있고 친절해서 너무 좋았어요  좀 더 많은 사진과 리뷰는  https://m.blog.naver.com/heybb/223588175379
24.10.24.목,음식이 맛있어요 지인들과 함께 오면 항상 반응이 좋네요 워크인 방문도 가능하면 좋겠어요
24.12.13.금,아쉽게도 전반적으로 너무 느끼했습니다. 리가토니는 느끼함의 정점이어서 피클이 없으면 먹기 힘들 정도였습니다. 맛의 한 킥도 없어서 실망스러웠습니다. 무난하거나 집 앞 파스타집 보다 덜하여서 멀리서 예약 잡아 온 보람이 없었습니다. 생면은 더 삶아졌습니다. 무엇보다 포스를 만지는 손으로 음식 조미를 하시는 게 여러 차례 눈에 띄니 좋게 보이지 않았습니다.
24.10.3.목,전체적으로 평타치 이상의 맛. 양이 조금 부족했어요. 트러플크림 리가토니 풍미가 좋고 가장 좋았어요. 디저트도 맛있네요.
3.14.금,반응 남기기 방문일 3.14.금 2025년 3월 14일 금요일 3번째 방문 인증 수단 예약
24.10.12.토,"토요일 미리 예약하고 방문했고, 우리가 예약한 좌석 말고는 빈 자리는 없었어요! 토요일이라 단체모임도 좀 있는것 같도 완전 북적북적.. 식당 찾을 때 여기에 식당이 있나? 하면 맞습니다 ㅎ 최근에 먹었던 파스타 중에 제일 맛있었다고 할 정도로 맛있었어요 생면 파스타고 그냥 와 여기는 진짜 요리를 잘 하는 곳이다가 느껴지는 곳이에요 소스도 진짜 맛있음! 파스타 말고도 다른 인기 많은 메뉴가 많던데,, 오늘의 수프는 2시쯤 방문하니 품절됐어요 다음에 먹으러 갈 예정!ㅎ 근데 손님이 워낙 많으니깐 직원분들이 엄청 바쁘셔서 부르는데 좀 걸리더라구용,, 참고하세요!"
24.12.16.월,반응 남기기 방문일 24.12.16.월 2024년 12월 16일 월요일 1번째 방문 인증 수단 예약
24.10.2.수,2층 올라가는 계단이 위험해 보이지만 내부는 괜찮았음. 맛있게 먹었음. 그러나 양도 적고 비싼 감이 있어 할인가격 아니면 못갈 듯...
24.9.22.일,옥수 제일의 맛집!!! 예약도 어렵지 않고 메뉴 전부다 넘 맛있어요. 특히 오렌지 치킨은 주기적으로 생각납니당! 지인들 데리고 가면 다들 넘 맛있다고하네요.
24.9.23.월,저녁에만 방문하다 브런치 먹으로 갔는데 낮에도 분위기가 좋네요🩷  맛있게 잘먹고 대화 편하게 하고 왔습니다🙋🏻‍♀️
24.9.7.토,오랜만에 아이 생일파티로 들렀습니다. 예약은 하고 왔지만 사람들이 많진 않았구요~ 바로 들어가서 이것저것 주문해서 먹었습니다. 우선 맛있고 직원분들 친절하십니다. 다음이 또 올게요~~
24.10.12.토,"무난무난한 음식, 가볍게 먹을 만한 음식이였습니다!"
24.8.31.토,봉골레파스타도 맛있고 오렌지치킨은 너무 맛있어서 놀랐습니다! 두번째방문인데 또 방문하고싶습니다!
1.4.토,맛없어요! 라구파스타는 무슨 맛인지 모르겠고 몬테크리스토는 기름져요. 크림파스타는 평범하네요. 비추합니다.
24.9.11.수,"음식,와인 맛있었습니다 디져트는 좀 별로였습니다 잘 유지하셔서 오래오래 가는 식당되시기 바랍니다"
24.10.18.금,메뉴 다 맛잇고 너무 친절하세오!!!
24.6.7.금,브런치할때 방문했다가 all day로 바뀌고는 처음 방문했는데 음식들 하나 하나 다 너무 맛있어요 💗  사장님도 너무 친절하시고 완벽한 서비스도 감사합니다..✨  다음에는 무제한 스파클링 와인 마시러 가보려구요 💟
24.8.31.토,진짜맛있고 양도 많은편! 또가고싶어요
24.11.16.토,감사합니다. 홀매니저님 서비스 인상깊었습니다.
24.9.6.금,음식이 다 맛있고 분위기도 좋았어요. 초리조 파스타👍🏻입니다.
24.12.7.토,특별한 메뉴이기는 하나 굳이 시간내어 다시 방문할 의사는 없습니다
24.7.5.금,"몬테크리스토, 카프레제 샐러드랑 초리조 라구 파스타 먹었는데 파스타 사진이 없어서 아쉽네요~ 모든 음식이 넘넘 맛있었어요! 특히 초리조 라구 파스타가 저한테 처음에 좀 생소했지만 먹다 보니 감칠맛이 입맛에 착 맞더라고요 ㅎㅎ"
24.5.28.화,당일예약이 가능해서 예약후 방문했어요 :) 우선 들어서자마자 공간이 너무 예뻐서 반했고 테이블간의 간격도 넓직해서 좋았어요 ! 일행들보다 먼저 도착했는데 직원분께서 얼음물 내어주셔서 직원분 센스덕분에 음식 맛보기도 전에 기분이 좋았습니다 🫶🏻 모든 음식들 간이 적당했고 조화로웠어요 🙏🏻 오랜만에 기분좋은 한 끼였습니다 💕 다음에 또 방문해서 다른 음식들 먹어보고싶어요
24.12.15.일,반응 남기기 방문일 24.12.15.일 2024년 12월 15일 일요일 2번째 방문 인증 수단 예약
24.10.3.목,블로그에서 많은 분들이 추천한 옥앤수 몬테크리스토와초리조 라구 파스타를 주문했는데 진짜 맛있더라구요~ 특히 초리조 라구 파스타! 흉내낼 수 없는 맛입니다~ 강추에요~ 잘 먹었습니다!
24.6.20.목,너무너무 맛있어요! 사실 옥수는 집에서 좀 먼데 그래도 다시 올려구요ㅋㅋㅋ 넘 맛있움💚 🌽아수크림도 최고
24.7.10.수,모든 음식이 다 맛있었어요:) 매장도 깔끔하고 예뻐요! 대만족입니당
24.7.13.토,음식 다 너무 맛있었어요~!! 또 방문 예정입니다
24.8.9.금,너무너무 맛있었어요 다음에 또 가서 다른 메뉴 먹고싶어요
24.10.6.일,미모사 칵테일에 들어가는 오렌지주스가 과육 있는 쥬스라서 넘 맛있었어요!! 강추 드립니다🍹음식들도 다 맛있습니당
24.3.31.일,"예약하고 방문해서 바로 앉았어요. 매장이 꽉 차 있었는데 답답하진 않았고, 을지로가 생각나더라구요. 잘 먹을 일 없어서 고른 몬테크리스토 맛있고 커피랑 같이 먹으니 딱 이었어요. 라떼 메뉴도 있으면 좋겠다 생각했어요. 트러플은 생각보다 향이 아주 강하진 않아요. 분위기 좋고 예약하고 방문하면 기다리지 않아도 되어서 꼭 예약하고 방문하시길 추천 드려요"
24.6.9.일,시켰던 모든 메뉴가 만족스러웠어요♡♥ 이쁘기만 한줄 알았는데 추천 할 만큼 맛있어서 즐거운 시간 보냈습니다ㅎㅎ
24.9.22.일,전부터 너무 와보고싶었는데 양도 많고 너무 맛있어요!
24.6.20.목,모든 메뉴 먹어보고 싶네요
24.7.18.목,옥수카프레제샐러드 진짜 맛있었다!
24.6.20.목,음식 깔끔하고 간도 잘 맞고 맛있었어요~ 동네에 이런 음식점이 있다는게 행복하네요 또 방문할게요!
24.5.24.금,맛있어요.. 2주전에 왔다가 맘에들어서 또 왔어요 메뉴 하나하나 다 맛있네요
24.8.19.월,리가토니 맛있었고 대체적으로 괜찮았는데 유자티라미수... 마무리로 상큼한 맛을 기대했지만 유자향이 미미한 건 둘째치고 다들 한입씩 먹자마자😵‍💫 그것은 유자티라미수가 아니라 멸치티라미수였습니다🐟 냉동실 안의 레이디핑거가 건어물 근처에 있는 건 아닌지 확인해주세요......
24.3.26.화,오렌지치킨+ 올데이스테이크+미모사/어퍼치퍼🙂 스테이크 보단 오렌지치킨이 좀 더 맛있었어용~ 퍽퍽하지두않쿠 상콤짭쪼름 소스도 잘배어 있구~ 근데 메인요리보단 올데이옥수같이 브런치쪽이 좀더 괜찮은거 같아용~
24.2.23.금,지인과 오랜만에 약속이라 어디갈지 생각하다가 저장해놨던 곳에 방문 ! 예약하고 가서 가자마자 방문했고 오렌지치킨과 새우산도 그리고 라구파스타까지 3개를 주문했다 새우산도로 시작하니 입맛이 돋았고 차례대로 다른음식도 나왔다 !!! 이세상에 맛없는 치킨은 없다라는 말을 어디서 들었는데 그말이 딱맞다 이름만 들었을때는 약간 걱정되는 이름인데 오렌지치킨은 진짜 너무 맛있었다 미니양배추까지 최고 양이 생각보다 너무 많았고 파스타도 아주 맛있게 잘먹었다 🥹 직원분들도 너무 친절하시고 아늑한분위기에 좋은시간 너무 잘보낸거같아 행복한밤이였다 🩷 옥수동이 핫하다고 하던데 정말 사람도 많고 아늑하고 왜 사람이 많은지 알것같다 ☺️
24.8.4.일,주방이살짝보이는데 주방위생이좋지않아보여요 음식하시는분머리가떡져있더군요 음식은 보통입니다 브런치를기대하고갔는데 저는실망했어요 그래도리뷰가좋은건 만족하는사람도많다는거겠죠 ~~
23.12.23.토,매번 감동을 주는 제이드앤워터.. 운좋게 예약성공해서 크리스마스 위크에 방문했어요! 🎄 이 가격에 이런 서비스와 공간에서 이토록 훌륭한 음식을 맛볼 수 있다니.. 메뉴 하나하나 감탄나오는 맛이었어요 정말 . 제이드앤워터 덕분에 친구들과 잊지못할 시간 보냈습니다🫶
24.6.1.토,음식이 정말 맛있고 분위기가 좋아요 아이스크림이 진짜 맛있어요 꼭 드셔보세요 추천합니다!!
24.3.1.금,"친구 생일이라 다녀왔어요! 아늑한 분위기도 좋지만 음식 너무 맛있어요~ 이런 곳은 정기적으로 가줘야할것 같아요. 초리조라구파스타, 옥앤수새우산도, 옥수 카프래제샐러드, 옥앤수선데 디저트까지 완벼크!!!"
24.6.16.일,사진찍은 라구랑 새우카츠외에 뽀모도로도 너무 맛있었어요🩵
24.5.10.금,맛있었어요 ㅎㅎ 예약 없이 방문 어렵습니다. 꼭 예약 하시길 추천 드려요.
24.5.5.일,"블루리본 3년 연속 당당하게 붙어 있어요 ㅎ 예약 하고 가야 하구요. 예약 안하고 워크인 갔다가 한번 된통 당해서 못먹고 예약 하고 갔습니다. 내부는 오픈 되어 있어서 손님들 얘기하고 웃는 소리가 다 혼합 되어 있고 주방은 오픈 키친인데 뒤에도 주방이 하나 더 있는 것 같았습니다. 새우산도는 새우가 좀 짰고, 양념이 칠리 같은 느낌이라 너무 흔한 맛이었습니다. 트러플은 트러플 향 첨가인지 너무 미미한 향이었고 그나마 라구가 맛있습니다. 라구는 들깨가 들어 있어 이 집의 시그니처 처럼 느껴지더라구요. 음식 다 먹고 나오면 어쩔수 없는 오래된 건물의 화장실 냄새가 진동을 하는데 1층 화장실, 2층 식당임에도 불구 비오는날이라 그런지 냄새가 더 났습니다. 그게 좀 별로...였습니다.."
24.5.4.토,"친절하고 맛있었어요 허브 향 좋아하는 분들은 좋아하실고 같아요~~ 분위기 좋고 재방문 의사 있숩니다,,"
