date,content
"""음식이 맛있어요""",이 키워드를 선택한 인원
"""고기 질이 좋아요""",이 키워드를 선택한 인원
"""친절해요""",이 키워드를 선택한 인원
"""매장이 넓어요""",이 키워드를 선택한 인원
"""직접 잘 구워줘요""",이 키워드를 선택한 인원
"""특별한 메뉴가 있어요""",이 키워드를 선택한 인원
"""매장이 청결해요""",이 키워드를 선택한 인원
"""양이 많아요""",이 키워드를 선택한 인원
"""단체모임 하기 좋아요""",이 키워드를 선택한 인원
"""인테리어가 멋져요""",이 키워드를 선택한 인원
"""재료가 신선해요""",이 키워드를 선택한 인원
"""가성비가 좋아요""",이 키워드를 선택한 인원
"""반찬이 잘 나와요""",이 키워드를 선택한 인원
"""잡내가 적어요""",이 키워드를 선택한 인원
"""특별한 날 가기 좋아요""","""특별한 날 가기 좋아요"""
"""메뉴 구성이 알차요""",이 키워드를 선택한 인원
"""비싼 만큼 가치있어요""",이 키워드를 선택한 인원
"""주차하기 편해요""",이 키워드를 선택한 인원
"""뷰가 좋아요""",이 키워드를 선택한 인원
"""음식이 빨리 나와요""",이 키워드를 선택한 인원
"""차분한 분위기예요""",이 키워드를 선택한 인원
"""혼밥하기 좋아요""",이 키워드를 선택한 인원
"""화장실이 깨끗해요""",이 키워드를 선택한 인원
"""아늑해요""",이 키워드를 선택한 인원
"""룸이 잘 되어있어요""",이 키워드를 선택한 인원
"""건강한 맛이에요""",이 키워드를 선택한 인원
"""좌석이 편해요""",이 키워드를 선택한 인원
"""아이와 가기 좋아요""",이 키워드를 선택한 인원
"""오래 머무르기 좋아요""",이 키워드를 선택한 인원
"""코스요리가 알차요""",이 키워드를 선택한 인원
"""반려동물과 가기 좋아요""","""반려동물과 가기 좋아요"""
"""샐러드바가 잘 되어있어요""","""샐러드바가 잘 되어있어요"""
"""환기가 잘 돼요""",이 키워드를 선택한 인원
10.4.토,가게에적힌문구만큼~ 먹는행복이~만땅인곳입니다~~~♡ 양대창모듬은너~~~무잘구워주셔서순삭해서 사진이없는게아쉽네요ㅎㅎㅎ 뒤에시킨사진밖에없네요ㅎㅎㅎ 자주오기쉽진않지만~먹고싶을땐꼭오는곳입니다 저희마나님이좋아하는곳이라ㅋ 한번와서드셔보시면반할맛입니다~ 강추합니다~꼭드셔보시길~~~~
10.4.토,여행 와서 일부러 찾아온곳 오래전 먹었는데 너무 맛있게 먹어서 다시 찾은곳. 다른곳. 검색도 안하고 여기로. 역시 다시 찾은 보람이 있네요. 직원분들 친절하고 직접 구워서 주시고. 질은 말할거 없이 좋고 맛 좋아요 추천
10.3.금,데이트 예약으로 방문했어요 구미에서 맛집이라 한달에 한번씩 오고싶은 소백산입니다 사장님 직원분들 친절하시고 맛은 말안해 알쥬 저의 최애집 👍
10.2.목,또또또온집! 묵사발부터 양념게장 명이나물 넘 깔끔하게 잘나오고 다 맛있어서 또 찾아오게되는 집이에요! 와도 후회 없을집 가까워서 넘 조아요
9.15.월,올때마다 너무 맛잇게 먹고 있어요! 구미 최고 맛집👍👍👍 분위기도 좋고 사장님 직원분들도 너무 친절하시고!! 항상 만족하며 먹는곳!! 고기도 다 구워주셔서 편하게 먹는답니다! 오늘도 잘먹고 갑니다🥰
7.17.목,진평동에 위치한 소백산 👍 너무맛있게 먹은생각이나서 또오게만드는 이집 정말 맛집 추천합니다 오자마자 드실수잇고 고기도 직원분이 친철하게 다 구워주셔서 너무 좋았아요 퇴근후 한잔하면서 먹는데 정말 꿀맛입니다
9.27.토,맛있는 양대창구이 친절하게 직접 잘 구워주시고 반찬도 잘 나와서 너무 좋네요 ^-^* 다음에 또 와야겠어요~♡
9.1.월,맛있어서 자주 와요 늦게 여는줄 모르고 낮에왔다가 저녁에 다시 왔어요ㅎ
9.12.금,주에 한번씩은 오는듯해요 맛있어요~
9.10.수,맛있어서 자주와요 맛도리~ 꿀맛육회도 맛나요
9.12.금,우리동네 맛집이에요. 신메뉴가 생겼네요!
10.3.금,고기가 질기지 않고 너무 맛있어요~^^ LA갈비랑 와규 먹었는데 둘 다 너무 맛있어요~ 된장찌개도 맛있게 잘 먹었습니다 ㅎㅎ 다음에 또 방문할게요~
10.7.화,고기뿐만아니라 반찬들도 맛있오요. 가게도 깔끔 자주 올게요
9.2.화,친구와 양대창구이 먹으러 소백산 다녀왔습니다 홍창 대창 갈비살 모두 맛있게 먹었네요 소맥이 술술 다음에 또올께요~
9.1.월,대창이랑 특양 먹고 싶어서 문성에서 인동까지 날아왔어요ㅋㅋㅋㅋㅋ 오랜만에 왔는데도 역시나 너~무 맛있네요♥️ 서비스 육회도 맛있어요! 맛있게 잘 먹었습니다 사장님!
8.6.수,오늘도~~~^^ 대창 찜♡♡♡ 맛있어요~~~~ 잘구워주시고 친절도하시고 맛있어요~~
9.10.수,고기가 맛있어요. 대창 먹었는데 엄청 느끼하지 않고 고소합니다. 매장도 넓고 사장님이 친절하세요! 지인에게 추천하고 싶어요!
9.27.토,ㅜㅜ그냥 내장종류 여기일등입니다 돼지갈비도맛있네용^^ 반찬도 엄청맛있구 강력추천 늘오는곳
8.5.화,일찍퇴근후 생각나서 사람들하고 같이모여서 왓습니당 늘 먹어도 맛잇는데 변함없는맛 너무 좋아요 한결같네요 진평동에 소백산 찾아오세요🐥
8.4.월,고기 질이 진짜 좋아요! 그리고 직접 잘 구워 주셔서 맛있게 항상 먹고 가요!ㅎㅎ 직원분들도 엄청 친절해서 좋아요!
10.4.토,완전 맛있어요. 제가 가는 곳 중에서 최애 맛집입니다. 한번 드시면 단골이 무조건 됩니다
8.14.목,맛있어요 ~~최애집♡♡♡ 강추합니다 ~~~~👍👍👍👍 직접구워주시고~~맛도 서비스~~♡♡♡ 굿!!!^^
9.11.목,자주오는곳이에요 맛있고 다 구워주셔서 넘좋아요 특히대창이 넘 맛나서 항상 대창추가해서 먹고와요 담에 또 올께요
8.19.화,소백산 양대창구이 맛있어요!😊 올때마다 맛있게 먹고 가는것 같아요! 구워주셔서 더 감사히 잘 먹었습니다!🙏🏻
8.9.토,"더운날씨지만, 불 앞이라도 괜찮아요 :) 가게안이 시원하고 좋아요!! 고기도 다 구워주시구 ~ 좋아옴 !!"
9.2.화,찬도 잘 나오고 너무 맛있어요♡
9.15.월,우선 너무 맛있어요 대화하기 좋은 분위기에 직원분들도 너무너무 친절해요😍 매일매일 먹고싶어요🫣
9.14.일,구미 대표 대창 맛집 10년째 먹어도 먹어도 맛있습니다. 안창갈비랑 돼지갈비도 꿀맛입니다. 반찬중 양념게장이 매콤하게 맛나고 묵사발도 별미!
7.8.화,먹어본 양대창중에 진쨔 입에 넣고 씹자마자 입 안에서 터지는 맛이 장난 아니에요👍🏻👍🏻 친절하게 구워주시면서 부위별 설명까지 해주시고 유쾌하게 얘기도 해주서서 편안하고 맛있게 먹었습니다! 처음 접하는 분들도 부담없이 맛나게 드실수있을것같아요!
9.9.화,대창 다른집에서 먹고 안먹었는데 대창 처음드시는분들 소백산에서 시도 하세요 고소한게 무슨말인지 아실꺼예요 사장님 너무 친절하세요 소백산 변함없는집 오래된.가게인데도 깔끔해요 너무 잘먹었습니다
10.2.목,맛있어요! 양도 푸짐하고 반찬도 많이나오고 메뉴가 다양하고 좋아요
10.7.화,앞으로 울산에서 구미 오면 반드시 들릴 거에요 .. . 꼬소하이 츠직 ... .. 🖤
9.11.목,가족들과 종종 오는데 아주 맛있어요~
9.29.월,너무 맛있어서 먹다가 찍었어요!!
9.11.목,갈비는 무조건 소백산!! 완전 맛있고 서비스도 좋아요👍
8.31.일,출산 전 마지막 만찬으로 먹으러 왔어요 너무 맛있어요🫶🏻 소백산 대창은 진짜 사랑이에요💕
10.3.금,메뉴도 다양하고 숯도 좋은거 쓰고 회식하기 좋아요
8.4.월,가게도 깔끔하고 밑반찬도 맛있고 고기도 다 구워주셔서 잘 먹었어요 다음에 또 올게요~~
9.9.화,오늘로써 두번째방문! 대창 안드시는분들 오셔서 드셔보세요! 다른곳이랑 틀립니다 기본찬 여러가지로 튼튼하고 맛나고 가격대비 넘 좋습니다🩷 특별한널 데이트 원하시면 한번 방문해보세요!!
9.11.목,대창은 소백산이 제일 맛있어요~ 느끼하지 않아서 많이 먹을수 있습니다!! 대창 맛집!!최고
6.8.일,구미에 놀러와서 이렇게 맛있는 대창을 먹어볼 수 있어서 행복합니다! 모둠 B로 시작해서 내장류 추가해서 더 먹었습니다 ㅎㅎ 원래 소주 잘 못하는데 정말 내장류와 함께 먹으니 술술 넘어가고 반찬들도 너무 맛있어서 다음에 또 방문 예정입니다 ㅎㅎ 숯불에 구워 먹는 내장류들 너무 맛있으니 의심말고 오세요~!
9.1.월,구미 찐맛집 직접 너무 맛있게 구워주시고 매우 친절하세요! 지인들이 놀러오면 첫번째로 추천해요♡
9.1.월,지난번에 모임으로 방문하고 맛있어서 재방문했어요 맛있게 구워주셔서 너무 잘 먹었습니다!👍👍👍
9.29.월,일주일만에 대창이랑 안창갈비먹으러 다시 왔습니다 맛집 확실합니다
9.4.목,저는 첨 와보는데 다~맛있어요~!! 맛있고 친절해서 또 오고 싶어요 잘 먹었습니다~!!.  남편은 단골😝
7.18.금,동네에 이렇게 깔끔한집 있는거 왜 처음알았죠? 반찬도 깔끔하고 너뮤 맛있고 만족스럽습니당 추천!!
10.2.목,구미 대창집 중에 최고예요!! 월급날 항상 갑니다 ㅋㅋㅋㅋ♥️
10.3.금,남편이 갈비 좋아해서 갈비 먹고싶은 날엔 소백산만 찾아와요!!! 대창도 맛있어요 👍👍
9.14.일,"소백산 양대창 구미 인동점!! 꼭 오셔서 맛 한번보고 가세요~~^^ 직접구워주시고, 친절하고 매장도 넓고좋아요!"
9.10.수,오랜만에 왔는데 여전히 모든메뉴가 맛있습니다~~~ 일하시는분들도 너무 친절합니다
9.15.월,대창 안창갈비 맛집입니다 된장찌개 김치짜글이도 엄청 맛있어요 직원분들 친절하신건 기본입니다!!!!🙂
7.16.수,고기들이 부드러워서 넘 마싯어요!! 다 구워주셔서 편하게 먹기 좋아요~~ 룸도 따로 있어서 다음엔 예약하고 와야겟오요
8.24.일,소문만 듣고 와봤는데 반찬 구성도 알차고 질이 좋네요~대창 모듬 시켰는데 맛있어요!!
8.30.토,너무맛있어요 생각날때마다 들린답니다 귀한분대접할때도 여기모시면 좋을것같아요
7.17.목,우리 부부가 좋아하는 진평 소백산 양대창! 맛있고 친절하시고 직접 구워주셔서 좋아요. 반찬도 많고 맛있어서 거를 게 없어요.
9.11.목,반응 남기기 방문일 9.11.목 2025년 9월 11일 목요일 11번째 방문 인증 수단 영수증
7.18.금,소백산 맛집 다들 아시죠~~~! 더운 여름에도 시원하게 고기 구울 수 있다구욤~~ 구미에서 제일 맛있는 고기 드세용!!
10.1.수,고기너무 맛있어용 ㅎㅎ 직원분들도 친절하하십니당 😍😋
8.8.금,애들도 잘먹고 반찬이며 다 너무 맛있어용 자주올께요 대창은 소백산이 젤 최고인듯요👍
9.27.토,밑반찬도 잘 나오고 메뉴 구성이 좋아요! 메뉴가 다 맛있어서 다음에도 재방문할 것 같아요ㅎㅎ
10.4.토,반응 남기기 방문일 10.4.토 2025년 10월 4일 토요일 1번째 방문 인증 수단 영수증
8.14.목,맛있게 구워주셔셔 잘먹었습니다! 매번 올때마다 맛있는거같습니다. 또 올께요!
7.18.금,고기 질도 좋고 너무 맛있어요~ 자주 올 것 같습니다-!
9.28.일,그냥그냥 먹을만 합니다. 남자분은 사장님이신지 직원이신지 이모님들보다는 훨씬 친절하시네요.
9.15.월,너무 맜있어요 직원분들도 친절하시구 맛있게 잘먹었습니다
9.13.토,제 또간집이예요 제 남자친구가 대창을 입에도 안대는데 여기만 오면 계속 먹어요!!! 삼겹살도 진짜 마싯어요 꼭 와보세용
6.14.토,"고급스러운 대창, 갈비 등 다양한 구이 메뉴가 일품인 곳! 👍 신선하고 고소한 맛이 정말 최고예요. 사장님도 친절하시고 분위기도 좋아서 즐거운 시간 보내고 왔습니다. 재방문 의사 100%입니다! 강력 추천드려요! 😊"
6.15.일,"밑반찬이 넘 잘나와요!!!양대창 진짜 고소하고 질감이 너무 좋아서 계속 먹게 됨!!!!대창은 안에 기름 터지는 느낌인데 이상하게 안 느끼하고 맛있었어요 ㅎㅎ 불판에 올려서 지글지글 익혀먹는 재미도 있고, 술이랑도 찰떡임~~~"
8.2.토,항상 올때마다 대창 먹었는데 다른것도 먹어보니 맛있네요
9.2.화,오랜만에 왔는데 여전한 구미 대창맛집입니닷!!!
7.17.목,오랜만에 왔는데 여전히 맛있어요! 잘 구워주시고 친절하셔서 기분 좋아요 😀
10.4.토,단골집인데 항상 맛도 있고 친절하시고 최고예요!!
6.8.일,밑반찬이 잘나오고 맛있어용ㅎㅎ😚  대창 진짜 넘사벽ㅠ 많이 느끼하지도 않고 소스에 찍어먹으면 꼬숩🥹  안창갈비도 맛있어요!!  대창먹고싶다면 무족권 여기👍🏻
8.8.금,"반찬도 다양하고 음식도 맛있어요~~ 연인이랑 같이 왔는데, 가족들이랑도 와도 좋을 것 같아요~ 사장님도 친절하시고 덕분에 즐거운 저녁 보냈습니다~"
8.8.금,첫 방문 후 일주일만에 또 왔습니다 대창의 맛을 잊을 수가 없어요✨️ 인생대창집입니다 직접 구워주셔서 모임하기도 좋네요
8.19.화,대창 너무 맛있어요 ㅠㅠㅠㅠㅠ미쳣어요 ㅜㅜㅠ
9.4.목,크으👍 통통하니 굽기도 전에 벌써부터 침이 꼴딱!! 대창은 말모🖤 너무 친절하시고 조아요✨
9.13.토,전에 맛있게 먹어서 친구들이랑 같이 왔는데 역시 맛있어요!!
7.4.금,맛있어요 구어주시니 편해요
7.16.수,"곱창이 먹고 싶어서 근처 찾아서 바로 들어왔어요 ! 대기없이 들어와서 앉자마자 음식 내주시고 주문한 음식도 바로 가져다주셨서용 간만에 먹는 곱창이라 기대했는데 기대 그 이상입니다 ,,,, 단체 모임하기도 좋고 데이트코스로도 좋을 거 같애요 즐겁게 잘 즐기다 갑니다 😁♥️"
8.1.금,오랜만에 맛도리 먹어요^^ 8년차 맛집단골 👍
7.6.일,대창은 구워주시는데 이런 숯불에 오랜만에 맛나게 먹었습니다! 실하고 너무 맛있었습니당
7.6.일,대창먹을때 항상 애용하는곳입니다 우선직원분들 엄청친절하시고 맛은 두말하면 잔소리입니다 너무맛있어요~ 진평동 맛집인정👍
10.3.금,양념대창이 완전 맛있고 회식하기에 좋습니다~ 사장님도 매우 친절하세요~
8.11.월,술이 술술 들어가용 ㅎㅎ 가족모임하기 좋아용 너무 맛있게 잘 먹었습니다!!
9.4.목,너무 맛있어서 재방문 했어요~ 역시 맛있어요^^
8.14.목,너무 맛있어서 자주오는곳이에요 특별난날 지인초대등 오기에 좋은곳이에요 여기만큼 대창맛있는곳 본적없어요
9.14.일,매장깔끔하고 맛있어요 좋아요~ ㅎ
9.3.수,언제 먹어도 늘 맛있습니다 구워주니 탈 걱정 없고 좋아요
9.13.토,지금 몇번째 온지 모르겠어요 고기가 먹고싶을때마다 매번 생각나요❤️❤️❤️❤️
9.13.토,고기 정말 부드럽고 서비스도 좋아서 잘 먹고 갑니다!!
9.29.월,항상 올때마다 너무 맛있고 친절합니다 구미 대창 관련 음식점 중엔 최고에요
8.20.수,맛있어요 매장도넓어서 회식이나 데이트하러오기 딱좋은거같고 직접구워주시고 친절하십니다!!
8.6.수,너무 맛있어서 친구랑 술먹을때마다 항상 오는곳입니다 조용하고 맛있는 음식점 좋아하시면 적극 추천드립니다
8.1.금,대창은꼭여기만오는 소백산러버입니당 언제나맛도링
9.27.토,반응 남기기 방문일 9.27.토 2025년 9월 27일 토요일 3번째 방문 인증 수단 영수증
6.7.토,대창이 생각날때 마다 오는 곳 입니다. 구미에서는 여기 만큼 맛있는 곳을 본적이 없습니다. 밑반찬도 잘 나와서 삼겹살 먹을때도 여기만 옵니다. 평생 단골이 될 겁니다
9.4.목,주변에 소개 해주고싶은 맛집!! 가게도 깔끔하고! 맛도 좋아요!
9.3.수,생각했던 거 보다 더 맛있고 기대 이상입니다 재 방문의사 100!!!!!!!! 얌얌 맛나당
9.11.목,반응 남기기 방문일 9.11.목 2025년 9월 11일 목요일 19번째 방문 인증 수단 영수증
8.7.목,언제 먹어도 맛있어요 대창은 여기 따라갈 곳이 없는것 같아요.
9.2.화,곱창 한판으로 시켰는데 다양하게 먹을 수 있어서 좋아요. 맛있어요!!
8.7.목,엄청 신선하고 맛있어요 밑반찬도 정갈하고 리필 잘 해주셔서 엄청 잘 먹고 갑니다 재방문의라 200%
6.7.토,잡내가 없어서 편하게 먹었네요 고기도 엄청 많고 지방 좋아하는 저는 너무 좋게 먹었습니다 또올게요!
6.18.수,매번 올때마다 변함없는 맛으로 실패한적이없는 맛집이에요 분위기도 너무 좋고 직원분들이 너무 친절하세요 앞으로도 자주 올게요 😊 맛있게 잘먹었습니다
10.7.화,엄청 맛있고 직원분들도 친절하십니다
8.2.토,대창 맛집이라고 찾아왔어요!! 근데 찐찐찐 맛집이네요 불향이 가득한 맛있는 대창구이입니다💖👍 직접 다 구워주시고 밑반찬도 맛있어서 즐거운 식사하고 갑니다!
5.3.토,오랜만에 왔어요 ㅎㅎ 너무 맛있어요ㅜㅜ 밑반찬도 너무 잘나오고 구미 맛집 소백산 양대창 !! ❤️❤️❤️❤️❤️❤️❤️❤️❤️❤️❤️❤️❤️❤️
5.4.일,소백산은 믿고 먹습니다! 실패 없는 맛 ..!! 소백산 대창 이기는 집 없습니다!! 대창은 꼭 소백산꺼 드세요 재방문 의사 100프로 입니다 🥹💖👍🏻
10.4.토,고기도 직접구워주시고 양도많고 맛도좋아요
10.3.금,회사 회식으로 왔어요~! 매장도 넓고 친절해요~~! 다음에 또 올게요
10.1.수,맛잏어요! 갈비는 소백산
10.3.금,매번 맛있게 먹고 갑니다.
8.8.금,매주생각나서 또 들려요 진짜 맛있어요!!
6.6.금,대창구이 맛집👍 진짜 매번 오지만 최고입니다. 묵이 맛있어요ㅋㅋㅋ
10.2.목,맛 과 서비스가 좋아요.추천합니다.
10.2.목,직원분들 엄청 친절하고 고기 질이 엄청 좋아요 재방문 필수 입니다
6.9.월,소백산 양대창 모둠 a세트 먹었는데 너무 맛있어요 사장님도 구워주시고 친절하세요
8.8.금,처음왔는대 사장님 너무 친절하시고 직접 고기 구워주셔서 좋아요 맛도 너무너무 맛있어요:)
9.30.화,맛있게 잘 먹었습니다.! 다음에도 방문 하겠습니다~
6.5.목,맛있어요. 직접구워줘서 좋았어요 직원분 친절하시고 넘넘 좋아요~~~
9.11.목,항상이용하는데에요 맛나고 푸짐해요
9.27.토,고기도 구워주시고 아주 친절합니다
9.10.수,매번오지만 음식은 맛있어요
6.5.목,지난번에 방문했을때 맛있었어서 또 왔어용 메뉴가 다 맛있어요:)
8.9.토,직원들이 친절하고 고기가 맛잇습니다
7.18.금,구미시 진평동 실패없는 맛집 벌써 10년째 이용하네요 오래 되었어도 여전히 깨끗하고 맛있는집 이여서 후회가 없어요. 오늘도 잘 먹고 갑니다^^
7.1.화,매장도 넓구 직원분도 엄청 친절하셔요 ! 대창은 직접 구워주셔서 너무 좋았어요 !! 고기도 맛있어요 !
8.19.화,오랜만에 방문란 소백산 진평 대창하면 소백산이죠. 여전히 맛있어요
8.2.토,대창 맛집 인정입니다^^ 대창 굽기 힘든데 사장님께서 정성껏 구워주셔서 최고의 대창 맛을 볼수 있었습니다~~ 👍👍👍👍👍
8.11.월,집 근처여서 항상 오는 맛집인데 너무 맛있어용 ㅎㅎ
7.16.수,n번째방문인데 올때마다 너무 맛있게먹고 사장님도 친절해서 좋아영
8.20.수,갈비는 진짜 소백산입니다. 다른데 비교가안됩니다
8.18.월,두번째 방문이요!직접 구워주시고 친절하세용!음식도 깔끔하고 사장님도 친절하세용❤️
5.10.토,매번 찾는 소백산 양대창구이|~~ 믿고 먹는 곳이에요 ❤️ 고소하고 대창의 곱이 가득 신선한 곳!! 진주에서먹으러 다녀요~~
5.3.토,"구미 처음와서 먹는 식당으로 많이 알아보고 갔는데 리뷰도 후기도 좋아서 왔는데 완벽,,잡내1도 없고 부드럽고 구워주시고 술 쭉쭉 들어가네요!!!"
7.16.수,엄청 맛있고 친절하세요 양도 많고 넓고 시원해서 다들 한 번 와보세요! 밑반찬도 엄청 잘 나오고 직접 구워주시고 짱짱 ‼️
8.10.일,너무 맛있어요 ㅠㅠㅠㅠ
7.8.화,신랑이 먹고싶대서 대창이랑 안창갈비시켰는데.. 애들이 대창을 더 잘먹어서 어른들이 먹을께 없네요ㅎㅎㅎ안질기고 부드러워요~양이 적다는게 단점이지만 맛은 좋아요~
8.14.목,직원분이 구워주셔서 편하게 먹을수있어요. 냄새도 안나고 너무 맛있게 잘먹었습니다.
7.9.수,사장님 친절하시고 고기맛있어용ㅎㅎ밑반찬도 굿
7.9.수,밑반찬도 푸짐하고 고기도맛있고 게장도 굿굿
9.12.금,소백산 양곱창 회식장소로 좋아요. 맛있습니다.
8.4.월,종종오는 맛집이예요!! 저렴하고 질좋아요 꼭 와보세요
8.4.월,오랜만에 들렀는데 여전히 맛있네요~ 얼마전에 다른 곳에 갔었는데 여기만한 곳이 없네요~~ 우리 중딩이들도 잘 먹고 너무 맛있게 잘 먹고 갑니다~
8.10.일,너무 맛있어요~ 자주오고싶어요^^
6.15.일,처음 방문해봤는데 왜 이제야 왔나 싶을정도로 맛있어용 ㅜㅜ 고기가 부드럽고 맛있어요! 자주 올게요 !!
6.4.수,구미 양대창은 소백산이 최고에요 ㅜㅜ 몇번째 재방문중 .. 너무 맛있어요 ㅜ 직접 구워주시구 🤓🤓🤓
6.14.토,지인들과 처음 왔는데 친절하시구 맛있었어요 ㅎㅎ 다음에도 또 방문하겠습니다! 추천드려요 ㅎㅎ
8.8.금,변함없이 맛있는 집입니다~!
7.4.금,자주오는곳이에요 맛있고 다 구워주셔서 넘좋아요 특히대창이 넘 맛나서 항상 대창추가해서 먹고와요 담에 또 올께요
6.7.토,저번에 처음먹고 생각나서 또 왔어요~! 오늘도 맛있게 잘구워주셨습니다~ 담에 또 올게용♡
8.10.일,자주 방문하는 단골집이예요~ 양대창은 물론이고 돌곱창한판까지 다 너무 맛있어요😍
4.8.화,찐 구미 소울푸드 ㅎ 구미 양대창 맛집입니다 💖 넓어서 웨이팅 대기 없이 편하게 식사할수있고 양대창모듬 쫄깃쫄깃 진짜 맛있어요~
8.6.수,소고기가 살살 녹아요 맛있아요
9.30.화,음식이 전부 맛이 있어요
5.1.목,고기 질도 좋고 아주 맛있어요. 친절하게 잘 구워주셔서 편하게 먹기 좋아요! 추천해요😍🫶🫶🫶
8.10.일,맛은 말할것도 없고 고기먹기전에 반찬부터가 너무 맛있어요!
8.4.월,멀리서 왔어요 맛있어요❤️
5.31.토,두번째방문인데고급지고 밑반찬도다양하게넘잘나와요 대창 하나도 안느끼하고고소해요 넘맛있어요 양은 식감 죽이고 넘 맛있게먹고갑니다
10.2.목,맛있게 잘 먹고갑니다~~
8.18.월,밑반찬도 다 너무 맛있고 고기질이 너무 좋아요! 특별한 날 방문하기 너무 좋은 맛집입니다!
6.30.월,"오랜만에 왔어요 깨끗하고, 친절하고, 역시나 맛있죵 🫶🫶"
6.30.월,회식 때 먹어보고 맘에 들어서 부모님 모시고 왔는데 정말 맛집입니당!! ㅎㅎ 특히 안창갈비랑 와규갈비가 정말 부드러워서 누구나 즐길 수 있는 메뉴이고 직원분들께서 친절히 응대해주시면서 내장류는 다 구워주셔서 너무 만족스러웠어요:) ㅎㅎ 잘 먹구 갑니당~!!
9.2.화,정말 맛있어요..!! 대창이 최고 입니다..
4.5.토,"우선 기본 반찬들이 다양하고 맛이 깔끔해서 계속 먹게 되더라고요!ㅎㅎ 특히 귀한 양념게장이 기본으로 나와서 한번더 리필해서 먹었어요👍 양대창모듬 B로 먼저 먹었고, 달달 고소한 대창과 ~ 아이들은 위한 돼지갈비까지 추가해서 먹었네요ㅎㅎ 음식들이 다 맛있어서 굿!ㅎㅎ 단체룸이 세개나 있어서 다음에 회식 때 재방문 예정입니다^^♡"
9.1.월,고기질조좋고 서비스도좋아요 맛있고 꼭와보세요
2.28.금,직접구워주시고 직원분항상 친절하세요~~~^^ 맛도최고~~^^ 친절도 최고~👍👍👍👍 대창도 강추강추입니다~~😁😁😁 오늘도 맛있게 잘먹고 갑니당🙏🏿🙏🏿🙏🏿
6.15.일,고기도 구워주시고 일단 맛이 끝내줍니다! 가격도 양대창치고 괜찮아서 회식장소로 좋아요!!
8.7.목,"음식이 맛있고,사장님 너무 친절하세요!!~~^^"
8.1.금,가게도 깔끔하고 고기도 맛있네요~
