date,content
"""음식이 맛있어요""",이 키워드를 선택한 인원
"""재료가 신선해요""",이 키워드를 선택한 인원
"""혼밥하기 좋아요""",이 키워드를 선택한 인원
"""가성비가 좋아요""",이 키워드를 선택한 인원
"""매장이 청결해요""",이 키워드를 선택한 인원
"""메뉴 구성이 알차요""",이 키워드를 선택한 인원
"""친절해요""",이 키워드를 선택한 인원
"""양이 많아요""",이 키워드를 선택한 인원
"""건강한 맛이에요""",이 키워드를 선택한 인원
"""특별한 메뉴가 있어요""",이 키워드를 선택한 인원
"""반찬이 잘 나와요""",이 키워드를 선택한 인원
"""인테리어가 멋져요""",이 키워드를 선택한 인원
"""차분한 분위기예요""",이 키워드를 선택한 인원
"""아늑해요""",이 키워드를 선택한 인원
"""술이 다양해요""",이 키워드를 선택한 인원
"""컨셉이 독특해요""",이 키워드를 선택한 인원
"""아이와 가기 좋아요""",이 키워드를 선택한 인원
"""잡내가 적어요""",이 키워드를 선택한 인원
"""매장이 넓어요""",이 키워드를 선택한 인원
8.26.화,좋아하는 곳이라서 이번에 식 메뉴가 나왔길래 도시락으로 주문하고 와서 이렇게 미리 주문해 놓고 도시락으로 회장에서 찾아 오니 집에서 먹기 엄청 편하고 싶더라구요. 이렇게 포장해 와도 반찬도 되게 많고 맛있어가지고 깜짝 놀랄 랄라네요. 자주 먹고 싶어요.
7.24.목,"평소에 자주 다니는 식당인데 , 장어덮밥이 나왔다고 해서 먹어봤습니다. 간만에 몸보신도 할겸 2미로 시켜서 아주 배부르고 맛있게 먹었습니다. 특히 오차즈게로 와사비와 뜨거운 물에 말아서 먹을수 있어서 먹는 재미도 있고 맛도 구성도 알차게 먹었습니다. 다음번엔 부모님 모시고 오고싶은 맛이었습니다:)"
7.24.목,장어덮밥 맛있다고 왔는데 3천원 추가하면 히츠마부시로 변경이 되네요! 장어 두마리에 히츠마부시로 주문하니 성인남자가 먹어도 정말 배부르게 먹고 갑니다~ 올 여름 많이 더운데 몸보신 제대로 하네요 ㅎㅎ 중복날 또 올게용!!
7.24.목,몇번가서 먹었던 하루반상에 신메뉴가 나왔다고 해서 장어덮밥을 방문포장했습니다!  양도 넉넉하고 맛도 좋고 갓성비 제대로네요! 장어를 이가격에 먹을수있다니 너무 좋습니다~ 히츠마부시도 추가했는데 먹는방법까지 들어있네요 대만족^^ 다음엔 2미도 도전해봐야겠어요  요즘 날이 더워 입맛도 없는데 또 먹으러갈게요~ 삼복이벤트도 한다고 하니 그때 재방문예정입니다ㅎㅎ^ㅇ^b
6.10.화,서울숲 놀러간김에 맛있는 도시락도 포장해가려고 들렸는데요. 같이간 친구가 생선을 안좋아해서 돼지생강구이 도시락과 치킨가라아게 덮밥으로 미리 주문하고 간건데 고등어구이 도시락을 보니 그냥 생선구이도시락을 시킬껄 그랬나 싶을정도로 퀄리티가 좋더라구요.잠시 생선구이도시락에 마음을 뺏길뻔했지만 돼지 생강구이도시락과 치킨가라아게덮밥도 맘에 쏙들었는데요. 미리 전화로 주문하고 갔더니 기다리지않고 따끈따끈한 도시락을 받을 수 있어서 더 좋았어요.  양많고 구성도 좋아서 앞으로 도시락먹고싶은날엔 무조건 떠올리게 될것 같은데요. 다음엔 생선구이 도시락도 같이 먹어봐야겠어요!! 잘먹었습니다.
8.9.토,"퇴근 후 하루반상 금호점에서 민물장어덮밥(1미)과 돼지생강구이 반상도시락 포장해왔어요. 원래 한강에서 먹으려 했는데 비가 와서 집에서 돗자리 깔고 피크닉 느낌으로 먹었습니다ㅎㅎ 😎 장어는 양념이 잘 배어 있고 살이 부드러워서 밥이랑 너무 잘 어울렸어요. 와사비 올려 오차즈케로 먹으니 별미였고, 돼지생강구이는 고기와 야채 조합이 딱 제 취향! 새우튀김, 타코야끼, 계란말이까지 구성 알차서 만족했습니다👍"
9.1.월,와 진심 너무 최악이에요. 소고기덮밥의 소고기는 질기고 퍽퍽하고 간도… 순살 고등어반상은 고등어가 메인인데 비비고 고등어가 더 나은듯 ㅋㅋ 반찬으로 나오는 튀김은 쩐내나고 맛없음 조미김이 젤 낫네요! 동네 장사하면서 이렇게 한다구요? 곧 영업종료 시간문제일듯 다신 안가요!
7.24.목,장어덮밥 너무 맛있어요! 이번엔 1미 짜리 먹었는데 다음엔 2미로 먹어볼래요 가성비 최고!!맛도최고😆
7.9.수,집에서 밥해먹기 싫어서 찾아보다가 하루반상 도시락 있어서 방문포장했어요! 도시락이 정말 맛있고 반찬도 정갈하네요 고등어 덮밥도 있고 건강한 한식이어서 어르신들도 좋아하셨어요!! 특히 치킨데리야끼는 제 원픽..너무 맛있습니다❤️
7.9.수,도시락 맛이 깔끔하고 밥양이 많아서 배부르고 맛있게 잘 먹었어요 !! 사장님도 친절하셔서 방문할때 기분이 좋았어요! 날이 시원해지면 도시락 포장해서 한강 나들이 가고 싶어요~~!
4.11.금,고등어랑 치킨데리야끼 도시락을 주문했는데 둘 다 너무 맛있게 잘 먹었네요 ㅎㅎ 반찬 구성도 알차고 무엇보다 메인메뉴 라인업이 맛있어서 최고였어요! 포장도 정갈해서 한강갈때 테이크아웃해서 가기에도 딱이네요 자주 먹을 것 같습니당 🤤🤤
4.8.화,구성이 굉장히좋은데 깔끔하고 맛있기까지! 무엇보다 가성비가 미쳤네오ㅠㅠ 남는게있을까요 금호동이자카야인만큼 일식가정식도 판매하면서 저녁에도 술한잔 하이볼한잔하기 좋아요 서울숲이나 한강 피크닉도시락으로도 딱입니닷 국물까지! 밥도정말 푸짐하고 재료들을 아낌없이 썼다는게 느껴지네요 완전 강추!!
5.23.금,"음식이 맛있고, 다찌석이 6개 정도 있어서 혼밥하기 편해요! 동네에서 간단하고 영양가 있는 식사하기 좋았어요 :)"
4.9.수,피크닉 가기 좋은 요즘 도시락 포장해오기 좋은 금호동 도시락 맛집 하루반상〰️🎶치킨데리야끼랑 고등어구이 반상 먹었는데 윤기촤르르 신동진쌀밥에 메인요리들이 묵직해서 도시락 먹을맛이 제대로 나요🩷 특히 치킨데리야끼소스도 맛있고 엄청 푸짐해서 맛있었습니다✌️
8.3.일,반응 남기기 방문일 8.3.일 2025년 8월 3일 일요일 7번째 방문 인증 수단 결제내역
8.10.일,"깔끔한 분위기, 정갈한 상차림 입니다 잘먹었습니다"
5.27.화,보기만하다가 처음가봤는데 맛있어요^^ 매장도깨끗하고 음식도 정갈 깨끗해요! 치킨데리야끼반상먹었는데 맛있었고 특히 적생강이 함께나오는데 맛있었어요
5.25.일,반응 남기기 방문일 5.25.일 2025년 5월 25일 일요일 6번째 방문 인증 수단 결제내역
5.5.월,반응 남기기 1 명 방문일 5.5.월 2025년 5월 5일 월요일 5번째 방문 인증 수단 결제내역
24.10.20.일,동네 산책하다가 새로 생긴 곳이라 호기심에 방문해봤는데 매장과 음식이 깔끔하고 맛있어요! 😍 고등어가 비리지않고 통통하고 잘 구워주셔서 뼈와 살이 잘 발립니다 나폴리탄 파스타는 라면처럼 계속 들어갑니다 밑에 깔린 🍳 계란이 킥이에요~!
24.10.10.목,"인근 응봉산 바람쐬러 왔다가 점심맛집 검색해봤는데 근처에 일본가정식 식당이 있어 방문하게 된 하루반상. 고등어구이,소고기 간장덮밥,돼지생강구이 반상등 여러 맛있어보이는 메뉴가 있었지만 철판 나폴리탄이란 파스타같이 생긴 메뉴가 베스트라 되어있길래 궁금해서 주문했습니다. 주문하고 나오기까지 약 15분~20분 이상 소요되는 편이라 짧은 시간내에 빨리 식사하셔야 되는 분들께는 권장드리고 싶진않고 홀은 다찌석 + 2~4인 테이블 5~6개(?) 정도 있어서 혼밥 부담없어보입니다. 주문한 나폴리탄을 보니 토마토 베이스 파스타 + 계란부침 + 소세지 조합인데 계란부침이 면밑에서 바삭하게 익혀있어 파스타에 감싸서 먹으면 바삭거리면서 맛있어요"
2.6.목,전에 와이프가 고등어 먹고 맛있다고 하더니 저도 돼지고기 먹으니 좋네요 아무거나 먹을까하다가 그래도 제대로 된걸 먹어야 몸에 좋을거 같아서 먹었어요
24.9.10.화,진짜 맛있어요. 반찬 구성도 완전 좋고요. 건강한 맛이라서 아주 좋아요. 브레이크타임없어서 편하게 가기에도 좋고요. 혼술로도 좋아요! 강추해요!
24.8.9.금,도시락 3종류 하나씩 포장주문해서 먹었어요. 깔끔 무난하네요~응대하시는 여자분 친절하시구요. 리뷰를 바로 쓰려고 했는데 다먹고나도 네이버에 준비중으로 떠있었어요. 아마 바쁘셔서 바로 체크를 못하셨나봅니다.
24.12.7.토,"치킨데리야끼반상,돼지고기 된장 덮밥,우동 모두 간도 딱 맞고 정갈하고 완전 맛있어요!👍🏻"
1.30.목,하루반상 금호점 3.30.일 안녕하세요. :)하루반상 금호점입니다. 항상 맛있는 음식과 서비스로 찾아뵙겠습니다. 감사합니다!
24.8.21.수,도시락 생겨서 너무 좋아요!! 네이버로 미리 주문 해놓고 찾아왔어요. 따뜻하게 맛있게 먹었습니다. 국 밥 반찬 구성도 나름 알차고 맛도 좋아요. 앞으로 많이 이용할게요!!
24.12.1.일,하루반상 금호점 24.12.7.토 안녕하세요. :)하루반상 금호점입니다. 항상 맛있는 음식과 서비스로 찾아뵙겠습니다. 감사합니다!
1.15.수,하루반상 금호점 3.30.일 안녕하세요. :)하루반상 금호점입니다.  저희 매장 메뉴가 아닌 다른 메뉴가 등록되었네요. 다음에 또 찾아주세요!!
24.7.6.토,한 끼 건강하고 든든하게 먹기 좋은 곳이에요~! 매장도 너무 깔끔하고 음식도 정갈해서 좋았어요~! 혼밥하기에도 좋고 데이트 하기에도 좋은 곳이라 자주 방문 할 것 같아요~!
24.6.7.금,"근처에 밥집이 많이 없어서 이 위치에 생기면 좋겠다고 늘 바래왔는데, 여기에 오픈해주셔서 너무 감사해요!🥹 심지어 완전 맛집이네요. 음식이 깔끔하고 영양균형도 좋게 골고루 나오네요. 고등어구이 먹었는데 전혀 안비리고 넘 맛있게 먹었습니다. 또올게요! 대박나세요☺️"
24.6.14.금,매번 돼지고기 도시락만 포장해서 먹어보다가 다른 도시락도 주문해서 먹어봤어요 밥양은 일정하게 계속 잘 나오고 있고 구성도 알차고 무엇보다 맛있어요  특히 치킨데리야끼가 맛있었는 데 꽈리고추와의 조합이 좋아서 맛있게 잘 먹었습니다!  아쉬운 건 고등어구이 도시락이 찬이 조금 아쉬운 느낌이 없지 않아 있었는 데 저는 여전히 배추김치로 바뀐 게 많이 ㅠㅠ 아쉬웠지만 사장님께서 여러 손님들의 의견을 반영하셨다고 하니.. 갓김치는 그만 잊어야 할 거 같네요..ㅠㅠㅋㅋㅋ  여러모로 참 맛있게 잘 먹고 있는 밥집이라 계속 잘 되셨으면 좋겠어요♡ 다음엔 매장에 방문해서 식사도 해볼게요 맛있게 잘 먹었습니다!
24.6.6.목,"신상 가게라서 와이프랑 같이 가서 식사했는데, 깔끔한 일본 가정식 식당이네요! 식사 구성 자체가 건강한 식재료로 되있어서 혼밥하기도 좋고, 데이트 식사하기도 좋은 곳이네요~! 직원분도 참 친절하구요!ㅎㅎ 기분 좋게 식사하고 갑니다."
24.7.25.목,금호동 이자카야 가라아게 맛있어요!! 하이볼도 있지만 사와도 팔아요~ 다음엔 고등어구이 반상 먹어보려구요!
24.6.7.금,"포장으로 도시락 주문하고 딸내미 시켜서 찾아왔지요. 딸아이가 치킨 데리야끼가 넘 맛있다고 하네요. 또 돼지 생강구이는 고기,버섯,양파, 양배추의 조합이 완전 제 취향저격입니다. 구성도 알차고 맛도 좋고 동네에 이렇게 포장해와서 뜨끈하게 먹을 수 있는 곳이 생겨서 넘 좋아요~~^^"
24.7.22.월,집 근처에 생겨서 여러번 포장해서 먹고 있습니다. 고등어구이가 잡내가 안나고 맛있습니다. 가격대비 알찹니다. 여러 메뉴 중에 개인적으로 고등어구이 도시락을 자주 포장해 갑니다.👍
24.9.27.금,"일본의 체인 덮밥집을 떠올리게 하는 장소, 맛, 스타일! 가볍게 끼니를 해결하거나, 간단히 맥주 한잔 할 때 추천!"
24.10.1.화,빠르게 먹고 가야하는 일정이라 빨리 나오는 메뉴시켰는데 맛있게 잘먹었습니다
24.8.13.화,네이버에서 포장주문하고 20분후 픽업해왔어요. 점심으로 아이와 먹었는데 깔끔하고 좋네요! 맛있게 잘먹었어요^^
24.6.12.수,금호동에서 일한지 오래되어서 주차가 가능한 왠만한 밥집은 다 가본거 같아요 몇몇집이 입맛에 맞아서 계속 가긴하는데 계속 먹으면 지겨우니 제발 밥집하나 생겨라 했는데 지나가다가 보고 오?!!!하면서 들어갔어요 혼자밥먹기 너무 편하고 든든하게 한끼 해결했어요! 고등어는 담백하게 너무 맛있고 국과 밥의 조화도 잘맞아서 전 자주 이용할거같아요! 감자고로케랑 가라아게 맛있어서 한상 뚝딱 다 비우고 나왔습니다! 점심시간동안 제 한자리 제발 있었으면 좋겠네요!!
24.6.27.목,와...후쿠오카에서 먹었던 인생나폴리탄 맛이네요 맥주랑 하이볼도 넘 맛있네요 ㅠㅠ 일본 안 가도 되겠어요..감동...ㅠㅡㅠ
3.30.일,반응 남기기 방문일 3.30.일 2025년 3월 30일 일요일 1번째 방문 인증 수단 영수증
24.7.3.수,동네새로생긴 깔끔한밥집!가성비괜찮고반찬도맛있다ㆍ다른메뉴 치킨데리야키 철판서간이좀짜고 ᆢ고등어는약간 식은느낌ᆢ그러나 전반적으로맛있고 괜찮다
24.7.20.토,정말 맛있네요 생각보다 양도 많아서 엄청 배불렀어요 직원분들도 모두 친절하십니다
24.10.20.일,반응 남기기 방문일 24.10.20.일 2024년 10월 20일 일요일 1번째 방문 인증 수단 결제내역
24.8.18.일,포장해 먹었습니다 가성비 좋고 음식도 맛있어요!
24.6.7.금,화요일날 첫 방문하고 도시락이 너무 괜찮아서 금요일에 한 번 더 방문했어요 양은 꽤괜이었고 맛도 생각 이상이어서 넘 만족하고 두 번째 방문 했었는 데 첫 날 받았던 도시락과는 조금 상이한 점이 있어서 리뷰 남깁니다 일단 도시락 구성에서 갓김치가 아닌 일반 배추김치로 바뀌었고 느낌상 밥의 양과 고기의 양이 줄어든 느낌이었어요ㅠㅠ 재료 소진을 우려해서 양을 임시적으로 줄이신 건지.. 이 부분이 조금 아쉬웠어요•• 사진 속 도시락은 첫 날 시킨 도시락 사진입니다! 10분 정도 기다리면 바로 도시락 받을 수 있을 정도로 매장 내의 회전률은 꽤 빠른 편인 거 같았어요 직원분들 다 친절하셨구요 도시락 양이 줄어든 건지 아닌지는 더 먹어보면 알 거 같지만 갓김치가 구성에서 빠진거라면 이 부분은 좀 많이 아쉬울 거 같아요
24.6.6.목,아이가 지나갈 때마다 꼭 가보고 싶다고 해서 주말 아침 첫번째로 아침도 거르고 방문했습니다. 편안하고 맛있게 먹었고 혼자 오시는 분들도 가족과 오시는 분들도 만족하실 것 같아요.
24.7.6.토,"매장이 깔끔하고, 음식이 정갈하니 맛있습니다. 포장하면 할인도 해주니 주변에 산다면 포장해서 가셔도 좋을것같아요"
24.7.29.월,타코야키가 맛있었고 소스도 좋았는데 뭔가 생선맛이 예전이랑 달랐습니다 싱거워졌다고 해야하나 조금 실망했습니다
24.6.7.금,고등어를 잘구워서 비린내없이 맛있게 먹었습니다 국물은 미역미소된장국맛입니다 어울려서 맛있었서요 샐러드도 제취향이었습니다 갓김치도 그럭저럭이었고요 그런데 저 타코야키랑 감자고로케는 개인적으로 별로였습니다 먹자마자 물린듯한 밀가루맛이 강해서 전체적으로 흐름이 끊겼어요 그리고 메뉴판에는 가라아게나 햄카츠가 포함돼있어서 시켰는데 랜덤으로 주신다네요 이건 사전에 안내를 해주셨으면 좋았어요
24.7.21.일,고등어 맛있습니다 생강구이는 생강향이 생각보다 쌔서 놀랐습니다 잘먹었습니다
24.6.13.목,맛: ⭐️⭐️⭐️⭐️ 양: ⭐️ 가격: ⭐️⭐️ 재방문 의사: 없음 치킨 데리야끼는 맛있었습니다. 간이 조금 센가 싶었는데 안주로 괜찮았어요. 다만 메인메뉴의 치킨이 버섯과 거의 비슷한 양으로 들어가 있더라고요 (5조각 정도) 큼지막한 버섯이랑 섞여있어서 전체적으로 봤을때 가격에 비해 양이 좀 아쉽구나 싶었는데 버섯을 골라내고 보니 가격에 비해 메인의 양이 굉장히 부족하다고 느껴졌습니다. 치킨의 양이 많이 부족해서 맛이 괜찮았음에도 이 가격에 저 정도 음식이라면 재방문하지 않을것 같습니다. 치킨의 부족한 양을 커버하려는건지 밥이 꽤 많았고요. 고로케와 새우튀김은 눅눅하고 밀가루 맛이 많이 나서 제 취향은 아니었어요. 미소장국은 매우 싱거웠고 바 형태의 좌석은 발을 두기가 불편했습니다. 맛있지만 아쉬운 곳이네요.
24.6.15.토,깔끔하고 맛있어요. 친절하시고 반찬도 밥도 리필해주시네요. 자주 올 것 같아요.
24.9.28.토,하루반상 금호점 24.12.2.월 안녕하세요. :)하루반상 금호점입니다. 항상 맛있는 음식과 서비스로 찾아뵙겠습니다. 감사합니다!
24.6.7.금,"마라탕, 국밥에 질려가던 중에 근처에 새로 오픈하였다하여 방문했습니다. 깔끔한 분위기에 편하고 맛있게 먹을 수 있어서 좋았어요!"
24.6.15.토,오픈 예정일 공지때 부터 기다렸다가 어제 처음으로 갔네요 ^^ 음식은 깔끔하고 맛있었습니다. 새 매장이어서 깔끔했구요. 그런데 4인 테이블 2개 말고 차라리 2인 테이블을 4개 두는게 어떨까요? 2명씩 오는 분들도 적지 않아 보였는데 사실 바는 자리가 약간 불편할 수 있고 그렇다고 4인 테이블에 앉자니 뭔지 모를 미안함이 몰려왔어요. 2명씩 두팀만 와도 테이블은 바로 차버려서 그 점이 조금 아쉬웠네요~ 아무튼 번창하시길 바래요 ^^ !!!
24.10.31.목,하루반상 금호점 24.12.2.월 안녕하세요. :)하루반상 금호점입니다. 감사합니다! 항상 맛있는 음식과 서비스로 찾아뵙겠습니다.
24.7.4.목,데리야끼 치킨 먹었는데 맛있어요
24.7.23.화,간편식으로 적당. 도시락의 맛 ㅎ
24.6.16.일,혼밥하기도 좋고 깔끔해요~~
24.9.3.화,반응 남기기 방문일 24.9.3.화 2024년 9월 3일 화요일 2번째 방문 인증 수단 포장주문
24.8.21.수,하루반상 금호점 24.12.2.월 안녕하세요. :)하루반상 금호점입니다. 뀻! 항상 맛있는 음식과 서비스로 찾아뵙겠습니다. 감사합니다! 접기
24.6.29.토,반응 남기기 방문일 24.6.29.토 2024년 6월 29일 토요일 1번째 방문 인증 수단 영수증
24.8.10.토,반응 남기기 방문일 24.8.10.토 2024년 8월 10일 토요일 3번째 방문 인증 수단 영수증
24.6.12.수,"찬 구성이 좋고, 정갈해서 기분 좋게 잘 먹고 왔어요. 도시락메뉴도 있던데 다음에는 도시락도 먹어볼 예정!"
24.6.30.일,깔끔하고 맛있어요 ~
24.7.6.토,반응 남기기 방문일 24.7.6.토 2024년 7월 6일 토요일 1번째 방문 인증 수단 영수증
24.7.21.일,반응 남기기 방문일 24.7.21.일 2024년 7월 21일 일요일 1번째 방문 인증 수단 영수증
24.7.24.수,반응 남기기 방문일 24.7.24.수 2024년 7월 24일 수요일 1번째 방문 인증 수단 포장주문
24.7.6.토,반응 남기기 방문일 24.7.6.토 2024년 7월 6일 토요일 2번째 방문 인증 수단 영수증
24.6.19.수,반응 남기기 방문일 24.6.19.수 2024년 6월 19일 수요일 1번째 방문 인증 수단 영수증
24.6.26.수,반응 남기기 방문일 24.6.26.수 2024년 6월 26일 수요일 1번째 방문 인증 수단 영수증
24.6.15.토,반응 남기기 방문일 24.6.15.토 2024년 6월 15일 토요일 1번째 방문 인증 수단 영수증
24.6.14.금,반응 남기기 방문일 24.6.14.금 2024년 6월 14일 금요일 2번째 방문 인증 수단 영수증
24.10.4.금,하루반상 금호점 24.12.2.월 안녕하세요. :)하루반상 금호점입니다. 뀻! 항상 맛있는 음식과 서비스로 찾아뵙겠습니다. 감사합니다! 접기
24.6.11.화,반응 남기기 방문일 24.6.11.화 2024년 6월 11일 화요일 2번째 방문 인증 수단 영수증
24.6.5.수,하루반상 금호점 24.6.7.금 찾아주셔서 감사합니다.!!  더욱 많은 연구와 개발로 다양하면서도 깊이 있는 메뉴들을 준비하도록 하겠습니다.!! 접기
24.6.4.화,하루반상 금호점 24.6.7.금 감사합니다. 가오픈 기간이라 어수선한 상황에서도 맛있게 드셔주셔서 진심으로 감사드립니다.  하루 빨리 모든 고객분들에게 만족감을 드릴 수 있는 하루반상이 되도록 하겠습니다!! 접기
