date,content
23.8.12.토,"분위기도 좋은데 안주도 너무 맛있는 한낮의 밤🥹 성수에 이렇게 좋은 와인바가 있는데 왜 안 유명한지 모를 일이에요,, 제가 원래 와알못인데 여기서 와인 마시고 와인에 빠져버렸어요,, 와인도 맛있지만 베리 진토닉인가?! 그것도 상큼하고 넘 맛있었어요! 다음엔 다른 칵테일도 마셔보고 싶어요! 혼자 와서 책 읽기도 넘 좋을 분위기,,🍹,, 게다가 사장님이 너어어어무 친절해요!! 사장님이 멋있고 안주랑 술이 맛있어요 ㅋㅋㅋ 담에 또 마시러 갈게요😉~!"
23.10.27.금,사장님이 친절하고 음식이랑 차 술 다 맛있어요 책 읽기에도 넘넘 좋아용!
23.8.13.일,"책도 있고 와인도 있는 가볍게 한잔하기 좋은 곳 테이블, 의자가 편해서 작업하기 넘 넘 좋았어요!! 적당한 조명과 아늑한 분위기 덕분에 사진 찍으면 완전 잘나옴... 아주 굿👍🏻 사장님 정말 정말 친절하시고 안주가 기본적으로 다 맛있어서 감동입니다🥹 입구는 맛닭꼬 바로 옆에 있어요!"
23.10.3.화,비건 지향이라 처음 보는 메뉴들이 많았는데 모두 맛있었어요‼️ 양배추 스테이크는 블루치즈와 꿀이랑 꼭 같이 드세요 매장도 큼직하고 깔끔해서 편하게 즐기다 올 수 있었어요 추천합니다🥹💕
23.11.3.금,책 구경하러 잠깐 들렀다가 책 읽을 겸 잔와인도 한잔 했어요
23.10.29.일,음식 너무 맛있고 매장도 깔끔하고 예뻐요! 책이랑 와인도 많습니다! 사장님 친절하세요! 다음에 또 올게요🙂
24.1.3.수,친구가 추천해서 가봤는데 인테리어가 너무 이쁘구 분위기가 너무 좋아서 깜짝 놀랐어요! 음식도 왜케 맛있는지ㅠ 친구랑 가도 좋고 혼자 가서 마시기도 좋아서 단골될 듯 합니다!
23.10.23.월,모임하기가 너무 좋은 곳이네요~ 분위기도 좋고 사장님 센스가 좋으신거 같아요 ㅎㅎㅎㅎ 자주 오겠습니다
23.12.23.토,비건메뉴도 있고 분위기도 딱 제가 좋아하는 스타일로 아늑한 느낌입니다. 사장님도 무척 친절하셔서 애인과 좋은 시간 보내고 왔습니다. 또 방문하고 싶은 곳이에요<3
23.10.9.월,"아주 아주 우연히 들르게 되었는데, 왠지 앞으로 자주 가게 될 것 같은 곳이에요. 햇볕이 잘 드는 창과 책장 가득한 책과 예쁜 술이 가득한 곳입니다. 혼자 조용히 시간을 보내고 싶을 때에도 친구와 마주 앉아 수다 떨기에도 좋을 곳이라고 생각합니다. 짧은 가을이 다 지나기 전에 꼭 다시 한 번 가야겠어요. :D"
24.1.21.일,정말 분위기 끝판왕!!! 너무 인상적이었어요!!! 다음에 또 방문하겠습니다!!!
24.1.21.일,데이트하기에 너무 좋은 장소에요💖💖🤭꼭 ㄷㅏ시 방묺할게용 :)
23.10.27.금,스테이크는 별로 기대를 안하고 먹었는데 정말 맛있게 잘 먹었습니다!! 음식도 맛있고 와인도 맛있었어요~~❤️❤️
23.10.25.수,가게 인테리어가 정말 좋습니다. 조용하게 휴식하는 공간으로 최고!! 음식도 너무 마음에 듭니다
23.9.22.금,"먹다만 가유… 비건 프랜들리해서 좋아요! 비건 만두, 버섯 알 아히요가 있어요. 양배추 스테이크도 치즈 빼면 비건으로 먹을 수 있었어요."
24.1.8.월,한낮의밤 24.2.25.일 멋진 사진 감사합니다! 머무시는 동안 즐거우셨기를 바랍니다💖 다음에 또 놀러오세요~!!🥰
23.10.29.일,사장님 친절하시고 메인디쉬 다 맛있고 논알콜도 많아서 너무 좋았습니다!!!
23.12.27.수,너무 편안해요 좋은 술과 편안한 분위기 그리고 브리치즈구이 아주 만족합니다
23.8.14.월,"혼자가서 바 자리 앉았는데 사장님이 친절하고 대체로 술이 달지 않고 맛있어요! 탄산수, 토닉워터 등 고를 수 있어서 진짜 좋아요  안주는 비건 메뉴가 다양하고 맛있었습니다. 사진에는 없지만 개인적으로 올리브 들어간 짜파게티가 진짜 맛있습니다. 식사 안하고 가시면 꼭 드셔보세요!"
23.8.18.금,포근하고 계속 머물고싶은 공간 사장님도 친절하신데 메뉴도 친절해요 신메뉴라는 네모감자도 즐거웠습니다❣️ 이름이 넘 귀여워요ㅎㅎ 사장님 센스 짱~
23.10.29.일,음식도 음료도 분위기도 너~무 좋은 곳! 좋은 책들도 많아서 좋았습미다~~!
23.10.29.일,"너무 만족스러운 방문이었습니다! 제일 먼저 눈에 들어오는 건 주류 및 음료들이었는데, 와인은 물론이고 다양힌 주종이 구비되어 있었고 알쓰 입장에서는 특히나 차가 있어서 좋았어요. 그런데 일단 차를 딱 맛있게 잘 내려 주시고요, 단지 구색만 맞춘 게 아니라 재밌고 독특한 이곳만의 차 메뉴를 넣으셨더라구요! 그리고 음식도 맛있었습니다. 비건 옵션이 있어서 비건이신 분들 찾아오시기 좋을 것 같아요. 근데 음식 자체가 맛있기 때문에 비건이 아니신 분들에게도 좋은 선택지일 것 같아요. 그리고 디저트..짱 마지막으로 분위기가 너무 좋아요! 전체적으로 밝고 편안한 느낌인데, 와인바이자 독립서점이어서인지 세련되고 지적인 분위기가 납니다. 혼술하시는 분들도 어색하지 않게 즐거운 시간 보내실 것 같아요! 잘 먹었습니다!"
23.11.29.수,너무 아늑하고 좋은곳이었습니다 ㅎㅎ 책이 넘많아서 좋았고 또 친절하셔서 더 좋은시간 보낼수있던것같아요~!! 집이넘멀지만 시간이 된다면 꼭 다시한번더 방문하고싶은곳입니다~!
23.9.16.토,"성수동 최고의 와인바..! 한낮의 밤❤️‍🔥 작년 오픈 할 때 부터 꾸준하게 다녔더니 벌써 10회 넘게 방문했습니다. 늦게나마 후기 작성합니다!🥹 갈 때마다 배치가 조금씩 바뀌는데 공간이 매번 새롭게 느껴지는 즐거움이 있어요 사장님과 직원분들 모두 친절하시고🤎 판매중인 책들도 흥미로운게 많습니당 주문하고 음식 기다리는 동안 책 구경하늠 재미가 쏠쏠합니다😆 저는 쇼파자리를 제일 좋아하는데, 다양한 크기와 종류의 자리가 마련되어 있어서 원하는 자리에 골라앉는 재미가 있어요! 음식도 정말 다 맛있습니다! 비건만두가 정말 맛있으니 비건이라고 거부감 가지지말고 도전해보세요. 신메뉴 네모감자를 아직 못먹어봐서 다음엔 꼭 먹어보러갈려구요! 메뉴판에 와인정보가 자세히 나와있어 처음보는 와인도 입맛에 맞게 고를 수 있어요.!!"
23.10.26.목,사장님이 음식 주문없이 주류만 시켜도 가능하다고 하네요!! 저는 여러가지 음식도 같이 먹어봤는데 음식이 다 맛있어요 ㅠㅠㅠㅠ 이런 가게를 이제야 찾다니... 매장도 깔끔하고 좋아요!
23.8.12.토,왜 5개까지만 선택할 수 있을까요 ㅠ 분위기가 너무 좋고 노래 선곡도 제 취향이라 기분좋게 있을 수 있었어요 무엇보다 술이 다양하고 특별한 안주들이 있어 맛있고 좋았습니다~ 다음에 또 방문할게요!!
23.5.11.목,"서점 속에 있는 와인바 같은 느낌! 찾기는 약간 어려운데 오히려 아지트 같아서 만족! 볼로네제는 조금 짜서 아쉬웠으나, 치즈플래터는 추천! 와인은 오렌지와인이 있어서 먹어봤는데 상큼하니 좋았음! 와인종류 많아서 굿!"
23.8.26.토,혼자 책 읽고 사색에 빠지기 너무 좋은 공간이에요! 다음엔 여러 사람과 함께 오래 있고 싶네요
23.9.22.금,안온하고 무해한 공간. 비건음식들도 너무 맛있어서 술도 별로 안 마시는데 안주를 잔뜩 먹었다. 책도 바로 구입해서 읽을 수 있다. 앞으로 자주 갈 것 같다.
23.8.18.금,항상 방문할 때마다 느끼지만 장소가 아늑하고 따뜻한 분위기에요ㅎㅎ 여기 오면 늘 좋은 추억과 예쁜 사진 많이 담아 갑니당🥹 이번에 위스키 이벤트도 하고 인테리어 바꼈다고 해서 다시 방문했는데..사장님 인테리어 솜씨가 👍👍 여기 감성은 다른 곳에서 느낄 수도 볼 수도 없어서 자주 방문할거 같은데..단골 할까 봐요😆 다음에 또 올게요! 번창하세용😍
24.1.21.일,반응 남기기 방문일 24.1.21.일 2024년 1월 21일 일요일 1번째 방문 인증 수단 영수증
23.9.9.토,분위기도 너무 좋고 아늑해요~~ 자주 오고 싶어요!!
23.6.22.목,너무 분위기가 좋아요! 퇴근길에 잠깐 들러 술한잔하기 딱 좋은 곳이에요~ 음악도 딱 분위기에 맞게😀 다음에도 또 가봐야겠어요!
23.8.12.토,술 종류도 많고 전체적으로 깔끔하고 맛있었습니다 칵테일에 들어가는 토닉을 탄산수로 변경이 가능해서 좋았어요
23.10.28.토,"사장님께서 정말 친절하시고 음식과 술, 책, 분위기 완벽했습니다. 여유로운 데이트를 원하신다면 추천드립니다."
23.8.18.금,분위기도 너무 좋고 게임도 있고 책도 많아서 좋아요 ㅎㅎ 재방문하겠습니다
23.6.8.목,너무나 찾고 있었던 편안한 분위기의 와인바.. 혼자 가기도 연인과 가기도 친구와 가기도 절대 어색하지 않을 곳. 성수동에 와인도 안주도 이런 가격이라니 반하지 않을 수 없다
23.9.18.월,사장님이 맛있고 음식이 친절해요 ^^ 양배추 스테이크 너무 잘 먹었습니당❤️
23.10.3.화,한낮의밤 23.10.23.월 방문해주셔서 감사합니다 다음에 오시면 서비스 챙겨드릴게요 꼭 말씀주세요🥰
23.9.30.토,사장님이 너무 친절하시고 음식은 말할것도 없어요..💕
23.6.4.일,음식이 자극적이지 않아요
22.12.10.토,"아름다운 공간이에요. 음식(비건 메뉴도 있어요!)과 와인이 모두 맛있고, 흥미로운 책들이 정말 많아요. 심지어 화장실도 예뻐요 ... 고민의 시간과 정성이 느껴져서 머무는 내내 즐거웠어요. 소파, 대형 테이블, 작은 탁자 등 앉을 수 있는 자리가 다양해서 좋아하는 사람들과 모임을 해도 좋을 것 같고, 혼자 와서 조용히 시간 보내는 것도 멋질 것 같아요. 특히 지금은 아름다운 크리스마스 트리와 장식들 덕분에 행복에 가까워지기 쉬우니 크리스마스 시즌이 지나가기 전에 꼭 방문해보시기를 추천드립니다! 추운 공기를 가르고 들어와 포근하고 반짝이는 공간에서 와인을 마시고 책을 구경했는데, 덕분에 겨울이 좀 더 좋아졌어요."
23.1.4.수,감성카페처럼 간판이 없어서 찾기 조금 어렵긴 한데요! 꼭 가보세요. 분위기가 넘 좋아요.
23.4.16.일,반응 남기기 1 명 방문일 23.4.16.일 2023년 4월 16일 일요일 1번째 방문 인증 수단 영수증
23.1.24.화,재밌어보이는 책 많고 인테리어도 멋져요
22.11.29.화,책과 와인.. 분위기 좋아요
