date,content
2.2.일,"쿨타임 차서 달려왔습니다 🫡 성수로 이전 한 해설 여전히 너무 맛있어요 :) 연어장,꽃게장은 해설 따라 올 곳이 없어요 😊 주기적으로 방문할게요 !"
4.4.금,사장님이 매우 친절하시고 가성비좋고 맛있어요! 번창하세요☺️
1.12.일,처음 방문했는데 직원 분들도 친절하고 음식도 신선해서 맛있게 먹었습니다!!! 다들 정식으로 드시길 추천합니다!
2.9.일,완전 깔끔하고 친절하고 맛있습니당!! 외국인 친구랑 같이 왔는데 너무 좋아했어요!
24.12.5.목,알차고 맛있습니다 훌륭한 식사.  최고에요  사장님께서 매우 친절하십니다
24.12.10.화,"서산에서도 정말 애정하던 매장인데 성수로 이전 해서 아쉽지만 성수 놀러간김에 들렸는데 여전히 변함없는 맛도리👍🏻  성수싸람들은 좋겠다 해설이랑 가까워서,,  서울 가면 또 갈집 😍"
2.23.일,간장게장 먹어본적이 없어서 한번 도전해봤는데 너무너무 맛있었어요 부모님이 게장 입맛 까다로우신데 여기 진짜 실하고 간장도 너무 맛있다고 다음에 또 사오라네요 ㅎㅎ
2.2.일,음식 너무 맛있어요!! 너무 안짜서 많이 먹을 수 있어서 너무 좋아요 ㅎㅎ 재방문 의사 무조건 있습니다..😊
3.27.목,메뉴도 빨리 나오고 넘 맛있어용
24.12.14.토,진짜 너무 맛있네요 ㅠㅠ 간도 딱 맞고 비리지도 않고 물리지도 않네요 해산물도 신선한 걸 쓰는지 딱 느껴짐… 알바생도 친절해서 앞으로 자주 갈 것 같아요🩵
3.20.목,반응 남기기 방문일 3.20.목 2025년 3월 20일 목요일 1번째 방문 인증 수단 영수증
1.23.목,간장게장 너무 먹고싶었는데 ㅠㅜ 너무 맛있게 잘 먹었어요 ㅎㅎ 다른 장도 너무 맛있네요 👍👍
1.16.목,연어덮밥 잘 먹었습니다! 직원분들 너무 친절하셔서 기분 좋았어요 서비스도 감사합니다 😊😊
24.12.31.화,너무 맛있어서 그만 사진은 못 찍었지만 2024년 마지막 날 특별한 음식으로 아주 맛있었습니다. 사실 서산에서 한번 가족 여행으로 방문한 적이 있어 회사 근처라 방문했는데 멀고 먼 성수로 이사 오셔서 꼭 대박 나셨으면 좋겠습니다!! 맛도 맛이지만 매우 친절하셔서 기분좋은 식사였습니다!!
1.12.일,이 퀄리티가 어떻게 2인분에 5만원도 안하죠.. 간장게장 진짜 맛있어요 ㅠㅠ
24.12.22.일,여기 진쯔 숨겨진 맛집 먹고 또 생각나길래 리뷰 적어요 또 방문예정 게장이 진짜..; 맛도리
10.16.목,반응 남기기 방문일 10.16.목 2025년 10월 16일 목요일 1번째 방문 인증 수단 영수증
1.19.일,맛있고 가격도 좋아서 좋았습니다 다음에 또 오려고해요 잘먹었습니다!!
24.12.18.수,리뷰이벤트 아니고 정말로 맛있어서 쓰는 리뷰에요! 비린내 하나도 안나고 정말 싱싱하고 맛있었습니다. 간도 적당하고 곁들여 먹는 양파랑 반찬도 다 맛있었어요!! 식당도 엄청 깨끗하고 너무 친절하셨어요! 멀리서 온 보람이 있는 곳이에요. 더더더 잘되셨으면 좋겠지만 왠지 나만 알고 싶은 그런 맛집이랄까? ㅠㅠㅠ 또 먹으러갈께요!!
1.11.토,게장정식이 땡겨서 왔는데 새우장 이 더맛있에요
1.11.토,리뷰보고 왔는데 맛있어요! 특히 관자!
24.9.8.일,사진찍고 리뷰 쓸 수 밖에 없네요 ㅎㅎ 최고에요b 사장님 연구가 깃들여진 요리인것이 티났습니다~ 다음에 또 오려고 기록삼아 리뷰~~~~
1.22.수,맛있게 잘 먹겠습니다~
1.25.토,음식이 정갈하게 나오고 맛있어요. 조용해서 대화하기도 좋구요
1.19.일,"많이 짜지 않고 맛있어요! 간단하게 깔끔하게 먹기 좋고, 식사도 빨리 나와요!! 지하에 있으니 잘 찾아오세요~!!"
24.8.11.일,멀리까지와서 맛있게 잘 먹었습니다 ~ 냄새안나고 너무 맛있어요~ 친절하시고 기분좋게 잘 먹고 갑니다~^^
1.21.화,너무 맛있어요 또 올게요!
24.7.16.화,"추천받아서 방문했는데 정말 정말 맛집이더라고요 💛 직원분도 친절하시고, 매장도 쾌적하고, 음식도 빠르게 나오고 퀄리티도 좋고 맛은 환상적입니다. 두고두고 생각날 맛이네요 💛"
24.8.4.일,"혼자서 연어장 먹고 싶을 때 가면 너무 좋은 곳. 연어장 말고도 관자장, 게장도 1인 정식으로 먹을 수 있어서 너무 좋음. 간장 자체도 짭쪼롬한 정도라 밥이랑 먹어도 너무 맛있고 조미 안된 김이 기본으로 나오는데 김이랑 싸먹어도 진짜 맛있음....ㅠ 담에 친구랑 오면 모듬장 도전할 것..."
24.5.21.화,"🧡 연어정식 13,000  서산의 보물같은 공간인 거 같아요 👍🥹  ✔️ 연어장이 자극적이지 않고 맛있어요. ✔️ 매장이 깔끔해요 ✔️ 친절해요 ✔️ 음식이 빠르게 나와요 ✔️ 재방문 의사 있음 🧡🧡"
1.17.금,반응 남기기 방문일 1.17.금 2025년 1월 17일 금요일 1번째 방문 인증 수단 영수증
24.7.9.화,혼밥 가능하다고 해서 출장 마치고 식사하러갔어요. 양은 보기보다 아주 넉넉합니다. 찬으로 내어주시는 갓김치가 참 맛있습니다. 잘 어울리고요. ‘장’ 전문집이니 당연 간장도 맛있고 자부심도 있으신게 당연하지만 개인의 선호에 따라 다를것같기도 합니다. 저는 개인적으로 좀 더 진한 장을 좋아하고 생강향이 진한것을 안좋아해서요. 살짝 아쉬움이 남았지만 슴슴하고 담백한 장 좋아하신다면 가보실만합니다.
24.4.6.토,진짜 맛있는 모듬장과 간장게장 맛집 발견!! 서산여행 코스로 플랜짜다가 발견해서 방문했는데 진짜 너무너무 맛있게 먹고 왔어요!!
24.5.25.토,인테리어가 카페같고 예뻐요!! 음식도 정갈하게 잘나옵니당
24.2.24.토,"가족모임으로 포장했는데 패키지도 깔끔하고 손질도 되어있어 너무 맛있게 먹었어요! 어르신들도 짜지 않고 비린내 없다고 좋아하셨습니다🫶🏻🫶🏻🫶🏻태안이나 안면도 팬션,캠핑 오시는 분들께 포장 강추합니다👍👍👍"
24.4.9.화,간장새우장이랑 연어장이 너무 맛있어요ㅠㅠ 가격도 합리적이예오ㅠㅠ
24.1.10.수,꽃게장이랑 연어 먹었는데 하나도 안짜고 맛있어요! 반찬도 다 맛있고 깔끔하게 나오더라구요 서비스로 전복장도 주셨는데 너무 맛있었어요!! 매장도 깨끗하고 친절하셔서 너무 좋았어요😄
24.4.30.화,모듬장 먹고 추가로 양념게장 세트 먹었어요 동생도 잘 먹었다고 합니다 다음에 또 올께요 양이 많았으면 ㅎㅎ 좋겠어요
24.5.6.월,가족들이 서산 놀러오면 자신 있게 데려가는 해설 !! 해물장 처음 먹어보는 가족도 비리지 않고 맛있었다고 하네요😆
23.12.10.일,맛집 찾다가 지인 강추로 일부러 찾아갔어요. 모듬장이 진짜 짜지않고 슴슴하고 담백하니 맛있고 골고루 맛볼수있어서 더좋았어요. 집원분들도 친절했어요. 강추합니다 사업번창하세요
24.2.12.월,꾸준히 방문하는데 늘 맛있어요~!
24.2.24.토,아들이 근처 공군기지에서 복무중이라서 만나러갔다가 맛집 찾다가 만난 집.. 원래 아들이 좋아하는 메뉴이기도하고 인터넷에서 검색하다 깔끔한 분위기와 좋은 평에 이끌려 둘이서 방문하게되었어요.. 모듬장세트 시키니 계란밥까지 나와서 맛있게 먹었는데 간장게장 좋아하는 아들위해 추가로 간장게장 단품으로 시켰어요.. 모듬장은 가성비가 좋다고 생각하면서 먹었는데 간장게장 단품은 (알은 품었지만) 작은 꽃게 한마리에 2만원이라 조금 비싸다는 생각이 들었습니다.. 그거 외엔 분위기도 깔끔하고 짜지않은 음식들이 아주 맛있었어요.. 다만 반찬들을 바로 리필해주시긴했지만 워낙 작은 접시에 서빙되어서 약간 당황했네요^^;
24.3.23.토,캠핑장 가기전에 해설 모듬장 2인세트 포장했어요 해물장먹었는데 정말 신선하고 맛있게 잘 먹었어요 아이가 게한마리를 맛있게 잘 먹어서 다음번에도 포장 할 생각입니다
23.12.3.일,아주 오랫만에 건강식 점심을 먹었네요 천안에서 다소 시간이 걸려 왔는데 시간이 아깝지 않게 해설모듬장식을 먹었어요. 전에 아내가 왔다가 넘 맛있게 먹었다고 해서 이곳에 올 기회가 있어 왔는데 ...와우 !넘 맛있어요. 전 간장보단 양념을 좋아하는데 이런 간장게장이라면 다음에 또 올것같네요 .비린내 없는 간장게장 잘머꼬 갑니다. 직원들도 친절하고 매장 구석 구석이 넘 청결해서 좋았답니다.
24.5.6.월,간단하게 먹기 좋아요.
24.3.9.토,모둠장이 솔직히 저렴하진 않는데ㅎㅎ..맛은 인정! 자주 가는 맛집이에요
24.1.28.일,"짜지않은 게장과 연어장이란,,, 너무 깔끔하니 맛있었어요! 밥이랑 같이 먹으니 너무 찰떡"
24.4.6.토,맛있는데 양이 너무 적어요..!
24.5.22.수,반응 남기기 방문일 24.5.22.수 2024년 5월 22일 수요일 3번째 방문 인증 수단 결제내역
24.5.11.토,반응 남기기 방문일 24.5.11.토 2024년 5월 11일 토요일 2번째 방문 인증 수단 결제내역
23.11.4.토,음식이 짜지 않고 단백하네요. 새우장 쫀득해요. 비빔밥 맛있고요
23.10.3.화,너무 너무 맛있어서 리뷰 쓰려고 일부러 영수증 받아왔어요 ㅠㅠ🖤 깔끔한 인테리어와 기분 좋은 친절함을 가지신 직원분과 사장님! 무엇보다 음식이 너무 맛있네요ㅠㅠ 하나같이 짜지도 비리지도 않아서 먹기 좋았아요🫶🏻 먹는 내내 기절각 외쳤답니다.. 주기적으로 먹고 싶은 맛집이에요! 타지 사람이라 해설까지 2시간이나 걸리지만 꼭 재방문하려구요 !! 맛있고 기분 좋은 식사했습니다 🥰
24.2.11.일,반응 남기기 방문일 24.2.11.일 2024년 2월 11일 일요일 1번째 방문 인증 수단 영수증
23.12.31.일,맛있어요~ 장들이 너무 짜지도않고 굿
23.11.24.금,음식이 깨긋하고 매우 신선하고 훌륭해요. 친절한 직원의 미소와 장인 정신이 물씬 묻어나는 사장님의 포스에서 음식에 대한 진심이 느껴집니다. 식사내내 가족이 몹시 생각나는 시간이었습니다. 반드시 가족과 함께 또 올것 같습니다.
24.3.16.토,반응 남기기 방문일 24.3.16.토 2024년 3월 16일 토요일 1번째 방문 인증 수단 영수증
24.2.16.금,게장이 짜지않아 좋아요
23.10.21.토,간장게장이 제일 맛나요
24.3.16.토,반응 남기기 방문일 24.3.16.토 2024년 3월 16일 토요일 1번째 방문 인증 수단 영수증
