date,content
"""음식이 맛있어요""",이 키워드를 선택한 인원
"""재료가 신선해요""",이 키워드를 선택한 인원
"""친절해요""",이 키워드를 선택한 인원
"""특별한 메뉴가 있어요""",이 키워드를 선택한 인원
"""매장이 청결해요""",이 키워드를 선택한 인원
"""반찬이 잘 나와요""",이 키워드를 선택한 인원
"""인테리어가 멋져요""",이 키워드를 선택한 인원
"""차분한 분위기예요""",이 키워드를 선택한 인원
"""아늑해요""",이 키워드를 선택한 인원
"""양이 많아요""",이 키워드를 선택한 인원
"""가성비가 좋아요""",이 키워드를 선택한 인원
"""혼밥하기 좋아요""",이 키워드를 선택한 인원
"""대화하기 좋아요""",이 키워드를 선택한 인원
"""음식이 빨리 나와요""",이 키워드를 선택한 인원
"""메뉴 구성이 알차요""",이 키워드를 선택한 인원
"""화장실이 깨끗해요""",이 키워드를 선택한 인원
"""건강한 맛이에요""",이 키워드를 선택한 인원
"""특별한 날 가기 좋아요""","""특별한 날 가기 좋아요"""
"""잡내가 적어요""",이 키워드를 선택한 인원
"""주차하기 편해요""",이 키워드를 선택한 인원
"""비싼 만큼 가치있어요""",이 키워드를 선택한 인원
"""술이 다양해요""",이 키워드를 선택한 인원
"""사진이 잘 나와요""",이 키워드를 선택한 인원
"""매장이 넓어요""",이 키워드를 선택한 인원
"""음악이 좋아요""",이 키워드를 선택한 인원
"""단체모임 하기 좋아요""",이 키워드를 선택한 인원
"""뷰가 좋아요""",이 키워드를 선택한 인원
"""컨셉이 독특해요""",이 키워드를 선택한 인원
"""아이와 가기 좋아요""",이 키워드를 선택한 인원
"""향신료가 강하지 않아요""","""향신료가 강하지 않아요"""
9.5.금,"외국인 친구가 간장게장을 먹고싶어해서 검색하다 성수핫플에 있길래 당일 예약 후 방문했어요 ! 친구 만족도 100점 .. 간장게장 하나도 안짜고 어쩜 이리 맛잇나여 ..?  새우가 근데 너무 꼬들꼬들해서 사실 제일 맛있었어요🥹 새우 게 전복 연어 순으로 맛나요 !!! 🤍 다음에 또 와볼듯요  글구 저 하얀거 모찌리도후 아니에요 ,, 첨에 오해함 ㅎ .. 다들 왜 모찌리도후를 남기고가지 ??? 했능데 그릇!! ㅋㅋㅋㅋㅋㅋㅋㅋ암튼 다 맛잇어요"
9.5.금,반찬이 딱 먹기 좋은 만큼 다양하게 나오고 원하면 더 주세요. 새우장은 자극적이지 않고 속편하게 맛있게 먹을 수 있렀어요. 비린 맛도 없구요! 세팅도 신경써서 해주시는 것 같아서 기분 좋게 잘먹었습니다! 직원분도 친절하세요!😊
8.27.수,장이란 장은 다 좋아하는데 특히 연어장이 너무 먹고싶어 가게 된 곳이에요! 혼자 먹는데 양이 굉장히 많았고 반찬들도 너무 잘 나오도 연어장 미친듯이 맛있어요ㅠㅠ 하나도 짜지도 않고 밥 없이도 먹기 가능한 맛이에요! 진짜 최고👍🏻
10.4.토,"해설은 맛있어서 재방문하게 된 곳이에요. 간장게장은 살이 알차고 양념이 잘 배어 감칠맛이 정말 좋고, 연어장은 신선하면서도 짭조름하게 간이 잘 맞아 밥도둑이 따로 없네요. 새우장은 탱글탱글한 식감이 살아 있어 씹는 즐거움이 있습니다. 무엇보다 포장도 깔끔해서 집에서 편하게 즐길 수 있어 더욱 만족스러웠어요. 앞으로도 자주 찾고 싶은 곳입니다."
10.7.화,"괜찮은 집입니다.  간도 적당하고, 원재료가 싱싱했을꺼라고 느껴집니다.  양도 푸짐했고,  노른자장도 비린맛 없이 고소했습니다.  감태 와 김 리필 / 반찬 리필도 여러번 해주셨네요."
10.18.토,연어장 먹고 싶어서 찾아보다가 발견한 곳인데 양도 푸짐하고 너무 맛있어요! 다음에 또 먹을거 같아요!
10.4.토,한꽃모듬장 정식 간장 새우장 연어장 전복장 꽃게장 너무 맛있어요 또 올께요
10.9.목,여자친구랑 왔는데 분위기도 좋고 반찬이 너무 정갈하게 나와서 기분좋게 먹었습니다! 반찬 맛이 다 깊고 깔끔하고 해산물 비린맛도 하나도 없이 잘 먹었어요
9.6.토,전에 매장에서 먹었을 때 너무 맛있어서 이번엔 포장으로 다시 즐겨봤습니당✌🏻 포장이라 신선도나 맛이 조금 달라지지 않을까 걱정했는데 정말 쓸데없는 걱정이였습니다ㅎㅎㅎ 전혀 그렇지 않고 집에서도 그대로 매장에서 먹는 그 감칠맛과 싱싱함을 느낄 수 있어서 너무 만족스러웠습니당✨❤️👍🏻 특히 간장 양념이 비리지 않고 깔끔하면서도 깊은 맛이 있어서 밥 두그릇 뚝딱이였고 새우랑 전복도 탱글탱글 식감이 살아있어서 정말 맛있었어용😍😍 매장에서 한 번 맛보고 또 포장해서 집에서도 그 맛을 똑같이 즐길 수 있다는 게 큰 장점인 것 같아여ㅎㅎ 해설 덕분에 집에서 부모님과 함께 호화로운 한 끼 제대로 했습니다 부모님께서도 너무 만족하셨어요! 제 또또또간집☺️ 다음엔 양념 메뉴도 한 번 먹어보고 싶어 재방문 할 예정입니다!
10.21.화,남자친구가 해산물에 진심이라 까다로운편인데 아주 잘먹었습니다! 외국인들이 어떻게 맛집을 찾아왔는지 모르겠는데 다른사람한테 추천할만큼 맛있어요 ㅎㅎ 재방문의사 있습니다!!
8.31.일,"성수동 해설을 방문했습니다. 날계란밥은 신선한 계란과 고슬고슬한 밥의 조합이 일품이었고, 한꽃모듬장 정식은 다양한 밑반찬과 함께 정갈하게 구성되어 있었습니다. 아늑한 분위기 속에서 정성스럽게 준비된 한식을 맛볼 수 있는 곳으로, 성수동의 숨겨진 맛집이라 할 만합니다. 재방문 의향이 높은 식당이었습니다."
8.31.일,근처에서 일하는 마지막날까지 4일동안 점심 해설에서 먹었어요! 아마 사장님이 이 글을 보신다면 아실거같은ㅋㅋㅋ 더 오래 일했어도 진심 매일 갔을거에요ㅠㅠ 마지막은 양념 새우장 먹어보고 싶었는데 안되는 메뉴라고 하셔서 간장 새우장 시켰는데 역시나 맛있었어요! 하지만 양념 맛 못본 게 아쉬우니 다음에 또 가겠습니다 :)
8.30.토,간장게장 킬러로서 한 번쯤 꼭 오고싶었는데 드디어 왔습니다!! 너무 맛있고 간장이 짜지 않아서 게장 특유의 얼얼한 맛이 없어서 너무 좋았어요😋 수율도 좋고 느끼한 거 잘 못 먹는데 연어장도 맛있었습니다. 반찬도 다양하고 직원분들도 사장님도 친절하셔서 다음에도 꼭 재방문 할게요!!💗
8.21.목,연어장 정식으로 먹었는데 짜지않고 반찬도 정갈하게 잘 나옵니다. 오징어 젓갈인지가 킥이네요 ㅎㅎ 찾아가기 좀 힘들지만 한번 발걸음하면 쉬워요 😀
8.31.일,식당 내부 인테리어도 깔끔하고 아늑해요 음식이 정갈하고 보기 좋게 나오고 먹었을때 너무 짜지도 않고 간장 베이스 자체가 맛있어요 다음에 성수를 방문하게 된다면 또 오고 싶어요
7.18.금,반찬이 정갈하게 잘 나와서 좋았습니다. 무엇보다 연어장 양이 너무 많아서 너무 좋았습니다. 연어장이 짜지 않아서 단독으로 먹어도 괜찮았습니다.  외국인분들도 많이 오시더라구요 더 많이 오셔서 한국식 백반을 경험해보시면 좋겠습니다. 부모님을 모시고 오기에도 좋은 것 같습니다.
9.7.일,오픈할때 왔더니 바로 입장 가능했습니다 정갈하고 다양한 장을 먹을수있어서 좋아요 짜지 않아서 아이들 먹기도 좋아요. 분위기 아담하고 직원들 친절하세요^^
10.4.토,남자친구랑 왓는데 식당도 너무 깨끗하구 밥이랑 반찬도 정갈하게 나와서 좋았는데!!! 너무맛있어요ㅎㅎㅎㅠㅠ❤️ 특히 새우장이랑 연어장 너무너무 맛있어용ㅎㅎ🫶🏻
10.2.목,"연어 새우 게 모두 신선하고 달달해서 좋았습니다. 반찬이 잘 나와서 좋았고, 밥 위에 올라간 계란장이 밥도둑이에요. 성수 일식당 맛집 ㅎㅎ"
10.1.수,반찬부터 엄청 깔끔하고 정갈하게나와요 맛도엄청맛있고 직원분이 친절해요!! 너무 강추합니다⭐️⭐️⭐️⭐️⭐️
9.5.금,최근에 너무 간장게장이 먹고 싶어서 검색해보고 오게 된 곳!! 분위기가 너무 좋고 직원분들이 너무 친절하셔서 맘에 들어요
7.11.금,"성수동에 위치한 간장게장을 비롯한 해산물로 만든 장 맛집입니다 직장인들이 많이 찾는 찐 맛집이에요 저는 한꽃모듬장정식 먹었습니다 계란밥 나오는 정식으로 드시고 해설의 해산물 간장 소스로 만든 모든 장을 맛볼 수 있어 정말 좋아요 짜지않고 맛있어요 거기다 비린맛 1도 없어요 재료들 좋은 거 쓰시고 정성껏 손질해 만든게 티가 나요 정말 맛있는 간강게장, 해산물장 드시고 싶다면 강추해요"
9.20.토,연어장이랑 새우장 고민하다가 연어장으로 시켜봤습니다!! 다음엔 새우장 먹으러 올게요 👍 반찬도 다양하게 나오고 가격도 합리적이어서 좋아용
6.21.토,간장게장을 정말 좋아하는데 정말 짜지않고 너무 맛있어요! ㅠㅠ 간장게장 연어장 새우장으로된 정식 구성도 너무 좋고 계란밥도 너무 맛있어서 둘이 3개 시켜 먹었어용 밥도둑입니다~ 반찬도 맛있어요! 재방문의사 완전 있음
9.11.목,가게가 너무 깔끔하고 귀여워요! 음식도 정갈하고 예뻐요. 성수에 잘 없는 메뉴라 자주 올 것 같아요~ 조용하고 테이블 간격도 넓어서 둘이 오기 좋아요
8.2.토,연어장은 늘 먹던대로 맛있고 양념게장과 양념새우도 먹었는데 너무 맵지 않고 맛있게 매워서 밥과 함께 먹으면 매운 거 잘 못 먹는 사람들도 맛있게 먹을 수 있을거 같아요ㅎㅎ 해설에서 식사하면 항상 밥 두공기씩은 먹는 거 같아요!!
8.29.금,맛있어요! 계란밥도 맛있고…! 제가 매운거에 약해소 그런지 양념게장은 조큼 매웠지만…! 전체적으로 간장베이스 음식들 다 맛있습니다! 밑반찬도 간이 다 너무 좋고 굿👍 추천합니다
9.18.목,음식이 너무 정갈하게 나와요!!! 계란밥이랑 정식 여러개 시켜서 먹었는데 너무 맛있었어요!!
8.27.수,새우장 맛있고 직원분도 친절하세요! 넓어서 혼밥도 괜찮고 데이트도 괜찮아보여요
10.19.일,게장 연어장 둘다 맛있었어요 ㅎㅎ 추천!!
9.13.토,연어장과 새우장 먹었는데 간도 너무 맛있고 계란 밥 같이 나왔는데 먹으니 너무 맛있었습니다. 다음에 또 오겠습니다. 감사합니다.
8.1.금,연어장을 평소에 참 좋아하는데 성수 와서 맛집 찾다가 발견했어요! 다소 숨겨져 있는 느낌이 없지 않아 있어서 그런가 가게에 아무도 없던데 음식은 너무 맛있어서 좋았습니다!
6.22.일,서산에서 서울로 이전하고 2번째 방문했어요🥰 여전히 맛있고 양념게장도 생기고 메뉴가 더 다양해져서 너무 좋아요ㅎㅎ~~!! 매번 점심때만 들렀는데 주류도 종류가 많아서 저녁에 술이랑 같이 먹어도 좋을 거 같아요 다음엔 저녁때 방문할께요
7.10.목,오랜만에 방문한 해설 다양하게 먹을 수 있는 모둠장이 너무 좋아뇨 반찬 수도 많고 맛있어서 웬만한 한식집보다 더 좋은 것 같아요!! 주변에서 공부하는데 맛있는 거 먹고 싶으면 자주 오게 되는 것 같아요! 체고👍
8.15.금,장 요리라 그런지 주문하자마자 바로 나왔어요 공휴일이라 사람도 거의 없고 직원들이 친절해요 학원 근처에 혼밥할만한 곳이 마땅찮았는데 추천합니다
9.10.수,먹기 쉽게 손질되어 나와서 넘 편하게 먹었어용😄
6.22.일,일본인 친구랑 성수에서 놀고 간장게장 먹고 싶다고 해서 방문했는데 간장게장 비린내 안나고 좋았어요 ㅎㅎ 개인적으로 양념보다는 간장이 더 맛나네요! 육게장은 품절이라고 해서 약간 아쉬웠지만 친절 깔끔해서 잘 먹고 갑니다😄
8.7.목,서산에 있을때도 맛있게 먹었었는데 성수에서도 여전히 맛있네요😊 관자 보코치니도 새로운 메뉴였어요ㅎㅎ 맛있게 잘 먹었습니다~!
9.3.수,"처음 주문해봤는데 정말 만족스러워요! 새우장은 살이 탱탱하고 짜지 않아서 밥이랑 너무 잘 어울렸고, 간장게장도 비리지 않고 감칠맛이 살아있어요. 간장 맛도 깊고 달지 않아서 계속 손이 가더라고요. 포장도 깔끔하게 잘 되어 있어서 선물용으로도 좋을 것 같아요. 재구매 의사 100%입니다! 잘 먹었습니다 :)"
8.7.목,회사에서 점심으로 먹으러 왔는데 반찬이 너무 맛있고 재료들이 너무 신선해요!
10.2.목,양이 정말 많아요! 연어장 이렇게 많이 나오는 곳은 처음 봤어요 😃 리뷰쓰고 받은 관자도 정말 맛있고 밑반찬들도 다양하고 맛있었어요~ 국도 맛있고 즐거운 한끼였어요 😊
8.29.금,장 킬러 또 들렀어요! 처음은 연어장 먹어봐서 간장새우장으로 시켜봤는데 크기도 크고 6마리나 주시는거 진짜 최고..👍🏻 간이 너무 딱 맞아서 좋고 계란장 밥 비벼먹는 것도 신의 한 수 입니당!!
9.20.토,직원분들도 친절 하시고 너무 맛나게 먹고 왔습니다 ㅎㅎ 재방문100000000000000000000%
8.2.토,너무 맛있구 신선해서 좋아요!! 친구들이나 데이트 코스로 오면 좋을듯 해여 맛있구 가성비 좋아요!!🥰🥰
6.12.목,성수에 간장게장 새우장 너무 예쁘고 맛있게 나오는 보석같은 집 만나서 전복장 간장게장 러버들 모일때 아지트마냥 모여서 식사하기 너무 좋을거 같아요 직원분 사장님 너무 친절하고 인테리어도 하나 하나 정성이 느껴지고 깔끔하고 맛있는 식사로 반해서 성수오면 내 맛집으로 지인들이랑 자주 와야겠어요 다양한 맥주종류와 맛있는 식사가 가능한 성수해설 내 맛집 리스트에 저장완료 입니다
7.6.일,음식이 너무 신선하고 맛있어용✨❤️ 너무 맛있어서 밥도 두공기나 먹었습미다😍😍 밥도 일반 공깃밥이 아닌 계란밥이라서 더 맛있게 먹었어요! 반찬 종류도 너무 다양해서 물리지 않고 다 너무 맛있어서 만족스러웠습니다ㅎㅎ 진짜 인생맛집 찾은 거 같아요ㅜㅜ!! 직원분들도 너무 친절하시고 먹는 내내 기분 좋아지는 식사였습니다ㅎㅎㅎ
8.22.금,재료 신선하고 너무 맛있어요 반찬도 안짜고 조아요🩷👍🏻
9.24.수,성수 올 때마다 맛있게 잘 먹고 갑니다!! 매장도 깔끔하고 직원도 친절해서 좋아요ㅎㅎ
6.5.목,"성수역 4번 출구 근처에 있는 아담한 식당 해설! 새우장, 연어장, 꽃게장등 장맛 중심의 음식들을 팔고 있어요. 갑각류 해산물 좋아하는 사람은 여기로 가도 후회 없음, 짭쪼롬한 연어장에 밥쓰윽 떠먹으면 한 공기는 금방 뚝딱함. 연어 자체도 신선하고 밑반찬이랑 너무 잘어울렸음. 무조미김나 감태에 싸먹는 연어장은.. 너.무.맛.도.리  와사비 살짝 떠서 계란 노른자에 비빈 밥이랑 연어 쓰윽;; 밥 한공기 추가해서 탄수화물 폭발하게 돼...  매장 자체가 작아서 혼밥하기나 데이트 하기에 좋아요. 단체모임 불가능 .ᐟ  가격만 보면 다소 비싸게 느껴질 수 있는데 나오는 해산물 양 보면 그런 생각 싹 사라질듯. 이거 먹고 힘내서 오늘도 잘 살아볼게요,,"
8.31.일,맛있게 잘 먹고 가요!!! 연어장이 양이 많아서 좋아요!!!! 그리고 성수치고 가격도 너무너무 합리적입니당 🥹😆🍒✌️
6.26.목,싱싱한 해물들이 다 입에서 살살 녹아요. 계란장밥이랑 같이 먹으면 조합이 넘 좋네요. 부모님 어르신들 입맛에도 맛있고 아이도 좋아해요.
7.6.일,반찬이 엄청 다양하게 잘 나와요! 말씀드리면 더 주시고 친절하세요! 가게 안은 생각보다 작지만 아늑하고 깔끔한 느낌이에요! 성수동 와서 맛있게 잘 먹고 갑니다!
10.2.목,한꽃모둠장 너무 푸짐하구 맛있게 먹었어요~ 밑반찬도 많고 맛있어서 좋았어용
5.15.목,울산에서 놀러와서 걱정하며 해산물 파는곳으로 왔는데 세상에나 완전 신선하고 맛있어요!! 간도 적당하고 계란밥 비벼서 올려먹으면 행복해용 넘나 맛나고 안비리고 정식하나해서 혼자 배터지게먹었네요! 감사합니다~~
9.14.일,넘 맛잇어용 게장 강츄드러요 야호!!!
8.30.토,리뷰 쓰는 이 순간에도 또 가고싶어요ㅜㅜ 넘넘 맛있어요
7.11.금,진짜 언제 먹어도 맛있어요ㅜㅠㅠ 연어장은 근본입니다 진짜로...성수에 가면 꼭 여기를 가세요 여러분ㅜㅠㅠ 양념새우도 많이 안 맵고 진짜 딱 알맞은 양념이에요!!! 너무너무 맛있어요ㅠㅠ
7.9.수,자주 오는곳인데 역시 맛있네요 새로 나온 양념 새우장도 정말 맛있게 먹었습니다 ㅎㅎ 사장님과 직원분도 친절하시고 위생도 깨끗해요 계란밥만 먹어도 맛있고 반찬도 직접 하신다는데 게장이랑 잘어울려서 다 먹었어요❤️
8.12.화,맛있게 잘 먹고 갑니다! 성수에서 연어나 새우를 찾으시면 여기로 오세요!!
9.20.토,연어장 진짜 너무너무 맛있어요!!! 다음엔 간장게장도 꼭 먹구싶음🥰
7.12.토,"넘 맛있어용 성수는 양식, 일식을 주로 하는 식당이 많은데 엄마랑 같이 한식 맛있게 먹었어요"
6.26.목,재료들도 다 너무 신선하고 너무 맛있어요 오늘 중 최고의 선택이었습니다😆💛 너무 맛있게 잘 먹었습니다!!
8.29.금,맛있어서 재방했어요 ㅎㅎ
9.21.일,모듬장 + 양념게장 조합으로 먹었습니다!! 종류도 많고 찬도 많아서 잘 먹었네요!! 손질이 잘 되어있어서 좋았어요
9.14.일,가격이 싸고 맛이있어요! 다음에 또 올 의향 있습니다.
7.15.화,평점 :3.9  16000원에 이정도 양에 이정도 퀄리티의 연어 정식이라니…엄청엄청 만족스럽게 먹고 갔습니다. 재방문 의사 있어요😆  연어 양많아서 1 차 놀라고 맛있어서 2차 놀람. 김치는 막 엄청 맛있다는 아니였지만 (여기가 칼국수 집이 아니니깐..크게 중요하진 않음 ) 반찬 구성도 알차서 돈이 안아까웠음. 연어장은 진짜 안느끼하고 탱글탱글해서 너무 맛있었음. 노른자도 굳굳 양많아서 다음에는 단품만 시켜먹어야겠음😆
5.8.목,"한꽃모듬장 정식 진짜 최고였어요! 🦀 연어장, 새우장, 전복장까지 바다 맛 가득한 구성이었고, 비리지 않고 짭조름해서 밥이 계속 들어가요 🍚 감태랑 싸먹는 재미도 쏠쏠! 같이 먹은 육게장 정식도 신선한 한우육회+게살 조합이 대박이었어요 😋 반찬도 정갈하고 풀치조림이 특히 인상 깊었고, 에일맥주까지 곁들이니 완벽한 식사였답니다 🍺 다음엔 부모님 모시고 또 가려구요~ 💕"
8.23.토,정갈하게 나와서 좋아여💕 잘 먹고 갑니당👍
8.27.수,아주 맛있읍니다..!!!! 감태 주는것두 넘 좋고 젓갈도 맛있고 가성비 좋아요 성수 맛집🥺🥺
7.16.수,"모둠장이 간장게장, 간장새우장, 전복장, 연어장까지 다양하게 구성되어 있어서 입이 정말 즐거웠어요😍 짜지 않고 감칠맛 도는 간장 양념이 밥이랑 찰떡이라 밥 순식간에 다 먹었습니다ㅠㅠ 특히 전복은 식감이 탱글탱글해서 씹는 맛이 일품이고 여러 가지를 한번에 맛볼 수 있어서 너무 좋았습니다! 양념새우장두 양념이 새우에 촘촘하게 배어 있어서, 한 입 먹자마자 밥 한 그릇 순삭했어여 새우 크기도 적당하고 살도 실해서 씹는 식감이 좋았고 비리지 않아 자꾸 손이 가는 맛이었습니다✨✨ 제 찐 또간집입미다ㅜㅜ"
8.21.목,맛있어요 양도 많고 가성비 최고👍🏻직원도 친절해용~
9.11.목,오늘 처음 친구랑 방문했는데 너무 맛있었어요! 성수에 맛집 찾아서 좋아요
8.28.목,음식이 깔끔하고 맛있어요
6.27.금,음식도 엄청 가지런하게 나오고 직원분들도 다 친절하세요!! 저층이라 안에도 시원해서 좋았습니다 ㅎㅎ
8.28.목,맛있어서 재재방문해용 히히
7.18.금,음식도 맛있고 분위기도 깔끔해요 반찬도 아기자기하게 잘 나오고 역시나 이렇게 먹으려면 밥 한 공기는 뚝딱이라 추가했어요!
8.30.토,반찬이 맛있고 메인메뉴도 맛있네요^^
9.11.목,"새우장은 물론 맛있고, 반찬도 정갈하게 나오고 직원분도 너무 친절하셔서 맛있게 먹고갑니다!"
8.28.목,지나가다 들른것 기대보다ㅜ맛잇어요!!
6.4.수,연어장 정식 비주얼 맛 모두 미쳤어요🙀🧡 지나가다 우연히 발견한 집인데 저만 알고싶은 맛집이네요-!! 재방문 의사있어요!!!
8.17.일,반찬이 잘 나오고 음식 너무 맛있습니다! 잘 먹었어요😁
8.19.화,너뮤 맛있고 알바생분 친절해요 >..< 🤍🤍
6.21.토,연어장이랑 양념게장 시켰는데 넘 맛났어요!! 정갈하고 깔끔하고 하나도 안 짜요 ㅎㅎㅎㅎ 담에 또 올게요 분위기도 좋아여 ㅎㅎ
4.16.수,"육게장 정식, 한꽃모듬장 정식, 양념꽃게장 정식먹었는데 육게장 정식은 육회 양도 적지 않아서 좋았고 등딱지에 게살,내장,육회를 같이 섞어서 먹었는데 이렇게 먹어도 맛있더라구여🥹 모듬장은 다양한 장을 맛볼수있어서 뭘 먹을지 고민될때 고르기 좋았습니당!새우랑 연어가 특히 너무 맛있어서 따로 시킬지 고민했지만.. 다이어트 이슈로.. 게장들이 다 비리지 않고 간이 적당해서 밥 한공기 다먹고 친구랑 한그릇 더 시켜서 나눠먹었네요ㅎ🫣 밑반찬도 8가지나 나와서 놀랐ㄱ하나같이 다 맛있었는데 전 젓갈이랑 갈치가 맛있었습니다!! 전체적으로 플레이팅도 예쁘고 재료도 신선해서 매우 만족했습니다 와사비 종지도 너무 귀여워서 좋았고 다음에 친구랑 또 방문할 것 같아요 해산물 좋아하는 사람이라면 꼭 방문하길"
8.27.수,밑반찬 엄청 잘나오고 장들도 너무 맛있어요 매장도 깨끗하고 편안한 분위기에요
7.5.토,"새우장 정식과 연어장 정식을 주문했습니다. 주문한 음식과 밑반찬 모두 맛있었고, 청결한 매장과 친절한 직원분들까지 너무나 만족스러웠습니다~ 성수에서 든든한 한 끼를 원하신다면 해설을 추천합니다!"
10.19.일,맛있고 직원분들이 친절해요
7.29.화,다시 와도 감동적인 맛! 저에게 있어서 맛있는 간장게장을 먹고 싶어질때 제일 먼저 떠오르는 곳이 되었어요. 다시 와도 처음 먹었을 때의 감동이 그대로네요! 앞으로도 생각 날때마다 자주 오고 싶어요.
8.10.일,성수동에서 한식 먹고 싶어서 왔는데 정갈하고 깔끔하게 나오네여^^
8.5.화,연어장 맛있어요 반찬들도 너무 정갈하게 나와요
9.14.일,분위기도 좋고 음식도 맛있어요! 가게도 청결해서 다음에 또 방문의사 있습니다!
7.23.수,진짜 반찬이랑해서 개잘나옴 게장 넘 맛있고 그냥 노른자 밥위에 올려주는 것부터 굿임 굿굿
9.9.화,맛있어요 다음에 또 올게용!!
7.18.금,하나도 안비리고 안짜고 너무 맛있어요!! 밥이랑 밑반찬도 정말 훌륭합니다😭😭
6.28.토,"간장새우장, 앙념새우장 정식 먹었어요 새우가 통통하고 머리까지 있어서 내장 맛이 일품이에요 밑반찬도 알차고 맛있어요 특히 감태랑 같이 싸먹으면 존밋!! 잘 먹었습니다~~"
9.7.일,직원분들 모두 친절하시고 음식도 맛있어요~!!
8.21.목,너무 맛있습니다! 플레이팅도 귀여워요ㅎㅎ 다음에 또 올 거 같아요
5.10.토,오랜만에 언니랑 서울 나들이 왔는데 뭐먹을까 고민하다가 비리지않다는 리뷰보고 왔습니다! 정말 그 리뷰대로 비리지않고 맛있어요 공간도 깨끗하고 조용해서 맛있게 먹었습니다.
5.3.토,"일본인 친구가 간장게장을 먹고싶다해서, 성수 들린다음에 예약하고 왔습니다. 비린내가 싫어서 간장게장 잘 안먹었었는데, 비린내도 없고 아주 깔끔한 맛이었어요. 짜지 않고, 간장향이 풍부한 맛 입니다. 알바분도 친절하고 사장님 서비스도 좋아요. 잘먹었습니다. 감사합니다."
6.8.일,🦀🦀간장게장이 너무 먹고싶어서 왔는데 완전 맛있어용🩷🩷🩷 반찬도 정갈하게 잘 나와서 짱입니다👍🏻
8.31.일,깨끗하고 도란도란 밥먹기 좋아요! 새우장도 맛있었어요
